Headline;Month;Day
What’s on TV Tuesday: ‘La La Land’ and ‘In a World … ’;4;11
What’s on TV Tuesday: Iranian Vampires and Scientologists;8;15
What U.S. Tech Giants Face in Europe in 2017;1;1
What’s on TV Saturday: ‘Good Time’ and ‘Secrets of Christ’s Tomb’;12;23
What’s on TV Wednesday: ‘I’m Sorry’ and ‘Funeral Directors: Dead Good Job’;9;6
How Much Watching Time Do You Have This Weekend?;11;9
What’s on TV Wednesday: ‘Vikings’ and ‘The Marvelous Mrs. Maisel’;11;29
What’s on TV Saturday: Andy Samberg in ‘Popstar: Never Stop Never Stopping’ and ‘Tour de Pharmacy’;7;8
What’s on TV Saturday: The Last Season of ‘Orphan Black’ Debuts;6;10
What’s on TV Tuesday: ‘Judd Apatow: The Return’ and ‘Finding Your Roots’;12;12
What’s on TV Monday: ‘Preacher’ and ‘Newton’s Law’;9;11
What’s on TV Friday: ‘The Incredible Jessica James’ and ‘The Last Tycoon’;7;28
Silicon Valley Takes a Right Turn;1;12
Where to Stream Christopher Nolan’s 9 Pre-‘Dunkirk’ Movies;7;20
Here Is How to Fend Off a Hijacking of Home Devices;2;1
How Much Watching Time Do You Have This Weekend?;3;16
Seven Films to Stream if You Loved ‘Get Out’;3;10
Cannes Film Festival Announces 2017 Lineup;4;13
Review: ‘Wonder Woman’ Is a Blockbuster That Lets Itself Have Fun;5;31
Dear Wirecutter: What’s the Best Radio for Retirees?;6;8
Tech Roundup: The World’s Top Venture Capitalists;3;27
Confirm or Deny: Anne Wojcicki;11;18
Checking a Digital Photo’s Dimensions;6;9
Hulu Chief Leaves to Lead Sony’s TV Division;10;24
Christine Alcantara, Isaac Gerber;3;19
Reminding E-Commerce Customers Who Delivers;12;11
A Fractious Final Debate in the New Jersey Governor’s Race;10;19
From ‘Zombie Malls’ to Bonobos: What America’s Retail Transformation Looks Like;4;15
Where to Stream the Best Agatha Christie Adaptations;11;10
Where to Watch the Best TV of 2017;12;4
Brazil Wavers on Environment, and Earth’s Largest Wetland Starts to Wither;12;23
Monica’s 3 Movies to Stream or Rent This Weekend;5;19
California Today: Tens of Thousands of New Jobs, and One Worry: Robots;7;31
Blue Apron Slashes Share Price for Its I.P.O.;6;28
Will Bill O’Reilly’s Latest ‘Killing’ Book Climb the Charts?;9;18
The Best Soundbar;7;19
Trump Picks Joseph Simons, Corporate Antitrust Lawyer, to Lead F.T.C.;10;19
Microsoft C.E.O. Says Tech’s Progress on Gender Equality Is ‘Not Sufficient’;9;27
Your Roomba May Be Mapping Your Home, Collecting Data That Could Be Shared;7;25
What to Know About CES 2017;1;4
Morning Agenda: Takeover of Rockwell Collins Said to Be Near;8;30
Google’s Disturbing Influence Over Think Tanks;8;30
So Your Phone Ran Out of Juice. Here Are the Top Chargers for It.;5;31
Five Long TV Cons Worth a Short Binge;3;9
Monica’s 3 Movies to Stream This Weekend;9;15
What’s on TV Saturday: Black Sabbath’s Final Performance and ‘Arrival’;10;28
What’s on TV Sunday: Jimmy Kimmel Hosts the Oscars;2;26
What’s on TV Friday: Ricky Gervais on Netflix and Revisiting Anna Nicole Smith;2;10
A Busy Children’s Book Character Gets Busier Still;4;7
The Best 4K Blu-ray Player;10;11
What’s on TV Sunday: ‘First Ladies Revealed’ and ‘Pride of the Yankees’;7;2
Summer Nights;7;28
A Trust Buster for the New ‘Knowledge Monopoly’;10;2
In the Future, Warehouse Robots Will Learn on Their Own;9;10
Uber’s C.E.O. Choice Faces a Question of Ambitions;8;28
What’s on TV Friday: ‘Marvel’s the Defenders’ and White Supremacists;8;18
Morning Agenda: Nestlé Considers Offloading Its Candy Business;6;16
What’s on TV Friday: ‘Fences’ and a Milestone on ‘Shark Tank’;2;24
What’s on TV Saturday: ‘La La Land’ and ‘One Mississippi’;9;16
What’s on TV Thursday: ‘Glen Campbell: I’ll Be Me’ and ‘S.N.L.: Weekend Update’;8;10
What’s on TV Tuesday: ‘Before Midnight’ and ‘The Bold Type’;7;11
What’s on TV Tuesday: Fireworks and ‘The Words That Built America’;7;4
What’s on TV Thursday: Red Nose Day and a ‘Love Actually’ Reunion;5;25
Student Winners From Our 2017 Editorial Cartoon Contest;11;28
What’s on TV Tuesday: Fireworks and ‘The Words That Built America’;7;4
What’s on TV Thursday: Red Nose Day and a ‘Love Actually’ Reunion;5;25
What’s on TV Friday: ‘The Crown’ and ‘Crazy Ex-Girlfriend’;12;8
What’s on TV Friday: ‘Hell or High Water’ and ‘This Is the End’;10;20
What’s on TV Tuesday: ‘Jerry Before Seinfeld’ and ‘Somewhere Between’;9;19
What’s on TV Sunday: The Return of ‘Episodes’ and ‘Endeavour’;8;20
What’s on TV Monday: ‘Life’s a Beach’ and ‘Janet King’;7;3
What’s on TV Tuesday: ‘T2 Trainspotting’ and ‘Celtics/Lakers: Best of Enemies’;6;13
What’s on TV Saturday: Samantha Bee hosts ‘Not the White House Correspondents’ Dinner’;4;29
What’s on TV Tuesday: ‘The Gabriels’ and ‘Bones’;3;28
