Headline;Month;Day
‘Porch Pirates’ Steal Holiday Packages as They Pile Up at Homes;12;20
What the Tax Bill Fails to Address: Technology’s Tsunami;12;20
Amazon, in Hunt for Lower Prices, Recruits Indian Merchants;11;26
Review: In ‘Jean-Claude Van Johnson,’ Van Damme Gives Us the True Hollywood Story;12;14
The Biggest Tech Failures and Successes of 2017;12;13
How 2017 Became a Turning Point for Tech Giants;12;13
Net Neutrality Protests Move Online, Yet Big Tech Is Quiet;12;12
Microsoft to Expand Campus, as Amazon Looks Elsewhere;11;29
Farhad and Mike’s Week in Tech: The Big Bitcoin Boom;12;8
Holiday Treats for Australian Readers;12;7
The Tarnished Image of ‘Transparent’;12;7
For ‘Transparent,’ Accusations Against Jeffrey Tambor Burst an Idealistic Bubble;12;6
How the Bot Stole Christmas: Toys Like Fingerlings Are Snapped Up and Resold;12;6
CVS to Buy Aetna for $69 Billion in a Deal That May Reshape the Health Industry;12;3
Jean-Claude Van Damme Plays Jean-Claude Van Damme, for Kicks;11;30
Travel Books Take You There and Back;11;29
The Trump Administration’s Incoherent Stance on Competition;11;28
Stitch Fix Prepares an I.P.O. in the Shadow of Amazon;11;17
Review: In ‘The Marvelous Mrs. Maisel,’ a Comic Asks, Take My Strife, Please;11;28
Amazon Sellers Brood as States Come Calling for Taxes;11;15
As Walmart Buys Online Retailers, Their Health Benefits Suffer;11;28
5 Lessons Seattle Can Teach Other Cities About Amazon;11;16
‘Lord of the Rings’ Series Coming to Amazon;11;13
As Health Care Changes, Insurers, Hospitals and Drugstores Team Up;11;26
Retailers’ Recipe for the Holidays: Big Sales, Fewer Seasonal Workers;11;22
Review: Amazon’s New Pilots, the End of an Era?;11;10
Jeffrey Tambor Leaves ‘Transparent’ After Sexual Misconduct Allegations;11;20
Apple Postpones Release of HomePod Speaker;11;17
Alia Shawkat on Growing Up and Gaining Control;11;17
Peltz May Have Won After All: DealBook Briefing;11;15
Hearing Amazon’s Footsteps, the Health Care Industry Shudders;10;27
Following the (Bike) Trail to Amazon’s Second Headquarters;10;26
Australia Battles Amazon, With Populist Defiance;10;26
Amazon’s Latest Way Into Your Life Is Through the Front Door;10;25
Review: Amazon’s British Thriller ‘Fearless’ Is for the Conspiracy-Minded;10;26
CVS Is Said to Be in Talks to Buy Aetna in Landmark Acquisition;10;27
Alibaba’s Earnings Jump as China’s Online Shopping Boom Continues;11;2
The Upside of Being Ruled by the Five Tech Giants;11;1
Not the Bots We Were Looking For;11;1
Amazon Counts Its Suitors: 238 Want to Be Home for 2nd Headquarters;10;23
A Showdown Brews Between Amazon and Alibaba, Far From Home;10;22
Aetna Could Offer CVS Valuable Protection;10;31
Australia’s Amazon Book Battle;10;19
How Amazon Took Seattle’s Soul;10;20
Inside Amazon, Diversity Concerns Flare Up After Harassment Accusations;10;20
Editing Your History on Amazon;10;19
What Are the Billboard Charts Really Measuring?;10;27
The Women Behind ‘Good Girls Revolt’ Think the Time Is Right to Revive the Feminist Show;10;27
What Worries? Big Tech Companies Post Glowing Quarterly Profits;10;26
In Amazon Bid, New York Brags About, Well, Everything;10;18
Roy Price Quits Amazon Studios After Sexual Harassment Claim;10;17
5 Cheap(ish) Things to Improve Your Home Office;10;26
Can Washington Stop Big Tech Companies? Don’t Bet on It;10;25
Big Tech’s Rivals Pounce at Chances to Win in Washington;10;25
How Australia’s Technology Stands Out;10;25
Newark Says, Hey Amazon, Look Over Here;10;16
Amazon Turns on the Charm Amid Criticism From Right and Left;10;15
What’s New on Netflix and Amazon Prime This Weekend;10;13
Amazon Studios Chief Suspended After Sexual Harassment Claim;10;13
Why We Don’t Vote With Our Wallets;10;20
What May Seem Good for New York Is Not Always Good for Its Mayor;10;19
From Amazon, a Change That Hurts Authors;10;12
U.S. and Europe May Collide on Taxing Apple and Amazon;10;13
How the Frightful Five Put Start-Ups in a Lose-Lose Situation;10;18
5 Cheap(ish) Things to Help You Recover From a Tough Workout;10;15
Silicon Valley Is Not Your Friend;10;13
Tech Giants, Once Seen as Saviors, Are Now Viewed as Threats;10;12
Why Tech Is Starting to Make Me Uneasy;10;11
E.U. Said to Order Luxembourg to Collect Back Taxes From Amazon;10;3
The Frightful Five Want to Rule Entertainment. They Are Hitting Limits.;10;11
HelloFresh, the Meal Delivery Service, Pursues I.P.O. in Frankfurt;10;10
E.U., Citing Amazon and Apple, Tells Nations to Collect Tax;10;4
Co-Parenting With Alexa;10;7
Amazon Wants You to Wake Up With Alexa, and That’s Just the Start;9;27
Walmart Puts Its Eggs in a Time-Saving Basket: Grocery Pickup;10;5
For Cities Wooing Amazon’s New Headquarters, Nothing Is Too Strange;9;25
The Last Stand of the Amazon’s Arrow People;9;23
What’s New on Netflix and Amazon Prime This Weekend;9;22
In the Amazon, a Catastrophic Gold Rush Looms;9;18
Witness a Changing Amazon;9;18
Farhad and Mike’s Week in Tech: Twitter’s Eventful Few Days;9;29
Amazon ‘Reviewing’ Its Website After It Suggested Bomb-Making Items;9;20
Best Buy’s Secrets for Thriving in the Amazon Age;9;18
Tech Firms Add $300 Million to Trump Administration’s Computer Science Push;9;26
While Amazon Plays the Field, Walmart Stays True to Arkansas;9;15
Farhad’s and Mike’s Week in Tech: A Very Bad Week for Digital Giants;9;22
As Amazon Pushes Forward With Robots, Workers Find New Roles;9;10
Robots and Humans Team Up at Amazon;9;10
Let’s Stop Government Giveaways to Corporations;9;21
Internet Giants Face New Political Resistance in Washington;9;20
Where Amazon Should Go;9;8
Dear Amazon, We Picked Your New Headquarters for You;9;9
‘Uncontacted’ Amazon Tribe Members Reported Killed in Brazil;9;10
Meet Me in St. Louis, Bezos;9;16
Amazon Plans Second Headquarters, Opening a Bidding War Among Cities;9;7
How to Keep on Top of Technology When You Write About It;9;13
Brazilian Judge Stymies Plan to Allow Mining in Amazon Region;8;30
The Retailers That Can Resist the Amazon Onslaught;8;28
These Are Not the Robots We Were Promised;9;9
Shades of Noir: My Hunt for an Eclipse Glasses Villain;9;9
Farhad’s and Nick’s Week in Review: Uber’s New Boss and Amazon’s New Supermarket;9;1
‘Cortana, Open Alexa,’ Amazon Says. And Microsoft Agrees.;8;30
The Amazon Effect: How Prices Dropped at Whole Foods;8;28
Democrats Begin Legal Assault on Trump’s Move to End ‘Dreamer’ Program;9;6
Google and Walmart Partner With Eye on Amazon;8;23
Amazon’s Play to Rattle Whole Foods Rivals: Cheaper Kale and Avocado;8;24
Amazon-Whole Foods Deal Clears Last Two Major Hurdles;8;23
Silicon Valley Courts Brand-Name Teachers, Raising Ethics Issues;9;2
Does Amazon Pay Taxes? Contrary to Trump Tweet, Yes;8;16
Whole Foods Voting on Amazon Takeover, and Pending Verdict in Samsung Case;8;21
$16 Billion Bond Sale Shows Amazon’s Power to Pursue Deals;8;16
Alaska Warily Eyes Change Bringing Suburbs and Amazon Boxes;8;18
Brazil May Face a New Threat, This Time From Biting Midges;8;25
Farhad and Mike’s Week in Review: Apple’s Self-Driving Shift;8;25
Wade Into the Deep Bollywood Pool With Amazon’s Heera;8;10
Amazon’s Jobs Fair Sends Clear Message: Now Hiring Thousands;8;2
As Amazon’s Influence Grows, Marketers Scramble to Tailor Strategies;7;31
Amazon’s ‘Black America’ Imagines a New Nation in the South;8;1
The Mind-Boggling Ascent of Amazon and Jeff Bezos;7;28
Joining Apple, Amazon’s China Cloud Service Bows to Censors;8;1
Amazon Profits Fall Far Short of Expectations, but Investors Shrug;7;28
Want a Job, Mate? Amazon Is Hiring Aussie Speakers;7;26
How to Watch a Solar Eclipse;8;11
Never-Ending Superheroes: Here Come the Defenders and the Tick;8;11
Your Instagram Posts May Hold Clues to Your Mental Health;8;10
How to Make Your House a Smart Home;8;8
What Will Service Work Look Like Under Amazon?;7;18
Amazon Tackles Hollywood’s F. Scott Fitzgerald Obsession;7;20
Nostalgia Goes Niche in ‘Wet Hot American Summer’ and ‘Comrade Detective’;8;3
How to Make the Most of Amazon’s Prime Day;7;10
Did an Echo Call 911 During a Domestic Assault? Amazon Says No.;7;11
Moving Your Amazon Music to a New Home;7;6
Farhad’s and Mike’s Week in Tech: The End of the iPod, Plus Uber News;7;29
Amazon’s Vision of Computing’s Future: An Information Appliance;6;28
The Riches of Jeff Bezos;7;28
Amazon Bites Off Even More Monopoly Power;6;21
When Amazon Comes to Town;6;20
Can Amazon Be the Next Apple?;6;20
Trump, Amazon and ‘Internet Taxes’: What Did He Mean?;6;29
Amazon to Buy Whole Foods for $13.4 Billion;6;16
Amazon’s Move Signals End of Line for Many Cashiers;6;17
Amazon Is Trying to Do (and Sell) Everything;6;16
Conglomerates Didn’t Die. They Look Like Amazon.;6;20
Whole Foods Deal Shows Amazon’s Prodigious Tolerance for Risk;6;17
Farhad and Mike’s Week in Tech: Meal Kits, Lyft and ‘Despacito’;7;22
Amazon Will Let Customers Try On Clothes Before Buying;6;20
Walmart Will Struggle to Top Amazon’s Offer for Whole Foods;6;19
Pittsburgh Gets a Tech Makeover;7;22
China’s Other Big Export: Pollution;7;21
Former Amazon Warehouse Manager Sues for Overtime Wages;6;11
Daily Report: Reinventing Food Isn’t Easy;7;18
Fear of a Monopoly Will Help Amazon’s Cloud Rivals;6;5
Amazon Deal for Whole Foods Starts a Supermarket War;6;16
Amazon Sets Up Shop in the Heart of the Publishing Industry;5;24
Heart Healthy in the Amazon;4;6
The Amazon-Walmart Showdown That Explains the Modern Economy;6;16
A Price Amazon Is Content to Keep High: $1,000 a Share;5;30
Farhad’s and Mike’s and Nellie’s Week in Tech: Struggles for Snap;7;15
David Lynch Weaves Film History Into ‘Twin Peaks: The Return’;7;13
At Amazon’s Bookstore, No Coffee but All the Data You Can Drink;5;27
Barry Jenkins’s ‘The Underground Railroad’ in the Works at Amazon;3;27
Amid Brick-and-Mortar Travails, a Tipping Point for Amazon in Apparel;4;30
Amazon’s Ambitions Unboxed: Stores for Furniture, Appliances and More;3;25
Amazon’s Living Lab: Reimagining Retail on Seattle Streets;2;13
Detailing Amazon’s Custom-Clothing Patent;4;30
‘Alexa, Where Have You Been All My Life?’;7;11
Amazon Eclipse Glasses Lawsuit;9;9
E-Commerce as a Jobs Engine? One Economist’s Unorthodox View;7;11
Amazon Will Stream N.F.L.’s Thursday Night Games;4;5
Daily Report: Using Amazon’s Echo to Phone Home;5;9
With New Echo Speakers, Amazon Lets You Ask Alexa to Phone Mom;5;9
Miscue Calls Attention to Amazon’s Dominance in Cloud Computing;3;12
Amazon to Open Retail Store in Manhattan at Time Warner Center;1;5
Amazon’s Holiday Quarter Doesn’t Match High Expectations;2;3
Special Ops With a Studious Bent Fight Destruction of Brazil’s Amazon;4;6
Deep in the Amazon, a Remarkable Beach (and Ant-Eating) Experience;3;20
Matthew Weiner Shares Details About His Amazon Series;3;2
Deep in Brazil’s Amazon, Exploring the Ruins of Ford’s Fantasyland;2;20
Movers: Amazon’s Stock Price Hits $1,000;5;30
How Alexa Fits Into Amazon’s Prime Directive;1;24
How the Amazon’s Cashews and Cacao Point to Cultivation by the Ancients;3;3
What to Watch on Netflix, Amazon and More This Month;10;2
Blue Apron Pursues I.P.O. as Amazon Looms Over Industry;6;19
Canada Letter: The Avro Arrow and an Amazon HQ;9;15
Amazon Takes a Gamble on Middle Eastern E-Commerce;3;23
Walmart, With Amazon in Its Cross Hairs, Posts E-Commerce Gains;5;18
Tech Roundup: Amazon Error Is a Reminder That No Company Is Infallible;3;13
Tech Stocks Boom, but Some Stock Pickers Are Wary;7;5
What You Get (and What You Don’t) From a $50 Amazon Fire;6;7
American Apparel Could Bolster Amazon’s Standing With Trump;1;6
Daily Report: The Next Voice You Hear Will Be Amazon’s;1;6
Amazon to Add 100,000 Jobs as Bricks-and-Mortar Retail Crumbles;1;13
What’s New on Netflix, HBO and Amazon Prime This Weekend;9;15
What’s New on Netflix, HBO and Amazon Prime This Weekend;12;8
Movers: Whole Foods Surges After Sale to Amazon;6;16
Morning Agenda: Retailers (Not Named Amazon) Continue to Struggle;9;19
What’s New on Netflix, HBO and Amazon Prime This Weekend;11;16
What’s New on Netflix, HBO and Amazon Prime This Weekend;10;27
Roy Moore, Yemen, Amazon: Your Tuesday Briefing;12;5
Six Great Movies Under 90 Minutes on Amazon Prime;10;4
The Best Alexa-Compatible Smart-Home Devices for Amazon Echo;11;3
James Patterson’s Latest Villain Looks a Lot Like Amazon;9;8
Stephen Miller, Genome Editing, Amazon: Your Thursday Briefing;8;3
Cloud Produces Sunny Earnings at Amazon, Microsoft and Alphabet;4;28
Hurricane Irma, North Korea, Amazon: Your Friday Briefing;9;7
The Best TV Shows and Movies New to Netflix, Amazon and More in April;3;31
When in the Amazon, Please Do Not Punch the Dolphins;4;20
Dear Wirecutter: Can I Control My TV With Amazon’s Alexa?;1;26
The Best TV Shows and Movies New to Netflix, Amazon and More in October;10;9
The Best TV Shows and Movies New to Netflix, Amazon and More in December;9;1
The Best TV Shows and Movies New to Netflix, Amazon and More in August;8;2
Farhad’s, Mike’s and Cade’s Week in Tech: More Uber, With a Dash of Amazon;6;17
Jeff Bezos Says He Is Selling $1 Billion a Year in Amazon Stock to Finance Race to Space;4;6
Review: Braving Foot Rot and Fire Ants in the Amazon ‘Jungle’;10;19
The Best TV Shows and Movies New to Netflix, Amazon and More in June;6;1
The Best TV Shows and Movies New to Netflix, Amazon and More in April;3;31
The Best TV Shows and Movies New to Netflix, Amazon and More in November;10;30
The Best TV Shows and Movies New to Netflix, Amazon and More in September;8;31
The Best TV Shows and Movies New to Netflix, Amazon and More in July;6;29
The Best TV Shows and Movies New to Netflix, Amazon and More in October;10;1
The Best TV Shows and Movies New to Netflix, Amazon and More in December;12;1
The Best TV Shows and Movies New to Netflix, Amazon and More in May;5;1
Amazon Alexa vs. Google Assistant: Which Voice Assistant Is Best for You?;4;14
Amazon Deforestation, Once Tamed, Comes Roaring Back;2;24
Review: Amazon’s ‘Last Tycoon’ Is Slick but Short on Passion;7;27
A Novel Set in the Amazon, Harking Back to Classic Survival Stories;10;27
20 Years On, Amazon and Jeff Bezos Prove Naysayers Wrong;5;16
CVS and Aetna Talks Take Place Under Amazon’s Shadow: DealBook Briefing;10;27
The Best Movies and TV Shows New to Netflix, Hulu, Amazon and HBO in February;2;1
The Best Movies and TV Shows New to Netflix, Hulu, Amazon and HBO in March;3;1
Amy Sherman-Palladino’s Newest Is an Amazon Pilot Standout;3;17
Netflix and Amazon Still Have Great New Movies and TV Shows Coming This Month;6;19
Trump, Amazon, Philando Castile: Your Friday Evening Briefing;6;16
Tech, Fed, Trump: So Many Reasons to Worry About the Market;6;29
Dear Amazon: Please Build Here;9;30
As Amazon Moves In, Demand for Warehouse Space Climbs;10;24
Wooing Amazon: Your Turn;9;26
Try, Then Buy? Amazon’s Move Is Part of a Shopping Trend;7;5
Amazon to Share New Building With Homeless Shelter in Seattle;5;10
Review: Amazon’s ‘Patriot’ Takes the Spy Thriller to a New Place;2;23
Review: A New ‘Tick’ on Amazon, Not Like the Old ‘Tick’;8;24
Alexa, What Happens if the Echo Has a Screen? You Get This Review;6;26
Moving Your E-Books to a New E-Reader;6;26
Amazon Key Is a Lot Less Scary Than My Post-1-Click Remorse;10;28
A Street Fight Among Grocers to Deliver Your Milk, Eggs, Bananas;6;24
You Don’t Want to Buy Groceries From a Robot;6;23
Tech Companies Fight Trump Immigration Order in Court;1;31
Tech Titans Make Pilgrimage to White House to Discuss Government Systems;6;20
For Your Consideration: An Increasingly Lavish Emmy Campaign Season;6;19
How Uber and Airbnb Became Poster Children for the Disruption Economy;6;19
In Whole Foods, Bezos Gets a Sustainably Sourced Guinea Pig;6;17
Jeff Bezos Goes Grocery Shopping;6;16
Rooted in Counterculture, Whole Foods’ Founder Finds an Unlikely Refuge;6;17
An Online Retailer Walked Into a Salad Bar;6;16
‘I Have Stopped Taking My Notebooks and Pens to Meetings’;6;17
Walmart to Buy Bonobos, Men’s Wear Company, for $310 Million;6;16
How Whole Foods Became the Organic Giant;6;16
At Last, Jeff Bezos Offers a Hint of His Philanthropic Plans;6;15
Groundbreaking TV About Female Desire, Thanks to Playwrights;6;16
Jeff Bezos Wants Ideas for Philanthropy, So He Asked Twitter;6;15
The Decline of the Baronial C.E.O.;6;17
A Slump in Tech Stocks That Leaves Some Investors Mystified;6;12
What to Cook, Watch, Listen To and More This Weekend;6;10
Taylor Swift Returns Her Music Catalog to Streaming Services;6;9
At the Cannes Film Festival, Tech and Tradition Collide;6;8
Surfing With a New Keyboard;6;8
Five Big Tech Stocks Build Market Euphoria, and Jitters;6;7
What’s on TV Wednesday: ‘Queen Sugar’ and the CMT Music Awards;6;7
Apple Needs to Reinvent Itself. It Just Might Be Doing So.;6;6
‘Climate Change Is Real’: Many U.S. Companies Lament Paris Accord Exit;6;1
Need Mood Lighting to Go With Your Music? Ask Alexa. No App Required.;5;23
‘Transparent,’ the Musical: Coming Soon?;5;24
Joshua Ferris on ‘The Dinner Party’;5;19
Which Tech Giant Would You Drop?;5;10
Tech’s Frightful Five: They’ve Got Us;5;10
Review: ‘I Love Dick’ Sketches an Artistic Love Triangle;5;11
The ‘Frightful Five’ Aren’t So Scary, as Long as They’re Competing;5;8
Amazon-Whole Foods: A Good Deal?;6;25
The Antithesis of Amazon’s Retail Shop;6;7
In Praise of International Crime Dramas;5;9
Open Thread: This Week in Style News;5;5
Chris Kraus and Jill Soloway Talk About the Show ‘I Love Dick’;5;5
Twitter Signs a Deal to Stream Regular-Season W.N.B.A. Games;5;2
Daily Report: Cloud Computing Asserts Itself;4;28
Giving the Behemoths a Leg Up on the Little Guy;5;3
Movers: Dan Loeb Takes Aim at Honeywell;4;27
Sharon Horgan and the Fun Filth of ‘Catastrophe’;4;28
Is It Time to Break Up Google?;4;22
‘Fortitude,’ ‘Bosch,’ ‘Gomorrah’: TV Crime Never Sleeps;4;24
Season 2 of ‘Fortitude’ Has More Icy Dread in Store;4;5
Daily Report: Why Retail’s Future Is in Seattle;2;13
The Best Ebook Reader;5;9
Oscar-Nominated Movies, Sometimes Streaming Near You;2;3
Oscars 2017: Where to Stream the Nominated Movies;1;24
Move Over, Bill Gates. Jeff Bezos Gets a Turn as World’s Richest Person.;7;27
Long Before Making Enigmatic Earthworks, People Reshaped Brazil’s Rain Forest;2;10
Ask Alexa? No, Hear This Alexa;1;16
What to Watch on Halloween;10;27
Our Existential Climate Fears;1;27
Walmart Expands Its E-Commerce Ambitions With a New Investment Arm;3;20
The 2017 Oscars are Over. Here’s Where to Stream the Winners;2;27
Rent or Buy These 2017 Oscar-Nominated Movies;4;6
Where to Stream the Best Movies of the 21st Century (So Far);6;26
Morning Agenda: Upheaval in Retail;6;19
Coming From Automakers: Voice Control That Understands You Better;1;5
Daily Report: Too Late to Run From Tech’s Frightful Five;5;10
Sears Clings to Catalog Thinking in an Online World;1;17
An Alexa Holdout Wants to Know Who’s Listening;12;8
Cut the Cord, but Keep the Films? Here Are 3 Ways;3;30
Word + Quiz: extrude;4;26
Where to Stream Every Major ’90s Comedy;10;26
Jeff Bezos’s Philanthropy;6;20
What’s on TV Friday: ‘Mary Tyler Moore: After All’ and ‘Rise’;1;27
Sonos One Review: Is This the Best Smart Speaker?;11;27
Review: ‘Z,’ Hardly the Last Word on the Fitzgeralds;1;26
Corporations Show Support for Transgender Boy in Supreme Court Case;3;2
7 Movies to Watch This Labor Day Weekend;9;1
Don’t Look Now, but the Great Unbundling Has Spun Into Reverse;2;14
Trump to Open Skies to More Drone Testing;10;25
Where to Stream Some of the Best Movies of 2017;5;26
This Weekend, Watch Some of the ’80s Movies That Inspired ‘Stranger Things’;10;26
What’s on TV Thursday: ‘The Blackcoat’s Daughter’ and ‘The Handmaiden’;4;13
The Best Smart Sprinkler Controller;6;16
Inside the Home of Instant Pot, the Kitchen Gadget That Spawned a Religion;12;17
Where to Stream Previous Cannes Film Festival Winners;5;19
Morning Agenda: An End to Debt-Ceiling Fights, Maybe;9;8
What’s on TV Tuesday: ‘Wonder Woman’ and Some Erotic Thrillers;8;29
9 Suggestions for Movies to Watch With Your Mother;5;12
Where to Stream Jonathan Demme Movies;4;26
What’s on TV Sunday: ‘Game of Thrones’ and ‘Florence Foster Jenkins’;8;27
Five Great ‘Mary Tyler Moore’ Episodes to Stream;1;25
Morning Agenda: Walmart Makes Another Push Online;3;21
Morning Agenda: Barclays Charged with Fraud;6;20
10 Great Jerry Lewis Movies to Stream;8;20
Thinking of Rigging Your Home With Smart Devices? Start Here;3;8
Slack Is Said to Be in Talks to Raise $500 Million;6;15
Stream These Beautiful Movies From Cinematographer Roger Deakins;10;11
CVS Will Offer Next-Day Delivery of Prescription Drugs;11;6
A Guide to the Different Scotlands You’ll Find on Film;10;19
Review: In ‘A River Below,’ Saving Dolphins Can Get You Killed;11;2
In Year of Anti-Muslim Vitriol, Brands Promote Inclusion;1;1
Kelly Paulson, Michael Furchtgott;3;12
‘Brexit’ Negotiations Resume, and a Price Drop at Whole Foods;8;27
Review: Hearts of Darkness and Light in ‘The Lost City of Z’;4;13
See How Tech Companies Got Together for a Day of Online Protest;7;12
What’s on TV Sunday: Season Finales of ‘Power’ and ‘Twin Peaks’;9;3
Can You Find Bolivia on a Map?;10;2
Stream These Great Latin American Movies on Netflix;10;6
Chief Executive of Audio Firm Sonos Steps Down;1;10
Nasdaq Hits 6,000 as Markets Rise on Tax Overhaul Optimism;4;25
Where to Stream the Best Movies of 2017;12;6
Whole Foods Investor Cashes Out After Merger Demands Were Fulfilled;7;20
Alibaba’s Singles Day Sales Hit New Record of $25.3 Billion;11;11
Where to Stream 5 Great Sam Shepard Movies;7;31
Stream These Great Steven Soderbergh Titles;8;16
Jamie Garfinkel, Jonathan Levy;9;3
Coen Brothers Planning First TV Series;1;11
Monica’s 3 Movies to Stream or Rent This Weekend;6;23
Lisa Ingrassia, Christopher Slevin;7;23
What’s on TV Thursday: ‘The Lost City of Z’ and ‘Tell No One’;6;29
Riot by Drug Gangs in Brazil Prison Leaves at Least 56 Dead;1;2
The Streaming Landscape After Disney’s Deal;12;14
Student Winners From Our 2017 Editorial Cartoon Contest;11;28
Monica’s 3 Movies to Stream or Rent This Weekend;7;21
Cisco and Google Find Mutual Interest in Cloud Computing;10;25
Seven Films to Stream if You Loved ‘The Shape of Water’;12;12
Home Delivery! What Will They Think of Next?;6;29
Did You Hear the One About the Housewife Who Walks Into a Comedy Club?;11;21
Monica’s 3 Movies to Stream or Rent This Weekend;7;14
Apple Provides Hedge Against Tech Backlash;12;20
Friday Mailbag: A Patriots Photo Lets Trump Score a Point;4;21
Monica’s 3 Movies to Stream or Rent This Weekend;8;11
Tablets for Music Mixers on a Budget;8;2
Monica’s 3 Movies to Stream or Rent This Weekend;5;12
George Orwell’s ‘1984’ Is Suddenly a Best-Seller;1;25
Jeanne Moreau Was a Cinema Giant. Here’s Where to Stream 5 of Her Greatest Roles;7;31
Morning Agenda: Time for a Break for Travis Kalanick?;6;12
Farhad’s and Mike’s Week in Tech: Thiel, Tech Companies and Trump;1;14
In Advertising Paradise, Reality Is Just a Conversation Away;6;26
HomePod Speaker and New iMacs: What We Saw at Apple’s WWDC;6;5
Uneasy About the Future, Readers Turn to Dystopian Classics;1;28
Should You Also Consider AmazonBasics?;11;27
March’s Book Club Pick: On the Road With the Casualties of the Great Recession;9;19
Dear Wirecutter: Would You Recommend Cheap True Wireless Headphones?;8;31
What’s on TV Wednesday: ‘The Tunnel’ and American Black Film Festival Honors;2;22
Monica’s 3 Movies to Stream or Rent This Weekend;6;16
Reading E-Books on a Bigger Screen;4;12
What’s on TV Thursday: ‘The Amazing Race’ and Some Beachy Diversions;3;30
Review: Con Man Poses as Long-Lost Grandson in ‘Sneaky Pete’;1;12
Daniel Day-Lewis Says He’s Retiring. But You Can Still Stream His Movies.;6;21
13 Beloved TV Holiday Specials You Can Stream Right Now;12;20
Quotation of the Day: Thousands Once Spoke His Language. Now He Bears the Burden of Its Survival.;12;27
The Best In-Wall Smart Light Switch and Dimmer;5;10
The Things That Matter From Apple’s 2017 WWDC Keynote;6;5
Morning Agenda: Proving Uber’s Real Value;8;24
What’s on TV Monday: ‘Hustle & Flow’ and ‘Le Havre’;11;27
What’s on TV Saturday: ‘Get Out’ and ‘It’s Always Sunny …’;11;4
What’s on TV Sunday: ‘The Ghost Writer’ and ‘A Little Chaos’;7;30
What’s on TV Thursday: ‘Shut Up and Play the Hits’ and ‘That’s Delicious Classics’;9;7
What’s on TV Tuesday: ‘American Horror Story’ and ‘Like Crazy’;9;5
What’s on TV Thursday: ‘Orphan Black’ and ‘Sister Act’;3;16
What’s on TV Thursday: ‘My Name Is Emily’ and ‘The Tunnel’;6;1
What’s on TV Sunday: The Brontë Sisters and Love in the Mediterranean;3;26
What’s on TV Monday: ‘Dancing With the Stars’ and ‘What We Do in the Shadows’;3;20
What’s on TV Saturday: ‘The Beatles’ and ‘Fences’;11;25
What’s on TV Saturday: ‘Daughters of Destiny’ and ‘Mad Max: Fury Road’;7;29
What’s on TV Friday: ‘Afternoon Delight’ and ‘Long Strange Trip’;6;2
What’s on TV Friday: ‘Everybody Wants Some!!’ and Charles Manson;3;17
Burger King ‘O.K. Google’ Ad Doesn’t Seem O.K. With Google;4;12
Seven Brian De Palma Movies Worth Streaming;9;21
Daily Report: Removing Checks to the Power of the Internet Titans;5;3
Europe Renews Offensive on Silicon Valley With Tax Reforms;9;20
The Best Outdoor Security Camera;1;31
What’s on TV Friday: ‘Jean-Claude Van Johnson’ and ‘Deepwater Horizon’;12;15
Alibaba Looks to Bricks and Mortar With Bid for Mall Operator in China;1;10
What’s on TV Friday: ‘Fortitude’ and ‘Mystery Science Theater 3000: The Return’;4;14
