Headline;Month;Day
Warren Buffett, at Berkshire Meeting, Condemns Republican Health Care Bill;5;7
Forget Taxes, Warren Buffett Says. The Real Problem Is Health Care.;5;8
Fed Will Update Economic Outlook, and April Jobs Data Is Ahead;5;1
Apple’s Stock Races Ahead as Investors Bet on New iPhones;4;30
When Warren Met Jorge Paulo: Buffett and Lemann Recall Their First Deal;4;10
Warren Buffett, in Annual Letter, Offers Hymn to U.S. Economy;2;25
The ‘Warren Buffett of Brazil’ Behind the Offer for Unilever;2;17
Buffett’s $1 Trillion Target for Apple Is in Sight;2;27
How Kraft Heinz Can Get a Deal Done for Unilever;2;17
E.U. Revisits Greek Crisis, and the Fed Releases Meeting Details;2;20
Buffett Asks Big Money: Why Pay High Fees?;2;27
Kelly McHenry, Owen Jennings;5;21
Christen Scanlon, Thomas Owston III;7;9
Homes That Sold for Around $1.5 Million;12;10
Pooja Pandit, Brian Baturin;3;19
Heather Phillips, Benjamin Silverman;5;21
Monica Enamandram, Emir Sandhu;10;29
Morning Agenda: New Rule to Let More Borrowers Sue Lenders in U.S.;7;11
‘Becoming Warren Buffett’ Goes Beyond a $74 Billion Fortune;1;29
Food Industry May Follow the Brewers’ Merger Frenzy;2;22
Morning Agenda: Buffett Finds a Big Deal in Energy;7;7
How Amazon Rattles Other Companies;12;29
What’s On TV Monday: Tilda Swinton in ‘A Bigger Splash’ and Rachel Weisz in ‘The Deep Blue Sea’;5;8
World’s 8 Richest Have as Much Wealth as Bottom Half, Oxfam Says;1;16
United Technologies to Buy Rockwell Collins in $30 Billion Deal;9;5
The Best Investment Since 1926? Apple;9;22
Wells Fargo Chairman Should Listen to Investors and Step Down;4;26
Apple Is the Most Valuable Public Company Ever. But How Much of a Record Is That?;12;21
Even Before Ill-Advised Letter, Arconic’s C.E.O. Had to Go;4;17
Homes That Sold for Around $750,000;3;19
As Wells Fargo Scandal Expands, a C.E.O. Is Exposed;8;31
Morning Agenda: Debating Gary Cohn’s Future in Washington;8;17
In Long Run, There’s No Such Thing as an Einstein Investor;6;23
Can 3G Capital Keep Thriving on Acquisitions and Cost Cutting?;3;7
Homes That Sold for Around $600,000;10;22
Homes That Sold for Around $1 Million;3;12
Homes That Sold for $450,000 and Under;1;29
Homes That Sold for Around $1 Million;10;8
Morning Agenda: Leading the S.E.C., Women in Law, Tech Giants;1;5
Morning Agenda: Banks Clear First Hurdle in Stress Tests;6;23
Homes That Sold for Around $600,000;9;17
Homes That Sold for Around $1,500,000;8;27
Homes That Sold for About $1 Million;6;25
Homes That Sold for Around $1.5 Million;3;5
Morning Agenda: Discovery Said to Be in the Lead to Buy Scripps;7;27
Homes That Sold for Over $1 Million;6;18
Homes That Sold for Around $1 Million;11;12
Homes That Sold for Around $1.5 Million;11;5
Homes That Sold for Around $450,000;10;29
Homes That Sold for Around $1,500,000;7;23
Homes That Sold for Around $1.5 Million;5;14
Homes That Sold for Around $1 Million;12;17
Homes That Sold for Around $450,000;9;24
Homes That Sold for Around $1.5 Million and Up;2;5
In Robert Wilmers of M&T, Regional Banks Had a Champion;12;18
Homes That Sold for Around $750,000;11;19
Homes That Sold for Around $1.5 Million;10;1
Morning Agenda: The Trump Tax Cut;4;25
Morning Agenda: Ethereum, Uber and Money Management Fees;2;28
What’s on TV Monday: ‘Becoming Warren Buffett’ and Agatha Christie Updated;1;30
Homes That Sold for Around $1,000,000;7;28
Valeant Bet Was a ‘Huge Mistake,’ Hedge Fund Chief Ackman Says;3;29
Morning Agenda: Tallying the C.E.O. Desertion of Trump;8;15
Movers: Buffett on IBM, Oil and Jobs;5;5
Morning Agenda: Time Inc., ‘Biblical Investing,’ Company Culture;3;1
Asian Conglomerates, Flush With Cash, Scour for U.S. Fund Deals;2;16
Ronald D. Croatti, Uniform Company Chief and Undercover Boss, Dies at 74;5;27
Conglomerates Didn’t Die. They Look Like Amazon.;6;20
Morning Agenda: Betting Against Trump, or Staying to Help?;8;22
Morning Agenda: Takeover of Rockwell Collins Said to Be Near;8;30
With Government in Retreat, Companies Step Up on Emissions;4;25
Taking the Long View Paid Off in the Short Term, Too;1;13
Morning Agenda: Trump Bites Back Against C.E.O.s Who Rebuked Him;8;16
Europe Gets Tougher on Tech’s Taxes: DealBook Briefing;10;4
20 Years On, Amazon and Jeff Bezos Prove Naysayers Wrong;5;16
$700,000 Homes in South Carolina, New York and Alabama;12;20
Donald Trump, ‘Moonlight,’ Warren Buffett: Your Evening Briefing;2;27
Apple’s W.W.D.C., and Energy Ministers Meeting: The Week Ahead;6;5
$800,000 Homes in New Hampshire, Washington and Pennsylvania;6;7
As Funds Invoke Bible Values, Others See Intolerance;3;1
Two Books Offer Unconventional and Divergent Approaches to Investing;4;16
$900,000 Homes in Colorado, Pennsylvania and Vermont;8;30
DealBook Briefing: Who Could Succeed John Skipper at ESPN?;12;18
Hedge Fund Titan’s Surefire Bet Turns Into a $4 Billion Loss;3;19
How North Korea Managed to Defy Years of Sanctions;5;12
American Express C.E.O. Ken Chenault to Step Down;10;18
Croton-on-Hudson, N.Y.: A Magnet for the Eclectic;5;3
Morning Agenda: The Next Big Battle for Business Is Immigration;9;1
Big Pharma Spends on Share Buybacks, but R&D? Not So Much;7;14
Ten Years After Going Public, Blackstone Stock Hasn’t Budged;6;22
Kim Jong-nam, Mosul, Immigration: Your Morning Briefing;2;26
The Mind-Boggling Ascent of Amazon and Jeff Bezos;7;28
Oscars, Kim Jong-nam, Mobile World Congress: Your Monday Briefing;2;27
Greenfield Hill, Conn.: For Nature Lovers;3;8
The Stock Market Has Been Magical. It Can’t Last.;8;19
Kraft Heinz Offers to Buy Unilever in $143 Billion Deal;2;17
With Snap’s I.P.O., Los Angeles Prepares to Embrace New Tech Millionaires;2;20
A Showdown Over Wells Fargo’s Board of Directors Looms;4;25
The Fabulous Apple Cash Machine;5;5
Former A.I.G. Executives Reach Settlement in Accounting Fraud Case;2;10
Oscars, François Fillon, Nokia: Your Monday Briefing;2;27
Route to Air Travel Discomfort Starts on Wall Street;5;28
Shareholders Demand More Drastic Shifts at Nestlé;6;27
Donald Trump Nominates Wall Street Lawyer to Head S.E.C.;1;4
The Kochs Are Inching Closer to Becoming Media Moguls;11;18
In One New Jersey Town, Pending Tax Changes Create Anxiety;12;17
Silicon Valley Takes a Right Turn;1;12
When Your Home Is a Castle;5;12
Trump’s S.E.C. Nominee Disclosure Offers Rare Glimpse of Clients and Conflicts;3;8
DealBook Briefing: Corporate Taxes, Musk vs. Buffett, and Will Fox Strike a Deal?;11;17
Tax Day Is Finally Here (or So We Think): DealBook Briefing;11;2
Ken Chenault’s Retirement Makes a Small Club Smaller: DealBook Briefing;10;19
Wage Growth Remains ‘Pedestrian’: DealBook Briefing;12;8
The Winklevoss Twins’ Path to Bitcoin Fortune: DealBook Briefing;12;19
DealBook Briefing: Blue Apron’s Co-Founder Steps Down as C.E.O.;11;30
Corrections: August 24, 2017;8;24
