Headline;Month;Day
Why Did Disney Expand Its Sports Kingdom With Out-of-Favor Networks?;12;15
AT&T vs. Disney: How the Trump Administration May View 2 Mega-Mergers;12;15
The Streaming Landscape After Disney’s Deal;12;14
A Departure With Implications for Investors: Disney’s John Lasseter;12;7
The Disney-Fox Deal Has Friends in High Places;12;14
‘He’s All Impulse’: Making Disney’s ‘Pinocchio’ Naughty Onstage;12;15
Murdoch Is Said to Want Iger to Stay as Disney C.E.O.;12;7
Disney Said to Be Nearing a Deal With 21st Century Fox;12;6
DealBook Briefing: A Fox Deal May Keep Iger at Disney Longer;12;6
A Sneak Preview of 2018 Netflix Films and a Canine Secret Weapon;12;29
‘Last Jedi’ Is 2017’s Box Office Winner in a Women-Led Year;12;31
‘Hamilton’ Rounds Off a Year When London Theater Embraced the New;12;28
Disney Is Said to Have Resumed Talks to Buy Parts of Fox;12;2
‘Jumanji’ Succeeds at Box Office, ‘Downsizing’ Struggles;12;24
Rupert Murdoch and President Trump: A Friendship of Convenience;12;23
How Hollywood Blockbusters Explain American Politics;12;19
‘Star Wars: The Last Jedi’ Has Second-Biggest Opening Ever;12;17
Apple Adds Another Show to Its Growing Streaming Stable;12;15
Zendaya Doesn’t Need a Safety Net;12;15
DealBook Briefing: Peltz Gets His Seat on Procter & Gamble’s Board;12;15
DealBook Briefing: Bitcoin Surges Past $16,000;12;7
Weinstein’s Complicity Machine;12;6
‘Coco’ Tops Box Office Again in Quiet Week;12;3
Disney Ban Elevated Tension at Los Angeles Times Newsroom;11;14
Disney’s Profit Drops, but ‘Star Wars’ Saves the Day;11;10
21st Century Fox Discusses a Deal With Sky, but Not Disney;11;9
DealBook Briefing: Corporate Taxes, Musk vs. Buffett, and Will Fox Strike a Deal?;11;17
Disney Ends Ban on Los Angeles Times Amid Fierce Backlash;11;7
Disney Said to Have Held Talks to Acquire 21st Century Fox Assets;11;6
The ‘Lion King’ Effect: How a Broadway Smash Changed South African Lives;11;15
Review: A ‘Fake News’ Opera on the Streets of Los Angeles;11;13
Trade Talks on Trump’s Asia Trip and Bank Regulation in Europe;11;6
On YouTube Kids, Startling Videos Slip Past Filters;11;4
Let It Go: Making Peace With Princesses;10;28
For Disney’s Iger, an Unlikely Political Turn;10;9
Disney’s Big Bet on Streaming Relies on Little-Known Tech Company;10;8
Disney, Hillary Clinton and the Obamas Condemn Weinstein;10;10
A Good Day for ESPN After Disney Reaches Altice Agreement;10;2
Disney Reimagines Its Stores to Be More Like a Vacation;9;26
Disney Plays Hardball in Cable Talks With Altice;9;23
Luxury for Less in Orlando? It Can Be Done;10;2
At a Los Angeles Art Show, Mickey Mouse as an Imperialist Icon;9;22
In New Zealand, a Translated ‘Moana’ Bolsters an Indigenous Language;9;19
Disney Plots Streaming, From ‘Star Wars’ and Marvel to Pay-Per-Sports;9;7
Review: A Darker ‘Frozen,’ With Glints of Ice and Murk;9;15
Calling All Broadway Songwriters (in High School);9;15
Most Orlando Attractions Have Reopened After the Hurricane;9;14
How Business Was Battered by Irma;9;12
Bill Nye Files $37 Million Suit Against Disney Over Royalties;8;25
Disney, Ditching Netflix, Grabs a New Key to the Kingdom;8;24
To Get People in Stores, Disney Offers ‘Star Wars’ Treasure Hunt;8;24
With Disney’s Move to Streaming, a New Era Begins;8;10
How Disney Wants to Take On Netflix With Its Own Streaming Services;8;8
How Netflix Can Thrive After a Disney Divorce;8;9
Oil Nations Look to Enforce Production Cuts, and Disney Earnings Are Coming;8;7
Virtual-Reality ‘Star Wars’ Attractions Coming to Disney Malls;8;3
Marty Sklar, Longtime Disney Aide and Executive, Dies at 83;8;4
Pandora: Disney’s New ‘Avatar’-Themed Section;7;31
Here’s the New ‘Frozen’ Musical Poster (and Seven That Didn’t Make the Cut);8;4
The Messy, Confusing Future of TV? It’s Here;8;13
Disney Splits With the YouTube Star Jake Paul;7;24
ABC’s ‘Pink Slime’ Report Tied to $177 Million in Settlement Costs;8;10
Review: In Disney’s ‘Descendants 2,’ the Kids Are on Their Own;7;20
Disney Vows to Give Epcot a Magical, Long-Overdue Makeover;7;15
Kermit the Frog Performer and Disney Spar Over an Ugly ‘Muppet’ Firing;7;17
A Grown-Up’s Guide to Walt Disney World;7;3
Inside Avatar, the Theme Park Version;7;31
At Shanghai Disney Resort, Mulan, Mickey and Dumplings;7;4
Attendance Drops at Disney Parks Worldwide as Prices Rise;6;1
Disney Character;4;4
Disney Parks and Movies Soar, but ESPN Is a Concern;5;10
James Stewart on Disney’s C.E.O.;3;23
In Disney’s Seedy Shadow, the Magic and Hardship of ‘The Florida Project’;10;5
Kids Are Getting Older Quicker. And Disney Tries to Adapt.;3;10
Disneyland Map Is Headed to Auction;5;11
In China, ‘Disney’ Deals Turn Out to Be Fantasy;3;29
Disney Chief: My Role on a Trump Panel Is ‘Not an Endorsement’;3;8
Disney Deal Should Erase the Murdoch Discount;12;14
Robert Iger, Disney’s C.E.O., Agrees to One-Year Extension;3;23
Disney Says It Won’t Edit ‘Beauty and the Beast’ for Malaysian Censors;3;15
Disney, Korea, Theresa May: Your Friday Briefing;12;14
U.K. Court Upholds Fine for Dad Who Took Child From School for Disney Trip;4;6
Robert Iger, Head of Disney, May Not Be Leaving Anytime Soon;2;6
How to Save on Your Trip to a Theme Park;7;4
Net Neutrality, Disney, ‘Star Wars’: Your Friday Briefing;12;15
‘Beauty and the Beast’: Disney’s $300 Million Gamble;3;8
Where to Stay in Orlando;7;3
Dear Wirecutter: What’s the Best Backpack for a Family Trip to Disney World?;7;20
Disney’s Challenge: Keeping It ‘Frozen,’ but Still Fresh;8;9
Fox’s Disney Talks Could Still Lead to a Sale: DealBook Briefing;11;7
Quotation of the Day: In Buying Fox, Disney Shapes Media’s Future;12;15
Disney’s ‘Frozen’ Musical Casts Its Princesses;4;17
DealBook Briefing: Disney Deal Expected to Value Fox at Around $40 a Share;12;13
China’s Wanda Signals Retreat in Debt-Fueled Acquisition Binge;7;10
Netflix Signs Shonda Rhimes in Counterpunch to ABC and Disney;8;14
Malaysia to Show ‘Beauty and the Beast’ With Gay Scene, Exhibitors Say;3;21
Beyoncé Joins Disney’s ‘Lion King’ Remake, in a Role Fit for a Queen;11;2
Disney Drops PewDiePie and YouTube Distances Itself After Reports of Anti-Semitic Videos;2;14
Russian Official Seeks to Ban ‘Beauty and the Beast’ Over Gay Character;3;6
Packages for New ‘Pandora-The World of Avatar’ in Orlando;6;15
Review: The Dog’s Nice. The Cat Brags About Defecating on a Bed.;6;13
Movie Ticket Sales Sagging? Time to Bring Out the Toys;5;22
ESPN Is Betting on Big Personalities to Restore Its Fortunes;5;17
Movers: Apple Hits a Market Cap Milestone;5;9
Ryan Seacrest Joins Kelly Ripa as Co-Host of ABC’s ‘Live’;5;1
A ‘Star Wars’ Salvo in the Toy-Store Gender Wars;4;13
‘The Boss Baby’ Bests ‘Beast,’ Barely, as Box Office No. 1;4;2
‘Beauty and the Beast’ Clobbers Record With $170 Million Opening;3;19
‘Beauty and the Beast’ Director Talks of ‘Exclusively Gay’ Moment;3;1
In Fashion, Coupling Up Is Best;3;15
‘Pinocchio’ Heading to London Stage;1;23
An Alabama Drive-In Bans ‘Beauty and the Beast’ Over Gay Character;3;3
John Lasseter, a Pixar Founder, Takes Leave After ‘Missteps’;11;21
Nickelodeon Wades Into Princess Politics;2;2
Stewart on Trump and the Media;2;10
Morning Agenda: Stocks Decline on North Korea Tensions;8;9
Word + Quiz: duplicity;5;23
Christopher Raeburn: Men’s Collection;1;8
Coming to Carnival Cruises: A Wearable Medallion That Records Your Every Whim;1;4
How ‘Bambi’ Got Its Look From 1,000-Year-Old Chinese Art;1;5
Courtney Khademi, Teddy Steinkellner;10;29
What’s on TV Friday: ‘Ozark’ and ‘Descendants 2’;7;21
Some Screwball Surrealism for Halloween;10;24
‘Spider-Man’ Still Has Box Office Bite, to Sony’s Relief;7;9
‘Coco’ Dominates Thanksgiving Weekend at the Box Office;11;26
Comcast Said to Be in Talks to Buy 21st Century Fox Assets;11;17
ESPN Layoffs: The Struggling Industry Giant Sheds On-Air Talent;4;26
‘Thor: Ragnarok’ Hits Theaters With a Thunderclap;11;5
Neil Patrick Harris on Travel, From Sandcastles to Subways;1;17
Coming Soon to AMC Theaters: Virtual Reality Experiences;9;26
Comcast’s Careful Steps to Grow Past Cable Yield Results;10;26
NBCUniversal Is Building Its Own Children’s Channel;4;30
Frank Gehry’s Vast Archive Joins the Getty’s Collection;3;29
At ESPN, John Skipper Resigns as President, Citing Substance Addiction;12;18
Lucasfilm Will Get New Director for ‘Star Wars: Episode IX’;9;5
Netflix Says It Will Spend Up to $8 Billion on Content Next Year;10;16
‘Pirates of the Caribbean’ Sequel Tops Box Office as ‘Baywatch’ Flops;5;28
Review: ‘Beauty and the Beast’ Revels in Joy and Enchantment;3;3
In ‘Coco,’ Death Is the Point;12;8
California Today: Talking to a Democratic Challenger for Feinstein;10;16
Morning Agenda: Uber Weighs Offers for Shares;8;14
Procter & Gamble and Peltz Spar Over Who Won: DealBook Briefing;10;11
James Monroe Iglehart, New ‘Hamilton’ Cast Member, at Home;4;7
What’s on TV Tuesday: Oscar Nominees ‘Jackie’ and ‘Moana’;2;21
Debt-Ridden Chinese Giant Now a Shadow of Its Former Size;8;1
Daniel Craig Is Coming Back as James Bond in 2019;7;24
The Fallout From a Global Cyberattack: ‘A Battle We’re Fighting Every Day’;5;15
‘Star Wars’ Royalty: Princes Said to Have Cameo in Film;11;17
It’s Darwin, Not Stalin;3;29
The Los Angeles Philharmonic Lost Its Leader. Can It Stay on Top?;6;15
Hot on the Trail of ‘La La Land,’ Here Come More Movie Musicals;1;15
PewDiePie Dust-Up Shows Risks Brands Take to Tap Into Social Media;2;19
Louise Linton and Steve Mnuchin’s Money Moment;11;16
Soundtracks Dominate the Top 10 and the Weeknd Returns to No. 1;1;9
What the Car Did — And What It Might Do;11;7
Farhad’s and Mike’s Week in Tech: A Letter From Zuckerberg and the Fall of PewDiePie;2;18
What’s on TV Thursday: ‘A Charlie Brown Christmas’ and ‘Penn & Teller’;11;30
Lin-Manuel Miranda Was Talking to Meryl Streep the Other Day;2;17
‘Kong: Skull Island’ Roars as March Becomes a Tent-Pole Season;3;12
‘Guardians of the Galaxy Vol. 2’ Gives Summer Box Office a Big Start;5;7
‘Daddy’s Home 2’ and ‘Orient Express’ Turn Out Older Crowds;11;12
‘The Fate of the Furious’ Stays at No. 1 as New Films Prove Forgettable;4;23
What’s on TV Monday: ‘Gunpowder’ and ‘Supergirl’;12;18
Bob Bowman, Major League Baseball’s Digital Mastermind, Steps Down;11;6
6 Spooky Travel Destinations for the Halloween Season;10;18
‘The Mummy’ Stays Asleep at the Box Office;6;11
More U.S. Parks and Attractions Are Offering Online Reservations;10;6
Alyson Rosenfeld, James Clark;10;22
Hear the Singer Who Just Took One of Opera’s Top Prizes;2;1
What’s on TV Tuesday: ‘Beauty and the Beast’ and ‘The American Epic Sessions’;6;6
Jake Paul, a Reality Villain for the YouTube Generation;7;20
‘Beauty’ Rules the Box Office Again, as ‘Power Rangers’ Surprises;3;26
21st Century Fox, Net Neutrality, Roy Moore: Your Thursday Evening Briefing;12;14
Review: Squeezing Music Made for One Hall Into the Geffen;5;21
Jimmy Fallon Says the Tax Bill Is Actually Meant as Punishment;12;20
‘The Bold Type,’ a Modern Gloss on Sex and the Single Girl;6;30
Alabama, California, Donald Trump: Your Weekend Briefing;12;17
With ‘Roseanne’ and Backstreet Boys, ABC Mines the Past;5;17
New Trailer: ‘A Wrinkle in Time,’ From Ava DuVernay;11;20
Fairy Tales, Gently Fractured;5;19
Wonder Woman’s Surprising Back Story Has a Film of Its Own;10;11
Kristina Saffran, Ryan Hammond;7;23
‘Avatar’ Sequels Are Given Release Dates (Again);4;23
Variety: Acrostic;2;4
California Today: Capitol Enlists Help to Navigate Harassment Claims;11;14
Neena Lalchandani, Jonathan Hendershott;12;17
Ariel Cohen, Louis Orren;8;13
Drake and Ed Sheeran Hold the Top Spots on the Billboard Album Chart, Again;4;10
Idina Menzel to Return to the Stage in an Off Broadway Play;5;16
Watching While White: How Movies Tackled Race and Class in 2016;1;5
The Golfer Lydia Ko Loves Beaches (and Legos);9;27
Burger King ‘O.K. Google’ Ad Doesn’t Seem O.K. With Google;4;12
Readers Share Their Favorite Horror Movies;12;19
DealBook Briefing: Who Could Succeed John Skipper at ESPN?;12;18
Maisie Allison, John Owen;11;5
Eavesdropping on Warhol and Capote;8;30
A Rainmaker Seeks to Grow His Firm at a Time of Big Media and Tech Deals;12;18
From Trump to #MeToo: A Dizzying Year in TV News;12;31
An Ad Woman at the Top of an Industry That She Thinks Still Has Far to Go;4;25
Los Angeles Has America’s Most Important Orchestra. Period.;4;18
New Trailer: ‘Avengers: Infinity War’;11;29
Drake’s ‘More Life’ Spends a Second Week at No. 1, Boosted by 253 Million Streams;4;3
Theresa May, Net Neutrality, Russia: Your Friday Briefing;12;15
A Sports Titan’s Strange and Sudden Abdication;12;22
Review: ‘Ferdinand’ Delivers a Timeless Be-Yourself Message;12;14
With Drake’s Playlist Looming, Ed Sheeran’s ‘Divide’ Is No. 1, for Now;3;20
Kendrick Lamar Returns to No. 1 in Doldrums of Music Sales;8;14
In London, Fantasy Meets Obsession;2;21
Business Leaders Finally Walk Away From Mr. Trump;8;16
Anita Hill to Lead Hollywood Commission on Sexual Harassment;12;16
Eli Broad, Patron of Los Angeles, to Step Down From His Philanthropy;10;12
Fashion Is a Little Obsessed With Cartoon Characters;9;8
Pricey ‘King Arthur’ Is a Box Office Pauper;5;14
In Search of the Simple Sign-In;5;24
YouTube Falls Hard for ‘In a Heartbeat,’ a Boy-Meets-Boy Story;8;4
Alabama, White House, Janet Yellen: Your Wednesday Evening Briefing;12;13
4 Easy(ish) Steps Toward Happiness You Can Take Today;11;27
Notes From the Book Review Archives;9;8
The Weeknd’s ‘Starboy’ and the ‘La La Land’ Soundtrack Top the Chart;1;16
‘Alien: Covenant’ Is a Ho-Hum No. 1 at the Box Office;5;21
Checking In on ESPN’s Big Bet on Boxing. (Yes, Boxing.);12;17
Facebook Goes to Washington: DealBook Briefing;10;13
With ‘Rusalka,’ Will the Fourth Time Be the Charm for Mary Zimmerman?;1;27
Listen to ‘The Daily’: Harvey Weinstein’s New Accusers;10;11
Streams Keep the Weeknd’s ‘Starboy’ at No. 1 Despite Low Sales;1;23
‘Hamilton’ Casts Its Next Lafayette and Jefferson;1;17
Touring the United States, One Marathon at a Time;5;12
Hollywood Writers and Studios, Scrambling to Avert Strike, Reach Last-Minute Deal;5;2
Hollywood Loves Sequels, Even in the Executive Suite;4;11
After Harvey Weinstein’s Fall, Spotlight Finds His Brother;10;20
Republicans, Syria, Geert Wilders: Your Wednesday Evening Briefing;3;15
Taking the Plunge at the New Volcano Bay Water Park in Orlando;5;30
Holdover Films Chug Away at the Box Office as ‘Last Jedi’ Looms;12;10
Shia LaBeouf’s Art Exhibit Shut Down for ‘Public Safety’;2;10
‘How to Be a Latin Lover’ and ‘Baahubali 2’ Show Power at Box Office;4;30
Oprah Winfrey Coming to ‘60 Minutes’ as a Special Contributor;1;31
How to Be a Better Traveler: Tips From 2017;12;13
Images of Heroism Emerge From Hurricane’s Turmoil;9;11
‘Hidden Figures’ Ties ‘Rogue One’ at Box Office;1;8
Donald Trump, Luther Strange, Sierra Leone: Your Wednesday Briefing;8;16
California Today: The Latino Education Crisis;11;8
Republican Party, Wimbledon, ‘Game of Thrones’: Your Monday Briefing;7;17
While Other U.S. Companies Flee China, Starbucks Doubles Down;8;1
Reality? No, Thanks. Moviegoers Sought Escape in 2016.;1;1
Turner Will Create New Streaming Service for UEFA Champions League in U.S.;8;17
Improvisation Is the Heart of Cuban Animation;3;31
After Dismal Summer, Hollywood Pins Hopes on Fall Ticket Sales;9;3
Republican Party, Iran, Kermit the Frog: Your Tuesday Briefing;7;18
Five Places to Shop in Dublin;6;28
J. J. Abrams Takes Over as Director of ‘Star Wars: Episode IX’;9;12
Shia LaBeouf Is Arrested at Anti-Trump Art Show in New York;1;26
New Selections for National Film Registry Include ‘Superman,’ ‘Titanic’ and ‘Spartacus’;12;13
Rocky, Nell, Witch Hazel and More: A Sampling of June Foray;7;27
The Making of Virtually Real Art With Google’s Tilt Brush;1;4
Kenneth Branagh to Direct Tom Hiddleston in ‘Hamlet’;8;1
Shortlist of Architects Announced for Music Center in London;7;10
Katzenberg’s Big Ask: $2 Billion for Short-Form Video Project;10;2
‘Close Encounters’ Was When the Movies Got New-Age Religion;8;31
Your 2017 Travel Forecast;1;3
‘Climate Change Is Real’: Many U.S. Companies Lament Paris Accord Exit;6;1
How Jake Paul Set the Internet Ablaze;9;8
Female Investors Express Interest in Weinstein Company;11;21
North Korea, Jacob Zuma, Samsung: Your Tuesday Briefing;8;7
California Today: Hollywood Stars Uniting to Fight Sexual Harassment;11;10
Kit Reed, Author of Darkly Humorous Fiction, Dies at 85;9;28
Review: ‘Wonder Woman’ Is a Blockbuster That Lets Itself Have Fun;5;31
Mourning in Paris;11;16
How Much Watching Time Do You Have This Weekend?;9;7
What to Wear to a Summer Wedding;5;31
Hulu Names Its First Chief Content Officer;5;10
The Business Leaders Who Were on Trump’s Advisory Councils;8;15
Hulu Adds CBS to Its Coming TV Streaming Service;1;4
What’s on TV Tuesday: ‘Genius’ and ‘Great News’;4;25
Lana Del Rey Is Named No. 1 After a Rare Delay Holds Up the Billboard Chart;8;2
What’s on TV Wednesday: ‘The Zookeeper’s Wife’ and ‘Amazing Monkeys’;6;21
Alabama, Salma Hayek, Net Neutrality: Your Thursday Briefing;12;14
How Pixar Made Sure ‘Coco’ Was Culturally Conscious;11;19
Donald Trump, ‘Brexit,’ Madeira: Your Wednesday Briefing;8;16
North Korea, Iran, Sierra Leone: Your Wednesday Briefing;8;15
North Korea, Google, Jacob Zuma: Your Wednesday Briefing;8;8
Poland, Turkey, Roger Federer: Your Monday Briefing;7;17
Michael Flynn, North Korea, Rohingya: Your Monday Briefing;12;3
Lionsgate’s Bets Pay Off as Studio Makes a Big Comeback;2;9
Big Tech’s Rivals Pounce at Chances to Win in Washington;10;25
Roger Federer, Turkey, Donald Trump Jr.: Your Monday Briefing;7;16
Small Businesses Cheer ‘New Sheriff in Town’ After Climate Pact Exit;6;3
Farhad’s and Nick’s Week in Review: Uber’s New Boss and Amazon’s New Supermarket;9;1
What’s on TV Sunday: ‘Curb’ and a Carol Burnett Celebration;12;3
Ex-Official at Staten Island District Attorney’s Office Is Charged With Theft;8;3
What’s on TV Friday: Kate del Castillo in ‘Ingobernable’ and Lady Gaga on ‘RuPaul’s Drag Race’;3;24
In Reversal, Tech Companies Back Sex Trafficking Bill;11;3
Is Wisconsin Really That Hard to Spell?;5;31
Ones in Suits;2;26
Netflix and Amazon Still Have Great New Movies and TV Shows Coming This Month;6;19
A Hollywood Party at a Picasso Brownstone;4;20
Tronc Is Said to Pursue Us Weekly for More Than $100 Million;3;8
Review: In ‘Life According to Saki,’ Whistling a Perversely Happy Tune;2;14
How Valeant Had a Bright Idea but Took It Too Far;1;10
What’s on TV Sunday: Grammys, ‘Girls’ and John Oliver;2;12
The Winklevoss Twins’ Path to Bitcoin Fortune: DealBook Briefing;12;19
What’s on TV Saturday: ‘Bridge of Spies’ and ‘Money Monster’;1;14
What’s on TV Saturday: ‘Good Time’ and ‘Secrets of Christ’s Tomb’;12;23
Bailey Bryan, a Country Upstart Who’s Already Looking Beyond;4;19
The Hand Has Its Social Media Moment;10;11
Without Harvey Weinstein, Is There a Weinstein Company?;10;7
How YouTube’s Shifting Algorithms Hurt Independent Media;4;17
How ABC Found a Surprise Hit in ‘The Good Doctor’;11;19
Review: Thoroughly Modern ‘Victoria,’ Still Nursing That Crush;1;13
Movers: Blackstone, Steel Order and Unilever;4;20
F.C.C. to Loosen Rules on Local Media Ownership;10;26
The Best Indoor HDTV Antenna;1;6
La Guardia Airport Terminal Partially Evacuated After Bomb Threat;10;14
Morning Agenda: What’s Next as U.S. Exits Paris Accord;6;2
Review: ‘Anne With an E’ Is a Rewarding Return to Green Gables;5;11
Baby Born With Heart Outside Her Body Is Saved by U.K. Surgeons;12;13
What to Cook This Weekend;3;3
Cineworld and Regal in Blockbuster Merger to Challenge AMC;12;5
Sky Threatens to Shut News Channel for 21st Century Fox Deal;11;7
Art Forger Is Accused of Selling Fake Prints. Again.;6;19
Diverse Crowds Fuel ‘Cars 3’ and ‘All Eyez on Me’ at Box Office;6;18
Review: Before He Was ‘King Arthur,’ He Was a Guy Ritchie Lad;5;11
New York Today: History in a Holiday Window;12;18
As the World Tweets, Social Media Chiefs Remain Tight-Lipped;10;15
Welcome to the Campiest Place on Earth;11;25
Virtual Reality’s Potential for Magic Gets Real;2;19
What We Know About ‘Star Wars: The Last Jedi’;1;23
Having a Sundance Hit May Not Make You Rich Anymore;1;20
5 Destinations for the Thanksgiving Traveler;11;15
Review: ‘The Lego Ninjago Movie’ Sticks to the Instruction Manual;9;20
10-Year-Old Girl Escapes an Alligator in Orlando;5;8
Glitch in South Carolina Lottery Could Mean $19.6 Million in Winnings;12;30
Dance in NYC This Week;10;26
Hulu Chief Leaves to Lead Sony’s TV Division;10;24
Review: The Berlin Philharmonic Stages a Musically Glorious ‘Vixen’;10;17
Guatemalan Soccer Executive Gets 8 Months in FIFA Corruption Case;10;25
Wenner Media to Sell Men’s Journal, Continuing Shift From Print;6;22
Digital Security Provider, CrowdStrike, Raises $100 Million;5;17
How to Build the Best Preschools;5;30
L.A. Phil’s Youth Orchestra to Get a New, Frank Gehry-Designed Home;11;9
Signs of Possible Guilty Plea in Turkish Gold Trader Case;10;31
Patton Oswalt Announces His Engagement — and Strikes Back at ‘Grub Worm’ Critics;7;10
Without New Laws or Walls, Trump Presses the Brake on Legal Immigration;12;20
Penny Chenery, Owner of the Triple Crown Winner Secretariat, Dies at 95;9;17
June Foray, Virtuoso of Cartoon Voices, Notably Rocky’s, Dies at 99;7;27
Uber and Starbucks Protests Show Boycotts Need More Than a Hashtag;2;3
When Your Home Is a Castle;5;12
With Trump, an Economic Feast With Surprises on the Menu;1;3
These Tales Get Excited for School Days;8;25
Australia’s ‘King Kong’ Is Bound for Broadway, a Bit Late but Just as Big;5;17
SeaWorld Stake, Long Held by Blackstone, Is Sold to Chinese Firm;3;24
Seth Meyers Says Trump ‘Thinks in Cartoons’;7;18
Trial Will Decide if ABC News Sullied a Company With ‘Pink Slime’;6;5
Ariel Stein and Rares Orzata: This Circus Has Two Rings;6;3
Review: Roulette, a Hangman and Singing Fish, in an Animation Fest;12;28
Shopping on the Side Streets of Copenhagen;10;26
Jeanne Button, Designer of Whimsical Costumes, Dies at 86;5;18
Heavens to Murgatroyd;4;21
The 2017 Oscars are Over. Here’s Where to Stream the Winners;2;27
Big Ideas for a Tiny House on Broadway;1;4
What We’re Reading;10;27
In Praise of the Prune;2;16
How an Author Found the Real Florida;1;12
Amazon Trumpets Its Cloud Lead With N.F.L. and Other Deals;11;30
C.E.O.s React After Trump Attacks Merck Chief;8;14
Noreen Fraser, Who Led a Public Fight Against Cancer, Dies at 63;3;30
‘Let Obamacare Fail’? Fallon Says Democrats Are Trying That With Trump;7;19
Morning Agenda: Executive Order Confrontations, Deutsche Bank, Fannie and Freddie;1;31
A 100-Car Army of Sound in Los Angeles;10;17
Anthony Scaramucci Announces Mystery Media Venture;10;3
How Do You Turn an Ad Into a Meme? Two Words: Dilly Dilly;12;31
Summer Reading Contest, Week 9 | What Interested You Most in The Times This Week?;8;11
Review: In ‘The Zookeeper’s Wife,’ the Holocaust Seems Tame;3;29
Vice Media Fires 3 Employees After Harassment Complaints;12;1
Step Aside, Boys, Kelsea Ballerini’s in Town;2;8
Psychedelic Comics Like Beautiful Tattoos;12;1
Meg Whitman to Step Down as Hewlett Packard Enterprise C.E.O.;11;21
Redhead of Hogwarts;9;23
C.E.O.s See a ‘Sad Day’ After Trump’s DACA Decision;9;5
Going to Hooters and Seeing America;7;4
Events for Children in NYC This Week;4;6
My Unforgettable Drive Home to Beaumont, Texas;8;31
Nero Rock Opera Is a Burning Issue in Rome;6;9
Movies and Television New on Netflix in March;3;3
‘Jigsaw’ Carves Up Clooney’s ‘Suburbicon’ at the Box Office;10;29
Prosecutor and Judge Issue Rare Response to Criticism From Turkey;11;22
A Tax-Cut Bill to Make Scrooge McDuck Proud;11;16
How Many People Watch Netflix? Nielsen Tries to Solve a Mystery;10;18
‘Rick and Morty’ Fans Wanted Their Sauce. McDonald’s Underestimated Just How Much.;10;8
Style That Demands to Be Seen;10;4
Us Weekly Is Sold to National Enquirer Publisher;3;15
A ‘Hamilton’ Star Is to Replace Josh Groban in ‘Great Comet’;2;15
‘American Idol’ Is Coming Back to Television;5;9
Macondo and Medellín: A Millennial Colombian’s Novel;3;17
Head of Sony Entertainment, Michael Lynton, to Step Down;1;13
Winter TV: Where Flowers Now Bloom;1;6
What an Attack at an Ariana Grande Show Means for Teen Girls;5;23
Morning Agenda: A Nervous Time for Banks;5;2
Jimmy Kimmel Thinks Trump Should Watch ‘Sesame Street’;3;17
What the Decline of the Dollar Means;7;20
The Pippa Middleton Wedding Dress Effect;5;22
Events for Children in NYC This Week;1;19
Risky Business for C.E.O.s: An Invitation From Trump;2;16
The Best Movies and TV Shows New on Netflix Canada in June;6;2
The Best Movies and TV Shows New to Netflix Australia in August;8;1
Hal Willner’s Vanishing, Weird New York;9;8
How Alabama’s Election Could Reshape Washington’s Policy Battles: DealBook Briefing;12;12
The Hills Are Alive With the Sound of Julie Andrews and Henson Puppets;3;10
Oscars 2017: Where to Stream the Nominated Movies;1;24
A New Leader for Central Park;12;13
Twitter Users Split on Boycott Over Platform’s Move Against Rose McGowan;10;13
Why Is Venezuela Included in Trump’s Travel Ban?;10;10
Review: In ‘The Florida Project,’ Enchantment in a Shabby Motel;10;5
What Ariana Grande Represents to Her Fans;5;24
Communism’s Answer to Mickey Mouse Is Thrust Into a Very Capitalist Dispute;10;23
