Headline;Month;Day
Weekly News Quiz: Mogadishu Bombing, Insurance Subsidies, Harvey Weinstein;10;17
Diversity Initiatives Are ‘Way Overdue,’ Academy President Says;8;15
Sony Pictures, Shifting Toward TV, Names Tony Vinciquerra Its C.E.O.;5;11
Events for Children in NYC This Week;2;17
With iPhone and Stickers, a Doodling Artist Who Dreams Big;8;1
Eyeing Emergency Exits From Mergers in Anxious Times;1;12
National Parks for the 1 Percent;11;3
Morning Agenda: Uber Chooses Détente With Russian Rival;7;14
Morning Agenda: Waiting on the AT&T and Time Warner Deal;7;10
Review: A Shaggy Fish Story With a Bounty of Questing Heroines;6;9
9 Suggestions for Movies to Watch With Your Mother;5;12
We Write Your Favorite Shows. We Need to Get Paid.;5;2
Lorenzo Servitje, a Founder of the World’s Biggest Bakery, Dies at 98;2;6
‘Outlander’ Season 3, Episode 12: A Touch Strange;12;4
A Mixed-Race Royal Couple? It Wouldn’t Be the First;11;30
Zarrab’s Take From Iran Sanctions Plot? ‘Maybe $150 Million,’ He Says;12;6
‘Outlander’ Season 3, Episode 12: A Touch Strange;12;4
A Mixed-Race Royal Couple? It Wouldn’t Be the First;11;30
YouTube Unveils Subscription Television Service;3;1
Barbara Hale, Who Played Perry Mason’s Loyal Secretary, Dies at 94;1;28
On the Golden Globes Red Carpet, It’s Fantasy vs. Reality;1;9
Gershon Kekst, Leader in Wall St. Public Relations, Dies at 82;3;24
In Iran Sanctions Case, a Clash Over Turkish Banker’s Role;12;16
New Concerto, New Leader: A Big Day at the New York Philharmonic;3;16
Is Wilbur Ross Really a Billionaire?: DealBook Briefing;11;8
The Deal Makers on CVS’s Bid for Aetna: DealBook Briefing;12;4
With Trump in White House, Some Executives Ask, Why Not Me?;3;9
Icahn Picks New Board Fight With Xerox: DealBook Briefing;12;11
Two Operas With Nothing in Common, Except Exhausted Women;11;17
Murray Lerner, Who Filmed Music’s Biggest Stars, Dies at 90;9;5
Sorry, Mom, I’m an Aspiring Punk Rocker;8;25
How Do I Get Invited to My Boyfriend’s Thanksgiving?;8;10
Children’s Book Awards Highlight Race — and Politics;1;23
Science, Art and Redemption in the Land of the Penguins;8;8
Drama, Humor and a Sex Scene Every 15 Minutes;6;28
California Today: Los Angeles’s Crackling Restaurants;5;10
Sinclair Is Said to Be Near a Deal for Tribune Media;5;7
What Is Hawaii?;4;21
San Bernardino School Shooting Leaves 3 Dead, Including Student;4;10
The More We Connect, the Better It Gets — for Facebook;9;26
Len Wein, Influential Comic Book Writer, Dies at 69;9;11
Review: HBO’s ‘The Deuce’ Works a Vibrant Hustle in the Naked City;9;7
Even Business Leaders Who Abandoned Trump’s Councils May Not Stray Far;8;22
Lena Dunham Says Her Dog Was Abused. The Shelter He Came From Disagrees.;7;7
Five Studios’ Mission: Winning the Distribution Rights to James Bond;4;20
Tom Lenk and His Lewks: Instagram Parodies From the Red Carpet;2;15
Paula Dell, Pioneering Movie Stuntwoman, Is Dead at 90;1;20
Review: ‘Coco’ Brings the Pixar Touch to Death;11;21
Even at $15 an Hour, Need Is Close By;10;9
Citizens of Gucci-land, Unite!;9;21
Morning Agenda: Despite Political Discord Over Taxes, Markets Still Rise;8;2
Uber Offers a Thankless Job, and the Applications Flood In;7;13
This City Ballet Dancer Has a New Role: Being Bad;2;10
Review: In ‘The Lego Batman Movie,’ Toys and Heroes, What’s Not to Like?;2;8
‘Outlander’ Season 3 Finale: What Is, and What Might Have Been;12;11
London, Japan, Cassini: Your Friday Evening Briefing;9;15
Redefining the Female Silhouette at Comme des Garçons;3;5
California Today: A ‘Seismic Change’ at Cal State;8;4
The Bronx, New Year’s, I.R.S.: Your Friday Evening Briefing;12;29
Canada Is Turning 150. Oh, to Be 100 Again.;6;29
Chloé Names Natacha Ramsay-Levi as Creative Director;3;10
Review: In ‘The Disaster Artist,’ How to Fail at Moviemaking;11;30
Whimsical New Picture Books with a Spotlight on Wordplay;7;13
‘Wonder Woman’ Deflects Doubt to Win Battle at the Box Office;6;4
The Rise and (Maybe) Fall of Influencers;5;10
As Trump Tries to Revive Coal, a Composer Confronts Mining’s Past;4;4
Republican Party, Russia, Tar Heels: Your Monday Briefing;3;27
‘Netflix and Chill’? Sure. But There Are Others, Too.;2;17
TV Executives Survey Relationships and Ratings and Snub Netflix;6;13
A Lackluster Cannes and Not Just for the Extra Security;5;24
Review: Some Sugar but Not Enough Spice in This ‘Chocolate Factory’;4;24
California Today: Henry Rollins Strikes Chord as a Columnist;3;24
‘The Good Fight’ Season 1, Episode 6: Potency and Perspective;3;20
California Today: Why the State’s Biggest Lake Is Dying;3;9
Profitable Companies, No Taxes: Here’s How They Did It;3;9
Write-In Results From Alabama Senate Race Are In. And They’re Downright Weird.;12;28
