Headline;Month;Day
Trump Vows to Ease Rules for Drug Makers, but Again Zeros In on Prices;1;31
Trump’s Pick for Health Secretary Under Scrutiny for Investments;1;27
How Indianapolis, Long Known as a Manufacturing Center, Is Luring Tech Talent;1;17
Qualcomm Rebuffs Broadcom, and Missouri Subpoenas Google: DealBook Briefing;11;13
A Chicken That Grows Slower and Tastes Better;5;1
Donald Trump Is the Godfather of a Democratic Renaissance;8;10
American Underdog;3;31
Sessions Avoids AT&T Talk, G.O.P. Merges Taxes and Health Insurance: DealBook Briefing;11;14
Business Moguls Criticize Republican Tax Plans: DealBook Briefing;11;27
My Son, My Daughter: A Mother’s Evolution;4;1
The Highest-Paid C.E.O.s in 2016;5;26
