Headline;Month;Day
Endowment Sweepstakes: How Tiny Houghton College Beat Harvard;2;9
Trump Adviser Gary Cohn to Sell Stake in Chinese Bank Giant;3;17
The N.F.L. Is Now One of the Most Divisive Brands in the U.S.;10;11
A Road Meant to Ease Traffic Will Be Named After Christie;11;20
What’s on TV Tuesday: ‘Casual’ and ‘Frontline: Bannon’s War’;5;23
9 Artists Honor the Man Who Put Brooklyn on the Map;2;14
Eric Underwood, the American Star of the Royal Ballet;7;13
New York Today: New Yorkers on the Declaration of Independence;8;2
F.D.A. Delays Rules That Would Have Limited E-Cigarettes on Market;7;29
Mary Adelman, 89, Fixer of Broken Typewriters, Is Dead;11;24
A Bounty of Europe Travel Deals;4;24
11 of Our Best Weekend Reads;11;18
10 New Books We Recommend This Week;4;27
Dance in NYC This Week;10;19
Richard Prince, Protesting Trump, Returns Art Payment;1;13
Some Older Smokers Turn to Vaping. That May Not Be a Bad Idea.;12;8
Points of No Return;3;10
How the Wealthy Talk to Their Children About Money;5;19
With Rebels Gone, Colombia Jumps Into the Pot Industry;3;9
Friday Mailbag: A Columnist Has a Fiery Debut and Another Goes Missing;5;5
A Big Deal in Big Food, Irene Rosenfeld Retires From Mondelēz;11;14
In New Jersey, Exploring the Innovations of Thomas Edison;3;8
Two Brothers Are Assets and Liabilities in Joseph Kanon’s Spy Novel;6;2
Dance in NYC This Week;6;29
Young Socialites Conjure the Ghost of Leonard Bernstein at the Dakota;6;24
Pop, Rock and Jazz in NYC This Week;4;13
Harvey Lichtenstein, Who Led Brooklyn Academy of Music’s Rebirth, Dies at 87;2;12
2018 Grammy Nominations;11;28
Frank Lloyd Wright Hated New York, Thought About Making the Guggenheim Pink, and Still Dreamed of Mile-High Skyscrapers;6;9
Bill Steinkraus, Equestrian Who Made Olympic History, Dies at 92;12;7
An Officer’s Death in ‘One Square Mile of Danger’;7;9
As Democrats in Suburbs Take Victory Lap, Focus Shifts to 2018;11;9
The Best Movies and TV Shows New on Netflix Canada in December;12;7
38 Years on Books: The Essential Michiko Kakutani Reader;7;27
A. Scott Berg: By the Book;7;6
Merce Cunningham as Collaborator, Breaking Down Hierarchies in Art and Bodies;3;3
Awed by Camden Yards, Rick Sutcliffe Started It All With a Shutout;8;19
Simon Schama: By the Book;10;19
MoMA Upends Its Collection to Celebrate Late Careers;12;28
8 Highlights From Miami Art Week;12;7
Arthur Finkelstein, Innovative, Influential Conservative Strategist, Dies at 72;8;19
The Highest-Paid C.E.O.s in 2016;5;26
10 Places That Define New York City, Reimagined;10;30
Still Processing: Harvey Weinstein and Our Unreal Reality;10;13
Still Processing: Take a Knee if You Agree;9;28
6 Ways ‘Girls’ Changed Television. Or Didn’t.;2;2
Jordan Peele’s X-Ray Vision;12;20
The First Woman to Translate the ‘Odyssey’ Into English;11;2
Corrections: November 16, 2017;11;16
