Headline;Month;Day
Robert G. Wilmers, Bank Chief and Buffalo Philanthropist, Dies at 83;12;19
The Future Is Now, and Dark, in T. Coraghessan Boyle’s Stories;12;8
Review: In ‘Mary Shelley’s Frankenstein,’ a Monster to Love;12;28
New York’s Attorney General in Battle With Trump;12;26
Box of Horse Manure Is Left for Steve Mnuchin Near His Home, Police Say;12;24
Rupert Murdoch and President Trump: A Friendship of Convenience;12;23
Tax Cuts Crystallize Haves, Wants, Can’ts, Won’ts;12;21
Holiday Fiction, Just in Time for Christmas;12;22
Past Debates Echo in Split Between Cornel West and Ta-Nehisi Coates;12;22
Eric Schmidt, Alphabet’s ‘Ambassador,’ to Step Down: DealBook Briefing;12;21
MacArthur Grant Will Create ‘Sesame Street’ for Syrian Refugees;12;21
Review: In ‘The Greatest Showman,’ a P.T. Barnum Smaller Than Life;12;20
As G.O.P. Celebrates House Vote, New York and New Jersey Lawmakers Say No;12;19
The Corker Handout (not Kickback);12;19
How Republicans Learned to Sell Tax Cuts for the Rich;12;18
A Fox Deal Would Test Disney;12;13
When the People’s Lawyer Breaks the Law;12;14
Mr. Mnuchin’s Magical Math on Taxes;12;12
Steve Mnuchin Pulls a Paul Ryan;12;11
Sculptural Accessories That Are True to Form;10;30
AT&T’s C.E.O. Meets Trump’s Justice;11;25
Trump and Warren Find Common Ground on Antitrust;12;6
The Takedown of Title IX;12;5
Washington Has Delivered a Tangled Message on AT&T’s Power;11;22
How to Make Sense of the U.S. Case Against AT&T-Time Warner;11;22
AT&T’s Run-Ins With the Government;11;21
Prosecutor Is Indicted Over Inquiry Into 2016 Police Killing;12;2
Bells Are Ringing! 5 New Holiday Books for Children;12;1
Acting Studios Are Struggling. Does It Matter?;12;1
Justice Department Sues to Block AT&T-Time Warner Merger;11;20
Trump Is Cracking Up;12;1
U.S. Lawsuit Against AT&T and Time Warner;11;20
DealBook Briefing: Trump Is Still Not a Fan of AT&T-Time Warner;11;21
Ahead of Vote, Promised Treasury Analysis of Tax Bill Proves Elusive;11;30
New York Assemblyman Is Disciplined for Sexual Harassment;11;29
DealBook Briefing: Pass-Throughs vs. Corporations — Who’s the Bigger Winner?;11;29
The Trump Administration’s Incoherent Stance on Competition;11;28
Wild for Animal Prints;10;25
About Last Night: T Magazine Celebrates the Greats;10;20
Watch Kids Sing Stephen Sondheim at T’s Greats Party;10;20
Woman Tried to Dupe Washington Post With False Claim About Roy Moore, Paper Says;11;28
With AT&T and Time Warner, Battle Lines Form for an Epic Antitrust Case;11;16
Why the AT&T-Time Warner Merger Makes Sense;11;16
DealBook Briefing: Nelson Peltz’s Trian Pushes Back as P.&G. Reviews Vote;11;22
Mr. Trump Casts a Shadow Over the AT&T-Time Warner Deal;11;15
Will Justice Department’s Lawsuit Derail Deal-Making Boom?;11;22
Trump Administration Scrambles Its Media Signals;11;21
Under Scrutiny, Trump Foundation Raised, and Gave, More in 2016;11;21
Can’t Follow the Tax Debate? Read This.;11;18
DealBook Conference: AT&T, Uber and President Cuban?;11;10
Dries Van Noten Captures His World — in Polaroids;10;19
AT&T Has No Intention of Selling CNN to Finalize Deal;11;9
DealBook Briefing: Senators Want Answers on AT&T Negotiations;11;10
How to Profit From Time Warner’s Troubles;11;17
In AT&T Deal, Government Action Catches Up With Trump Rhetoric;11;9
DealBook Briefing: Corporate Taxes, Musk vs. Buffett, and Will Fox Strike a Deal?;11;17
‘I Have Never Offered to Sell CNN,’ AT&T C.E.O. Says;11;9
Justice Department Says Not So Fast to AT&T’s Time Warner Bid;11;8
Why Blocking the AT&T-Time Warner Merger Might Be Right;11;10
AT&T Deal Puts Trump’s Antitrust Cop at Center of a Political Storm;11;10
Trump Returns and Attacks a Favorite Foe: CNN;11;15
Peltz May Have Won After All: DealBook Briefing;11;15
Excerpts From the DealBook Conference;11;14
Sprint and T-Mobile End Merger Discussions;11;4
Security Breach and Spilled Secrets Have Shaken the N.S.A. to Its Core;11;12
Farhad and Mike’s Week in Tech: Get Ready for Robot Cars;11;10
U.S. Imposes Sanctions on 10 More Venezuelan Officials;11;9
CNN Is Not for Sale, and the Search for a ‘Corporate Kaepernick’: DealBook Briefing;11;9
TIAA Receives New York Subpoena on Sales Practices;11;9
Trevor Noah Is Amazed at How Fast Trump Cut Ed Gillespie Loose;11;9
Republicans Are All In on Tax Plans, but Face Real Political Risk;11;9
Jurors, Seeing a Punch, Found an Officer Justified in a Fatal Shooting;11;9
YouTube’s Rapid Response Partisans Game the News of Tragedy;11;8
Ritz-Carlton Has Become a Gilded Cage for Saudi Royals;11;7
A Mafia Turncoat, Facing Life, Is Sentenced to 11 Years;11;3
Transactions Tied to Weinstein and AIDS Charity Are Under Investigation;11;3
Queens Man Is Sentenced for Hiring Gunman in Midtown Killing;11;3
Republicans’ Mistakes on Writing, and Selling, Tax Plan Could Cost Them;11;2
Mnuchin Talks Taxes and That Vanishing Treasury Study;10;31
Republicans Delay Releasing Tax Bill, Signaling Trouble for Party;10;31
Investigations of Manafort in New York Are Beyond Trump’s Power to Pardon;10;30
The Best Uses of Color in T This Year;12;27
The Best Rooms in T in 2017;12;22
The Best Vintage Images That T Published in 2017;12;29
T’s Most Vibrant Images in 2017;12;27
Our Favorite Vintage Photographs in T This Year;12;29
The Best Rooms Featured in T in 2017;12;22
T’s Best Destinations of the Year;12;20
In Niger, Where U.S. Troops Died, a Lawless and Shifting Landscape;10;29
The 10 Most Stunning Pieces of Jewelry Featured in T This Year;12;28
The 30 Best Fashion Images That Appeared in T This Year;12;19
The 10 Best Quotes, as Told to T, in 2017;12;18
13 Far-Flung, Beautiful Destinations That Appeared in T This Year;12;20
Trump Unlikely to Name Top Two Fed Officials at Same Time, Mnuchin Says;10;28
The Little-Known Pragmatist Who Is Shaping the Trump Tax Cuts;10;28
The T Editors’ (Fantasy) Gift Guide;12;11
U.S. Soldiers Were Separated From Unit in Niger Ambush, Officials Say;10;27
Trump: ‘The Press Makes Me More Uncivil Than I Am’;10;25
A Shortlist of What We Like Right Now;10;3
A Sergeant’s Last Mission: Soldiering, Barbering and Missing His Family at Home;10;25
The Bone-Spur Bozo at the White House;10;24
Dueling Motives in Shooting by Officer: Murder, or Trained Response?;10;24
Honor the Truth, John Kelly;10;24
The Sergeant Caught in a Trump Controversy;10;23
U.S. Troops Ambushed in Niger Waited an Hour to Call for Help;10;23
Weinstein Company Faces Civil Rights Inquiry by New York Attorney General;10;23
Soldier’s Widow Says Trump Struggled to Remember Sgt. La David Johnson’s Name;10;23
Some Things T Editors Like Right Now;12;1
Planned Obsolescence;12;29
The Enduring Power of a Low Bun;12;27
9 New Fashion Brands We Discovered This Year;12;26
The Anti-Resolution Revolution: 5 Vows You Can Keep;12;27
Lake Como for a New Generation of Cool Kids ;12;28
When Good Beauty Products Smell Downright Bad;12;26
10 Models Who Caught Our Eye This Year;12;21
In Palm Springs, to Pool Hop Is to Time Travel ;12;27
What Perfume Are You Wearing? Now You Never Have to Tell;12;26
Francine Prose’s Oaxaca: An Immersion Course in Mexico’s Delights;12;26
On the Road for Work and Finding Love;12;25
Super Yaya’s Rym Beydoun Sees the Future of Fashion;12;22
The Daniel Day-Lewis Version of Fantasy Fashion Diva;12;23
Open Thread: This Week in Style News;12;22
Review: ‘Drawing Home’ Sketches the Life of an Artist Couple;12;21
Small-Batch Botanical Oils, Made in Brooklyn;12;21
T Holiday Gift Guide | Bread Face;11;27
The Nuclear Showdown in Georgia;12;20
This Year’s Greatest Fashion Pictures;12;19
Resort Wear for Anywhere ;12;20
T’s Holiday Issue: Editor’s Letter;11;29
How Fliers Can Relax and U.S. Airlines Can Compete: With Spas;12;18
Political Guardrails Gone, a President’s Somber Duty Skids Into Spectacle;10;21
Are High Heels Headed for a Tumble?;12;16
Open Thread: This Week in Style News;12;15
Jonathan Saunders Resigns Role at Diane von Furstenberg;12;15
The More We Learn About ‘Dido and Aeneas,’ the Less We Know;12;15
What’s in a Rick Owens Retrospective? Whatever He Wants;12;15
Scenes of Holiday Lights in New York;12;13
New York City, Illuminated for the Holidays;12;13
Christie’s Just Set Another Auction Record, for Handbag Sales;12;14
The New Supermodelmania of 2017;12;14
3 Chill-Proof Party Looks;12;13
Getting in a Holiday Frame of Mind;12;13
Conflicting Accounts in Niger Ambush Are Subject of Pentagon Investigation;10;21
The Year in Stuff;12;13
Why You Should Love Secondhand Fashion Now;12;13
Military Members and Their Families Respond to John Kelly’s News Conference;10;21
Trump’s America First Trade Agenda Roiled by Internal Divisions;10;20
After Video Refutes Kelly’s Charges, Congresswoman Raises Issue of Race;10;20
Kelly Delivers Fervent Defense of Trump Call to Soldier’s Widow;10;19
Open Thread: This Week in Style News;12;8
8 Highlights From Miami Art Week;12;7
Bobby Cannavale, Tough Guy, ‘Can Handle a Pink Couch’;12;7
Karl Lagerfeld Sails Home to Hamburg for Chanel’s Métiers d’Art;12;7
The Star Power of Johnny Hallyday (Jimi Hendrix Was His Opening Act);12;7
Josh Goot and Christine Centenera’s Line of Essentials;12;6
The Future Is ... Purple;12;7
Sweater Vests Are Back. Just Don’t Tell Grandpa. ;12;6
Rules of Good Gift Giving;12;6
Why Is There No Great Multibrand Men’s Store in New York?;12;6
Fallen Troops’ Families Tell of Meeting Presidents: Sympathy and Sometimes Discomfort;10;19
Rep. Frederica Wilson on Trump: ‘That Is Not What You Say to a Grieving Widow’;10;18
A Hole-in-the-Wall Graffiti Store in Sleek SoHo;10;18
Maison Atia’s Debut Collection;12;5
Death of Retail? 2017 Was All About the Empire of Luxury E-Tail;12;6
Gucci Moves Its Fine Jewelry Line Upmarket;12;6
Brand to Know: Coats (and Home Goods) Made Entirely of Faux Fur;12;5
5 Easy, Breezy Skin Care Tips for Guys this Winter;12;5
A Macho Home on Guys’ Wrists;12;5
In London, Empowerment and Emotion at the Fashion Awards;12;5
Samsung Is Under Scrutiny Again as South Korean Police Raid Offices;10;18
Trump’s Condolence Call to Soldier’s Widow Ignites an Imbroglio;10;18
A MacArthur ‘Genius’ on Overcoming Modern Farm Slavery;10;18
Orange Blossom Perfume, to Remind You of Summer;12;4
A Street Wear Original Starts Its Own Label;12;4
Festive Footwear and Other Whimsical Duds for the Holidays;12;4
A Season of Cleveland Anxiety, Brought to You by LeBron James;10;17
How Ruby Rose Achieves a Unicorn Effect;12;4
Open Thread: This Week in Style News;12;1
House Tour | Jenna Lyons;12;1
Marco Zanini Captures His Italian Trip — in Polaroids;11;30
Jenna Lyons’s Space of Her Own;12;1
A Fashion Guide to Miami Art Week;12;1
Put a Ring on It;12;1
Holiday Windows, a (Sort of) Love Story;12;1
A Studio Visit With Henry Taylor;11;29
Malta, Where the West Was Born;11;30
In India, Ivanka Trump Tried on Some Fashion Diplomacy. Was it a Good Look?;11;30
In the Studio With the Artist Who Painted Jay-Z;11;29
Sick of Millennial Pink? Here’s the Cure;11;29
Jay-Z and Dean Baquet, in Conversation;11;29
Jay-Z Discusses Rap, Marriage and Being a Black Man in Trump’s America;11;29
Profile in Style: Marco Zanini;11;28
A Designer Inspired by Italy — and Scandinavia;11;28
A Film That Pays Homage to the Bygone Era of London Couture;11;28
The Illustrated Interview: Ricky Gervais;11;27
Some Things T Editors Like Right Now;11;14
Meghan Markle Is Going to Make History;11;27
Victoria Beckham Raises $40 Million in Private Equity Investment;11;27
Surreal Gifts for Unreal Times;11;27
Pinups in the Post-Weinstein World;11;27
How to Get Your Mind to Read;11;25
When Sexual Assault Victims Are Charged With Lying;11;24
Open Thread: This Week in Style News;11;24
Mnuchin Says Estate Tax Repeal Will Help ‘Rich People’ Most;10;13
A Modeling Rite of Passage, Unmasked;11;23
A Chat With MacArthur Genius Nikole Hannah-Jones;10;13
Because Sometimes You Don’t Want to Get Off the Couch;11;22
The Sweet Rewards of Bitter Food;11;22
T’s Travel Issue: Editor’s Letter;11;10
Generations of Jewelry in a Small Italian City;11;22
8 Elegant Ashtrays;11;21
The ‘Good Time’ Stylist Has Some Tips for Style on a Budget;11;21
The New Generation of Character Actors;11;21
Design, Jewelry and Cora Sheibani;11;21
HSBC Names John Flint as Chief Executive;10;12
The Making of a Family Home in ‘Call Me by Your Name’;11;20
An Ode to Things That Are Not What They Seem;11;20
Remembering Azzedine Alaïa: The Designer Who Took Time;11;20
A Guide to Cap Ferret, the Cape Cod of France;11;20
Detroit: The Most Exciting City in America?;11;20
MacArthur Foundation Fellows: Winners List;10;11
MacArthur Foundation Names 2017 ‘Genius’ Grant Winners;10;11
For Lisa Eisner, ‘Money Never, Ever Motivates Me’;11;17
To Serve Is to Slobber;10;10
Open Thread: This Week in Style News;11;17
Review: A Message-Heavy Bill T. Jones Dance-Theater Collage;10;4
Dressing to Play a Power Woman;11;17
Poles Cry for ‘Pure Blood’ Again;11;17
8 Very Bright Mini Bags;11;16
Christie’s da Vinci Auction: Who Was There;11;16
A London Penthouse, in Shades of Gray;11;16
Classic Scottish Knits, Updated;11;15
Paris Restaurants Get a Design Boost ;11;15
The Beauty of Subtly Mismatched Earrings;11;15
Prepare for the Chill;11;15
You’re Getting Better With Age. Your Makeup Should, Too.;11;15
A Feminist Collective, Not Just a Store in NoLIta;11;15
3 Designers Creating Clothes for Life — Not the Runway;11;15
Trump’s Masochism;10;9
Our Favorite Photos of London Fashion Week;9;20
Gary Cohn and Steven Mnuchin Risk Their Reputations;10;9
The New Wave of Wellness-Oriented Bath Products;11;14
The Season’s Most Stunning Red Jewelry;9;20
Is the Age of the Artistic Recluse Over?;11;14
The School Prepping for Apocalypse;11;13
Why Fashion Can’t Stop Looking North;11;13
The Death Knell for the Bricks-and-Mortar Store? Not Yet;11;13
Luxury in a Turbulent World: What’s Next?;11;13
In India, Fashion Has Become a Nationalist Cause;11;12
A New Fashion Hub? Eastern Europe;11;12
Fashion’s Interest in Alternative Fabrics Keeps Growing;11;12
The Wing, a Chic Women’s Club, Is Going Wide;11;11
My Madeleine | Deuki Hong;11;10
My Madeleine | Diep Tran;11;10
My Madeleine | Angela Dimayuga;11;10
Open Thread: This Week in Style News;11;10
Three Asian-American Chefs Share Recipes for Meaningful Dishes;11;10
Treasury Report Calls for Sweeping Changes to Financial Rules;10;6
A Short List of What We Like Right Now;9;18
Kendrick Lamar and Rihanna Wear Her Jewelry;11;10
No Room for America Left in Those Jeans;11;10
Asian-American Cuisine’s Rise, and Triumph;11;10
Celebrating Fashion That Can Be Seen But Not Bought;11;10
Highlights from “The Authentics”;11;9
Creative People’s Stunning Homes, All Over the World;11;9
On Stephen Shore, and Looking for America;11;9
Seven Flights for $800,000: Mnuchin’s Travel on Military Jets;10;5
Joyce Carol Oates’s Prized Portraits by a Friend;11;8
How to Host a Dinner Party;11;8
This Week’s Openings, Pop-Ups and Don’t-Miss Shopping Events;11;8
A Journey Into Silence | The Hoh Rain Forest;11;8
Simple Boots, Updated;11;8
Arriving This Week: Styles to Brighten Winter;11;8
Lessons in Stillness From One of the Quietest Places on Earth;11;8
Trump’s Scandals, a List;10;5
State of Play: Suiting Meets Sportswear;9;5
Where Sweats Are Cinched and Air Jordans Are Art;11;7
Imaginary Vagabonds;11;7
Clothes You Can Take Anywhere You Dream of;11;7
At Tiffany, the Fifth Avenue Face-Lift Starts at Home;11;7
A Lot of Fashion Insiders Say Telfar Is the Brand to Know;11;7
8 Pairs of Timeless Greek Sandals;11;6
A Brief History of Time;11;6
Some Things T Editors Like Right Now;10;27
The Rise of Modern Ikebana;11;6
The Trump Tax Idea That’s a Boon for Shareholders;10;3
Republicans Won’t Rule Out Tax Hikes for Some in the Middle Class;10;2
Who Will Mourn Teen Vogue?;11;4
2017 Holiday Gift Guide;11;3
Open Thread: This Week in Style News;11;3
Profile in Style: Makie Yahagi;11;3
A Beloved Boutique Owner’s Favorite Things;11;3
A Trump for All Ages;11;3
What You Wear to MoMA Could Soon Become a Part of It;11;2
How to Protect Your Skin Against Winter Dryness;11;2
Modest Dressing, as a Virtue;11;2
Olympic Fashion: Winning or Not?;11;2
Shopping With Superman;11;2
A Filmmaker and Artist Who Also Designs Clothing;11;1
Paris’s Best Chocolates: A Guide ;11;1
The Illustrated Interview: William Wegman;11;1
Unspeakable Pursues Uneatable, Fashion Follows;11;1
Where to Relax (and What to Eat) in Formentera;11;1
Josh Hutcherson of ‘The Hunger Games’ Keeps His Wardrobe Basic;10;31
T Magazine Celebrates the Greats;10;20
The Feminine Mystique;10;31
Mr Porter’s New Private Label (and Getting Cozy Indoors);10;31
Your Grandma’s Favorite Bargain Store Wants You;10;31
A TriBeCa Store With Built-In P.R. Buzz;10;31
The Feminist Pioneers Making Provocative Art About Sex;10;31
A Shortlist of What We Like Right Now;10;31
Some Things T’s Editors Like;10;20
Paul Manafort’s Shopping Sprees Hit Home;10;31
Alicia Silverstone’s Very Green Beauty Routine;10;31
Your Week in Culture: Katy Perry, Agnès Varda, the Guggenheim’s Chinese Art (Minus the Animals);9;29
Sight and Insight in the California Desert;10;30
Private Emails, Private Jets and Mr. Trump’s Idea of Public Service;9;29
After the Tsunami, Japan’s Sea Creatures Crossed an Ocean;9;28
Trump’s Worst: An Update;9;28
When Rough Meets Refined;10;27
Open Thread: This Week in Style News;10;27
‘Terry Richardson Is Just the Tip of the Iceberg’;10;27
Read T a Poem | Amy Adams;10;16
Tell T a Joke | Amy Adams;10;16
Helsinki’s Best Public Saunas: A Guide;10;26
8 Nerdy-Cool Fanny Packs;10;26
The Man Designing Spaces for the Instagram Age;10;26
T’s The Greats Issue: Editor’s Letter;10;16
North Korean Banks and Citizens Added to U.S. Sanctions List;9;26
This Week’s Pop-Ups, Openings and Special Shopping Events;10;25
Putting Detroit’s Finest in Detroit Public Theater;10;25
How to Cheat Halloween;10;25
In Catalonia, a Church Becomes a Place of Artistic Pilgrimage;10;25
Tarot Is Trending, and Dior Predicted This Months Ago;10;25
Gens Y and Z Are Buying Lots of Luxury Stuff After All;10;25
Calvin Klein’s First Coffee-Table Book Is R-Rated History;10;25
Fall Boots: Just a Little Bit Country;10;24
Home and Work: Valerie Barkowski;10;24
Bulgari Reopens Fifth Avenue Flagship Store;10;24
You’ll Wear What They Tell You to Wear;10;24
A Textile Designer’s Calming, Sunlit Life;10;24
Make T Something | Alex Da Corte;10;13
In Britain, Few Surprises in 2017 Fashion Awards Nominations;10;23
The Place Beyond the Fire Island Pines;10;23
After Weinstein Scandal, a Plan to Protect Models;10;23
6 Things T’s Editors Like Right Now;10;13
How Protest Works;10;21
‘Janelle Asked to the Bedroom,’ a Micronovel by Chimamanda Ngozi Adichie;10;20
Tumult After AIDS Fund-Raiser Supports Harvey Weinstein Production;9;23
Open Thread: This Week in Style News;10;20
Tom Price’s Entitlement Spending;9;22
T’s Best Images From Fashion Month;10;10
T’s 30 Best Photos From Fashion Month;10;10
On T’s Radar: A Mountain Getaway, Lumpy Design & More;8;31
How to Dress to Win an Election: The Sebastian Kurz Primer;10;19
This Week’s Pop-Ups, Openings and Special Shopping Events;10;18
6 Denim Jackets for This Weird Fall Weather;10;18
10 Famous People on Stephen Sondheim ;10;18
Who Doesn’t Like Being First?;10;18
Moscow’s Monument to Murder;9;21
Rochester Launches New Inquiry Into Harassment Accusations;9;20
Sézane Finds Success by Making Less;10;17
I Took It With a Grain of Salt;10;17
5 Operas in 72 Hours: A Philadelphia Festival Is a Test of Survival;9;20
Chimamanda Ngozi Adichie, a Humanist On and Off the Page;10;16
The Greats 2017;10;16
A Look at Dries Van Noten’s Designs;10;16
Claes Oldenburg and His Art, Through the Years;10;16
Stephen Sondheim | "Broadway Baby";10;16
Highlights From Dries Van Noten’s Many Runway Shows, in Pictures;10;16
Stephen Sondheim | "I'm Still Here";10;16
Stephen Sondheim, Theater’s Greatest Lyricist;10;16
Nicki Minaj, Always in Control;10;16
Claes Oldenburg Is (Still) Changing What Art Looks Like;10;16
The Versatile and Resilient Amy Adams;10;16
Park Chan-wook, the Man Who Put Korean Cinema on the Map;10;16
Dries Van Noten, Icon of Creative Freedom;10;16
Nike’s Chief of Design Doodles All Day;10;16
Giant Monument to Kalashnikov, Creator of AK-47, Is Unveiled in Moscow;9;19
Decoding Dress in North Korea;10;16
James Corden Denies Kissing Sean Spicer — Then Apologizes, Sort of;9;19
Open Thread: This Week in Style News;10;13
8 Sleek Tape Dispensers for Your Desk;10;13
Fashion Breaks Its Silence on Harvey Weinstein Scandal;10;13
Why Frankenstein’s Monster Haunts Queer Art;10;13
The Ghost That Haunts Grant’s Memoirs;10;13
The Illustrated Interview: Gloria Vanderbilt;10;12
Slinky Dresses, Meet Slouchy Trousers;10;12
A Paris Boudoir Where Everything’s Meant to Be Touched;10;12
The Artist Chris Ofili Captures Trinidad, in Pictures;10;11
Chris Ofili’s Images of Trinidad;10;11
Fashion’s Gossip Addiction;10;12
7 Great Things I Saw at Frieze and Frieze Masters;10;11
We’re Living in the Golden Age of Contouring;10;11
What Is Slow Fashion? We Explain;10;11
Psst! Prince Harry Parties Here. Also Pippa and J-Law.;10;11
Where to Stay (and What to Eat) in Matera, Italy;10;11
Melania Trump Wears First Lady Cred on Her Sleeve;10;11
Sexual Harassment Charges Roil Elite University Department;9;15
A Police Bombing, Homes on Fire and an Opera That Grapples With It All;9;15
Alexander Coggin’s ‘Clavicle Studies’ at Frieze London;10;10
More Classmates of Treasury Secretary Hound Him to Quit Trump Post;9;15
A Photographer Documents Art-Fair Archetypes — and Their Accessories;10;10
Profile in Style: Ilse Crawford;10;10
8 Pairs of Exotic, Graphic Mules;10;10
Ilse Crawford’s Unerring Eye;10;10
Lil Mama Instructs Us on How to Glow Up Properly;10;10
One Model, 41 Beauty Looks;10;9
Highflying Mnuchins Take the Country for a Ride;9;14
For a New Capsule Collection, Loewe Looks Back;10;9
‘Mr. Robot’: What to Remember Before Watching Season 3;10;9
What Killed the Promise of Muslim Communism?;10;9
The New Generation of Japanese Accommodations;10;9
Mnuchin Inquired About Using Government Plane for His Honeymoon;9;14
T Fashion Editors’ Guide to Paris;9;27
Trump Goes All In on a Tax Overhaul Whose Details Remain Unwritten;9;13
For Madison Cox, Widower of Pierre Bergé, C’est Compliqué;10;7
Democrats Vow to Fight Republican Tax Provisions that Aid Rich;9;12
Open Thread: This Week in Style News;10;6
An Ode to the Fragile Majesty of the Natural World;10;6
Paris Fashion Week Accessories;10;6
What Does It Mean When an Artist Retires?;10;6
Can Paul Andrew Fix Ferragamo’s Fashion Problem?;10;6
Our Favorite Photos of Paris Fashion Week;10;5
The 25 Best Photos of Paris Fashion Week;10;5
4 Streamlined Timepieces;10;5
Need a New Fall Look? Upgrade These Basics;10;5
Guerrilla Flower Installations That Don’t Last Long at All;10;5
Stars and Stripes for Maison Kitsuné;10;5
Supreme Opened in Brooklyn With a Giant Skate Bowl. We Dropped In.;10;5
The Latest Act of a Designer Found, Lost and Found Again;10;5
The Top 10 Moments of Paris Fashion Week;10;5
Enamel Adds a New Shine to Small Accessories;10;4
Supreme Brooklyn Opens and Other Retail Highlights;10;4
Our Favorite Street Style Looks From Four Cities;10;4
The Novel Taste of Old Food;10;4
Runway Trend Report: Spring 2018;10;4
Will Smith Revives the ‘Fresh Prince’ at Paris Fashion Party;10;4
Next Spring, Next Trends;10;4
Our Favorite Photos From Paris Fashion Week;10;4
Make Your Wardrobe a Work of Art;10;4
The Fashion Dialectic;10;4
Balenciaga Makes You Look Twice;10;4
How to Throw a Laid-back Parisian Dinner Party;10;3
Looking Crisp for Fall;10;3
At Totokaelo’s New Home, the Fitting Rooms Are Bank Vaults;10;3
A Guide to Finding the Perfect Summer T-Shirt;8;9
Eden in Extremis at Chanel and Alexander McQueen;10;3
Carla Bruni-Sarkozy: Me and My Guitar;10;3
Joseph Altuzarra Gets Ready for His Show;10;2
Behind the Scenes in Paris With Joseph Altuzarra;10;2
Artists Who Peddle Products — and Politics;10;2
How to Build a Skin Care Routine;10;2
Christian Louboutin on Cardi B and His ‘Red Bottoms’;10;2
L’Oréal on the Champs-Élysées;10;2
From Mars, That Dress Looks Awesome;10;2
L’Oréal Brings the Champs-Élysées to a Standstill;10;2
Jhené Aiko Talks Vampire Facials and IV Vitamin Drips;10;2
On Being Jewish, American and a Writer;10;2
T’s Design & Luxury Issue: Editor’s Letter;9;22
T Fashion Editors’ Guide to Milan;9;20
Equifax Hack Exposes Regulatory Gaps, Leaving Consumers Vulnerable;9;8
From Miniature Art to an Intimate New Hotel, New Things on T’s Radar;8;17
Lacking a Point Person on China, U.S. Risks Aggravating Tensions;9;7
Democrats Begin Legal Assault on Trump’s Move to End ‘Dreamer’ Program;9;6
Open Thread: This Week in Style News;9;29
Isabel Marant Wants to Dress You and Your Boyfriend;9;29
In Atlanta With Guo Pei, Who Spins Stories in Couture;9;29
After Weiner’s Sentencing, Abedin Opts for ‘Divorce Jeans’;9;29
Jamaica Puts a Different Face on the Runways;9;29
Skin Care’s Backlash Against Essential Oils;9;29
Doom Is So Last Season;9;29
Brigitte Macron’s Stylist: Man of Mystery;9;29
Virgil Abloh, the Mixmaster of Fashion;9;28
Instead of Changing the Woman, Change the Standard;9;28
On the Cocktail Trail in Brazil, a Favorite Spirit Gets Frisky;9;28
The One Piece You Need This Fall;9;27
Street Style: Paris;9;27
Virgil Abloh Isn’t SHOUTING (He Just LIKES Capital Letters);9;27
A Week of Openings, Collaborations and Don’t-Miss Shopping Events;9;27
What Does a ‘Woke Woman’ Wear?;9;27
How to Wreck a Brand in 3 Years;9;27
A Designer With a Low Profile Is Ready to Raise It Up;9;27
Maye Musk, 69, Is Now a CoverGirl;9;27
T Fashion Editors’ Guide to London;9;15
Gender War, Aisle 3: Unisex Kids’ Clothes Stir British Backlash;9;4
