Headline;Month;Day
As Wells Fargo Scandal Expands, a C.E.O. Is Exposed;8;31
Wells Fargo Review Finds 1.4 Million More Suspect Accounts;8;31
Wells Fargo’s Testimony Left Some Feeling Shortchanged;8;31
Wells Fargo Borrower Got Unneeded Insurance, and Ruined Credit;8;18
Wells Fargo Vice Chairwoman to Succeed Departing Chairman;8;15
Wells Fargo Shows Erosion of Corporate Accountability Under Trump;8;14
Wells Fargo, Awash in Scandal, Faces Violations Over Car Insurance Refunds;8;8
Wells Fargo May Have Found More Fake Accounts Created by Employees;8;5
Carl E. Reichardt, Leader of Wells Fargo in the 1980s and ’90s, Dies at 86;8;2
Wells Fargo Forced Unwanted Auto Insurance on Borrowers;7;28
Wells Fargo Accidentally Releases Trove of Data on Wealthy Clients;7;21
The Fed Wants to Make Life Easier for Big-Bank Directors;8;11
Oops, Wells Fargo Did It Again;6;15
Wells Fargo Is Accused of Making Improper Changes to Mortgages;6;14
Justice Department Weighs In Against Wells Fargo in a Whistle-Blower Suit;6;7
Wells Fargo Defends Its Boardroom;4;25
Wells Fargo Shareholders Tepidly Re-elect Bank’s Directors;4;25
Wells Fargo C.E.O. on Claw Backs;4;10
Wells Fargo Chair on Sales Scandal;4;10
Report on Wells Fargo’s Sales Scandal;4;10
Plenty More Villains at Wells Fargo;4;12
Wells Fargo’s Regulator Admits It Missed Red Flags;4;20
Morning Agenda: The Wells Fargo Clawback;4;11
Wells Fargo Seeks to Soothe, and a Weak G.D.P. Is Expected;4;24
Trump Says Wells Fargo Fines Will Not Be Reduced;12;8
Wells Fargo Struggling in Aftermath of Fraud Scandal;1;13
Morning Agenda: Another Wells Fargo Scandal?;6;15
Morning Agenda: More Questions for Wells Fargo;8;8
A Showdown Over Wells Fargo’s Board of Directors Looms;4;25
You Don’t Want What Wells Fargo Is Selling. What Should It Do Now?;1;13
Wells Fargo Chairman Should Listen to Investors and Step Down;4;26
At Wells Fargo, Crushing Pressure and Lax Oversight Produced a Scandal;4;11
Wells Fargo Leaders Reaped Lavish Pay Even as Account Scandal Unfolded;3;16
Wells Fargo to Claw Back $75 Million From 2 Former Executives;4;10
Treasury Auctions Set for the Week of July 24;7;24
From the London Whale to Wells Fargo, a Bank Regulator Looks Back;5;5
Wells Fargo Whistle-Blowers’ Fate Becomes Just a Footnote;5;4
Morning Agenda: China Deals, Wells Fargo Severance, Soros Fund Management’s Leader;2;1
Texas, Wells Fargo, Russia: Your Thursday Evening Briefing;8;31
Wells Fargo Scandal Blocks Severance Pay for Laid-Off Workers;2;1
From Wells Fargo to Fyre Festival, the Scam Economy Is Entering Its Baroque Phase;5;16
Citing Misdeeds, U.S. Gives Wells Fargo Failing Grade on Lending;3;28
Results for Big Banks Show a Reliance on Washington;7;14
Quotation of the Day: Wells Fargo Says 2 Ex-Leaders Owe Bank $75 Million More;4;11
Wells Fargo Whistle-Blower Wins $5.4 Million and His Job Back;4;4
All-Clear for Big Banks Raises Fears of a Return to Risk;6;30
Meet the Legislation Designed to Stifle Shareholders;6;16
Why Should the Big Banks Get Free Money?;5;25
Elizabeth Warren on Big Banks and Their (Cozy Bedmate) Regulators;4;21
Supreme Court Rules Miami Can Sue for Predatory Lending;5;1
‘Fargo’ Season 3 Finale: Bled Out;6;22
‘Fargo’ Season 3, Episode 7: The World Is Wrong;6;1
What’s on TV Wednesday: ‘Fargo’ and ‘Nova: Holocaust Escape Tunnel’;4;19
‘Fargo’ Season 3, Episode 9 Recap: ‘You Think the World Is Something’;6;15
Movers: Paulson Leaves A.I.G. Board and Banks Report Earnings;4;13
‘Fargo’ Season 3, Episode 4 Recap: A Wolf in Cheap Clothing;5;11
Bank Lending Stalls on Doubts About Trump’s Pro-Growth Agenda;4;14
Actor David Thewlis on the ‘Fargo’ Season Finale, V.M. Varga and Greed;6;22
Carrie Coon, the Simultaneous Star of ‘The Leftovers’ and ‘Fargo’;4;13
Trump Faces Stark Choice: Protect Consumers or Banks;1;18
Suit Challenges Denial of Education Loans to Unauthorized Immigrants;2;6
Big Banks Reap Stock Gains Ahead of Profits;1;13
Morning Agenda: Murdoch, O’Reilly and Fox News;4;20
Score One for the Bank Whistle-Blowers;2;24
Treasury Auctions Set for the Week of Jan. 2;1;1
New Firms Catching Up to Banks in Foreclosure Rankings;3;30
Banks and Tech Firms Battle Over Something Akin to Gold: Your Data;3;23
Big Banks Lose Bid to Halt Crisis-Era Lawsuits;1;11
Banks Look to Cellphones to Replace A.T.M. Cards;2;13
Vanguard Speaks Softly but Carries a Big Stick;9;1
Elaine Chao Gets Cozy Reception at Confirmation Hearing;1;11
Treasury Auctions Set for the Week of Nov. 20;11;19
Morning Agenda: The Next Big Battle for Business Is Immigration;9;1
Morning Agenda: The Robots Are Coming ... for Your Stocks;3;29
Movers: Markets Surge, but Express Scripts Plunges;4;25
Treasury Auctions Set for the Week of April 24;4;23
Morning Agenda: Understaffed Treasury Isn’t Ready for Tax Overhaul;4;4
When Money Gets in the Way of Corporate Ethics;4;17
Treasury Auctions Set for the Week of Jan. 30;1;30
Danielle Sauro, Mark Lloyd;10;1
Morning Agenda: The Trump Tax Cut;4;25
Warren Buffett, at Berkshire Meeting, Condemns Republican Health Care Bill;5;7
Sean Spicer’s Teeny Little Slip-Up;4;12
Treasury Auctions Set for the Week of June 26;6;25
Johanna Kilbride, Alexander Volpi;10;1
Laura Bornstein, Bradford McFarland;10;8
Kathleen Farley, David Imamura;6;25
Kira Ramani, Kevin Hernandez;12;31
Morning Agenda: A Blueprint for Tax Cuts;4;26
KPMG Fires 6 Over Ethics Breach on Audit Warnings;4;12
Treasury Auctions Set for the Week of Oct. 23;10;23
Treasury Auctions Set for the Week of April 17;4;16
Marissa Karpoff, Daniel Friedman;5;14
Brittany Johnson, Patrick Carroll;10;1
Vape Shops Want to Do Good, but Fear F.D.A. Won’t Let Them Do Well;5;10
Treasury Auctions Set for the Week of May 22;5;21
Prepaying Property Taxes? Your Bank May Make You an Audit Risk;12;29
Treasury Auctions Set for the Week of May 1;4;30
Lindy Wisotsky, Joshua Dembowitz;10;29
Yes, Mr. President, Banks Are Lending;2;18
Jessica Warren, Samuel Callahan;10;15
Cash Faces a New Challenger in Zelle, a Mobile Banking Service;6;12
Morning Agenda: As Health Care Push Fails, Taxes Are Next;7;28
Eurozone Jobless Figures and U.S. Bank Earnings Will Be Released;1;9
Treasury Auctions Set for the Week of Aug. 14;8;13
Kaitlyn Kucich, Jeremy Whelan;9;17
Colleen Clark, Pip Ngo;11;19
Morning Agenda: Too Big to Jail, ‘Government Sachs,’ and Automation Nation;1;13
A Talk With Yellen, and Debt Payments From Venezuela Are Due;4;10
V.I.P. Shoppers Toast Linda’s, a New Shop at Bergdorf Goodman;5;3
Consumer Bureau Loses Fight to Allow More Class-Action Suits;10;25
Treasury Auctions Set for the Week of May 15;5;14
Count on a Political Backlash to the Banks’ Victory in the Senate;10;25
With Trump, an Economic Feast With Surprises on the Menu;1;3
Europe Gets Tougher on Tech’s Taxes: DealBook Briefing;10;4
Advice to College Students on Bank Promotions: Read the Fine Print;9;29
Wall Street Reassures Employees, Without Wholly Rejecting Travel Ban;1;30
Student Loan Suit Is Bold Gambit on Eve of Trump Presidency;1;19
Why the Urge to Merge Could Return to Wall Street;3;31
For Goldman, the Fintech Revolution Can’t Come Soon Enough;4;18
Treasury Auctions Set for the Week of Nov. 13;11;12
Treasury Faults Arbitration Rule Aimed at Protecting Consumers;10;24
Under Trump, Banking Watchdog Trades Its Bite for a Tamer Stance;11;15
Nobel in Economics Announced, and Bank Earnings Begin;10;9
Forcing Banks to Fight Fair;7;15
Auditing the Auditors;4;14
Treasury Auctions Set for the Week of Feb. 20;2;20
Treasury Auctions Set for the Week of March 13;3;12
Euronet’s $1 Billion MoneyGram Bid Could Prompt Bidding War;3;14
Equifax Breach Caused by Lone Employee’s Error, Former C.E.O. Says;10;3
Treasury Auctions Set for the Week of Feb. 6;2;5
Treasury Auctions Set for the Week of Sept. 18;9;17
Treasury Auctions Set for the Week of March 20;3;19
JPMorgan to Pay $55 Million to Settle Mortgage Discrimination Complaint;1;18
Closing the Courthouse Door;8;10
Consumer Watchdog Faces Attack by House Republicans;2;10
Facebook Goes to Washington: DealBook Briefing;10;13
A Drug Maker Spends Big in Washington to Make Itself Heard;7;21
Wage Growth Remains ‘Pedestrian’: DealBook Briefing;12;8
Morning Agenda: Uber Executive Invokes Fifth Amendment;3;31
Treasury Auctions Set for the Week of March 6;3;6
Treasury Auctions Set for the Week of July 17;7;16
Allen & Co.’s Meeting of the Moguls, and Yellen Goes to Congress;7;9
Treasury Auctions Set for the Week of Aug. 21;8;20
Treasury Auctions Set for the Week of Feb. 13;2;12
Another Silicon Valley Start-Up Faces Sexual Harassment Claims;8;12
The Soul of a Corporation;4;7
Springtime for Scammers;2;6
Morning Agenda: Uber Chooses Détente With Russian Rival;7;14
Treasury Auctions Set for the Week of Sept. 11;9;10
Treasury Auctions Set for the Week of Oct. 16;10;15
Treasury Auctions Set for the Week of Oct. 30;10;29
Treasury Auctions Set for the Week of April 3;4;2
Two Men Charged With 2015 Murder of the Rapper Chinx;12;14
Treasury Auctions Set for the Week of Jan. 23;1;22
Yellen Treads Carefully on Regulatory Issues in Senate Panel Appearance;7;13
‘Dreamers’ Find Allies in Trump’s Business World;9;5
How to Tell a Secret in the Digital Age;3;3
Alex Noren, the World’s Most Unknown Top Player;5;24
Big Banks Set to Pay Out Largest Dividends in a Decade;6;28
Knicks’ Playoff Hopes Take a Hit in Philadelphia;3;4
Let Consumers Sue Companies;8;22
A Confounding Course Feels Like Home to Kevin Kisner;8;11
The President Wants to Keep Us in the Dark;6;28
Home Delivery! What Will They Think of Next?;6;29
The High Cost of Not Talking About Money;10;12
Treasury Auctions Set for the Week of Sept. 25;9;24
Right and Left React to the Turmoil at the Consumer Finance Watchdog;11;27
Justin Thomas’s 63 Breaks a U.S. Open Record as Brian Harman Seizes the Lead;6;17
The Dow Hit 20,000. Now What?;1;25
Cashing Out From the Climate Casino;12;15
Syria, Gorsuch, United Airlines: Your Monday Evening Briefing;4;10
Knicks, Losing at the Buzzer, Are Unable to Break Their Fall;1;12
Staples to Sell for $6.9 Billion, and Its New Owner Has an Uphill Battle;6;28
Treasury Auctions Set for the Week of Nov. 6;11;5
‘Claw’ and Cross-Handed Putting Styles Gain More Ground;6;15
California Today: The 29-Year-Old Taking Over for Vin Scully — No Pressure;3;17
‘Get Shorty’: You Know the Name, but Not This Story;8;11
California Today: Berkeley Turns to Comedian for Advice;4;11
France, James Comey, Uber: Your Monday Briefing;4;24
Climate Change, Kenya, Google: Your Tuesday Briefing;8;8
Is Pride Still for Queer People Like Me?;6;17
Harvey, Kenya, Harriet Tubman: Your Friday Briefing;9;1
Syria, London, United Airlines: Your Tuesday Briefing;4;11
DealBook Briefing: U.S. Sues to Block AT&T-Time Warner;11;20
A Possible Alternative to Stocks and Bonds: Commodities?;7;14
Tax Plan, Michael Flynn, Ivanka Trump: Your Wednesday Briefing;4;26
America’s Shampoo Economy;12;11
Former Barclays Executives Returning to Court, European Bank Chief Will Address News Media;7;17
What Are Critics Saying About FX’s Trippy Superhero Drama, ‘Legion’?;2;8
Freddie Mac Follows Fannie Mae to Rental Market, With Affordability as Goal;7;19
Money Worries for Retired Women;3;3
Health Care, Anthony Scaramucci, Nawaz Sharif: Your Friday Briefing;7;28
Why ‘Sorry’ Is Still the Hardest Word;4;13
A Hush Over Punishments on the PGA Tour Leads Only to Whispers;5;13
Hearing Amazon’s Footsteps, the Health Care Industry Shudders;10;27
California Today: A Big Swing on Sanctuary Cities;4;24
Profitable Companies, No Taxes: Here’s How They Did It;3;9
Inauguration Protesters and Police Clash on Washington’s Streets;1;20
‘It Was a Frat House’: Inside the Sex Scandal That Toppled SoFi’s C.E.O.;9;12
The Good News on Brexit They’re Not Telling You;7;31
Do Not Drain Your 401(k), or Let a Former Employer Do It;5;19
The Fabulous Apple Cash Machine;5;5
Consumer Agency Can Demand Answers About Foreclosed Homes, Judge Rules;2;16
California Today: The Dominating Dodgers;8;8
We Read Them So You Don’t Have To: New Books by Senators Al Franken, Elizabeth Warren and Ben Sasse;6;2
Donald Trump, Peggy Whitson, Robert Pirsig: Your Tuesday Briefing;4;25
Rex Tillerson, Egypt, Masters Tournament: Your Monday Briefing;4;10
‘Legion’ Brings a Genuine X-Factor to FX;2;3
Fed Will Update Economic Outlook, and April Jobs Data Is Ahead;5;1
California Today: Looking at Los Angeles’s Abandoned Sofas;4;28
Syria, Egypt, Korean Peninsula: Your Morning Briefing;4;10
What the Future of S.E.C. Enforcement Holds Under Jay Clayton;3;27
Steve Scalise, London, Flint: Your Thursday Briefing;6;15
San Francisco’s Skyline, Now Inescapably Transformed by Tech;12;29
An Ad Woman at the Top of an Industry That She Thinks Still Has Far to Go;4;25
Neil Gorsuch, Senate, Standing Rock: Your Wednesday Briefing;2;1
Why We Don’t Vote With Our Wallets;10;20
Considering the Side Effects of Drugmakers’ Money-Back Guarantees;7;10
In the Berkshires, Musicals With Ambitions Not Always Realized;8;21
Chief Executive of Social Finance, an Online Lending Start-Up, to Step Down;9;12
Small Investors Support the Boards. But Few of Them Vote.;10;6
The G.O.P. Plan to Unleash Wall Street;6;9
How Disaster Charity Can Pivot to Sustainable Philanthropy;12;22
Stream These Beautiful Movies From Cinematographer Roger Deakins;10;11
Hedge Fund Managers Don’t Always Beat the Market, but They Still Make Billions;5;16
Sure, I Have Fashion Regrets. All the Best People Do.;7;12
Treasury Auctions Set for the Week of Nov. 27;11;26
Starbucks, Exxon, Apple: Companies Challenging (or Silent on) Trump’s Immigration Ban;1;31
Generic Drug Prices Are Falling, but Are Consumers Benefiting?;8;8
What’s on TV Wednesday: ‘The Eagle Huntress’ and ‘The Handmaid’s Tale’;6;14
The Life of a Small-Time Landlord;3;31
Thanks to Wall St., There May Be Too Many Restaurants;10;31
Elisabeth Moss on Her Emmy Nomination and ‘The Handmaid’s Tale’;8;13
A Boom in Credit Cards: Great News for Banks, Less So Consumers;10;19
Warning Signs About Another Giant Bitcoin Exchange;11;21
Apple Is the Most Valuable Public Company Ever. But How Much of a Record Is That?;12;21
Hurt and Angry, Charlottesville Tries to Regroup From Violence;8;13
How to Make the Family Business Work Across the Generations;6;23
Have Your Grandparents Told You About ‘Good Witch’?;6;15
American Underdog;3;31
Where Else Does the U.S. Have an Infrastructure Problem? Antarctica;7;17
‘Legion’ Season 1, Episode 4: Mind Games;3;2
Business Schools Now Teaching #MeToo, N.F.L. Protests and Trump;12;25
George Clooney’s Awkward White Guilt in ‘Suburbicon’;11;3
The Best Movies and TV Shows New to Netflix Australia in June;5;31
Russia Scandal Befalls Two Brothers: John and Tony Podesta;11;11
Trump Moves to Roll Back Obama-Era Financial Regulations;2;3
Tax Cuts Buoy Republicans, but They’re Swimming Against an Undertow;12;21
Why the Equifax Breach Stings So Bad;9;22
Tax Changes Are Coming Next Year, but You Can Plan for Them Now;12;7
How Jinder Mahal, an Indian WWE Star, Is Turning Up the Heat;8;18
What to Find in Salinas Valley: Lush Fields, Good Wine and, Yes, Steinbeck;2;9
The Best Movies and TV Shows New to Netflix Australia in July;7;5
Review: FX’s ‘Snowfall’ Dramatizes an Origin Story for Crack Cocaine;7;3
The Ivy League Sweep: Still Rare, but You’re More Likely to Hear About It;4;6
‘Legion’ Season 1, Episode 6 Recap: Asylum Seekers;3;16
9 TV Shows We’ll Be Talking About in April;4;4
Senate Plan Gives Health Care Industry Hope, for Now: DealBook Briefing;10;18
A Hockey League in the U.S. Attracts Europeans With an Eye on College;12;26
The South Doesn’t Own Slavery;9;11
Quicken Loans, the New Mortgage Machine;1;21
Our TV Critics Debate the 2017 Emmy Award Nominations;7;13
Frances McDormand’s Difficult Women;10;3
How Floyd Mayweather Helped Two Young Guys From Miami Get Rich;10;27
One of Bitcoin’s Biggest Champions Turns Bearish: DealBook Briefing;12;22
Richard Schickel, Movie Critic, Author and Filmmaker, Dies at 84;2;21
Margaret’s Picks for the Best TV of 2017 (So Far);7;3
Silicon Valley Courts Brand-Name Teachers, Raising Ethics Issues;9;2
The Fed Chair Should Be a ‘Principled Populist’;10;30
‘The Leftovers’ Season 3, Episode 4: Disappearing Act;5;8
‘Game of Thrones’ Dragon Battle Was Inspired by ‘Apocalypse Now’ and ‘Saving Private Ryan’;8;8
The Growing Costs of Netflix’s Dominance: DealBook Briefing;10;17
Dustin Johnson and Phil Mickelson Cruise at Match Play;3;25
Six Types of TV Shows Influenced by ‘Twin Peaks’;5;18
Crowded TV Marketplace Gets Ready for Three Tech Giants;8;21
A Feast of Rock Writing, Freewheelin’, Funny and Deep;6;2
What Was Unusual About Tom Brady’s Stolen Super Bowl Jersey? He Got It Back;5;15
Who Can Beat Trump in 2020?;9;30
It’s a Merry ‘Taxmas’ for AT&T Employees: DealBook Briefing;12;20
‘The Founder’: Burgers, Fries and a Couple of Wiseguys;1;18
Eric Schmidt, Alphabet’s ‘Ambassador,’ to Step Down: DealBook Briefing;12;21
Detroit: From Motor City to Housing Incubator;11;4
Using Shakespeare to Ease the Trauma of War;3;9
DealBook Briefing: Who Could Succeed John Skipper at ESPN?;12;18
A Star-Spangled Revue Kicks Up Its Heels in the Badlands;8;23
The Memorable TV Episodes of 2017;12;14
The Accent Whisperers of Hollywood;7;20
Department of Justification;2;28
Holiday 2017 Release Schedule;11;3
How a Fractious Women’s Movement Came to Lead the Left;2;7
Summer Movie Release Schedule 2017;5;5
Corrections: April 7, 2017;4;7
