Headline;Month;Day
Where Should You Buy Appliances?;8;7
Jenieve Guevarra, Amín Fernández;8;26
Record-Smashing Heat Wave Kills 33 in Quebec;7;5
GE’s Smart Air Conditioners with HomeKit, Workout Headphones, and the End of Apple’s AirPort: New This Week;5;4
Three Friends, Two Homes, One Brooklyn House ;8;2
So Now You Own a Home. Do You Know How to Maintain it?;9;7
What Companies Are Doing With Their Savings From the Tax Law;1;31
Tech Drove Stocks Skyward. It Was a Different Story on the Way Down.;10;31
Brutal Choice in Houston: Sell Home at a Loss or Face New Floods;3;30
Where Brooklyn Tenants Plead the Case for Keeping Their Homes;5;20
Lucky Breaks, Video and Pink Gloves Led to Austin Bombing Suspect;3;21
Discovering Eugene O’Neill’s San Francisco;10;3
Grimy, Glorious, Gone. The Divergent Paths of 7 Train Stations;9;29
Design Legend Murray Moss Captures His Beloved Objects — in Polaroids;3;13
Sean Hannity’s Guide to Real Estate;5;6
The Supreme Court Case That Could Give Tech Giants More Power;3;2
Failed by Facebook, We’ll Return to the Scene of the Crime. We Always Do.;4;10
Stock Markets Are Wild, but Bond Markets Can Be Dangerous;12;18
The Best Gas Stoves and Ranges;7;16
What to Cook This Week;2;4
In Atlanta, Concessions Prices Go Down and Revenue Goes Up;1;25
Who Doesn’t Love to Hate-Watch HGTV?;4;6
The D.I.Y. Country House;1;30
How to Recycle Your Christmas Tree;12;28
Billionaire vs. Billionaire: A Tug of War Between 2 Rogue Donors;4;12
Wall Street Halts a Global Rout;2;6
Making the Most of a Tiny Kitchen on a Tiny Budget;5;15
Sears, the Original Everything Store, Files for Bankruptcy;10;14
Surprise Gift: Free Tuition for All N.Y.U. Medical Students;8;16
The Charts That Show How Big Business Is Winning;6;17
Submerged by Florence, North Carolina’s Rural Towns Fight for Attention;9;20
Guns, Faucets and Energy Drinks: Detroit Bar Owner Charged in $1 Million Theft Ring;12;7
Elon Musk, in Search of Profit, Cuts Tesla’s Work Force;6;12
What We Know About the Austin Bombings;3;19
Shopping High-Fashion Paris on the Cheap;3;21
Card Data Stolen From 5 Million Saks and Lord & Taylor Customers;4;1
Seth Meyers Says Trump Appointing Kavanaugh Is Like Bonnie Appointing Clyde;9;5
Sears Plan to Get Out of Bankruptcy Has a Familiar Ring;10;15
Helen Mirren Hits the Road;3;2
How C.E.O.s Should Spend Their Tax Cuts;2;9
It’s Trump’s Economy Now;1;28
Family Who Took Florida Suspect In: ‘We Just Didn’t Know’;2;18
When the Downstairs Neighbors Become Best Friends;4;30
How the Cleveland Browns Can Make the N.F.L. Playoffs;10;9
How the Carolina Panthers Can Make the N.F.L. Playoffs;10;9
How the Pittsburgh Steelers Can Make the N.F.L. Playoffs;10;9
How the Miami Dolphins Can Make the N.F.L. Playoffs;10;9
How the Minnesota Vikings Can Make the N.F.L. Playoffs;10;9
How the Jacksonville Jaguars Can Make the N.F.L. Playoffs;10;9
How the Dallas Cowboys Can Make the N.F.L. Playoffs;10;9
How the Arizona Cardinals Can Make the N.F.L. Playoffs;10;9
How the Oakland Raiders Can Make the N.F.L. Playoffs;10;9
How the Seattle Seahawks Can Make the N.F.L. Playoffs;10;9
How the Cincinnati Bengals Can Make the N.F.L. Playoffs;10;9
How the Detroit Lions Can Make the N.F.L. Playoffs;10;9
N.F.L. Playoff Picture: Every Team’s Playoff Chances;10;9
How the Washington Redskins Can Make the N.F.L. Playoffs;10;9
How the Houston Texans Can Make the N.F.L. Playoffs;10;9
How the Tennessee Titans Can Make the N.F.L. Playoffs;10;9
How the Indianapolis Colts Can Make the N.F.L. Playoffs;10;9
How the Baltimore Ravens Can Make the N.F.L. Playoffs;10;9
How the Buffalo Bills Can Make the N.F.L. Playoffs;10;9
How the Chicago Bears Can Make the N.F.L. Playoffs;10;9
How the Denver Broncos Can Make the N.F.L. Playoffs;10;9
How the Philadelphia Eagles Can Make the N.F.L. Playoffs;10;9
How the Atlanta Falcons Can Make the N.F.L. Playoffs;10;9
How to Turn Your Renovation Into a Vacation;3;20
How to Become a Plant Parent;5;15
Letter of Recommendation: Dissecting a Human Body;2;8
How the New England Patriots Can Make the N.F.L. Playoffs;10;9
How the New York Giants Can Make the N.F.L. Playoffs;10;9
How the Tampa Bay Buccaneers Can Make the N.F.L. Playoffs;10;9
How the Kansas City Chiefs Can Make the N.F.L. Playoffs;10;9
How the Los Angeles Rams Can Make the N.F.L. Playoffs;10;9
How the San Francisco 49ers Can Make the N.F.L. Playoffs;10;9
How the Los Angeles Chargers Can Make the N.F.L. Playoffs;10;9
How the Green Bay Packers Can Make the N.F.L. Playoffs;10;9
How the New Orleans Saints Can Make the N.F.L. Playoffs;10;9
How the New York Jets Can Make the N.F.L. Playoffs;10;9
S.&P. Closes at a Record, as Profits Defy Turmoil;8;24
At an Updated Head Shop, High Meets Highbrow;8;15
He’s Atop the Ballot, Yet Virtually Broke. And G.O.P. Donors Are Not Coming to the Rescue.;10;8
Signing Off on Signing Credit Card Receipts;4;14
Bulging Debt May Spell Trouble for Energy, Telecom and Retail;4;13
Telling a Story Through Tiles;3;3
And the Beat Goes On ;12;1
For Puerto Rican Storm Evacuees, Another Moving Day Looms;6;30
For Many Public Housing Residents, It’s Cold Inside, Too;1;5
Summer Vacation? Nah, I’m Taking a Creative Hiatus;7;28
Spreadsheets at Dawn: The New Tax Battle Is All About Data;2;28
Anatomy of a Bomb Investigation: Inside an A.T.F. Lab;4;1
How Dangerous Is Asbestos From the Steam Pipe Explosion in New York?;7;20
Valee, Kanye West’s New Signee, Is a Rapper Who Just Might Build You a Koi Pond;5;7
This Old House Is a Chore;2;16
Devah Pager, Who Documented Race Bias in Job Market, Dies at 46;11;8
Sports Stadiums Help Lead the Way Toward Greener Architecture;5;24
They’re Falsely Accused of Shoplifting, but Retailers Demand Penalties;8;17
Musical Beach Chairs;6;29
Two Bronx Brothers Arrested in Bomb-Making Scheme;2;15
He Was a Tireless Critic of the Iran Deal. Now He Insists He Wanted to Save It.;5;13
Mueller Says Manafort Lied About Contacts With Trump Officials;12;7
‘Full Metal Jacket’ Seduced My Generation and Sent Us to War;4;18
How the Hedge Fund Manager Running Sears Cut His Losses;10;18
How to Bid for the N.F.L.’s Biggest Prize: Team Ownership;2;2
Detroit Was Crumbling. Here’s How It’s Reviving.;4;30
Shakespeare and Company Is Coming Back to the West Side and the Village;3;13
Need More Space? Deciding to Fix Up or Trade Up;4;20
Railway Workers Sue, Citing Discrimination and Low Pay;2;14
Who Wore It Better: Art or Commerce? ;8;1
In N.R.A. Fight, Delta Finds There Is No Neutral Ground;2;28
In London, Electric Trucks Are Helping UPS Make ‘Eco-Friendly’ Deliveries;9;21
Picking Berries, Playing Cards, Jumping in the Bay: The Canada Letter;7;6
Garrison, N.Y.: A Bucolic Hamlet on the Hudson;1;24
Who Was the First Person Killed by a Car in New York?;3;30
4 Free Apps That Can Earn You Extra Cash;2;13
Walmart and Now Starbucks: Why More Big Companies Are Offering Paid Family Leave;1;24
More Evacuations as ‘Monster’ Storm Looms;9;11
What to See in New York Art Galleries This Week;10;11
A Sleek San Diego Hotel With a Focus on Food;8;4
A Long Journey North for Migrants That May End Where It Started;6;30
At Toys ‘R’ Us, ‘There Is Nothing Left’: The Day It Closed for Good;6;30
Diary of a New York Co-op Board President;4;27
FedEx Follows Amazon Into the Robotic Future;3;18
New York Today: What We Know About the Mail Bombs;10;25
Heaviest Snow in Decades Batters U.K., Ireland and the Continent;3;1
Wildfires, Thousand Oaks, Elections: Your Friday Evening Briefing;11;9
Led by the Mercers, Bannon’s Allies Abandon Him;1;4
In Milan, a Trip to Jeremy Scott’s Candy-Colored World;2;23
KFC Has a Problem in Britain: Not Enough Chicken;2;20
‘The Deuce’ Season 2, Episode 7 Recap: Duck and Cover;10;22
Want to See What’s Up Amazon’s Sleeve? Take a Tour of Seattle;9;23
Betting on the Berkshires;4;13
Robert Pitofsky, Champion of Consumer Protection, Dies at 88;10;11
Bergenfield, N.J.: Comfortable And Unassuming;4;25
A New Wave of Spirits-Driven Travel;8;10
The Perfect Way to Explore Modern Kansas City? A Streetcar, Believe It or Not;7;4
Katrina Lake of Stitch Fix on Building Diverse Teams;6;1
A Shadowy War’s Newest Front: A Drone Base Rising From Saharan Dust;4;22
For David Beckham and M.L.S., a Miami Marriage at Last;1;29
Rafting Across a Mexico River to Make a Living, and Remake a Life;7;21
Are A.D.M. and Glencore About to Square Off for Bunge? DealBook Briefing;1;19
France’s Yellow Vests Reveal a Crisis of Mobility in All Its Forms;12;20
At the Border Town That the News Cycle Has Left Behind;10;21
Nashville’s Star Rises as Midsize Cities Break Into Winners and Losers;12;16
From the E.R. to the Garden, M.T.A. Chief Holds Unusually Powerful Perch;5;22
13 Great Things We Saw at Milan’s Design Fair;4;24
Roger Penske, IndyCar’s Grand Old Man, Shows No Signs of Slowing Down;3;10
Months Before Deadly Crash, Helicopter Pilots Warned of Safety Issues;4;7
Ford Aims to Revive a Detroit Train Station, and Itself;6;17
A Strategy of Retreat in Syria, With Echoes of Obama;12;19
In Jersey City, It’s Kushner vs. Kushner in a Race to Develop;5;21
A Big Reason Wall Street Is Flocking to Spotify: DealBook Briefing;4;3
Global Trade, Aung Suu Kyi, Women’s Day: Your Thursday Briefing;3;7
Israel Moves to Seal Hezbollah Tunnels at Lebanon Border;12;4
Tariffs, Gun Control, International Women’s Day: Your Thursday Briefing;3;8
Can Crazy Still Keep the Peace Between Israel and Iran?;1;31
Donald Trump, Sergei Skripal, Champions League: Your Thursday Briefing;3;8
Take a Tour of Lady Liberty’s Torch (Right This Second);11;14
In North Korea, Missile Bases Suggest a Great Deception;11;12
The 52 Places Traveler: In Denver, a Mile High but Down to Earth;5;15
A Guide to Livingston, Montana, the Literary Town on the Yellowstone River;10;29
From the Director of ‘Call Me by Your Name,’ a New Project: A House;9;19
California Tries New Tack on Gun Violence: Ammunition Control;9;9
Paul Krugman Explains Trade and Tariffs;3;15
Jewish Heirs Take on an Art Foundation That Rights Nazi Wrongs;8;26
Booming Savannah Port Sees Trade Tensions as Just a Hiccup;5;18
A Struggling Desert Town Bets Its Future on Pot;12;9
Climate Change Denialists Say Polar Bears Are Fine. Scientists Are Pushing Back. ;4;10
The Baby-Formula Crime Ring;5;2
The Top 10 Moments from the Men’s Shows;1;24
Transcript of ‘Charm City,’ Part 4: The Police Scandal That Shook Baltimore;6;13
36 Hours in Oaxaca ;3;15
Murder, Politics and Architecture: The Making of Madison Square Park;8;3
DealBook Briefing: Tronc Nears Deal to Sell Los Angeles Times;2;6
The Case of Jane Doe Ponytail;10;11
The Culture Wars of Car Racing;10;18
Is Capital or Labor Winning at Your Favorite Company? Introducing the Marx Ratio;5;21
Dipsea: A Trail Race Where ‘You’re Either the Hunter or the Hunted’;6;13
The 52 Places Traveler: In Chile, a Gorgeous, Very Rainy and Sometimes Lonely Journey;5;8
This Week’s Wedding Announcements;8;26
Selling Airborne Opulence to the Upper Upper Upper Class;1;23
How the War in Yemen Became a Bloody Stalemate — and the Worst Humanitarian Crisis in the World;10;31
Transgender Lives: Your Stories: Corey;9;13
Transcript of ‘Charm City,’ Part 5: What’s Behind the Black Box?;6;21
