Headline;Month;Day
Memorial Sloan Kettering’s Season of Turmoil;12;31
AIDS Researcher Robert R. Redfield Named to Lead the C.D.C.;3;21
DealBook Briefing: Meet Our 2018 Conference Speakers;10;4
Top Cancer Researcher Fails to Disclose Corporate Financial Ties in Major Research Journals;9;8
Sloan Kettering Executive Turns Over Windfall Stake in Biotech Start-Up;9;29
Prices Keep Rising for Drugs Treating Painful Sex in Women;6;3
DealBook Briefing: Does Facebook Have Room for More Than One Founder?;9;27
DealBook Briefing: Corporate America Says It Often Apologizes for Trump;12;17
DealBook Conference Live Updates: Google C.E.O.’s Mea Culpa;11;1
DealBook Briefing: Tesla’s Mass Market Hopes May Remain Elusive;2;7
Wells Fargo Is About to be Hit With $1 Billion Fine: DealBook Briefing;4;19
Is Capital or Labor Winning at Your Favorite Company? Introducing the Marx Ratio;5;21
The Highest-Paid C.E.O.s in 2017;5;25
Why America’s Black Mothers and Babies Are in a Life-or-Death Crisis;4;11
Black Mothers and Childbirth;5;5
