Headline;Month;Day
Nike Courts Controversy With Kaepernick Deal;9;5
Nike’s Kaepernick Ad Set to Air on N.F.L.’s Opening Telecast;9;5
Nike Returns to Familiar Strategy With Kaepernick Ad Campaign;9;4
Colin Kaepernick’s Nike Campaign Keeps N.F.L. Anthem Kneeling in Spotlight;9;3
After Colin Kaepernick’s Nike Deal, Some Salute Swoosh, Others Boycott It;9;4
The Anthem Is a Trap for Democrats;9;7
Trump’s Thumps Don’t Cause Stock Slumps;9;6
How Do You Feel About the N.F.L. Players’ Protests?;9;4
The Deafening Silence of Colin Kaepernick;9;4
Serena Williams, the U.S. Open, and the Sexist Rules of Fashion and Tennis;8;28
Ex-Employees Sue Nike, Alleging Gender Discrimination;8;10
Shoe Deals and Double Standards at North Carolina;8;17
Shalane Flanagan Will Defend New York City Marathon Title at Age 37;8;13
Nike Will Raise Wages for Thousands After Outcry Over Inequality;7;23
Nike Says Its $250 Running Shoes Will Make You Run Much Faster. What if That’s Actually True?;7;18
Roger Federer Sheds Nike Swoosh for Uniqlo, Then Wins Match;7;2
The N.F.L. and Nike Make Room for Fanatics;5;23
At Nike, Revolt Led by Women Leads to Exodus of Male Executives;4;28
5 More Nike Executives Are Out Amid Inquiry Into Harassment Allegations;5;8
Nike’s C.E.O. Vows Changes After Claims of Workplace Harassment and Bias;5;6
Second Top Nike Executive Departs Amid Complaints of Workplace Behavior;3;16
Roger Federer Wants to Win a New Game;7;12
Nike Executive Resigns, C.E.O. Addresses Workplace Behavior Complaints;3;16
Jenifer Lewis Supports Colin Kaepernick by Wearing Nike on Emmys Red Carpet ;9;17
Learning With: ‘Colin Kaepernick’s Nike Campaign Keeps N.F.L. Anthem Kneeling in Spotlight’;9;6
Nike Vaporfly 4% Shoe May Make Some Run Faster;12;5
A Truckload of Nike Shoes, Left as ‘Bait,’ Stings Chicago;8;24
Earliest Known Human Footprints in North America Found on Canadian Island;3;28
A Fashion Expert and a Football Expert Had a Conversation About World Cup Kits;6;15
Investigation? N.C.A.A. Scrutiny? Business as Usual in Grassroots Hoops;5;21
Tiger Woods Is Back. Will Sponsors Buy In?;3;31
Lacey Baker Wants More Girls to Skate With;3;27
The brand as a platform for dialogue;11;12
NYT: Weekend Business for 10/12/2007;8;28
Eugenie Bouchard Has One Victory and Many Setbacks Off the Court;3;10
Jay-Z, Known Basketball Fan, to Help Puma Sell Sneakers;6;19
Seth Meyers Says Trump Appointing Kavanaugh Is Like Bonnie Appointing Clyde;9;5
Mellany Sanchez Started on Instagram and Is Now Drake’s Image Director ;7;4
Craig Green Shares a Glimpse Into His Creative World, in Polaroids;6;20
Jenifer Lewis Has Some Advice for Kanye West;10;30
Pac-12 Task Force Recommends Sweeping Changes in Wake of N.C.A.A. Investigation;3;13
The Best Cross-Training Shoes;10;18
This Is Peak Olympics;2;10
How Sneakers Intersect With Recent American History;7;5
Should Technology in Sports Be Limited?;2;15
Fall Fashion: The Shape of Things to Come, Starring the Season’s Freshest Faces;8;15
How Design for One Turns Into Design for All;1;24
DealBook Briefing: Amazon Could March Past $1 Trillion;9;5
Peak Sneaker: Inside Sneaker Con;1;4
What’s Going On in This Graph? | Dec. 12, 2018;12;6
Word + Quiz: surmount;4;25
Open Thread: Fashion Week Is Coming;8;31
Collaborations Make Inroads in the Luxury Market;11;19
In a Trade War, China Might Boycott U.S. Goods. That Could Backfire.;4;19
Sporty Sunglasses for Fashion Jocks;9;5
How the Neighbors Voted in 2016: Make Your Own List;7;26
DealBook Briefing: Does Facebook Have Room for More Than One Founder?;9;27
Kaepernick’s Knee and Olympic Fists Are Linked by History;9;6
Tips from Sneaker Heads on Scoring the Hottest Shoes and Keeping Them Fresh;1;2
The North Korean Cheer Squad Is Playing a Different Olympic Game;2;8
What’s Smoother Than a Federer Backhand? His $300 Million Uniqlo Deal;9;8
The Netherlands, a Tax Avoidance Center, Tries to Mend Its Ways;9;20
Saudi Arabia’s Female Designers to Know;4;17
In Luxury, What’s Next?;11;19
What Kanye West Said About Slavery, Obama and Mental Health in His New Interviews;5;1
At the U.S. Open, It’s What You Wear;8;24
Word + Quiz: lackadaisical;10;10
Open Thread: Let’s Talk About the Fourth of July;7;6
Shop Your Way Through the Winter Doldrums;1;10
A Nasdaq for Sneakerheads? StockX Aims to Tame ‘Chaos’ of Luxury Market;7;6
Iran, Schneiderman, Met Gala: Your Tuesday Evening Briefing;5;8
Running in 2018: A Review;12;29
Burn It All Down;9;28
Samantha Barry’s Work Diary: ‘Fashion Can and Should Reflect the World Around Us’;12;25
5 Functional Smartwatches Chic Enough for Everyday Wear;9;13
What 10 Entrepreneurs Wore to a Girlboss Rally;12;13
Young Star of ‘White Boy Rick’ Was Discovered in the Principal’s Office;11;16
Celebrating Dads;6;15
A Whirlwind Paris Fashion Week With Virgil Abloh;3;2
First Came the Sneakerheads, Then the Blue-Chip Art Collectors;2;27
Wait Wait … for NPR Host Peter Sagal;12;12
Adidas and Kanye West: What Did Everyone Expect?;5;4
Taye Diggs Has a New Title: Football Coach;10;12
Olga Tokarczuk of Poland Wins Man Booker International Prize;5;22
How Much Is That Sneaker in the Window?;5;12
What Skateboard Champion Nyjah Huston Likes to Wear ;5;9
Founder’s Big Idea to Revive BuzzFeed’s Fortunes? A Merger With Rivals;11;19
N.F.L., Serena Williams, Midterm Elections: Your Weekend Briefing;9;9
If Ronaldo Can’t Beat Uruguay, the Least He Can Do Is Pay Taxes;7;3
He Had the Treasonous Uncle Killed, but He Forgave the Disloyal Chef;3;9
Texas Instruments Chief Executive Resigns, Conduct Violations Are Cited;7;18
The Apocalypse Is Coming. Here’s How to Dress for It.;3;21
In Paris, a Nightclub With Manners;7;4
Lululemon’s Chief Executive Resigns Over Behavior;2;6
Is Gibson, a Totem of Guitar Godhead, Headed for Chapter 11?;3;30
If You Hype It, Will They Come?;9;12
Olga Tokarczuk’s Book ‘Flights’ Is Taking Off;8;9
Gwen Jorgensen Tries to Solve the Marathon;10;5
Another Hot Take on the Term ‘Latinx’;11;21
Police to Auction Off an Inmate’s Designer Sneakers;12;9
The Season of Peak Sneaker Silliness;10;18
Japan, Amazon, Brett Kavanaugh: Your Wednesday News Briefing;9;4
Has the N.C.A.A.’s ‘Student-Athlete’ Fiction Reached Its Logical End?;10;20
The Man Who Knew Too Little;3;10
Brian Bowen II and the Real Victims of N.C.A.A. Scandals;10;11
DealBook Briefing: Big Tech May Need to Swallow Its Political Pride;9;4
Hey Boss, You Don’t Want Your Employees to Meditate;6;14
Open-Water Swimming With the Fast-Rising Pop Duo Let’s Eat Grandma;7;24
Are You a Sneaker Head?;1;5
Burberry to Stop Burning Clothing and Other Goods It Can’t Sell;9;6
Girls Who Code at Fashion Week;2;9
News Quiz: Test Your Knowledge of the Week’s Headlines;10;19
World Cup Trivia Quiz;6;18
Tassi the Goat Gives Birth to Goat Twins During Goat Yoga;5;24
Whether It’s 5 Years or 5 Decades, Running Streaks Take Dedication;12;8
3 Labels That Prove Style Has No Size;7;25
The Artist Making Otherworldly Sets for London’s Emerging Designers;6;14
Today’s Supreme Drop Is All Over the New York Post;8;13
Weekly News Quiz for Students: Supreme Court Hearings, Museum Fire, Colin Kaepernick;9;11
Serena Williams Shrugs Off Catsuit Concerns;8;25
LeBron James Once ‘Hated’ Southern California. How He Came to Embrace It.;10;18
These College Basketball Players Will Be Fun to Watch (for One Year Only);11;6
Farfetch, Online Retailer, Plans to Go Public as Luxury E-Commerce Grows;8;20
Men’s Fashion Week Loses Some Luster;6;8
Macy’s Courts Muslims With New Hijab Brand;2;8
After a Surprise Layoff, ‘I Didn’t Have a Safety Net’;12;9
Weekly News Quiz for Students: Box Office Record, Trump Legal Team, New Diseases;5;8
A Day in the Life of Court 15;9;1
We’re Living in the World That Klout Built;5;14
An ‘It’ Bag Faces Its Imitators;3;21
A Lollipop Made for Looking, Not Licking;10;28
How the ‘Biggest Trade War in Economic History’ Is Playing Out;7;6
N.C.A.A. Alters Rules for Agents and Draft in Wake of Basketball Corruption Scandal;8;8
Shaniqwa Jarvis Is No One’s Assistant;5;30
How Warby Parker’s Neil Blumenthal Disrupts His Daily Routine;2;28
Let’s Talk About What It’s Really Like to Be at the Shows;9;7
Nitin Vadukul, Innovative Photographer of Hip-Hop, Dies at 52;3;8
2018: The Year in Stuff;12;19
How the Sprint Deal is a Feather in T-Mobile C.E.O.’s Cap: DealBook Briefing;4;30
How One Silicon Valley C.E.O. Masters Work-Life Balance;8;24
Facebook’s Stock Plunge Shatters Faith in Tech Companies’ Invincibility;7;26
$1.3 Million Homes in Oregon, California and New York;5;23
A Korean Olympic Dilemma: Do Hockey Sticks Violate U.N. Sanctions?;2;7
American Sprinter Used ‘Passionate Kissing’ Defense in Doping Case. And It Worked.;1;25
What Do Sneakerheads Wear at Thanksgiving?;11;20
A Device That Makes Running Faster and Easier;10;17
Jewels Maketh the Shoes;9;27
Ellen Page and Emma Portner, in Motion;2;12
Tax Havens Blunt Impact of Corporate Tax Cut, Economists Say;6;10
Summer Reading Contest, Week 6: What Interested You Most in The Times This Week?;7;20
The Pyramids of Giza Are Near a Pizza Hut, and Other Sites That May Disappoint You;5;30
Nordstrom Men: Choose Your Own Adventure;5;9
The Dangerous Naïveté of Trump and Xi ;11;17
The Best and Worst Moments of the 2018 Emmys;9;18
Australian Open: Sandgren Loses to Chung, Then Targets the News Media;1;24
Brett Kavanaugh, Colin Kaepernick, Amazon: Your Tuesday Evening Briefing;9;4
JD.com Chairman Richard Liu Arrested in U.S. in Sexual Misconduct Case;9;2
Who Wants to Be a Gold Medalist?;8;20
China Strikes Back at Trump’s Tariffs, but Its Consumers Worry;7;6
North Korea, Golden State Killer, Bill Cosby: Your Weekend Briefing;4;29
‘Endgame,’ at Last: The Week in Classical Music;11;16
Olympic Committee Moves to Revoke U.S.A. Gymnastics’ Governing Rights;11;5
Cedric the Entertainer and Max Greenfield on Finding the Laughs in Gentrification;9;28
Burt Reynolds, Brett Kavanaugh, Alex Jones: Your Thursday Evening Briefing;9;6
Remember When Athletes Didn’t Have to Specialize? These Hall of Famers Do;3;9
Pompeo, Politics, Charlottesville: Your Tuesday Evening Briefing;10;16
In KFC’s China Ads, Nuggets Are Served With Patriotism;9;27
Years After Retiring, Li Na Wields Major Influence in Tennis;7;12
Intel C.E.O. Brian Krzanich Resigns After Relationship With Employee;6;21
Olympic Curler’s Shoes Are Revolting, Other Olympians Say;2;13
New Jersey School Bus Collides With Truck, Killing Student and Teacher;5;17
M.L.B., Once Averse to Gambling, Strikes a Deal With MGM Resorts;11;28
Millennial Moms-to-Be Don’t Hide the Bump;1;31
What 8 Holiday Shoppers Wore to Industry City in Brooklyn;12;21
California Today: Gavin Newsom Looks to Sacramento;9;27
California Today: A Bailout for the Power Company?;9;6
California Today: California Tribes Confront History and Heroin;9;5
DealBook Briefing: A Favorite Trump Bank Questioned Over Kushner Credit;7;24
What’s New at Langlitz Leathers? Nothing;11;14
Whoa, Whoa, Whoa. Leggings That Cost $300?;10;31
How to Talk About the World Cup and Sound Reasonably Smart;6;14
What the Dreamers Can Teach the Parkland Kids;3;17
Oklahoma’s Trae Young, the Superstar Nobody Saw Coming;1;23
At Sotheby’s, ASAP Rocky Breaks Out of the Box;5;25
Russia, Robert Mueller, Miami: Your Friday Briefing;3;16
With ‘Dear Basketball,’ Kobe Bryant Could Add an Oscar to His Victories;2;20
A New Novel Asks, What Is More Powerful, a Microphone or a Gun?;11;16
It’s Her Job to Get More People to Act Like You Right Now ;10;10
When the Robot Doesn’t See Dark Skin;6;21
Gritty’s First Month: The Heroic Ascendance of a ‘Ghastly Empty-Eyed Muppet’;11;1
What 9 Hypebeasts Wore to Hypefest;10;12
Forget a Fast Car. Creativity Is the New Midlife Crisis Cure.;7;14
What 9 Instagram Employees Wore to Their New Offices;6;29
Two Star Conductors Faced #MeToo Allegations. Now They’re Back.;12;28
Meet the Dreamers Who Walked 1,500 Miles to Stay in America;4;4
Cory Booker Dips a Toe Into New Hampshire as 2020 Decision Nears;12;9
The Couples of Nostrand Avenue;6;7
The Most Diverse Fashion Season Ever on the Runway, but Not the Front Row;10;11
The Skeleton in My Closet;5;18
Jill Ker Conway, 83, Feminist Author and Smith President, Dies;6;4
Duke’s Basketball Managers Strive to Be (What Else?) Elite;3;16
Scared but Resilient, Stoneman Douglas Students Return to Class;2;28
New York Today: Getting Fit for Free;1;9
Sweden, Brazil, Kavanaugh: Your Tuesday News Briefing;9;4
The Hot College Gig: Online Brand Promoter;8;31
He Wore It First;6;13
Walmart Finally Makes It to the Big Apple;9;16
North Korea, Mike Pompeo, Correspondents’ Dinner: Your Monday Briefing;4;29
Will Vinton, Revolutionary Animator With Claymation, Dies at 70;10;9
Three Found Guilty in N.C.A.A. Basketball Recruiting Scheme;10;24
DealBook Briefing: Silicon Valley Has Bigger Problems Than Facebook;7;3
Iran, North Korea, Malaysia: Your Wednesday Briefing;5;8
Cleo Wade Is Everybody’s BFF;4;19
A Conversation With Louise Penny: The Canada Letter;3;16
Damien Hirst’s Post-Venice, Post-Truth World;3;13
Tefaf Widens Its Focus From Maastricht to a World of Art Collectors;3;6
Jon Bon Jovi and His Son Get Into the Rosé Business;6;13
The Dandy Is Dead;6;12
Shut Out in 2014, U.S. Speedskaters Modify Their Suits, Their Training and Their Expectations;1;23
Your Friday News Briefing: Russia, Brexit, Puerto Rico;9;21
Michael Cohen, Germany, Dubai: Your Wednesday Briefing;8;22
Brett Kavanaugh, Bob Woodward, Amazon: Your Wednesday Briefing;9;5
In a Year of Women Running for Governor, One Incumbent Finds a Tough Fight;10;28
From a Hawaiian Island to a New York Island, and Back;7;13
The Lingering Dream of an Islamic State;1;12
Britain, Pamplona, Killer Caterpillars: Your Monday Briefing;4;30
Louis Vuitton Names Virgil Abloh as Its New Men’s Wear Designer;3;26
10 Gifts for People Who’ve Made the News This Year;12;21
Brett Kavanaugh, China, Octopus: Your Thursday Briefing;9;27
N.C.A.A. Panel Proposes Reforms, Including End to ‘One and Done’;4;25
Powerful Hollywood Women Unveil Anti-Harassment Action Plan;1;1
China’s Consumption Downgrade: Skip Avocados, Cocktails and Kids;8;22
Clint Capela Found His Shot, and He’s Taking It;4;8
After Boston, Des Linden Tries to Conquer New York ;11;1
Brett Kavanaugh, Jeff Sessions, Colin Kaepernick: Your Tuesday Briefing;9;4
Iran, Laos, Oakland: Your Tuesday Briefing;7;24
Iran, West Virginia, Gina Haspel: Your Wednesday Briefing;5;9
Larry Nassar Sexual Abuse Scandal: Dozens of Officials Have Been Ousted or Charged;10;22
This Week in Culture: André Leon Talley, J Balvin’s New Album, DanceAfrica;5;18
What Happens When People and Companies Are Both Just ‘Brands’?;5;1
Oklahoma Quarterback Kyler Murray Nears the End of a Two-Sport Career;11;30
A New Option for N.B.A. Prospects: The Million-Dollar Intern;10;22
With a Murdoch in Charge, a Start-Up Leads the Way on Mobile Video;9;30
The Original Ronaldo Adjusts to the Owner’s Box;12;10
A Winter-Coat Heavyweight Gives Trump’s Trade War the Cold Shoulder;11;23
Lil Wayne Becomes an Elder, While Logic Grows Up;10;3
DealBook Briefing: What’s Next for CBS Without Les Moonves?;9;10
Mediating Faith and Style: Museums Awake to Muslim Fashions;9;25
DealBook Briefing: Instagram’s Co-Founders Are Leaving;9;25
The Youth Sports Megacomplex Comes to Town, Hoping Teams Will Follow;9;12
Kenny Stills Carries Colin Kaepernick’s Torch by Continuing to Kneel;9;7
After #MeToo, the Ripple Effect;6;28
And the Beat Goes On ;12;1
Canada, Los Angeles Dodgers, U.S.A. Gymnastics: Your Wednesday Briefing;10;17
In the Cradle of Hip-Hop, a South Bronx Gallery Bridges a Gap;10;3
DealBook Briefing: Trump Rails Against Globalism;9;26
Pakistan, Myanmar, Russia: Your Thursday News Briefing;9;5
Donald Trump, Brett Kavanaugh, Theranos: Your Thursday Briefing;9;6
What Students Are Saying About: Logos, Trigger Warnings and Living Forever;11;29
How I Dressed to Heal My Heartbreak;9;15
‘Democrat. Fighter. Mother.’ Lucy McBath Is Redefining Social Justice in Politics.;10;24
Chicago on Edge as Officer Who Shot Laquan McDonald 16 Times Faces Trial;9;4
T Suggests: Handblown Glass Earrings, a Culinary Retreat and More;8;24
Eric Wynalda Discusses His Financial Problems — and Everything Else;1;17
Saudi Arabia Just Had Its First Fashion Week;4;16
College or Pro? It’s a Tough Call When You’re 12 Years Old;9;5
An Artist Warns of a Robot-Ruled Future. Or Is It Our Present? Let’s Discuss.;8;23
Serena Williams Came In on a High Road. It Made Her Fall More Devastating.;9;11
Six Things T Editors Like Right Now;4;20
Oksana Masters’s Road From a Ukrainian Orphanage to Paralympic Stardom;3;9
Business Leaders’ Breakthrough Moments;11;6
‘Seriously, You Chose Her?’: U.S.A. Gymnastics’ Trouble at the Top;11;10
Gender Is a Construct. Christine and the Queens Built a Bulldozer.;9;12
Side by Side and No Finish Line in Sight for Alexi Pappas;7;6
The Town Where the Shots Go Up, and the Records Fall;12;26
Live-Streaming Your Broke Self for Rent Money;12;8
DealBook Briefing: Tech and Trade Woes Keep Dragging on the Markets;10;30
My 8-Month Search for $900 Sneakers;7;25
America’s Next Great Running Hope, and One of the Cruelest Twists in Youth Sports;6;8
‘How Can I Help?’ Meet 5 People Who Serve the Community;11;10
Magnet Implants? Welcome to the World of Medical Punk;5;12
Top Private Schools Bring In the Power Elite (and the Power Forwards);3;30
Eliud Kipchoge Is the Greatest Marathoner, Ever;9;14
Skateboarders Won;4;7
‘I Try Not to Look as if I’m Trying Too Hard’;2;7
Michael B. Jordan Is Finally in Control. Now What?;11;16
Once Prohibited, Women’s Ski Jumping Is Set to Take Flight;1;30
Making Sense of the N.B.A.’s Wacky Start ;11;25
Warren Buffett Really Likes Apple’s Shares: DealBook Briefing;5;4
The Land That Failed to Fail;11;18
The Octomom Has Proved Us All Wrong ;12;15
‘Four Thousand Miles for the W’;10;18
Weight Watchers Gets Its Own Makeover;4;14
Key Dates to Watch in China-U.S. Trade Dispute: DealBook Briefing;4;18
Goldman’s Gains in Trading Raise a Familiar Dilemma: DealBook Briefing;4;17
Wynn Resorts Slides on Report of Sexual Misconduct by C.E.O: DealBook Briefing;1;26
The Flea Circus;9;15
Rei Kawakubo Revealed (Sort Of);9;3
‘I’ve Seen Too Many Accidents’: The Perils of Deliverymen;8;17
China’s Health Care Crisis: Lines Before Dawn, Violence and ‘No Trust’;9;30
Trump Slump? Tech, Trade Drag Down Stocks: DealBook Briefing;4;2
What to Expect From Powell’s First Fed Meeting: DealBook Briefing;3;20
Judge Deals AT&T a Setback: DealBook Briefing;2;20
The $20 Billion Question for Guyana;7;20
How Amazon Steers Shoppers to Its Own Products;6;23
Jacobs’s Pursuit of Qualcomm Faces Long Odds: DealBook Briefing;3;16
Beauty Is in the Eye of These Beholders;7;28
Two Years and Two Continents — Behind Walmart’s Flipkart Deal: DealBook Briefing;5;9
Tiger in Twilight;9;7
Jamie Dimon’s Letter — Handicapping a Run for President in 2020: DealBook Briefing;4;5
The Filmmaker Karyn Kusama Explores the Many Dimensions of Women’s Rage;12;20
Miscarrying at Work: The Physical Toll of Pregnancy Discrimination;10;21
How ‘Desus & Mero’ Conquered Late Night;6;18
The College Recruit and the Downfall of a Hall of Fame Coach;9;18
Athletes Who Changed the Game in 2018;12;28
Can ‘the French Scorsese’ Pull Off a Western?;10;11
The Highest-Paid C.E.O.s in 2017;5;25
Selling Airborne Opulence to the Upper Upper Upper Class;1;23
The Unlikely Activists Who Took On Silicon Valley — and Won;8;14
Sneaker Heads, Astrology and New Year’s Resolutions: Our Favorite Student Comments of the Week;1;11
How a Crackdown on MS-13 Caught Up Innocent High School Students;12;27
25 Songs That Tell Us Where Music Is Going;3;8
Corrections: July 29, 2018;7;29
