Headline;Month;Day
The Week in Tech: Infowars and China’s Great Firewall;8;10
Russia, World Cup, Espionage: Your Tuesday Briefing;7;17
California Today: 2 Views of the Judge Persky Recall;6;13
Talking U.S. Politics and Mythical Beasts: The Canada Letter;9;7
Russia, Germany, Uber: Your Thursday Briefing;8;9
DealBook Briefing: The Supreme Court Is Open for Business;6;28
Japan Seeks Its Economic Mojo in the Stuff That Makes the Stuff;5;8
Weather, Stephen Bannon, Intel: Your Thursday Briefing;1;4
The Big Tech Trends to Follow at CES 2018;1;3
DealBook Briefing: Disney’s Smart New Move to Beat Comcast in the Fight for Fox;6;21
The Architect Kulapat Yantrasast Loves ‘Making Good Spaces’;5;24
Russia, Sean Hannity, Kendrick Lamar: Your Tuesday Briefing;4;17
Syria, Israel, Davos: Your Wednesday Briefing;1;24
California Today: A Final State of the State From Jerry Brown;1;23
Donald Trump, Indonesia, Nobel Prizes: Your Wednesday Briefing;10;3
California Today: ‘Secret Science’ in the Salinas Valley?;8;27
NATO, Germany, World Cup: Your Tuesday Briefing;7;3
North Korea, Ireland, Lisbon: Your Friday Briefing;5;25
Markets That Climbed the Trump Bump Are Tumbling Down From It;4;2
Big Bets on A.I. Open a New Frontier for Chip Start-Ups, Too;1;14
California, Midterms, Armistice Day: Your Weekend Briefing;11;11
What Isaac Asimov Taught Us About Predicting the Future;10;31
Trump, Pakistan, Macron: Your Tuesday Briefing;7;24
World Cup, NATO, Trade War: Your Thursday Briefing;7;11
In Sparing Consumers Tariff Burden, Trump Hit Manufacturing;4;5
The Market’s Trump Test Is About to Get Real: DealBook Briefing;5;8
Alan Greenspan’s Ode to Creative Destruction;11;2
Pope Francis, Nafta, Serena Williams: Your Tuesday Briefing;8;28
New York Today: Avoiding a Workplace Breakdown;8;22
DealBook Briefing: Facebook Is Acting Fast on Election Meddling This Year;8;1
North Korea, Amazon, World Cup: Your Friday Briefing;5;31
SpaceX, Julian Assange, North Korea: Your Wednesday Briefing;2;6
Thousand Oaks, Armistice, Lion Air: Your Friday Briefing;11;9
Your Wednesday News Briefing: China, Myanmar, Elon Musk;9;18
Mark Zuckerberg, Manchester, Ramadan: Your Wednesday Briefing;5;23
 The Playlist: Sean Ono Lennon’s ‘Xmas’ Wish and 11 More Holiday Songs;12;21
Jaguar’s Electric E-Type Marries ’60s Sex Appeal and Tomorrow’s Tech;9;6
DealBook Briefing: Trump’s Wounded. Will Business Feel the Pain?;8;22
Hairy Mountain Beasts and Franglais Humor: The Canada Letter;8;17
Vladimir Putin, Greece, Facebook: Your Wednesday Briefing;6;6
Tariffs, E.P.A., Villanova: Your Tuesday Briefing;4;3
California Today: Remembering the Legacy of a Liberal Judge;4;2
The Most-Read New York Times Stories of 2018;12;19
Your Monday News Briefing: China, North Korea, Naomi Osaka;9;9
Google, Pope Francis, Duterte: Your Wednesday Briefing;8;28
Indonesia, China, President Trump: Your Wednesday Briefing;10;2
Primary Elections, Nafta, Google: Your Wednesday Briefing;8;29
Pope Francis, John McCain, Copenhagen: Your Monday Briefing;8;27
Stormy Daniels, India, North Korea: Your Friday Briefing;5;3
Why This Tech Executive Says Her Plan to Disrupt Education Is Different;3;1
The Computer Chauffeur Is Creeping Closer;10;19
Fred Trump, M.L.B., Lady Gaga: Your Wednesday Briefing;10;3
Your Tuesday News Briefing: South Korea, Taiwan, the Emmys;9;17
How Rare Earths (What?) Could Be Crucial in a U.S.-China Trade War;7;11
Tariffs, Italy, Telegram: Your Friday Briefing;6;1
Earthquakes, Oscars, Narendra Modi: Your Wednesday Briefing;1;23
Thailand, World Cup, LeBron James: Your Tuesday Briefing;7;2
Downloadable Neurons, Life on Mars: A Physicist’s View of Where We’re Headed;5;25
Stormy Daniels, Russia, Yemen: Your Friday Briefing;5;4
North Korea, Mike Pompeo, Correspondents’ Dinner: Your Monday Briefing;4;29
Trade War, YouTube, Syria: Your Thursday Briefing;4;4
Turkey, Taliban, Peter Strzok: Your Tuesday Briefing;8;13
Indonesia, Cambodia, Imran Khan: Your Monday Briefing;7;29
Microsoft Employees Protest Work With ICE, as Tech Industry Mobilizes Over Immigration;6;19
Guangzhou, Facebook, Kim Jong-un: Your Thursday Briefing;6;6
Volkswagen Set to Oust Matthias Müller as C.E.O. After Diesel Scandal;4;10
Prefab Finds a Home in Fire-Ravaged Neighborhoods of California;3;5
Korean Families, Kerala, Asia Argento: Your Tuesday Briefing;8;20
Trade War, Genoa Bridge, Paul Manafort: Your Wednesday Briefing;8;14
Mexico, LeBron James, World Cup: Your Monday Briefing;7;2
These Books Let Kids Fight Their Own Battles;11;9
Brett Kavanaugh, Elon Musk, ‘Night School’: Your Friday Briefing;9;28
John McCain, Myanmar, Jacksonville: Your Monday Briefing;8;27
Donald McGahn, Indonesia, Pakistan: Your Monday Briefing;8;19
They’re Not ‘Mad Men’ Anymore. But the Ad Business Is Still High Stakes.;6;5
Brexit, Macedonia, Facebook: Your Friday Briefing;11;16
Nafta, Brett Kavanaugh, Nobel Prize: Your Monday Briefing;10;1
Indonesia, Brett Kavanaugh, Nafta: Your Monday Briefing;10;1
In Shadow of Mt. Etna, Europe Makes a Last Stand for Solar;8;17
North Korea, China, Mark Zuckerberg: Your Wednesday Briefing;5;22
Britain, Pamplona, Killer Caterpillars: Your Monday Briefing;4;30
Self-Driving Uber Car Kills Pedestrian in Arizona, Where Robots Roam;3;19
Vladimir Putin, China Economy, Indonesia: Your Tuesday Briefing;7;16
Looming China Trade Action Divides Industry and Roils Markets;4;3
Your Monday News Briefing: Typhoon Mangkhut, #MeToo, South Korea;9;16
Chris Collins, Argentina, Bill Hybels: Your Thursday Briefing;8;9
Tariffs, Stanley Cup Finals, ‘The Americans’: Your Thursday Briefing;5;31
 How Nasdaq C.E.O. Adena Friedman Beat the Odds on Wall Street;3;23
How an A.I. ‘Cat-and-Mouse Game’ Generates Believable Fake Photos;1;2
Thousand Oaks, Jeff Sessions, Jim Acosta: Your Thursday Briefing;11;8
3 Ways to Create a Climate Change Investment Strategy;10;26
Aretha Franklin, Genoa, Trump: Your Friday Briefing;8;17
How a Self-Driving Uber Killed a Pedestrian in Arizona;3;20
From ScoMo and Xi to Goop and #MeToo: Australia Looks Back at 2018;12;20
Pipe Bombs, Saudi Arabia, Vladimir Putin: Your Thursday Briefing;10;25
Your Wednesday News Briefing: Storm Ali, Chemnitz, Trade War;9;19
