Headline;Month;Day
Tech Earnings Provide a Breather From the Selling;10;25
Why Tesla Could Do Better Than James Murdoch for Chairman;10;11
Elon Musk’s Ultimatum to Tesla: Fight the S.E.C., or I Quit;10;2
What Are the Consequences of Elon Musk’s S.E.C. Criticism?;10;12
Tesla Reports Progress on Model 3 Car Production;10;2
Unraveling a Tesla Mystery: Lots (and Lots) of Parked Cars;10;2
How the S.E.C. Is Trying to Push Traditional Corporate Governance Upon Tesla;10;1
Foretelling the Future of Oil;10;9
Elon Musk Steps Down as Chairman in Deal With S.E.C. Over Tweet About Tesla;9;29
Elon Musk’s Fans Just Took a Big Hit as Tesla Shares Tank;9;28
Elon Musk Settled With the S.E.C., but Tesla’s Troubles Aren’t Over;10;1
Tesla Chief Elon Musk Is Sued by S.E.C. in Move That Could Oust Him;9;27
Tesla Stock Tumbles Over the S.E.C. Suing Elon Musk: What to Watch Today;9;28
Tesla’s Elon Musk Had a Deal From the S.E.C. It Fell Apart in a Morning.;9;29
Elon Musk Calls S.E.C. ‘the Shortseller Enrichment Commission’ on Twitter;10;4
Tesla’s Biggest Problem Isn’t Elon Musk;9;20
The Future of Electric Cars Is Brighter With Elon Musk in It;10;1
DealBook Briefing: The S.E.C. Can’t Change Elon Musk;10;1
Justice Department Is Examining Tesla After Musk Comment;9;18
S.E.C. Goes After Musk With Its ‘Ultimate’ Penalty. Here’s Who Else Has Been Barred.;9;28
Betting Against Tesla: Short-Sellers Make Their Case;9;17
DealBook Briefing: Elon Musk Turned Down a Fraud Settlement With the S.E.C.;9;28
Tesla Needs to Build Investor Trust. The Exit of Its Accountant Won’t Help.;9;9
Tesla Shaken by a Departure and What Elon Musk Was Smoking;9;7
Trade, Buybacks and Brexit: DealBook’s Closing Bell;9;18
Companies Are Pushing for Less Disclosure. Is That Good for Investors?;9;15
Elon Musk and Tesla Resolved One Issue. Now for the Rest.;8;27
Why Elon Musk Reversed Course on Taking Tesla Private;8;25
DealBook Briefing: Elon Musk Smoked Weed On Air;9;7
One Tesla Investor Wants It to Stay Public;8;23
Tesla Will Not Go Private, Elon Musk Says, Capping Month of Turmoil;8;25
DealBook Briefing: The Hard Math of a Tesla Take-Private;8;24
Elon Musk Wants to Take Tesla Private. Can He Make the Math Work? ;8;23
How the S.E.C. May Pursue a Case Against Elon Musk and Tesla;8;24
Tesla Slashes Spending, and May Add to Its Troubles;8;20
DealBook Briefing: Tesla Supplier? Your Check May Be in the Mail;8;21
Elon Musk’s No Good, Very Bad Year: A Tesla Timeline;8;18
Kalashnikov Unveils a Car of the Future. Russians See a 1970s Relic.;8;24
Elon Musk’s Highs and Lows: PayPal, SpaceX, Tesla;8;18
Investors Betting Against Tesla Made $1 Billion on Friday;8;18
Tesla Is Said to Be Subpoenaed by S.E.C. Over Elon Musk Tweet;8;15
5 Takeaways From Elon Musk’s Interview With The Times About Tesla;8;17
Weekend at Elon’s: A Tesla Subplot With Azealia Banks;8;17
Tesla Directors, in Damage Control Mode, Want Elon Musk to Stop Tweeting;8;15
In Elon Musk’s World, Brakes Are for Cars, Not C.E.O.s;8;28
Tesla Board Surprised by Elon Musk’s Tweet on Taking Carmaker Private;8;13
A Tesla Take-Private Bid Would Be More of the Same for Silver Lake. Sort of.;8;15
A Question for Tesla’s Board: What Was Elon Musk’s Mental State?;8;15
Elon Musk’s Effort to Take Tesla Private to Get Board Oversight;8;14
The Week in Tech: When to Tweet;8;17
Elon Musk Details ‘Excruciating’ Personal Toll of Tesla Turmoil;8;17
DealBook Briefing: Where Is Tesla’s Money?;8;9
DealBook Briefing: How on Earth Will Tesla Go Private?;8;8
Elon Musk’s Tweets on Tesla Started a Tizzy. Someone Should Hit the Brakes.;8;13
Elon Musk’s Pitch to Take Tesla Private Has Wall Street Salivating;8;8
Elon Musk Says Tesla May Go Private, and Its Stock Soars;8;7
DealBook Briefing: Who Isn’t Worried About Elon Musk?;8;20
Did Elon Musk Violate Securities Laws With Tweet About Taking Tesla Private?;8;8
Interviewing Elon Musk;8;19
Tesla Reports Another Big Loss, but Sees Only Profit Ahead;8;1
DealBook Briefing: The Agony of Elon Musk;8;17
Elon Musk Is the Id of Tech;8;16
Tesla, Pushing for Profit, Faces New Questions Over Finances;7;23
Elon Musk Is Beating Short-Sellers, for Now;8;9
Tesla’s Latest Aim: Build 500,000 Cars a Year in China;7;10
Inside Tesla’s Audacious Push to Reinvent the Way Cars Are Made;6;30
Apple Reports Earnings, and July’s Job Numbers Come Out;7;29
Tesla Achieves a Key Weekly Goal for Producing Its Model 3;7;2
Elon Musk Accuses Tesla Employee of Sabotage;6;19
Elon Musk, in Search of Profit, Cuts Tesla’s Work Force;6;12
Tesla Turns Back Rare Challenge From Shareholders;6;5
Tesla Is Coming to Its Financial Senses. That Has Its Own Risks.;6;13
‘Big Red Flag’: Automakers’ Trade Secrets Exposed in Data Leak;7;20
Elon Musk Walks Back ‘Pedo Guy’ Attack on Thai Cave Diver;7;18
SpaceX and Tesla Go Into Orbit;2;12
Tesla Factory Safety Under Scrutiny After Worker Is Injured;4;20
Tesla Model 3 Goes Upscale, and Base-Price Buyers Must Wait;5;22
Elon Musk Rejects ‘Boring, Bonehead Questions,’ and Tesla’s Stock Slides;5;3
Tesla to Halt Production of Model 3 Cars Temporarily;4;17
Porsche Positions Itself Against Tesla, on the Road and Beside It;3;6
Thai Navy May Put Elon Musk’s Mini-Submarine to Use. One Day.;7;12
Tesla’s Manufacturing ‘Hell’ Won’t Slow Down Electric Cars;4;4
Tesla Says Crashed Vehicle Had Been on Autopilot Before Fatal Accident;3;31
Tesla Is Still Burning Cash, but Elon Musk Sees a Turning Point;5;2
Trade, Tariffs and Tesla’s Conference Call: DealBook Briefing;5;3
For Tesla, ‘Production Hell’ Looks Like the Reality of the Car Business;4;3
Apple Developers Gather and Trump Meets World Leaders;6;3
Tesla Looked Like the Future. Now Some Ask if It Has One.;3;29
China Wants High-Tech Cars. German Automakers Are Eager to Help.;7;11
With Tesla in a Danger Zone, Can Model 3 Carry It to Safety?;4;5
Elon Musk Makes Light of Tesla’s Troubles in April Fool’s Tweets;4;2
Tesla Reports New Setback for Model 3, With Output Lagging;1;4
Fatal Tesla Crash Raises New Questions About Autopilot System;3;31
Tesla Model 3, Elon Musk’s Grail, Remains a Costly Pursuit;2;7
Germany, California, Tesla: Your Wednesday Briefing;8;8
Chris Collins, Tesla, Trade War: Your Thursday Briefing;8;8
Tesla’s Elon Musk May Have Boldest Pay Plan in Corporate History;1;23
North Korea, Tesla, Taiwan: Your Thursday Briefing;2;7
For Electric Cars Without a Plug, Thank Tesla (the Scientist);5;31
Elon Musk Thinks a Mini-Submarine Could Help in Thai Cave Rescue;7;7
DealBook Briefing: Tesla’s Board Tries to Calm Its Chaos;8;15
Tesla Fixes Model 3 Flaw, Getting Consumer Reports to Change Review;5;30
Proposals Challenging Musk’s Control of Tesla Fail: DealBook Briefing;6;5
Tesla’s Targets for Elon Musk Would Put His Pay in Orbit;1;23
DealBook Briefing: Tesla’s Mass Market Hopes May Remain Elusive;2;7
Ohio Special Election, Tesla, Alex Jones: Your Wednesday Briefing;8;8
A $70 Billion Deal for Tesla? Elon Musk Faces 2 Huge Questions;8;8
Even Tesla Seems Worried It’s Consuming Too Much Cash: DealBook Briefing;5;2
What’s on TV Tuesday: ‘Tesla’s Death Ray’ and Near East Relief;1;2
Tesla Pushes Back Its Model 3 Targets Again: DealBook Briefing;1;3
Alex Jones, Tesla, Primaries: Your Tuesday Evening Briefing;8;7
Brett Kavanaugh, Jeff Flake, Tesla: Your Friday Evening Briefing;9;28
Electric Vehicle Tax Credit Survives, but G.M. and Tesla Aren’t Cheering;1;11
Closing Arguments in AT&T Trial, and Jobs Numbers Will Be Released;4;29
He Drove a Tesla on Autopilot From the Passenger Seat. The Court Was Not Amused.;4;29
Congress, Look at Tesla;8;17
Porsche Mission E Cross Turismo Review: ‘Silence Is the New Power’;6;6
Elon Musk, the Donald of Silicon Valley;5;26
Why Is Elon Musk Attacking the Media? We Explain. (Also, Give Us a Good Rating!);5;24
Elon Musk Declares War on the Media: DealBook Briefing;5;24
Musk vs. Buffett: An Invitation for Investors to Take Sides;5;7
Elon Musk Wants to Fill Warren Buffett’s ‘Moat’ With Candy, but It Still Holds Water;5;7
Trump Slump? Tech, Trade Drag Down Stocks: DealBook Briefing;4;2
Elon Musk Joins #DeleteFacebook With a Barrage of Tweets;3;23
Tech Stocks Often Rise and Fall Together. They Shouldn’t.;12;13
Technology Companies Drag Stock Markets Down Again;3;27
Nio’s Share Surge Takes It From Carmaker to Tech Star;9;14
Daniel Naughton, Zachary Kirkhorn;5;6
Why Reining in Amazon Could be Difficult: DealBook Briefing;3;29
Patent Pending in Nomad is a Cafe by Day, Speakeasy by Night;8;8
U.S. Stocks Rebound Slightly After Tech-Driven Slump;4;3
More Than Just a Sell-Off in Tech?: DealBook Briefing;3;28
DealBook Briefing: Elon Musk Has Answers. We Still Have Questions.;8;14
Elon Musk Sued by Cave Rescuer He Accused of Being a Pedophile;9;17
In Norway, Electric and Hybrid Cars Outsell Conventional Models;1;4
Farhad’s Week in Tech: HomePod Whiffs, but Elon Musk Does Not;2;9
China Loosens Foreign Auto Rules, in Potential Peace Offering to Trump;4;17
California Today: Is ‘The Shape of Water’ the Movie to Beat?;2;8
DealBook Briefing: Dell Plans to Go Public, Again;7;2
No Saudi Aramco I.P.O.? No Problem, Potentially, for Saudi Arabia’s Investment Dreams;8;24
DealBook Briefing: Saudi Arabia’s Deep Pockets May Need a Top-Up;8;10
DealBook Briefing: China Has to Think Beyond the Tariff Two-Step;7;11
DealBook Briefing: Does Bank of America Care About Investment Banking?;9;21
It’s Showtime for Elon Musk’s Boring Co., With a Long Way to Go;12;19
California Shooting, Elections, Matthew Whitaker: Your Thursday Evening Briefing;11;8
G.E. Investors Place Their Bets on Another New Leader;10;1
Judge John Hodgman on a Wannabe Astronaut;4;4
Weekend Reads: 11 of Our Best Articles;8;18
Stocks Claw Their Way Back From an Early Slide Amid China Worries;10;23
A Big Reason Wall Street Is Flocking to Spotify: DealBook Briefing;4;3
Big U.S. Trade Gap Expected, and European Stimulus Plan at Issue;2;5
DealBook Briefing: Turkey’s Chaos Could Be Your Problem;8;13
DealBook Briefing: Wall Street Should Look to Hollywood for Equality Tips;6;19
Buses, Delivery Vans and Garbage Trucks Are the Electric Vehicles Next Door;6;21
DealBook Briefing: How Trump Reaped Riches From His Father;10;3
Paul Manafort, Trump, Opioids: Your Wednesday Evening Briefing;8;15
DealBook Briefing: Why Corporate America Is Content With the Midterms;11;8
DealBook Briefing: Media Mergers Coming in 3, 2, 1 …;6;13
Brett Kavanaugh, George Papadopoulos, Elon Musk: Your Friday Evening Briefing;9;7
Trump Asks S.E.C. to Study Quarterly Earnings Requirements for Public Firms;8;17
DealBook Briefing: Europe’s Big Trip to Fix Trade;7;23
California Housing Problems Are Spilling Across Its Borders;3;20
The Metamorphosis of Silicon Valley C.E.O.s: From Big to Boring;9;12
Elon Musk Defends His Rejected Mini-Sub Plan for Thai Cave;7;10
Shutdown, E.P.A., Syria: Your Friday Evening Briefing;12;28
As Electric Cars’ Prospects Brighten, Japan Fears Being Left Behind;1;9
DealBook Briefing: Google in China Is No Done Deal;8;2
DealBook Briefing: Trump’s Trade War Finally Hits Consumers;9;18
DealBook Briefing: Trump’s Potentially Permanent Trade War;9;19
Teaching Activities for: ‘Falcon Heavy, in a Roar of Thunder, Carries SpaceX’s Ambition Into Orbit’;2;8
Starbucks, North Korea, Shinzo Abe: Your Wednesday Briefing;4;17
A Cryptocurrency Millionaire Wants to Build a Utopia in Nevada;11;1
DealBook Briefing: Tencent, and the Markets, Are Hurting. Blame Beijing.;8;16
DealBook Briefing: C.E.O.s Think Kim Played Trump at Their Meeting;6;18
Kim Jong-un, Kashmir, Gaza Strip: Your Monday Briefing;4;1
Catholic Church, Turkey, Omarosa Manigault Newman: Your Tuesday Evening Briefing;8;14
China Cuts Car Tariffs, in a Small Offering to the U.S. on Trade;5;22
Elon Musk’s Chicago Tunnel: A Breakthrough or a Pipe Dream?;9;16
The Week in Tech: What Trump’s Trade War Is Really About;7;13
Jerome Powell Clears the Senate: DealBook Briefing;1;23
Trump’s Trade War Faces Its First Big Test: DealBook Briefing;6;8
What’s Behind the G.M. Cutbacks, and Why Trump Is Angry ;11;27
Trump Moves to Greatly Expand Offshore Drilling: DealBook Briefing;1;4
California Today: Yosemite National Park Reopens to Visitors;8;16
Kavanaugh Hearings, U.N., Elon Musk: Your Thursday Evening Briefing;9;27
Ford Says It’s a New Era. Wall Street Isn’t Buying It.;1;24
Strutting the Red Carpet and Worrying About Climate Change;12;5
Timeline of SpaceX Missions;1;22
Cheaper Battery Is Unveiled as a Step to a Carbon-Free Grid;9;26
Chinese I.P.O.s Are Bringing Casino Trading to New York;9;18
DealBook Briefing: This Year’s Stock Gains Are Wiped Out;10;25
5 Classical Music Concerts to See in N.Y.C. This Weekend;9;13
Who Will Teach Silicon Valley to Be Ethical?;10;21
California Today: Are Criminal Justice Reforms Making the State Safer?;7;11
California Today: Victories, Then Scandal. What’s Next for Democrats?;12;3
A.I. Researchers Are Making More Than $1 Million, Even at a Nonprofit;4;19
Taxpayers Always Lose Industry’s Shell Game With Jobs ;12;7
California Today: The Expensive Rent Control Fight on the State Ballot;10;15
California Today: San Francisco Nurses Protest the Zuckerberg Hospital’s Name;5;15
As Facebook Struggles, Rivals’ Leaders Stay (Mostly) Mum;4;1
Sovereign Wealth Funds Embrace Their Growing Ambitions;10;8
Child Separations, Tariffs, U.N.: Your Tuesday Evening Briefing;6;19
Yes, in Your Backyard;10;31
Trump, Asia Argento, Elon Musk: Your Monday Evening Briefing;8;20
A Tech Wunderkind Who Knows Jaden Smith and Elon Musk;11;14
Mark Zuckerberg, Elon Musk and the Feud Over Killer Robots;6;9
DealBook Briefing: The Big Problem at the Heart of Tech’s Latest Spy Scandal;10;5
DealBook Briefing: Business Titans Turn Their Backs on the G.O.P.;9;17
Car Navigation Systems Plot a Course Forward Against Phone Apps;2;1
Kavanaugh, J.F.K. Airport, ‘Genius’ Grants: Your Thursday Evening Briefing;10;4
Security Clearances, Elon Musk, Aretha Franklin: Your Weekend Briefing;8;19
European Automakers Prepare for an Electric Future;3;6
California Today: State Farmers Supported Trump. Now His Trade Policies Have Them Worried.;5;30
Boosting U.S. Exports to China by $200 Billion Is a Tricky Task;5;18
Three Funds Find Routes to Top Performance in a Rough Market;4;13
California Today: Xavier Becerra on California vs. Trump;5;4
California Today: In Chico, Feeding Fire Evacuees and Emergency Workers;11;16
The Week in Tech: A Breach That Ripples Far Beyond Facebook;10;5
California Today: What Is Wrong With the Salesforce Transit Center;10;3
Meet SpaceX’s First Moon Voyage Customer, Yusaku Maezawa;9;17
Comforts, but Few Creatures (Unless You Count the Dog);10;3
Turkey, Germany, Taliban: Your Tuesday Briefing;8;14
On Politics: An Emotional Hearing, With the Supreme Court at Stake;9;28
Watch as NASA and SpaceX Launch TESS, a Planet-Hunting Satellite;4;16
Microsoft’s Potent Acquisition Currency: DealBook Briefing;6;4
Alkaline Water Makes a Big Splash;11;16
Recent Commercial Real Estate Transactions;7;17
Puns and Anagrams;2;24
Breakfast for Dinner;3;19
No More ‘Nathan for You’: Your Wednesday Pop Culture Cheat Sheet;10;17
Waymo Teams Up With Walmart, Avis and Others for Short Driverless Rides;7;25
DealBook Briefing: Uber and Lyft Are in an I.P.O. Race;10;17
SoftBank Fund Puts $2.25 Billion in G.M.’s Driverless Unit;5;31
DealBook Briefing: Tech and Trade Woes Keep Dragging on the Markets;10;30
SpaceX, Wall Street, Poland: Your Wednesday Briefing;2;7
Brett Kavanaugh, Tsunami, Elon Musk: Your Weekend Briefing;9;30
Genoa, Turkey, Elon Musk: Your Thursday Briefing;8;16
DealBook Briefing: A $100 Billion Tax Break Plan (for the 1 Percent);7;31
Through All the Hype, Self-Driving Cars Remain Elusive;11;27
I Am Begging You to Stop Sleeping With Your Co-Workers ;12;14
Germany, Marijuana, Trade War: Your Wednesday Briefing;6;20
Mars Close Up;8;1
A Storm of Reaction to Trump’s Tariffs;3;8
The Books We Read to Help Us Understand Racism;12;1
How Dodd-Frank Rollback Bill Could Come Back to Haunt Us: DealBook Briefing;5;22
DealBook Briefing: Silicon Valley Has Bigger Problems Than Facebook;7;3
China, Spotify, Fake News: Your Wednesday Briefing;4;3
Winnie Mandela, Tariffs, North Korea: Your Tuesday Briefing;4;2
California Today: In Oakland, a Clash of Artists vs. Big Cannabis;3;30
Brett Kavanaugh, Slovakia, Elon Musk: Your Friday Briefing;9;28
North Korea, Sergei Skripal, Rohingya: Your Wednesday Briefing;3;6
Chinese State TV Mocks Trump in Sarcastic Video;8;22
Elon Musk, Aretha Franklin, ‘Disenchantment’: Your Friday Briefing;8;17
Google, Thousand Oaks, China: Your Friday Briefing;11;8
North Korea, Emmanuel Macron, Malta: Your Wednesday Briefing;4;18
Britain, Kosovo, Sweater Guy: Your Wednesday Briefing;4;4
Taylor Swift, Donald Trump and an America That Confounds the World;11;9
Visionaries With the Courage to Change the World;5;24
Virgin Galactic Rocket Ship Reaches Space, a Milestone in Space Tourism;12;13
Weekly News Quiz for Students: Brett Kavanaugh, Tsunami, Nafta;10;2
Google Promises Its A.I. Will Not Be Used for Weapons;6;7
Summer Reading Contest Winner, Week 9: On ‘Talking to a Man Named Mr. Cotton About Slavery and Confederate Monuments’;8;28
Offering Inspiration and Advice, Real Vision Is HGTV for Hedge Fund Hopefuls;10;2
DealBook Briefing: How the Financial Crisis Helped Elect Trump;9;11
We Have Reached Peak Screen. Now Revolution Is in the Air.;6;27
DealBook Briefing: What’s Next for CBS Without Les Moonves?;9;10
Aretha Franklin, Paul Manafort, ‘Crazy Rich Asians’: Your Thursday Briefing;8;16
News Quiz: Test Your Knowledge of the Week’s Headlines;2;9
LendingClub Founder, Ousted in 2016, Settles Fraud Charges;9;28
Weekly News Quiz for Students: Brett Kavanaugh, Tsunami, Nafta;10;2
Inside One of America’s Last Pencil Factories;1;12
Can Deutsche Bank Be Fixed?: DealBook Briefing;3;27
Jeff Goldblum Is Going Back to His Roots;11;20
Seven Last-Minute Labor Day Getaways to Book Right Now;8;13
At a Denver Hotel, Art, Yoga Mats and Loaner Bikes;4;7
China Is Opening Its Car Market. But Not Enough, Say Auto Companies.;4;25
Uber’s Self-Driving Trucks Hit the Highway, but Not Local Roads;3;6
Stocks Enter Correction Territory: DealBook Briefing;2;8
How China Wins the Trade War;8;8
Summer Reading Contest Winner, Week 8: On ‘A World Tour of Fake Places That Fool the Eye’;8;21
As Auto Industry Transforms, Ford and Volkswagen Consider an Alliance;6;20
The Week in Tech: Claims of Censorship Come Through Loud and Clear;8;31
How Plato Foresaw Facebook’s Folly;11;17
Ford, Once a Leader in the S.U.V. Race, Aims to Catch Up;3;15
Chinese Auto Magnate Buys $9 Billion Stake in Daimler;2;23
DealBook Briefing: Elizabeth Warren Has Wall Street and Big Tech in Her Sights;9;14
China Will Slash Car Tariffs, Trump Says in a (Vague) Tweet;12;3
Noam Chomsky, Elon Musk and Ayn Rand Walk Into a Puppet Show;4;16
Off the Grid, on Maui;3;13
California Today: Tackling Climate Change, Without Trump;9;12
The Week in Tech: A Doozy of a Week for Industry Bosses;7;20
You’ve Become Rich. That Doesn’t Mean You’re Great at Everything.;10;26
Trump, Elon Musk, Turkey: Your Friday Evening Briefing;8;17
Cecilia’s Week in Tech: It’s G.D.P.R. Day!;5;25
Weekly News Quiz for Students: Grammys, Mascots, Mueller ;1;30
Lip;7;28
DealBook Briefing: What Economists Are Worried About for 2019;12;14
DealBook Briefing: SoftBank’s Big Saudi Problem;10;18
Cuomo’s ‘Buffalo Billion’: Is New York Getting Its Money’s Worth?;7;2
DealBook Briefing: BlackRock’s Fink and Blackstone’s Schwarzman Turn Their Backs on Saudi Arabia;10;15
DealBook Briefing: How Not to Increase Board Diversity;10;2
Zuckerberg Breaks His Silence: DealBook Briefing;3;21
California Today: Unease in Sacramento After a Suspected ISIS Member’s Arrest;8;17
Uber, Primaries, Russia: Your Wednesday Evening Briefing;8;8
California Today: Can San Francisco Force Workers to Go Out for Lunch?;8;2
Olympics, Rob Porter, Israel: Your Weekend Briefing;2;11
Rocket Launches and Trips to the Moon We’re Looking Forward To in 2018;1;1
The Week in Tech: Are Robots Coming for Your Job? Eventually, Yes.;9;21
Your Monday Evening News Briefing: Brett Kavanaugh, North Carolina, Elon Musk;9;17
This Week in Business: G.M. Idles Plants, and Sundar Pichai Goes to Washington;12;2
Now Even Apartment Dwellers Can Use Solar Power;7;12
California Today: After Three Decades, Finally, an Arrest;4;26
Why Google’s Bosses Became ‘Unpumped’ About Uber;2;7
California Today: Investing in Newspapers to Save Them;8;28
John Kelly, Winter Games, Flu: Your Friday Evening Briefing;2;9
Turkey, Trump, Primaries: Your Monday Evening Briefing;8;13
How U.S. Fuel Economy Standards Compare With the Rest of the World’s;4;3
G.M. Says Its Driverless Car Could Be in Fleets by Next Year;1;12
Trump’s Truly Terrible Time;9;7
In This Space Race, Jeff Bezos and Elon Musk Are Competing to Take You There;4;24
Are Killer Robots the Future of War? Parsing the Facts on Autonomous Weapons;11;15
The Week in Business: ’Twas the Week After Christmas, and Markets Were Stirring;12;30
End Forced Arbitration for Sexual Harassment. Then Do More.;11;14
California Today: In the Wake of the Fires, Memories of a War Zone;11;14
The Sun Sets. The Wind Dies. But Energy Data Is Relentless.;9;26
California Today: Home Cooks Can Now Sell Their Food in California;9;21
How and Why Silicon Valley Gets High;8;23
Lights, Camera, Artificial Action: Start-Up Is Taking A.I. to the Movies;3;26
Once an S.E.C. Regulator, Now Thriving as a Lawyer for Whistle-Blowers;3;20
Ground Control to Major Mom;2;27
The Week in Business: Facebook Is on the Defensive, and Black Friday Sales Start Early;11;18
California Today: Los Angeles Tests Housing the Homeless in Its Own Backyard;10;30
Your Tuesday Evening News Briefing: Brett Kavanaugh, Apple, Trump;9;18
California Today: A Move to Mandate 100% Carbon-Free Electricity;8;14
California Today: Koreatown’s Wary Response to the Trump-Kim Meeting;6;12
What’s That Smell?;12;19
California Today: Limiting Ammunition to Thwart Gun Violence;9;10
Bands of Paint and Light Shimmer. But Do They Still Shock?;7;25
California Today: At an Oakland Hospital, a New Way to Treat Opioid Addiction;8;20
California Today: An Additional Fund for Solar Power;10;2
DealBook Briefing: Trump’s Brexit Bombshell for Trade;7;13
The Future Is Bright for the Video Games of Yesterday;12;2
California Today: To Tell the Brown Family Saga, Start in 1852;9;19
California Today: A Rare Look Inside Steve Jobs’s Family;8;24
California Today: Privacy Activists Rein in Silicon Valley, From Big Tech’s Backyard;8;15
Has Anything Changed in Post-#MeToo Hollywood?;8;9
California Today: L.A.’s Plan to Harness Hoover Dam’s Energy Reserves;7;25
California Today: Stockton Tries Free Cash to Fight Income Inequality;5;31
Google Is in Europe’s Cross Hairs Again: DealBook Briefing;6;6
North Korea, Harvey Weinstein, Syria: Your Thursday Evening Briefing;5;24
Some College Building Dedicatees;8;8
China Strikes Back at Trump’s Tariffs, but Its Consumers Worry;7;6
California Today: In Picking L.A., Did LeBron Choose Comfort Over Legacy?;7;3
California Today: A Tech Company Wades Into Housing Politics;5;3
California Today: San Francisco’s Spiritual Bastion Gets Behind Its Beyoncé Mass;4;23
Trade War, Oklahoma, March Madness: Your Evening Briefing;4;2
You’ve Got Lots of Company Stock. Now What?;3;22
California Today: Earthquake Insurance Sales Spiked in 2017;2;9
California Today: How a Market Tumble Affects California;2;7
California Today: Traffic Is Terrible, but Californians Keep Buying Cars;2;6
What Improved Tech Means for Electric, Self-Driving and Flying Cars;5;16
Why Electric Vehicles Are Gathering Speed in Latin America;12;28
California Today: A Show About ‘Women, Sex and Power’ Gains New Urgency;9;28
California Today: The Big Decisions Voters Face This November;7;2
Winter Olympics, SpaceX, Steve Wynn: Your Wednesday Briefing;2;7
California Today: The Los Angeles Times Has (Another) New Editor;1;31
‘I Flail. I Gasp. I Use a Snorkel’: A Reporter Learns to Swim in Los Angeles;10;5
Russia, Scallops, Aston Martin: Your Thursday Briefing;8;30
Nafta, Google, Trump: Your Tuesday Evening Briefing;8;28
California Today: Saudi Prince Tours Los Angeles and San Francisco;4;9
Indonesia, Nobel, Aznavour: Your Tuesday Briefing;10;2
California Today: Shabbat at a Wendy’s in Palm Desert;4;20
Angela Merkel, Winter Olympics, Corsica: Your Thursday Briefing;2;8
Slumping Stock Market Enters Negative Territory for the Year ;10;24
To Power the Future, Carmakers Flip on 48-Volt Systems;2;8
San Diego’s Power Move: City Takes on Utility Over Green Energy;10;25
California Today: Recalling the State’s Own ‘Trump Moment’ in a ’90s Immigration Debate;6;20
They Tried to Boycott Facebook, Apple and Google. They Failed.;4;1
Stocks Plunge as Market Enters ‘Correction’ Territory;2;8
California Midterm Results: Funding for Affordable Housing and a Rent Control Defeat;11;8
DealBook Briefing: The Disney-Comcast Fight Switches to Sky;7;12
California Today: Readers Talk About Homelessness With Their Children;10;1
Demands Grow for Facebook to Explain Its Privacy Policies;3;26
Troye Sivan Is a New Kind of Pop Star: Here, Queer and Used to It;5;10
Goldman’s Succession Timeline Takes Shape: DealBook Briefing;5;18
Amid Optimism, Automakers Pack Geneva With What’s Next;3;6
Inside the Global Relay Race to Deliver Moly-99;1;12
California Today: A Costly Race for State Superintendent;10;29
John McCain, Michael Cohen, Pope Francis: Your Weekend Briefing;8;26
Apple Computers Used to Be Built in the U.S. It Was a Mess.;12;15
NATO, Facebook, World Cup: Your Wednesday Briefing;7;11
Advice for Renovating Your Home;5;8
Earthquake, Davos, Academy Awards: Your Tuesday Briefing;1;23
Nafta, Pope Francis, Russia: Your Wednesday Briefing;8;29
