Headline;Month;Day
#mycabletoo;8;22
At Verizon, a Changing of the Guard as It Pursues 5G;6;8
U.S. Investigating AT&T and Verizon Over Wireless Collusion Claim;4;20
ESPN and Others Try to Restrain Reporters for N.B.A. Draft, to No Avail;6;21
Largest Cellphone Carriers to Limit Sales of Location Data;6;19
CBS Escalates Its Fight With Redstones;5;15
Silicon Valley Faces Regulatory Fight on Its Home Turf;5;13
T-Mobile’s 5G Argument to Regulators Is Compelling;5;3
Sprint and T-Mobile Are Said to Be Close to a Merger to Compete at the Top;4;27
Investment Boom From Trump’s Tax Cut Has Yet to Appear;4;30
How the Sprint Deal is a Feather in T-Mobile C.E.O.’s Cap: DealBook Briefing;4;30
Bulging Debt May Spell Trouble for Energy, Telecom and Retail;4;13
It’s Not a Bird or a Plane. It’s a 17-Foot Drone, and It’s Here to Save Your Cellphone Service.;4;6
Back Story With The Times's Adam Liptak;8;28
NYT: Tech Talk for 08/12/2010;8;28
NYT: Weekend Business for 01/14/2011;8;28
NYT: Tech Talk for 08/19/2010;8;28
The Mobile Virtual Network Operator Will Connect You Now;8;15
T-Mobile and Sprint: How Fewer Competitors Could Increase Competition;7;31
NYT: Tech Talk for 11/05/2009;8;28
How Would a T-Mobile-Sprint Merger Affect Your Cellphone Bill?;4;30
Sprint and T-Mobile Try Again, but Antitrust Hurdles Remain the Same;4;30
Trump’s Trade War Faces Its First Big Test: DealBook Briefing;6;8
The Adobe Museum of Digital Media, smartphone backup methods, news.;8;28
Sprint and T-Mobile to Merge, in Bid to Remake Wireless Market;4;29
Telepsychiatry,  iPad2 teardowns, the tech term "dual core", news.;8;28
How to Switch Cell Phone Carriers;12;31
Bits: Tech Talk for 01/13/2011;8;28
New iPhones Are Coming. Here’s How to Save on an Upgrade.;9;11
NYT: Tech Talk for 10/14/2010;8;28
Ben Sisario on the digital music business, a laptop sound bar, and ifixit.com unpacks Xoom and MacBook Pro.;8;28
How to Buy a Used Phone Without Getting Fleeced;11;1
NYT: Tech Talk for 10/07/2010;8;28
Matt Richtel on tools to curb distracted driving, Smartphone photography, the Mikey mobile recorder for iPods, and news.;8;28
Measuring and Managing Your Cellular Data Use;2;12
What Is 5G? Here’s What You Need to Know About the New Cellular Network;12;31
Get a Wi-Fi Tablet on a Cellular Network ;6;8
Letting Sprint and T-Mobile Merge Is a Terrible Idea;5;1
Should Trump Nationalize a 5G Network?;2;1
Should You Buy Someone a Phone for the Holidays?;12;5
How to Use Your Existing Phone Overseas;9;19
Mahika Sharma, Daniel Naparstek;9;23
Jennifer DeAngelis, Patrick Rodenbush;6;10
How the Government Could Win the AT&T-Time Warner Case;5;31
Sprint and T-Mobile C.E.O.s Are in Washington to Sell Their Merger. Here’s What They’ll Confront.;5;1
Review: Suicidal Man Seeks Mystery Woman for ‘Entanglement’;2;8
‘He’s a Pit Bull’: T-Mobile C.E.O. Is the Colorful Outlier of Wireless;5;1
Sleepless in Manhattan;3;14
The Security of Cellular Connections;8;10
Why Trump Lashed Out at OPEC: DealBook Briefing;4;20
Justice Department Sues to Stop California Net Neutrality Law;10;1
California Today: What We Learned at Apple’s iPhone Bonanza;9;13
How to Unlock Your Phone for Overseas Travel ;7;9
Closed Captions You Can Actually See;3;9
What Happened to AOL Time Warner?;6;15
Five Underrated Things to Pack for Every Trip;9;13
IndyCar Series Will Move to NBC in 2019;3;21
Service Meant to Monitor Inmates’ Calls Could Track You, Too;5;11
A Battle for Control of CBS, With Far-Reaching Consequences;5;17
Jerome Powell Clears the Senate: DealBook Briefing;1;23
T-Mobile-Sprint Merger Would Give Japan’s SoftBank Bigger Foothold in U.S.;4;29
N.S.A. Triples Collection of Data From U.S. Phone Companies;5;4
Roger Penske, IndyCar’s Grand Old Man, Shows No Signs of Slowing Down;3;10
Montana Governor Signs Order to Force Net Neutrality;1;22
Washington Governor Signs First State Net Neutrality Bill;3;6
With Disney Deal Looming, Murdoch’s Empire Is Fractured;1;1
Meet the $800 Smartphone That You Probably Won’t Buy;1;24
DealBook Briefing: A $100 Billion Tax Break Plan (for the 1 Percent);7;31
Net Neutrality Has Officially Been Repealed. Here’s How That Could Affect You.;6;11
Apple’s Stock Buybacks Continue to Break Records;8;1
SoftBank Hires a Veteran Corporate Image-Maker;10;31
News Quiz: Test Your Knowledge of the Week’s Headlines;12;21
Marie Kondo, in Reverse: How to Fill a Space;8;20
CBS Escalates Its Fight to Thwart Redstones: DealBook Briefing;5;14
The N.F.L. and Nike Make Room for Fanatics;5;23
The World Is Growing More Indebted: DealBook Briefing;5;15
Five Strategies for Stress-Free Travel;12;17
Sprint, T-Mobile Deal Gets Green Light From U.S. Regulators;12;18
News Quiz: Test Your Knowledge of the Week’s Headlines;5;4
What Companies Are Doing With Their Savings From the Tax Law;1;31
Oath Agrees to $5 Million Settlement Over Children’s Privacy Online;12;4
How Net Neutrality Actually Ended Long Before This Week;6;11
The Charts That Show How Big Business Is Winning;6;17
The Implausible Promises of a T-Mobile-Sprint Merger;4;30
New York State Attorney General Race Remains a Tossup, New Poll Shows;9;10
A New Life and Language, 7,000 Miles From Home;2;10
Trump Will Nominate William Barr as Attorney General;12;8
Capitalism, Socialism, and Unfreedom;8;26
Roger Goodell Begins to Shape a Team for His Stretch Run;3;14
How C.E.O.s Should Spend Their Tax Cuts;2;9
AT&T Drops Huawei’s New Smartphone Amid Security Worries;1;9
AnchorFree, Maker of a Top Online Privacy App, Raises $295 Million;9;5
The Week in Tech: Facebook Is in the News. Again.;12;7
Stocks Claw Their Way Back From an Early Slide Amid China Worries;10;23
A Temporary Cease-Fire in CBS’s Fight With Redstones: DealBook Briefing;5;16
Quirks and Gossip in a Corporate Cellphone Branch;4;6
HuffPost, Breaking From Its Roots, Ends Unpaid Contributions;1;18
‘Presidential Alert’ Goes to Millions of Cellphones Across the U.S.;10;3
If You Love High TV Bills, This Is the Merger for You;3;22
California Today: The Human Element in California’s Wildfires;8;23
California Today: An Indictment Reveals a Pitfall in the Top-Two Primary System;8;22
Why the AT&T-Time Warner Case Was So Closely Watched;6;12
California Passes Sweeping Law to Protect Online Privacy;6;28
California Lawmakers Pass Nation’s Toughest Net Neutrality Law;9;1
A Perfect Target for Cybercriminals ;11;20
MoviePass Says All Is Well. Even Some of Its Customers Are Skeptical.;4;26
Digging Out From a Snowy Spring Day;3;22
Your Monday Evening News Briefing: Hurricane Florence, China, Primaries;9;10
Senate Democrats Win Vote on Net Neutrality, a Centerpiece of 2018 Strategy;5;16
Your Country House Is a Disaster? Tell Me Everything.;4;12
Our Cellphones Aren’t Safe;12;27
Trump Gambles and Loses on AT&T;6;13
Florida at 200 M.P.H.;3;17
States Push Back After Net Neutrality Repeal;1;11
What’s Hot (and What’s Not) This Black Friday;11;14
Need a Song for Your Commercial? Try These Campers;10;14
Karlie Kloss Teaches Teenage Girls How to Code;3;16
$2.4 Billion Deal for Chelsea Market Enlarges Google’s New York Footprint;2;7
The Charity Scandal That Ensnared U.K. Business Elites: DealBook Briefing;1;24
De Blasio, a Pro-Labor Mayor, Is Sued Over Bargaining Tactics;1;31
Stock Markets Are Wild, but Bond Markets Can Be Dangerous;12;18
DealBook Briefing: Merger Binge Could Lead to a Hangover;7;5
Sean Patrick Maloney Jumps Into New York Attorney General’s Race;6;6
Modem vs. Router: What’s the Difference?;5;31
Facebook Vowed to End Discriminatory Housing Ads. Suit Says It Didn’t.;3;27
Marriott Hacking Exposes Data of Up to 500 Million Guests;11;30
Concacaf’s Leader Earned $2 Million Last Year, More Than FIFA and UEFA Presidents;4;2
Order a Coffee and Pay, With a Tap on the Dash;10;11
AT&T Has Had Many Run-Ins With the Government;6;12
Huawei, Failing to Crack U.S. Market, Signals a Change in Tactics;4;17
The Big Tech Trends to Follow at CES 2018;1;3
Les Moonves Said to Be Negotiating Possible Exit From CBS;9;6
California Today: ‘Secret Science’ in the Salinas Valley?;8;27
Advertisers Eschew Politics for Humor in Super Bowl Commercials;2;4
Diversity in Attorney General’s Race Is Celebrated: Whoever Wins Will Make History.;9;10
Paul Manafort, Hawaii, Urban Meyer: Your Thursday Briefing;8;23
You Want to Watch All the European Soccer? Here’s How. (Warning: It’ll Cost About $750.);8;10
Your Wi-Fi Security Is Probably Weak. Here’s How to Fix That.;6;13
Behind the Battle Over the Future of MTV and ‘Big Bang Theory’;5;18
North Korea, Mike Pompeo, Correspondents’ Dinner: Your Monday Briefing;4;29
Why Trump Is Right About the E.U.’s Penalty Against Google;7;26
Yes, You Can Be an Ethical Tech Consumer. Here’s How.;12;12
DealBook Briefing: Trump’s Wounded. Will Business Feel the Pain?;8;22
Trump Administration Mulls a Unilateral Tax Cut for the Rich;7;30
WhatsApp Co-Founder Leaving Facebook Amid User Data Disputes;4;30
Huawei and ZTE Hit Hard as U.S. Moves Against Chinese Tech Firms;4;18
How the 52 Places Traveler Stays Charged While Chronicling the World;7;11
As Florence’s Power Nears the Carolinas, Residents Brace for the Worst;9;11
Amazon Has Lots of Company as Trump Slams ‘Stupid’ Businesses;4;4
The Republican Fiscal Stimulus Could Be Bigger Than Obama’s;2;6
DealBook Briefing: Media Mergers Coming in 3, 2, 1 …;6;13
The Week That Could Rattle the World Economy: DealBook Briefing;6;11
DealBook Briefing: The C.E.O.s Taking on Trump Over Immigration;6;20
5G Cell Service Is Coming. Who Decides Where It Goes?;3;3
Your Pyeongchang 2018 Travel Guide;1;17
Trump Weighs Bringing Back William Barr as Attorney General;12;6
When Answering the Phone Exposes You to Fraud;12;7
Introducing the Internet Bill of Rights;10;4
How to Block and Report Spam Calls and Text Messages ;8;15
AT&T-Time Warner Ruling Has Dealmakers Bracing;6;10
‘Who Gets to Be Sexy?’;5;5
Marissa Mayer Is Still Here;4;18
Disney and Fox Shareholders Approve Deal, Ending Corporate Duel;7;27
Tragically Lost in Joshua Tree’s Wild Interior;3;22
It’s Almost 2019. Do You Know Where Your Photos Are?;11;29
Trump Will Nominate William Barr as Attorney General;12;7
Ex-Senate Aide Charged in Leak Case Where Times Reporter’s Records Were Seized;6;8
DealBook Briefing: Investors May Be Overlooking Their Own Discrimination;12;11
Overlooked in Atlanta, Black Female Artists Try Miami;12;11
Dorm Living for Professionals Comes to San Francisco;3;5
Teenagers in The Times: September 2018;10;4
Olympian Erin Hamlin Marries a Childhood Playmate;8;3
DealBook Briefing: How Trump Plans to Keep China In Line on Trade;12;12
The 52 Places Traveler: A Celebration of African-American Culture in Baltimore;6;29
#MeToo Called for an Overhaul. Are Workplaces Really Changing?;3;23
The 52 Places Traveler: On an Icelandic Road Trip, Mossy Moonscapes and More;7;3
Who’s Still in Amazon’s HQ2 Contest: DealBook Briefing;1;18
How Shipping Costs Have Put Amazon in a Bind: DealBook Briefing;4;27
How Artificial Intelligence Is Edging Its Way Into Our Lives;2;12
Highlights From Zuckerberg’s Day 2 Testimony: DealBook Briefing;4;11
How to Keep Track of the Trade Fights: DealBook Briefing;5;29
Three Reasons Deutsche Bank Didn’t Exit Wall Street Earlier: DealBook Briefing;4;26
The Myth of the Hacker-Proof Voting Machine;2;21
Tallying Wells Fargo’s Penalties: DealBook Briefing;2;2
JPMorgan Promotes Pinto and Smith to Co-Presidents: DealBook Briefing;1;29
Peter Thiel Is a Bitcoin Believer: DealBook Briefing;1;2
The WeWork Manifesto: First, Office Space. Next, the World.;2;17
Three Takeaways from Mark Zuckerberg’s Senate Testimony: DealBook Briefing;4;10
Is Capital or Labor Winning at Your Favorite Company? Introducing the Marx Ratio;5;21
This Week’s Wedding Announcements;6;10
The Highest-Paid C.E.O.s in 2017;5;25
This Week’s Wedding Announcements;9;23
The Unlikely Activists Who Took On Silicon Valley — and Won;8;14
New York Primary Election Results;9;13
