Headline;Month;Day
Nobel in Economics to Be Awarded, and Big Banks Begin Reporting Earnings;10;7
DealBook Briefing: Reliving Wall Street’s Near-Death Experience;9;13
A Candidate Backed Medical Marijuana. Wells Fargo Closed Her Bank Account.;8;21
Trump’s Thumps Don’t Cause Stock Slumps;9;6
Wells Fargo Sailed Through Its Stress Test. Goldman Sachs and Morgan Stanley, Not So Much.;6;29
Wells Fargo Pays $1 Billion to Federal Regulators;4;20
Wells Fargo Continues to Test Regulators: DealBook Briefing;5;17
Wells Fargo Agrees to Settle With Shareholders for $480 Million;5;4
Wells Fargo Said to Be Target of $1 Billion U.S. Fine;4;19
Wells Fargo Accused of Harming Fraud Victims by Closing Accounts;3;1
Four Directors Will Leave Wells Fargo’s Board;3;2
Tallying Wells Fargo’s Penalties: DealBook Briefing;2;2
Federal Reserve Shackles Wells Fargo After Fraud Scandal;2;2
How Wells Fargo and Federal Reserve Struck Deal to Hold Bank’s Board Accountable;2;4
What the Wells Fargo Crackdown Signals to Corporate America;2;12
Wells Fargo Is About to be Hit With $1 Billion Fine: DealBook Briefing;4;19
Punishing Wells Fargo: Just Deserts, or Beating a Dead Horse?;4;19
Wells Fargo, North Korea, Cuba: Your Thursday Evening Briefing;4;19
The Former Khmer Rouge Slave Who Blew the Whistle on Wells Fargo;3;24
Bank Earnings Climb in Growing Economy, but Lending Doesn’t Keep Pace;7;13
Don’t Like Your Mortgage Servicer? Good Luck Trying to Switch;2;16
Banks Are Paying Out Billions to Shareholders. We Put the Numbers in Context.;6;29
Punishing Wells Fargo;4;22
A Playful Headline. Confusion Ensues. An Editor Explains.;4;20
Bank Earnings Boom as Regulators Relax Rules;4;13
Why Trump Lashed Out at OPEC: DealBook Briefing;4;20
JPMorgan’s Profits Are Strong, and They’ll Likely Get Stronger;1;12
Jerome Powell Is Sworn In as Federal Reserve Chairman;2;5
Do Financial Advisers Have to Act in Your Interest? Maybe;3;22
Zelle, the Banks’ Answer to Venmo, Proves Vulnerable to Fraud;4;22
DealBook Briefing: How Monday’s Stock Plunge Ranks?;2;5
The Banks Changed. Except for All the Ways They’re the Same.;9;12
Citigroup Acted. Now, Two New Ideas on How Banks Can Limit Gun Sales.;3;27
Companies Are Handing Out Bonuses Thanks to the Tax Law. Is It a Publicity Stunt?;1;3
Margaret Williams, Frank Driscoll;9;16
Bank ‘Stress Tests’ Results Clear Way for Wall Street to Reward Investors;6;28
Comcast-Fox: By the Numbers;6;13
The Redstones’ Voting Power Leaves Moonves and CBS Few Options: DealBook Briefing;4;13
Banks Are Big Winners From Tax Cut;1;16
Can Deutsche Bank Be Fixed?: DealBook Briefing;3;27
Berkshire’s Annual Meeting: Buffett Approves of Apple’s Buyback Plan;5;5
Regulator Urges Banks to Compete With Payday Lenders;5;23
What Companies Are Doing With Their Savings From the Tax Law;1;31
Discussion of Inflation, Unveiling of Consumer Tech and Bank Earnings;1;8
Maria Canales, Jane Greenwood;6;24
Tess Reed, Samuel Dippo;7;8
A Top Candidate for New York Fed’s Leader: San Francisco’s;3;25
Lily Mercer, Austin Belcak;9;23
Weekly News Quiz for Students: Secret Memo, Super Bowl, Stock Market;2;6
Lauren May, Ryan Adams;10;21
5 Tips to Weather a Turbulent Stock Market;2;16
Goldman Sachs Names David Solomon C.E.O. as Blankfein Plans Exit;7;17
Takeaways From Spotify’s Investor Day: DealBook Briefing;3;15
How an Unsolved Mystery Changed the Way We Take Pills;9;16
The World’s New Top Bank Cop Faces a Stress Test of His Own;11;27
The Real Reason the Investor Class Hates Pensions;3;5
California Today: Shabbat at a Wendy’s in Palm Desert;4;20
Why It’s So Hard to Invest With a Social Conscience;3;2
Super Bowl’s Minneapolis Stadium Brings a Surge in Development;1;23
Southwest Airlines Engine Explodes in Flight, Killing a Passenger;4;17
Viva Mexico, America’s Team;6;27
Iowa Basketball Rivalry Fizzles as Big School Ducks the Upstarts;12;14
New York Fed Weighs a Wall Street Overseer, and Left Spies an Opening;3;26
Biggest Banks Pass Fed’s Stress Tests;6;21
Facebook Falls From Grace, and Investors’ Stock Holdings Tumble Too;3;29
When Wall Street Writes Its Own Rules;2;9
Flyers, at ‘Rock Bottom,’ Shake Up Their Organization;12;18
Unreliable Witnesses to Their Own Meeting?;3;17
The Biggest Buyers of American Stocks Are on the Sidelines Right Now;10;11
U.S. Bancorp Fined $613 Million for Money-Laundering Violations: DealBook Briefing;2;15
Remington, the Gun Maker, Is Set to Exit Bankruptcy;5;3
N.B.A. Playoffs: It All Goes Wrong for the Sixers, Including the Confetti;5;6
Moguls Rub Shoulders in Idaho, and China Releases Trade Numbers;7;8
Dustin Johnson Shoots 66, Joining a Crowd in the Players Championship Lead;5;11
Big Banks’ Earnings and China Growth Report to Give Snapshots of Economies;10;14
How Mark Zuckerberg Can ‘Win’ on Capitol Hill;4;10
To Reach Men, Advertisers Dial In to Sports Radio;8;19
News Quiz: Test Your Knowledge of the Week’s Headlines;7;20
Weekly News Quiz for Students: Box Office Record, Trump Legal Team, New Diseases;5;8
How C.E.O.s Should Spend Their Tax Cuts;2;9
William Bain Jr., 80, Business Consultant and Romney Mentor, Dies;1;19
She Dropped Out of High School. Now She’s President of the San Francisco Fed.;9;14
F.D.A. Seeks Restrictions on Teens’ Access to Flavored E-Cigarettes and a Ban on Menthol Cigarettes;11;15
Fed Makes a Risky Bet on Banks;6;1
DealBook Briefing: Why Corporate America Is Content With the Midterms;11;8
Consumer Bureau Looks to End Public View of Complaints Database;4;25
Markelle Fultz Returns for the 76ers, and He Brought His Jumper;3;27
Boston’s Al Horford Has Enough Experience for His Entire Team;5;6
Stocks Bounce Back From Edge of Bear Market;12;26
 Wall St. Pins Hopes on Strong Earnings After October’s Ugly Start for Stocks;10;14
Bank Regulator, on the Defensive, Endorses an Obama-Era Approach to Fight Discrimination;6;14
Sinclair Deal With Tribune Hits Complications in Washington;2;28
Appeals Court Questions Dual Roles of Consumer Bureau’s Director;4;12
‘Like a Mosquito in a Nudist Colony’: How Mick Mulvaney Found Plenty to Target at Consumer Bureau;5;7
Bulging Debt May Spell Trouble for Energy, Telecom and Retail;4;13
New Long-Term Economic Forecast and Facebook Founder Testimony;4;8
What Stress? It's Good to Be a Bank;6;22
Overlooked No More: Charley Parkhurst, Gold Rush Legend With a Hidden Identity;12;5
For Big Tech, a Comeuppance We’ve Seen Before: On Wall St.;9;9
Is Facebook Serious About Its Clean Up?: DealBook Briefing;4;25
Trump, at Rally, Vows to Carry On Anthony Kennedy’s Legacy With Court Pick;6;28
A New Report on the Las Vegas Gunman Was Released. Here Are Some Takeaways.;1;19
Poll Finds Upturn in Sentiment on Tax Overhaul and Economy;1;17
Stocks Plunge, as Fresh Tensions With China Batter Tech Shares;10;10
Almost Zero: Why You’re Still Not Making Much on Your Bank Account ;4;13
4 Easy Ways to Cut Down Your Sugar Intake;3;19
DealBook Briefing: How Facebook Wrestled With Its Scandals;11;15
California Today: At Merced, the Changing Face of the U.C. System;7;20
American Success on the European Tour;5;23
More Bank Earnings, China’s Growth and Sundance Without Weinstein;1;15
As Markets Tumble, Tech Stocks Hit a Rare and Ominous Milestone;12;21
California Today: The Former Turkish Soccer Star Running a Bay Area Cafe;5;7
Topicality and Risk in Next Playwrights Horizons Season;2;14
DealBook Briefing: This Trade Truce Feels Familiar;7;27
Goldman’s Succession Timeline Takes Shape: DealBook Briefing;5;18
Juul Closes Deal with Tobacco Giant Altria;12;20
Meet the ‘Change Agents’ Who Are Enabling Inequality;8;20
DealBook Briefing: Comcast Gave Up Fox. Now It’s All Eyes on Sky.;7;20
Powell Takes Over as Fed Chief as Economy Starts to Show Strain;2;4
School Officer: A Job With Many Roles and One Big Responsibility;3;4
How and When to Talk to Your Children About Money;11;16
Banks Report Earnings, and Google Faces Antitrust Fines ;7;15
Apple’s Big Plans: DealBook Briefing;1;17
Super Bowl, Amtrak, Ecuador: Your Monday Briefing;2;5
How Banks Could Control Gun Sales if Washington Won’t;2;20
F.D.A. Cracks Down on ‘Juuling’ Among Teenagers;4;24
Earth Day, North Korea, Michael Cohen: Your Weekend Briefing;4;22
Inside Southwest Flight 1380, 20 Minutes of Chaos and Terror;4;18
DealBook Briefing: The Biggest Ever I.P.O. Is on Hold;8;23
Is Comcast Going to Crash Disney’s Deal With Fox?: DealBook Briefing;5;7
How the Tax Code Rewrite Favors Real Estate Over Art;1;12
Kim Jong-un, Greece, Satan: Your Friday Briefing;4;20
Paychecks Lag as Profits Soar, and Prices Erode Wage Gains;7;13
Citigroup Sets Restrictions on Gun Sales by Business Partners;3;22
Why Are We Suddenly Surrounded by ‘Grift’?;12;4
Vaping Can Be Addictive and May Lure Teenagers to Smoking, Science Panel Concludes;1;23
Washington Wants to Weaken Bank Rules. Not Every Regulator Agrees.;4;24
When Cryptocurrencies Fluctuate, He Uses These Tech Tools to Keep Track;9;12
Is Capital or Labor Winning at Your Favorite Company? Introducing the Marx Ratio;5;21
Walmart’s Bumpy Day: From Wage Increase to Store Closings;1;11
J.J. Redick, the N.B.A.’s Most Meticulous Player;3;21
DealBook Briefing: The Glass Ceiling Grows Back;8;7
Windfall for Super Bowl Hosts? Economists Say It’s Overstated;1;29
North Korea, Kabul, Gaza Strip: Your Monday Briefing;4;22
An Alternative to Payday Loans, but It’s Still High Cost;9;21
Patients Eagerly Awaited a Generic Drug. Then They Saw the Price.;2;23
Dow Jones and S.&P. Slide Again, Dropping by More Than 4%;2;5
New York Fed Names John Williams President, Bucking Calls for Diversity;4;3
Mueller Guides Us Through the Swamp;4;22
Victoria’s Secret? In 2018, Fewer Women Want to Hear It;11;16
John Bolton, Gun Control, China: Your Monday Briefing;3;25
How Mark Zuckerberg Became Too Big to Fail;11;1
Businesses Look at Washington and Say, ‘Never Mind, We’ll Do It’;2;1
Worries Grow That the Price of Bitcoin Is Being Propped Up;1;31
The Cost of Going Back to School as an Adult;6;5
Kicking Off the New Year With a Bang: DealBook Briefing;1;5
When Family Members Care for Aging Parents;9;19
Will Bank Earnings Flash Any Warnings?: DealBook Briefing;4;12
Washington Moves to Soften a Big Bank Capital Rule: DealBook Briefing;4;24
A Big Tax Break for Socially Responsible Investing;11;9
James Comey, Prince, ‘Westworld’: Your Friday Briefing;4;20
The Bright (and Dark) Side of Roger Deakins;1;5
3 Ways to Create a Climate Change Investment Strategy;10;26
We’re All Afraid to Talk About Money. Here’s How to Break the Taboo.;8;28
Walmart and Now Starbucks: Why More Big Companies Are Offering Paid Family Leave;1;24
‘It’s a Terrible Vote’: Red-State Democrats Face an Agonizing Supreme Court Choice;7;7
DealBook Briefing: Does Bank of America Care About Investment Banking?;9;21
DealBook Briefing: Saudi Arabia Plans to Cut Its Oil Production;11;12
Review: A Sensational Prison Escape, Without the Sensation;11;15
Let the Pre-Oscar Bingeing Begin;2;2
Green Party, Eyeing the 2020 Presidential Race, Prepares for the Midterms;8;1
Big Banks to Get a Break From Limits on Risky Trading;5;30
‘Castle Rock’ Is a Stephen King Story That Isn’t Really a Stephen King Story;7;19
Review: ‘Castle Rock’ Is Too Haunted by Its Past;7;24
DealBook Briefing: Meet Our 2018 Conference Speakers;10;4
DealBook Briefing: BlackRock’s Fink and Blackstone’s Schwarzman Turn Their Backs on Saudi Arabia;10;15
The Russian Comic Writer Who’s an Antidote to Mad Times;5;2
Dropbox’s First-Day Pop Should Give Investors Pause: DealBook Briefing;3;23
Banks Adopt Military-Style Tactics to Fight Cybercrime;5;20
DealBook Briefing: Chinese Business U-Turns in America? Blame the Trade War;9;20
Obama Lashes Trump in Debut 2018 Speech. President’s Response: ‘I Fell Asleep.’;9;7
DealBook Briefing: This Year’s Stock Gains Are Wiped Out;10;25
Ready for Season 2 of ‘Legion’? Here’s What to Remember.;4;2
Vultures! Elections! It’s September!;9;1
A Minnesota Lake House Built on Legend;5;22
A Supreme Court Vote Is Just One of Heidi Heitkamp’s Headaches;7;23
DealBook Briefing: Will U.S. Markets Stop Plunging?;10;12
With ‘Electric Dreams,’ Philip K. Dick Gets the TV Anthology Treatment;1;5
On Politics With Lisa Lerer: Asked and Answered;10;12
Breaking Down the New Players on This Year’s Baseball Hall of Fame Ballot;11;19
The Billion-Dollar Bank Job;5;3
Dorothy’s Ruby Slippers Were Stolen 13 Years Ago. Now They’ve Been Found.;9;4
Trump Warns NATO Allies to Spend More on Defense, or Else;7;2
Trump Claims Credit for the Economy. Not So Fast, Says Obama.;9;9
His Body Was Behind the Wheel for a Week Before It Was Discovered. This Was His Life.;10;23
One Risk to the Economy — A Slowdown in Lending: DealBook Briefing;5;10
Trail Blazers’ Game-Day Posters Are Often First Shot Against Opponents;12;15
The Leeway in President Trump’s Tariff Order: DealBook Briefing;3;8
Will Investors Shrug Off Trump’s Tariffs?: DealBook Briefing;3;1
The Best Movies and TV Shows New to Netflix Australia in November;11;6
Dow and S.&P. 500 Have Their Best Day in Nearly Three Years: DealBook Briefing;3;26
Will Market Volatility Help Goldman Get Its Groove Back?: DealBook Briefing;2;13
Kennedy Retirement Injects an Inflammatory New Issue Into Midterms;6;28
Trump Wants Attorney General to Investigate Source of Anonymous Times Op-Ed;9;7
Jan Maxwell, Celebrated Stage Actress, Is Dead at 61;2;12
It’s Time to Take a Serious Look at Michael Stuhlbarg;1;19
Doris Burke Has Game;4;28
How Good Were the Paydays for Bank Chiefs … and Shareholders?: DealBook Briefing;2;16
Did Juul Lure Teenagers and Get ‘Customers for Life’?;8;27
How the Sprint Deal is a Feather in T-Mobile C.E.O.’s Cap: DealBook Briefing;4;30
A Brief History of G.E. Asset Sales: DealBook Briefing;5;21
Three Takeaways from Mark Zuckerberg’s Senate Testimony: DealBook Briefing;4;10
Where Pot Entrepreneurs Go When the Banks Just Say No;1;4
Carl Eller, Ex-Viking, Is Using the Super Bowl as a Platform;2;2
4 Questions as Amazon, Berkshire and JPMorgan Take on Health Care: DealBook Briefing;1;30
Stocks Record Their Biggest Two-Day Rally Since 2016: DealBook Briefing;2;12
What Does Winning an Olympic Gold Medal in Curling Do? Crazy Things;12;31
Why Reining in Amazon Could be Difficult: DealBook Briefing;3;29
Oracle’s Ellison Unveils Hydroponic Farming Start-Up: DealBook Briefing;3;19
Where Are Your Favorite Shows Streaming Now?;5;24
Would a Broadcom-Qualcomm Deal Really Shift the 5G race?: DealBook Briefing;3;2
This Week’s Wedding Announcements;7;8
The Best TV Shows and Movies New to Netflix, Amazon and More in August;8;1
This Week’s Wedding Announcements;9;23
The Highest-Paid C.E.O.s in 2017;5;25
This Week’s Wedding Announcements;9;16
What Makes ‘The Good Place’ So Good?;10;4
This Week’s Wedding Announcements;10;21
New Hampshire Election Results;11;6
New Hampshire Primary Election Results;9;11
Transgender Lives: Your Stories: Corey;9;13
Corrections: February 6, 2018;2;6
