Headline;Month;Day
It’s Time for Pharmaceutical Companies to Have Their Tobacco Moment;2;24
Drug Prices on TV? They May Be Coming.;3;23
C.E.O. Pay, America’s Economic ‘Miracle’;5;17
There Is No Single, Best Policy for Drug Prices;7;15
These Silicon Valley Investors’ Bets May Pay Off;3;31
DealBook: Trump Says Business Leaders ‘Have No Choice’ but to Vote for Him;11;13
DealBook Briefing: A Tariff Pause, but the Reprieve May Be Temporary;8;14
DealBook Briefing: Beijing’s Plan to Get to a Trade Deal;9;13
The Highest-Paid C.E.O.s of 2018: A Year So Lucrative, We Had to Redraw Our Chart;5;24
Corrections: February 27, 2019;2;27
