Headline;Month;Day
Where the Thirst for Literature Meets the Thirst for Beer;1;5
A Taste of Home for California’s Punjabi Truck Drivers;8;26
What You Get for $1.2 Million;7;24
Trevor Noah Pokes at the Holes in Trump’s ‘Impenetrable’ Wall;11;5
China’s Voracious Appetite for Timber Stokes Fury in Russia and Beyond;4;9
The Billionaire’s Stadium Next Door;2;1
How Much Will the Trade War Cost You by the End of the Year?;9;1
News Quiz: Test Your Knowledge of the Week’s Headlines;6;28
How to Put Away Christmas Decorations So They’re in Great Shape for Next Year;12;27
Poachers Stockpile ‘Tiny and Cute’ Succulents Worth $600,000, Investigators Say;6;3
‘He’s a Good Man’: Jim Jordan Finds Support at Home in Ohio State Abuse Scandal;6;2
Stock Market Rallies, Showing Resilience of Consumers;8;21
Louis Vuitton Lands on the Lower East Side. (What, You Thought Upper?);7;16
Are African Artifacts Safer in Europe? Museum Conditions Revive Debate;9;4
Do Not Trust That Stranger’s 5-Star Review;5;25
Stewart O’Nan Returns to the Fictional Maxwell Family;5;2
When ‘Good Stories’ Happen for Bad Reasons;7;17
CES 2019: It’s the Year of Virtual Assistants and 5G ;1;9
How to Stop Package Thefts This Holiday Season;12;9
It Was in the Heavens and the Periodic Table;9;21
Jimmy Fallon Says the Government Shutdown Feels Like One Big Metaphor;1;11
Trump Says He’s Exploring ‘Various Tax Reductions,’ and the Economic Data He Loves Shows Why;8;20
Dallas Tornado Leaves Trail of Damage, Storm Causes Panic at Memphis Airport;10;21
For Holiday Ads, Nothing Says Tradition Like Cardi B’s Twerk Shop;11;24
How Did the Gettysburg Address End Up in Glenn Beck’s Office?;11;24
Walmart Says Tesla Solar Panels Set Fires Atop Stores;8;20
The Dim Sum Chef Who Plays With His Dough;9;17
The Primal Thrill of a Cherry Tomato;9;27
Hurricane Dorian in Pictures;8;30
In Barry Trotz, the Islanders Trust;4;7
That Ugly Fireplace Isn’t as Bad as You Think;12;10
What Billionaires Don’t Understand About College Debt;12;23
Feel Like You’re Being Stalked?;7;19
Every Building on Every Block: New York in the 1980s;4;19
A Tour of the Tour Buses;7;11
Hawthorne, N.Y.: A Neighborly Community With Strong Schools;11;13
Billionaire’s Letter to Elizabeth Warren Accuses Her of ‘Warping the Facts’ on the Wealthy;10;31
Parsippany-Troy Hills, N.J.: Away From the City, but Not Far;4;24
Tesla Looks to Regain Its Luster in Solar Energy by Slashing Prices;4;30
Getting the Garden Ready for Fall;9;20
Even in Strong Economy, Most Families Don’t Have Enough Emergency Savings;10;25
What Does ‘Black Friday’ Even Mean Anymore?;11;27
Traveling With Kids? Boy, Do We Have Some Tips for You;5;28
They Gave Me Oxy. I Didn’t Want It. Now What?;11;28
Big Business Is Overcharging You $5,000 a Year;11;10
Apple’s Plan to Buy $75 Billion of Its Stock Fuels Spending Debate;4;30
Ask Wirecutter: How Do I Keep the Gutters Clear of Ice and Leaves?;3;5
Do Hand Dryers Hurt Kids’ Hearing? This 13-Year-Old Studied It;7;1
California Endures More Blackouts, PG&E Tower Gets Scrutiny in Fire;10;24
Seduced by Singapore’s Charismatic Orchids;3;21
Wegmans Feels Like Family, Even if It Isn’t Mine;10;28
It’s Horses vs. Motors in Senegal. The Steeds Still Win on Many Roads.;9;10
Luke Combs and Miranda Lambert, Both Bound by Country’s Gendered Rule Book;11;6
How Much Do You Trust Online Reviews?;5;29
To Nurture Nature, Neglect Your Lawn;4;15
Disappearing New York, Captured in Vintage Photos;4;25
Make Shoes in U.S., or Pay Tariffs? A Footwear Company Seeks a Third Option;9;2
How to Raise a Child Without Imposing Gender;3;7
The N.B.A.’s Hot Stove Has Burned Down the League;6;21
The Life and Death of the Local Hardware Store;11;22
For One Los Angeles Artist, Cars Are Her Canvas and Rainbows Are Her Brush;6;21
Welcome to the K-12 Surveillance State;7;2
Dozens of Civilians Reported Killed in Afghan Commando Strike;9;23
6 Years After Hurricane Sandy, Here’s What They Came Up With: Really Big Sandbags;5;5
Our Lives in the Time of Extremely Fancy Axes;12;18
For Forecasters, Hurricane Dorian Has Already Been a Handful;8;31
As Big Retailers Seek to Cut Their Tax Bills, Towns Bear the Brunt;1;6
Your Uber Driver Is ‘Retired’? You Shouldn’t Be Surprised;10;25
A Game Plan for Eating Well in Atlanta;1;29
Louisiana Prepares for Tropical Storm Barry;7;12
‘They’re Playing Our Song,’ Over and Over and Over Again;5;28
On ‘S.N.L.,’ Trump, Mueller and Barr Interpret the Final Report Very Differently;3;31
A Couple Unwittingly Threw Away $20,000. The Dump Gave It Back.;12;31
Martha Stewart’s Right-Hand Man;4;16
Does This Red Cap Make Me Look MAGA?;7;20
The Battle to Make the Strand a Landmark Is About More Than a Building;1;30
Have We Hit Peak Podcast?;7;18
Women Becoming Marines: ‘I’ Will No Longer Be in Your Vocabulary;3;24
Beaumont, Calif.: Growing Fast, but Still a Bedroom Community;12;10
Where Libraries are the Tourist Attractions;8;10
Westport, Conn.: A Historic Town With a Global Mind-Set;9;4
The Best Black Friday Deals You Can Get Right Now;11;20
Where Even the Children Are Being Tracked;12;21
Uighur Noodles, Terrifically Chewy and Earthy, at Nurlan in Flushing, Queens;9;13
7 Simple Ways to Protect Your Digital Privacy;5;3
Anger at Big Tech Unites Noodle Pullers and Code Writers;6;10
Morehouse College Graduates’ Student Loans to Be Paid Off by Billionaire;5;19
Digital Jail: How Electronic Monitoring Drives Defendants Into Debt;7;3
‘The Institute’ Might Be Stephen King’s Scariest Novel Yet;9;10
Was de Blasio Too Quick to Call a Snow Day? Why It’s a Tricky Decision for Any Mayor;3;4
Looking for Frederick Douglass in Savannah;11;29
For the Teen Who No Longer Wants a Period ...;11;12
Reporting on the Retirees Making Migrants’ Journeys a Little Easier;5;29
Britain, Struggling With Brexit, Eyes Another Retreat. This One’s From Fossil Fuels.;10;3
How to Organize Your Kitchen Like a Professional Chef;4;3
DealBook Briefing: Debating the Economics of the Shutdown;1;25
When Brand Trump Met Brand Vuitton;10;18
Reading My Grandfather’s Accounts of World War II, 75 Years Later;7;12
Another Month, Another Neighborhood;3;18
Indonesia Has a Papua Problem;9;26
‘Such a Fun Age,’ by Kiley Reid: An Excerpt;12;31
In Praise of Pioneer Women and Rocket Scientists;3;19
Lambertville, N.J.: Vintage Charm and Free Spirits;10;2
Brutalism Springs Eternal in Morocco;10;1
When Detroit Was on Top of the Sports World;6;2
36 Hours in Boone, N.C. (and Environs);10;3
Gordon Sondland, Syracuse University, Grammys: Your Wednesday Briefing;11;20
He Captured a Clandestine Gay Culture Amid the Derelict Piers;9;19
Prime Anchor: An Amazon Warehouse Town Dreams of a Better Life;12;27
The Fury in France;12;10
Hudson Yards: A City Within a City;4;5
16,000 Readers Shared Their Experiences of Being Told to ‘Go Back.’ Here Are Some of Their Stories.;7;19
N.Y. Today: Why Did the Mayor Call a Snow Day?;3;5
Connecticut Has Among the Lowest Growth in the Nation. Can Links to Silicon Valley Help?;1;7
Turkish Forces Escalate Campaign in Syria Against Kurdish-Led Militia;10;10
Airstrike Kills Dozens of Migrants at Detention Center in Libya;7;3
36 Hours in Milan;5;9
What It’s Really Like to Eat Your Way Around the Globe;9;27
NATO, France, Global Heat: Your Thursday Briefing;12;5
From 1969 to 2019, a Day at The New York Times;2;28
The Disappearing Schools of Puerto Rico;9;12
These Jewish World War II Veterans Would Be Legends, if People Knew Their Stories;5;8
Strikes Against Macron’s Pension Plans Shut Down Much of France;12;5
Officials Called It a Heart Attack. Inmates Saw a Bloody Beating.;10;24
What Makes an American?;8;9
An Artist Rises, and Brings a Generation With Him;4;12
A Real-Life Fairy Tale That Crossed the Sea of Japan;3;1
Safe Deposit Boxes Aren’t Safe;7;19
Diamond Doris, the Bourbon King and Other Stars of True Crime;10;25
Ready, Set, Ski! In China, Snow Sports Are the Next Big Thing;11;27
Lawrence Ferlinghetti’s Enduring San Francisco;3;11
Scientists Are Giving Dead Brains New Life. What Could Go Wrong?;7;2
How Sovereign Citizens Helped Swindle $1 Billion From the Government They Disavow;3;29
How to Stay Cool During Europe’s Heat Wave;7;25
Prime Mover: How Amazon Wove Itself Into the Life of an American City;11;30
A Gun Killed My Son. So Why Do I Want to Own One?;6;1
The Jungle Prince of Delhi;11;22
Can China Turn the Middle of Nowhere Into the Center of the World Economy?;1;30
Will Brexit Bring the Troubles Back to Northern Ireland?;12;30
Maintaining Light Bulb Standards;4;28
What It’s Like to Attend Political Rallies;7;5
