Headline;Month;Day
Cristine Mayer, Keith Timko;4;14
Le Fooding Announces List of Best Bistros in Four Cities;11;25
Always Removes Female Symbol From Sanitary Pads;10;22
An Age-Appropriate Place Downtown;2;18
Trump Administration Warns Venezuela Not to Arrest Opposition Leader;3;14
Hollywood’s 2 Biggest Public Relations Firms to Merge;7;30
Capital One Breach Shows a Bank Hacker Needs Just One Gap to Wreak Havoc;7;30
Electric Lemon Opens in the Equinox Hotel;7;30
Instagram Wants to Be Your Mall;3;19
Zone 1 or Group E? Making Sense of the New Boarding Rules;4;12
U.S.-China Trade Talks Face Big Obstacle: Ensuring That Promises Are Kept;2;12
Korean Barbecue in an Elegant Space, at Hyun;9;24
Fed Chair Raises ‘Serious Concerns’ About Facebook’s Cryptocurrency Project;7;10
Google Makes a Bid for Banking, Where Tech Firms Go to Stumble;11;13
PayPal Pulls Out of Libra, Facebook’s Cryptocurrency Project;10;4
How to Pack Your Wallet for a Trip to Europe;10;22
Zuckerberg to Admit That Facebook Has Trust Issues;10;22
The Rise of Halal Tourism;1;18
Trump to Strip India of Special Tariff Status, Escalating Trade Tensions;3;5
Renting Cars With a Debit Card Is Made Easier at Dollar and Thrifty;2;8
The Week in Tech: Facebook Romance Scams and Banking Hacks;8;2
Amazon Users in India Will Get Less Choice and Pay More Under New Selling Rules;1;30
Dear Walmart C.E.O.: You Have the Power to Curb Gun Violence. Do It.;8;5
The Plan to Shut Down Gifted Programs, Explained;8;28
Your Mesopotamian Credit Card Is No Good Here;7;22
Are Budget Airlines Really Worth It?;5;2
Facebook’s Digital Money Could Mean Fabulous Wealth. Or Not.;7;12
Cryptocurrencies Pose National Security Threat, Mnuchin Says;7;15
Facebook Lays On the Charm for Its Libra Cryptocurrency Plan;10;21
Barely Drawing a Whisper Where Hockey Is the Talk of the Town;2;14
Facebook’s Zuckerberg, Accused of Lying, Withstands a Washington ‘Beating’;10;23
The Week in Tech: Facebook’s Crypto Dream Faces Deep Mistrust;6;21
Facebook Plans Global Financial System Based on Cryptocurrency;6;18
It’s the Anniversary of Everything!;8;2
Build an Online Presence Without Giving Up Privacy;9;3
Modi Cut India’s Red Tape. Now He Hopes to Win Votes for His Work.;5;14
When License-Plate Surveillance Goes Horribly Wrong;4;23
Edgemont, N.Y.: Strong Schools and Aspirations of Autonomy;8;28
Apple Gives Way to Pressure From Beijing;10;10
DealBook Briefing: How a Recession Could Hit This Year;8;19
The Ultimate Video Art Retreat;3;7
Can We Trust Facebook to Run a Bank?;10;24
DealBook Briefing: ‘Forecasting a Slowdown’ for 2019;1;15
DealBook Briefing: China vs. U.S. Could Be a Long, Slow Grind;8;7
WeWork Has to Pick Its Bailout;10;14
DealBook Briefing: Could This Weekend Bring Relief to the Global Economy?;8;23
DealBook Briefing: Is It Time to Worry About Oil Again?;6;14
Blocked in Business, South Korean Women Start Their Own;8;29
DealBook Briefing: Tesla Is Raising Cash. It May Not Be Enough.;5;3
WeWork’s Lifeline Could Wipe $39 Billion Off Its Valuation;10;22
Investors Get Excited Over the Brexit Deal;10;17
DealBook Briefing: A Rival Makes a Bid for Gannett;1;14
This Week’s Wedding Announcements;4;14
The Highest-Paid C.E.O.s of 2018: A Year So Lucrative, We Had to Redraw Our Chart;5;24
