Headline;Month;Day
Drug Makers Try to Justify Prescription Prices to Senators at Hearing;2;26
Nazeela Nasseri, Danyal Farooqi;7;7
Trump Administration Scaling Back Rules Meant to Stop Corporate Inversions;10;31
Should Adults Get a Measles Booster Shot?;4;30
Jenna Gilligan, Michael Spencer;6;9
Botox Maker Allergan Is Sold to AbbVie in $63 Billion Deal;6;25
Court Rejects Trump’s Cuts in Payments for Prescription Drugs;1;8
How Companies Learned to Stop Fearing Trump’s Twitter Wrath;3;20
DealBook Briefing: Don’t Bet on the Trade War Ending Quickly;7;29
What Is JAB? Owner of Panera, Snapple and Krispy Kreme Faces Its Nazi Past;6;14
Drug Prices on TV? They May Be Coming.;3;23
Bayer and Johnson & Johnson Settle Lawsuits Over Xarelto, a Blood Thinner, for $775 Million;3;25
Trevor Noah Has Some Advice for Jussie Smollett;2;22
Drugmaker Deals Are Near Record Pace in 2019, but Investors Don’t Love Them All;6;27
Carol F. Reich, Charter School Innovator, Is Dead at 83;2;13
Charles Santore Dies at 84, Illustrated Classic Children’s Books;8;23
Drug Prices Will Soon Appear in Many TV Ads;5;8
How to Dislodge the Brute in the White House;11;16
Study Examines Why Black Americans Remain Scarce in Executive Suites;12;9
Trump Officials Move to Lower Drug Prices by Passing On Rebates to Patients;2;1
DealBook Briefing: Why Wall Street Likes Mayor Pete (and Harris and Biden);6;17
Millions Take Gabapentin for Pain. But There’s Scant Evidence It Works.;5;20
An Alzheimer’s Drug Trial Gave Me Hope, and Then It Ended;3;22
California Adds Its Clout to States Battling High Drug Prices;1;11
The Global Con Hidden in Trump’s Tax Reform Law, Revealed;2;6
When It’s Right, It’s Right;11;6
Depo-Provera, an Injectable Contraceptive, Does Not Raise H.I.V. Risk;6;13
Lester Wunderman, Father of Direct Marketing, Dies at 98;1;14
Trump’s Efforts to Rein In Drug Prices Face Setbacks;7;11
The Next Wave of ‘Unicorn’ Start-Ups;2;10
Sound, Fury and Prescription Drugs;7;6
Gilroy Garlic Festival, John Ratcliffe, Hong Kong: Your Monday Briefing;7;29
2020 Democrats Love Small Donors. But Some Really Love Big Donors, Too.;3;30
Labor Unions Team Up With Drug Makers to Defeat Drug-Price Proposals;12;3
DealBook Briefing: Sidestepping the Huawei Ban;6;26
Drug Sites Upend Doctor-Patient Relations: ‘It’s Restaurant-Menu Medicine’;4;2
DealBook Briefing: A Moment of Truth for a Trade Deal;6;28
The Christian Case for Marijuana;6;20
The Fake Meat War;7;25
DealBook Special: Wall Street’s Unexpectedly Hot First Half of 2019;6;30
Mark Zuckerberg Sticks to His Guns on Political Speech;10;18
DealBook: Google’s Founders to Step Aside, Ending an Era;12;4
DealBook Briefing: Say Hello to the E.C.B.’s New Chief, Christine Lagarde;7;3
At Trump’s Inauguration, $10,000 for Makeup and Lots of Room Service;1;15
The $6 Million Drug Claim;8;26
Warning of ‘Pig Zero’: One Drugmaker’s Push to Sell More Antibiotics;6;7
How Big Companies Won New Tax Breaks From the Trump Administration;12;30
How Big Business Is Hedging Against the Apocalypse;4;11
Where Would You Draw the Line?;4;11
This Week’s Wedding Announcements;7;7
The Highest-Paid C.E.O.s of 2018: A Year So Lucrative, We Had to Redraw Our Chart;5;24
This Week’s Wedding Announcements;6;9
New York’s Fight Against AIDS;10;13
