Headline;Month;Day
‘Medicare for All’ Could Kill Two Million Jobs, and That’s O.K.;5;16
Chinese Money in the U.S. Dries Up as Trade War Drags On;7;21
How Trump’s Latest Plan to Cut Drug Prices Will Affect You;2;5
High Medical Bills Are at Center of Hospital Group’s Trial;10;3
Hospitals Stand to Lose Billions Under ‘Medicare for All’;4;21
Medicare for All Would Abolish Private Insurance. ‘There’s No Precedent in American History.’;3;23
DealBook Briefing: The Stock Market Hit a Record. Thank the Fed.;6;21
DealBook Briefing: ‘Forecasting a Slowdown’ for 2019;1;15
DealBook Briefing: Chinese Investment in the U.S. Drops 90%;7;22
DealBook Briefing: Apple and Qualcomm Kiss and Make Up;4;17
This Week’s Wedding Announcements;8;18
The Highest-Paid C.E.O.s of 2018: A Year So Lucrative, We Had to Redraw Our Chart;5;24
