Headline;Month;Day
The Week in Business: Walmart Takes a Stand on Gun Control, and Brexit Goes Off the Rails;9;8
Making Companies Act When Government Won’t;9;16
Walmart’s C.E.O. Steps Into the Gun Debate. Other C.E.O.s Should Follow.;9;3
Walmart to Limit Ammunition Sales and Discourage ‘Open Carry’ of Guns in Stores;9;3
Maybe We’re Not All Going to Be Gig Economy Workers After All;9;15
Retailers Walk Thin Line by Asking, Not Telling, Shoppers Not to Carry Guns;9;10
More Retail Chains Ask Customers Not to Carry Guns Openly;9;6
Walmart Says Tesla Solar Panels Set Fires Atop Stores;8;20
Walmart to Overhaul and Reopen El Paso Store Where 22 People Were Killed;8;23
Expressing Opinions;9;6
Debt-Free College is Closer Than You Think;8;30
Four Democratic Candidates Call on Walmart to Stop Selling Guns;8;9
Walmart Pulls Violent Video Game Signs;8;9
Scare at Missouri Walmart as Man With Rifle and Body Armor Is Detained;8;9
Armed Man Who Caused Panic at Missouri Walmart Said It Was 2nd Amendment Test, Authorities Say;8;10
Walmart Shooting in El Paso Renews Attention on Crime Frequency at Its Stores;8;6
DealBook Briefing: How Walmart Could Take a Stand on Guns;8;6
Shooting at Walmart in Mississippi Kills 2;7;30
At the Walmart in El Paso, Serving Shoppers Meant Saving Them;8;8
El Paso Reels After Walmart Shooting Leaves 20 Dead;8;3
Dear Walmart C.E.O.: You Have the Power to Curb Gun Violence. Do It.;8;5
Massacre at a Crowded Walmart in Texas Leaves 20 Dead;8;4
Walmart Store Connected Cultures, Until a Killer ‘Came Here for Us’;8;5
In Delaying Tariffs, Trump Faces Up to Economic Reality;8;14
‘I’m the Shooter’: El Paso Suspect Confessed to Targeting Mexicans, Police Say;8;9
What Experts Know About People Who Commit Mass Shootings;8;5
The Man Who’s Putting More Sex Toys on Walmart’s Shelves;7;3
El Paso Shooting Victims: Here Are Some of Their Stories;8;5
How Many Mass Shootings in 2019? Last Weekend Underscored the Violence;8;4
A ‘Sorceress’ in Brazil, a ‘Wink’ in India: Walmart Pleads Guilty After a Decade of Bribes;6;20
3,271 Pill Bottles, a Town of 2,831: Court Filings Say Corporations Fed Opioid Epidemic;7;19
The Best Walmart Deals for Cyber Monday;11;25
Walmart Raises Minimum Age to Buy Tobacco Products to 21;5;8
The Week in Business: Amazon Won’t Let the Robots Take Over;7;13
Walmart Vendor’s Employees Face F.B.I. Inquiry for Snooping on Retailer’s Internal Emails;3;9
Quotation of the Day: Sex Sells. Walmart Buys In.;7;5
DealBook Briefing: Walmart’s C.E.O. Sets an Example for Corporate America on Guns;9;4
The Best Anti Prime Day Deals at Best Buy, Walmart, and More;7;11
Hurricane Dorian, Walmart, Linda Hamilton: Your Tuesday Evening Briefing;9;3
The Week in Business: No More E-Cigarettes at Walmart, and an Attack on the World’s Oil Supply;9;22
Kudos to Walmart on Guns;9;4
Amazon Gives Up on Chinese Domestic Shopping Business;4;18
Amazon Users in India Will Get Less Choice and Pay More Under New Selling Rules;1;30
FedEx Says It’s Ending Express Shipping Service for Amazon;6;7
Capturing a Shooting Survivor’s Long Recovery, With Humanity;11;28
Families of El Paso Victims Waited in Anguish After Shooting;8;5
Mnuchin Presses Companies for Trade War Contingency Plans;5;22
A Stark Divide in America’s Retail Industry Is Coming Into Focus;3;6
Nothing Says Christmas Like … a KFC Fried-Chicken Fire?;12;6
Day at a Shopping Center in Texas Turns Deadly;8;3
An Empty Parking Lot, Filled by El Paso’s Grief;8;9
I Felt Safe in America. Until El Paso.;8;10
700,000 Rocking Baby Sleepers Are Recalled After 5 Infant Deaths;4;27
El Paso Shooting Suspect Indicted on Capital Murder Charge;9;12
Blue Bell Ice Cream Licker in Viral Video Is Found, Police Say;7;6
The Week in Business: Trump’s Money Man Talks, and a New Spacecraft Blasts Off;3;2
FedEx Ends Amazon’s U.S. Ground Deliveries as Retailer Rises as Rival;8;7
Morgan Fancher, Owen Morris;9;22
‘Catastrophic,’ ‘Cataclysmic’: Trump’s Tariff Threat Has Retailers Sounding Alarm;6;16
As Big Retailers Seek to Cut Their Tax Bills, Towns Bear the Brunt;1;6
F.B.I. Increases Reward in Series of Unsolved Church Arsons in El Paso;9;23
‘Cut the Wire,’ a Toy Bomb Game, Is Discontinued After Criticism;1;14
Trump Comes to Console. El Paso Says No Thanks.;8;8
Modern Black Friday Work Force: Postal Clerk, Influencer, Robot;11;28
How Does It Feel to Be Impeached? These Mayors Can Tell You All About It.;10;4
‘My World Has Now Stopped’: How One Family Is Recovering From a Mass Shooting;8;31
Prosecutors Re-examine Killing After Missouri Deputy Is Charged in Another Shooting;10;14
Amazon Prime Day Brings Sales, and Risks, for Retailers;7;15
88 Days of Recovery: How a Girls’ Soccer Team Healed a Broken Coach;11;20
DealBook Briefing: The Stock Market Hit a Record. Thank the Fed.;6;21
El Paso Shooting: Massacre That Killed 20 Being Investigated as Domestic Terrorism;8;4
Dorian, Brexit, Ariana Grande: Your Wednesday Briefing;9;4
Iran, N.B.A. Draft, ‘Toy Story’: Your Friday Briefing;6;21
Should Kids Be Social Media Influencers?;3;8
Schumer and Sanders: Limit Corporate Stock Buybacks;2;4
Partisans Dig In as Executives Call for Action on Guns;9;12
Popular YouTube Toy Review Channel Accused of Blurring Lines for Ads;9;4
After El Paso Attack, Mexico Demands Protections for Mexicans in the U.S.;8;4
Inside China’s Push to Turn Muslim Minorities Into an Army of Workers;12;30
Beto O’Rourke Urges Banks to Cut Services for Gun Sales;9;12
Why Wendy’s Is Facing Campus Protests (It’s About the Tomatoes);3;7
Shopping Tips to Get the Most Out of Cyber Week;11;1
The Aftermath of Shootings in Ohio and Texas;8;5
53 People Died in Mass Shootings in August Alone in the U.S.;9;1
Trump’s Rhetoric and Conservative Denial;8;8
What American C.E.O.s Are Worried About;8;21
On Politics: A Busy Weekend in Iowa;8;12
Tesla Batteries Investigated for Possible Defects;11;2
Michael Cohen Acknowledges Payments for Poll Rigging;1;17
El Paso Suspect Ordered Gun and Moved Out in Weeks Before Attack;8;8
In a Suffering City, an El Paso Priest Needed a Message of Hope;8;11
Top Officials Resign From Southwest Key, Shelter Provider for Migrant Children;3;11
Rethinking Counterterrorism;9;24
A Milk Giant Goes Broke as Americans Reject Old Staples;11;13
In El Paso, Hundreds Show Up to Mourn a Woman They Didn’t Know;8;17
This Is a Warning About the 2 Sides of White Nationalism;8;5
‘It Feels Like Being Hunted’: Latinos Across U.S. in Fear After El Paso Massacre;8;6
Back-to-Back Outbreaks of Gun Violence in El Paso and Dayton Stun Country;8;4
Gunman’s Own Sister Was Among Dayton Shooting Victims;8;4
Zantac Recall Widens as Sanofi Pulls Its Drug Over Carcinogen Fears;10;18
Casper Mattress Review: An Honest Assessment;9;13
Here’s the First Real Discount on the Latest Apple Watch;5;3
The Beauty of Being Bilingual;9;20
His Only Relative Was Killed in the El Paso Massacre. He Has Invited the City to Her Funeral.;8;14
Trump to Nominate Eugene Scalia for Labor Secretary Job;7;18
Nick Cave Photographs Two Colorful Days in His Life;10;16
News Quiz: Test Your Knowledge of the Week’s Headlines;8;9
Johnson & Johnson Says Recalled Baby Powder Doesn’t Have Asbestos;10;29
$400 Million Bet on DoorDash Heats Up Delivery Wars;2;22
On Politics: The Would-Be Trump Candidate;9;4
J. Cole’s ‘Dreamers’ Finally Reaches No. 1;7;15
11 of Our Best Weekend Reads;12;27
How a City Fought Runaway Capitalism and Won;11;15
Minutes Before El Paso Killing, Hate-Filled Manifesto Appears Online;8;4
Impeachment, Chicago, Halloween: Your Thursday Evening Briefing;10;31
‘Avengers: Endgame’ Muscles Out Competition to Maintain Box Office Lead;5;5
Amazon Is Closing Pop-Up Stores, as Its Retail Strategy Evolves;3;6
It’s Back: 8chan Returns Online;11;4
Trump’s Pick for No. 3 Post at Justice Dept. Withdraws From Consideration;3;28
Duncan Hunter Will Plead Guilty to Misuse of Campaign Funds;12;2
It’s Not Worth Camping Out in Front of Stores on Black Friday;11;18
On Politics: Trump Ousts Pollsters;6;17
F.D.A. Criticizes Walgreens and Other Retailers for Selling Tobacco Products to Minors;3;4
Uber Acquires Cornershop, a Grocery Delivery Start-Up;10;11
On Politics: Trump’s Words Are Scrutinized by Candidates in Wake of Shootings;8;5
11 of Our Best Weekend Reads;11;22
The Best Deals for Good Dogs We’ve Seen This Week (So Far);10;29
Why Was Johnson & Johnson the Only Opioid Maker on Trial in Oklahoma?;8;26
Sears Won’t Close Yet as Its Chairman, Edward Lampert, Fends Off Creditors;1;16
New Mexico’s Oil Boom: Bounty for One of the Country’s Poorest States;10;27
Online and Making Thousands, at Age 4: Meet the Kidfluencers;3;1
Stock Market, Shootings, Kashmir: Your Monday Evening Briefing;8;5
11 of Our Best Weekend Reads;11;1
Man Hurt in Florida Mall Panic, but No Sign of Shooting, Police Say;10;13
Zantac Pulled From Shelves by Walgreens, Rite Aid and CVS Over Carcinogen Fears;9;30
Colt to Suspend Production of AR-15 Rifles for Consumers;9;19
F.B.I. Opens Domestic Terrorism Investigation Into Gilroy Shooting;8;6
Willy Chavarria’s House Music;7;25
When Santa Goes on Vacation;7;3
A Charred Gas Can, a Receipt and an Arrest in Fires of 3 Black Churches;4;11
Toys ‘R’ Us Tries to Rise From the Ashes. Wary Partners Try Not to Get Burned.;2;15
DealBook Briefing: The Big Problems Facing the Trade Talks;2;20
With Harrowing Ads, Gun Safety Groups Push a Scarier Reality;9;18
DealBook Briefing: Why WeWork’s I.P.O. Struggles Could Hurt;9;6
San Francisco Declares the N.R.A. a ‘Domestic Terrorist Organization’;9;5
Shaving Start-Up Harry’s Will Be Sold to Owner of Schick for $1.37 Billion;5;9
Movie Studio Cancels Release of ‘The Hunt’: ‘Now Is Not the Right Time’;8;10
Can a Coal Town Reinvent Itself?;12;6
Dick’s Sporting Goods Destroyed $5 Million Worth of Guns;10;8
Kohl’s Is Betting on Amazon Returns to Drive Sales;7;8
Man Accused of Burning Louisiana Churches Is Charged With Hate Crimes;6;12
El Paso, Two Weeks Later;8;19
Shareholder Value Is No Longer Everything, Top C.E.O.s Say;8;19
Was Trump’s El Paso Visit a Turning Point?;8;8
‘Simply Unacceptable’: Executives Demand Senate Action on Gun Violence;9;12
Those Silly Chairs You Keep Seeing in the Park? They’re Lamzacs;6;4
Toys, Phones and Sneakers: The Chinese Goods Trump Wants to Tax Next;5;13
White House to Unveil a Global Women’s Empowerment Initiative, Led by Ivanka Trump;2;7
Inside a Deadly American Summer;9;21
Wall Street Slides on Heightened Anxiety Over the Trade War;8;12
Rite Aid to Stop Selling E-Cigarettes, Citing Surge in Young Users;4;12
Trump Administration Strips India of Special Trade Status;6;1
Trump Honors Police Officers and Civilians in El Paso and Dayton Shootings;9;9
Jones Day Law Firm Is Sued for Pregnancy and Gender Discrimination by 6 Women;4;3
The Shock Over Casio’s New G-Shock;3;20
Texas Shooting Leaves 7 Dead and At Least 21 Injured Near Odessa;8;31
They Died Shielding Their Baby in El Paso. Their Family’s Anguish Was Only Beginning.;8;12
Amazon Wants to Rule the Grocery Aisles, and Not Just at Whole Foods;7;28
Chasing Amazon, Retailers Are in a Never-Ending Arms Race;11;25
Beto O’Rourke: Who He Is and What He Stands For;9;10
Man Arrested With 17 Guns, Grenade Launcher and Nazi Paraphernalia;8;20
Joe Biden Says ‘Poor Kids’ Are Just as Bright as ‘White Kids’;8;9
Neil deGrasse Tyson’s Tweet on Mass Shooting Deaths Strikes a Nerve;8;5
Stock Market Rallies, Showing Resilience of Consumers;8;21
Toledo? Trump Misstates Location of Ohio Massacre;8;5
Kenneth Lerer Steps Down as BuzzFeed Chairman;6;25
Dressbarn Closing All 650 Stores;5;21
Fortnite’s Bugha Targeted in ‘Swatting’ Hoax;8;13
ABC Tells Democrats to Keep Debate Clean. Looking at You, Beto.;9;12
Clown Giving Kids Candy From Car Meant Well, Police Tell a Relieved Town;5;10
Amazon Turns to More Free Grocery Delivery to Lift Food Sales;10;29
Lord & Taylor Will Be Sold to Le Tote, a Clothing Rental Start-Up;8;28
The Week in Business: Oil Tankers Are Under Attack, and the Grocery-Delivery Battle Heats Up;6;15
Opioid Defendants Seek to Disqualify Judge Overseeing 2,300 Cases;9;14
‘Amor Eterno’ Rings Out at Mass Shooting Vigils;8;6
Mother of Children Found Hanging in Basement Is Charged With Murder;12;3
F.B.I. Arrests U.S. Soldier Who Discussed Bomb Plot, Authorities Say;9;23
New Hampshire Couple’s Adventure Ends in Mysterious Death in Texas;11;5
Amazon and New York Unions Had ‘Productive Meeting,’ Then Came a Shock;2;15
Celery Is Ready for a Starring Role;11;19
Weekly News Quiz For Students: Hurricane Dorian, Brexit, U.S. Open;9;10
A Summer Rite Canceled by a New Reality: Fear;9;2
Shooting at Festival in California Kills at Least 3;7;29
In Aftermath of El Paso Attack, a Reckoning on Texas’s Divisive Political Rhetoric;8;24
Trump Uses a Day of Healing to Deepen the Nation’s Divisions;8;7
Why the ‘Joker’ Movie Was a Risk Warner Bros. Wanted to Take;10;3
‘I’m Sick of Seeing My Face,’ Says the Internet’s Kombucha Connoisseur;8;20
A Pregnancy Scandal;10;10
Prime Power: How Amazon Squeezes the Businesses Behind Its Store;12;19
What We Know About the Canadian Teenage Fugitives Suspected in Three Murders;7;24
At Rally for Jazmine Barnes, an Outpouring of Grief and a Plea for Answers;1;6
F.B.I. Learned of Gunman’s Hatred of Women Months Before Attack at Yoga Studio;2;13
5 Things to Avoid on Black Friday;11;20
The Price for ‘Predatory’ Publishing? $50 Million;4;3
The El Paso Shooting Is the Violence Latinos Have Been Dreading;8;6
Letter of Recommendation: Rides to the Airport;1;15
‘Reprisal’ Review: A Femme Fatale on the Midnight Train to Revenge;12;6
Police Investigating Drive-By Shooting of Jazmine Barnes Seek Public’s Help;1;2
12 Things to Know About Ohio Before 12 Candidates Debate There;10;15
Stephen Colbert Makes Fun of Joe Biden After Misconduct Claim;4;2
Valeria Luiselli Traces the Youngest Casualties of the Border Crisis;3;6
Dear C.E.O.: Before You Give to Charity, Look at Your Own Workplace;12;24
How to Torture Trump;8;14
Investors Use Indexes to Play in the Video Game Business;7;12
Elizabeth Warren’s Radical Plan to Fix the Dollar;6;16
Max Azria, Designer Who Sold Couture for Less, Has Died;5;8
How the Insufferably Woke Help Trump;11;8
John Lithgow: Trump Is a Bad President. He’s an Even Worse Entertainer.;10;16
Vaping-Related Illnesses Climb to 805, C.D.C. Says;9;26
Man Who Claimed Trump Would Start a ‘Racial War and Crusade’ Is Arrested;8;20
Trump Finds a Brawler for His War on Workers;8;10
Why Mass Murderers May Not Be Very Different From You or Me;8;8
The Virtuous Corporation Is Not an Oxymoron;9;23
Letter of Recommendation: Stick-and-Poke Tattoos;6;18
British Panel Calls for Stricter Antitrust Rules on Tech Giants;3;13
8 Wellness Products to Add to Your Bridal Survival Kit;1;30
The Impossible Alchemy of Barneys at Saks;11;9
Eugene Scalia Confirmed by Senate as Labor Secretary;9;26
‘Had I Catfished My Wife?’: A Debut Midlife-Crisis Memoir;6;30
How to Stop Package Thefts This Holiday Season;12;9
Trump to Strip India of Special Tariff Status, Escalating Trade Tensions;3;5
5 Things to Avoid on Black Friday;11;20
Beetlejuices, Beetlejuices, Beetlejuices, All Over Broadway;10;30
Lil Nas X’s ‘Old Town Road’ Breaks Billboard’s Singles Record;7;29
Letter of Recommendation: Cheap Sushi;12;17
Juul Is Sued by School Districts That Say Vaping Is a Dangerous Drain on Their Resources;10;7
Families of Aurora Shooting Victims Express Concern About ‘Joker’;9;24
Amazon’s Sales Growth Slows, Even as Cloud Business Stays Hot;2;1
West Texas Shooting Spree Terrorized Two Towns and Killed 7;9;1
DealBook Briefing: The Huawei Backlash Goes Global;5;23
A European Tech Giant Is Born, Spun Off From a South African Firm;9;11
Terror on Both Sides of the Rio Grande;9;2
El Paso Was a Massacre Foretold;8;10
How I Found Out Nicky Barnes Was Dead;6;14
How Trump Has Hurt the Gun Lobby;2;12
Juul Suspends Online Sales of Flavored E-Cigarettes;10;17
What Is the Great Replacement?;8;6
Trump Is a White Nationalist Who Inspires Terrorism;8;5
Teenage Murder Suspects Vanish Into Canada’s Wilderness;7;28
Amazon Expanding One-Day Prime Shipping as Sales Growth Slows;4;25
Hollywood’s Obsession With Cartels ;1;5
C.E.O.s Should Fear a Recession. It Could Mean Revolution.;8;21
Tucker Carlson’s Fox News Show Loses More Advertisers;8;20
Where Floods of ‘Biblical Proportion’ Drowned Towns and Farms;7;30
What’s First on the Wedding Planner? The Dentist for Some;5;21
The Week in Business: The Truth About Drug Costs, and Uber’s Disappointing I.P.O.;5;11
$3,000 to Rent a Movie? Bringing the Theater Home for the 1 Percent;4;7
Defying N.R.A., Texas Lieutenant Governor Favors Background Checks on Private Gun Sales;9;7
13 Black Friday Mega-Discounts of 50% or More;11;28
Climate Protests, Whistle-Blower, Area 51: Your Friday Evening Briefing;9;20
‘The Public Needed to See This’: Revisiting New York’s Latinx Music History;8;9
Elizabeth Warren Sticks Her Message in Big Tech’s Face;6;3
Climate Protests, Whistle-Blower, Area 51: Your Friday Evening Briefing;9;20
You’ve Got Something on Your Teeth;2;19
A Twist in the Jazmine Barnes Case as a Suspect Is Charged With Capital Murder;1;6
How to Make Hearing Aids as Cool as Glasses;10;1
For Tech, We’re the Gift That Keeps on Giving. But We Get Prime!;7;29
Fed Officials Sound an Alarm, Worrying Weak Inflation Could Last;5;16
An Inmate’s Death in Jail and a Journalist’s Search for Why;2;1
How Shareholder Democracy Failed the People;8;20
J.D. Scholten Almost Beat Steve King in 2018. Now He’s Running Again.;8;5
DealBook Briefing: Jeffrey Epstein’s Finances Are Under the Microscope After His Death;8;12
Opioid Settlement Talks Stumble With Trial Set for Monday;10;18
Ilhan Omar: It Is Not Enough to Condemn Trump’s Racism;7;25
Long-Distance Romance? Get on the Love Bus;2;13
‘I Am Fearless Again’: New Veterans’ Group Gives Women a Sense of Belonging;10;2
How to Prepare for Amazon Prime Day;6;25
Modi’s Problems at Home Overshadow Trump’s Latest Trade Threat to India;6;1
Boeing Taps David Calhoun as C.E.O. to Stem 737 Max Crisis;12;23
Trump Echoes ‘Fox & Friends’ on Shootings. The New York Post Dissents.;8;5
Iran, Heat Wave, Robert Mueller: Your Weekend Briefing;7;21
$15 an Hour? New Jersey Minimum-Wage Workers Say It’s About Time;1;23
His Victim Forgave Him Years Ago. Now the State Has, Too.;11;6
Trump’s 5G Plan Is More Than a Gift to His Base;3;6
Joseph Segel, Founder of the QVC Shopping Network, Dies at 88;12;25
Why I Left ‘Knives Out’ With Emotional Whiplash;11;27
Smith & Wesson’s Owner to Break Away From Gun Business;11;14
India Annexes Kashmir and Brings Us Back to Partition;8;7
Inquiry Into Migrant Shelters Poses Dilemma: What Happens to the Children?;1;5
My Family Cared for My Sick Aunt. Who’s Caring for Us?;10;25
Scammers Look for Vulnerability, and Find It in Older People;9;12
How El Chapo Escaped in a Sewer, Naked With His Mistress;1;18
When Hate Came to El Paso;8;4
His Job: Running Shelters for Young Migrants. His Pay: $3.6 Million.;7;15
Bernie Sanders Raises $18 Million in 3 Months, Trailing Buttigieg;7;2
The Post-Brexit Food Chain: ‘This Is Really, Really Scary’;1;30
The C.E.O. Taking On the Gun Lobby;10;25
With Rise of Far-Right Extremists, N.Y.P.D. Creates Special Unit;12;11
Massachusetts Orders 4-Month Ban on Sale of All Vaping Products;9;24
There’s No Second Amendment Right to Large-Capacity Magazines;8;5
And the Bride Wore, Um, Nothing (the Groom, Too);2;13
El Paso, 2020, Trade: Your Weekend Briefing;8;4
Don’t Think Sanders Can Win? You Don’t Understand His Campaign;12;10
Black Friday Sales Our Readers Asked Us to Find;11;28
A Racist Book’s Malign and Lingering Influence;11;22
Mike Pompeo, Hong Kong, Iran: Your Monday Evening Briefing;11;18
The Great Fortune of Ordinary Sadness;8;29
What It’s Like to Live in Your Car;7;31
We Tried the Gillette Heated Razor. It’s Not So Hot.;7;5
Why an Assault Weapons Ban Hits Such a Nerve With Many Conservatives;9;18
Trump’s Trip to Dayton and El Paso: The Back Story;8;10
Why a Border Wall Could Mean Trouble for Wildlife;1;24
Lafayette, La., Plane Crash Kills 5, Including Relative of an L.S.U. Football Coach;12;28
You See Pepsi, I See Coke: New Tricks for Product Placement;12;20
Estate Tax Can Pay Off for States, Even if the Superrich Flee;10;20
How Well Off Is Ohio, Site of Democratic Debate? It’s Debatable;10;12
E-Commerce Promised the World. Are We Happy With Our Purchase?;8;10
Gordon Sondland, Debate, Google: Your Wednesday Evening Briefing;11;20
Stocks Whipsaw as Traders Face Conflicting Trade War Signals;8;15
The Paparazzi Staked Outside Ivanka Trump and Jared Kushner’s D.C. Home;6;1
In the Decade Since Madoff, Ponzi Schemers Try New Tactics;9;23
Tucker Carlson of Fox Falsely Calls White Supremacy a ‘Hoax’;8;8
What Could a Domestic Terrorism Law Do?;8;7
Amazon’s Latest Experiment: Retraining Its Work Force;7;11
6.4-Magnitude Earthquake and Swarm of Aftershocks Rattle Southern California;7;4
You Accomplished Something Great. So Now What?;5;29
‘How Could We Not Know?’ Kidnapping Suspect Hid in Plain Sight;1;17
The Wirecutter 2019 Year in Review;12;30
Nancy Pelosi’s Political Flex;1;17
From Zero to 4, Before the End of the Driveway;12;16
Why Buy That Expensive Tent When You Can Rent?;9;13
She Entered the U.S. Illegally as a Child. She Was Stabbed Nearly to Death After Being Deported.;5;2
What Democrats Need to Know to Win in Rural America;3;17
White Extremism Faces a Subversive Foe Online: Google Ads;12;30
With Crowdfunding, Game Inventors Advance to Go;9;2
Managing Fear After Mass Violence;8;6
9 Cyber Week Deals That Are Still Kicking;12;3
Trump Accuses Jewish Democrats of ‘Great Disloyalty’;8;21
Trump’s Case for China Tariffs Fails to Persuade Americans;6;28
The Fight to Be a Middle-Aged Female News Anchor;3;11
BuzzFeed Plans Layoffs as It Aims to Turn Profit;1;23
The Year Women Got ‘Horny’;12;13
Bezos and Zuckerberg Take Their Pitches to Washington;9;19
Brexit, Hong Kong, ‘Friends’: Your Friday Briefing;9;5
Beto O’Rourke’s New Approach to 2020: ‘Taking the Fight to Donald Trump’;8;15
Shut Out by Shoe Giants, ‘Mom and Pop’ Stores Feel Pinched;6;18
Iran Declares Protests Are Over, but the Evidence Suggests Otherwise;11;21
U.S. Delays Some China Tariffs Until Stores Stock Up for Holidays;8;13
Income Before: $18,000. After: $85,000. Does Tiny Nonprofit Hold a Key to the Middle Class?;3;15
The Accidental Celebrities of the Impeachment Inquiry;12;6
Video Games Aren’t Why Shootings Happen. Politicians Still Blame Them.;8;5
Trump and Xi Will Meet at G-20 Amid Stalled Trade Talks;6;18
Jayme Closs, Kidnapped by a Stranger, Endured Horror, Police Say;1;14
Goodbye Barneys, Hello Cheap Luxury Handbags for Christmas;10;30
Your Wednesday Briefing;9;3
The World Wastes Tons of Food. A Grocery ‘Happy Hour’ Is One Answer.;9;8
This Boutique Bike Shop Shows How Trump’s Tariffs Can Hit the Little Guy;5;29
Here’s Soylent’s New Product. It’s Food.;4;18
Hickenlooper Exits as O’Rourke Presses On: This Week in the 2020 Race;8;17
Businesses Plead to Stop More China Tariffs. They Expect to Be Ignored.;6;17
South Carolina, Brexit, U.S. Open: Your Thursday Briefing;9;5
Traditional Dresses as Resistance;5;25
Striking a Balance Between Fear and Hope on Climate Change;4;15
Bernie Sanders Accuses Liberal Think Tank of Smearing Progressive Candidates;4;14
4 Podcasts for Your Summer Travels;7;5
Summer 2019 News Quiz | June 1-Aug. 31;8;28
In the Land of Self-Defeat;10;4
$260 Million Opioid Settlement Reached at Last Minute With Big Drug Companies;10;21
Mitch McConnell, SoulCycle, Uber: Your Friday Briefing;8;9
Trade Dispute Between U.S. and China Deepens as Beijing Retaliates;5;13
The Upshot, Five Years In;4;22
Gordon Sondland, Syracuse University, Grammys: Your Wednesday Briefing;11;20
Hometown of Canadian Teenage Murder Suspects Grapples With Infamy;8;13
In Ciudad Juárez, Migrants Dream of America but ‘Run Into Trump’s Wall’;8;8
We Have a White Nationalist Terrorist Problem;8;4
Fact-Checking Trump’s Claims That Democrats Are Radical Socialists;7;20
When Science Fiction Comes True;3;12
Eugene Scalia, Apollo 11, ‘The Lion King’: Your Friday Briefing;7;19
A Darker Portrait Emerges of Trump’s Attacks on the Justice Department;4;20
The Discount Cable and Charger Brands You Can Trust;2;25
Are Electric Cars Only for the Rich? Sacramento Is Challenging That Notion;1;24
Free Speech Is Killing Us;10;4
When Mac & Cheese and Ketchup Don’t Mix: The Kraft Heinz Merger Falters;9;24
If You Can Get Killed Doing It, Fashion Wants It;8;7
Toni Morrison, Mass Shooting, R. Kelly: Your Tuesday Briefing;8;6
Milford, Conn.: A Pretty New England City That’s ‘Just Big Enough’;5;29
Richard Jewell Was Wrongly Implicated in a Mass Attack. He’s Not the Only One.;12;29
FSA-Eligible Products Wirecutter Loves;12;20
Homeland Security Dept. Affirms Threat of White Supremacy After Years of Prodding;10;1
‘He Was Looking Straight at Me’: West Texas Shooting Victims Recall Day of Horror;9;3
Texas Shooting Brings New Urgency to Gun Debate in Congress;9;2
Under the Influence of a ‘Super Bloom’;3;23
Is America Becoming a Four-Party State?;2;20
Black Friday 2019: What You Need to Know;11;29
Surgeons Labored to Save the Wounded in El Paso Mass Shooting;8;9
Meet the Curiosity-Seekers and Die-Hards at the Last True Blockbuster;3;29
These Villages in Thailand Are Part of the Global Economy. Go to Ikea to Find Out.;11;19
Farm Country Feeds America. But Just Try Buying Groceries There.;11;5
What if the Thief Who Steals Your Identity Is Your Mom?;10;15
SoftBank Bet Big on Disruptive Companies. Many Have Not Paid Off.;9;26
When Science Fiction Comes True;3;12
$260 Million Opioid Settlement Reached at Last Minute With Big Drug Companies;10;21
