Headline;Month;Day
SoftBank Bet Big on Disruptive Companies. Many Have Not Paid Off.;9;26
Surgeons Labored to Save the Wounded in El Paso Mass Shooting;8;9
In Ciudad Juárez, Migrants Dream of America but ‘Run Into Trump’s Wall’;8;8
Eugene Scalia, Apollo 11, ‘The Lion King’: Your Friday Briefing;7;19
Navy SEAL War Crimes Trial in Turmoil Over Claims Prosecutors Spied on Defense;5;17
Is America Becoming a Four-Party State?;2;20
A Horrible Day, Horribly Familiar;8;9
September’s Book Club Pick: The Upheaval in the American Workplace;10;3
In Texas, a Lone House Democrat Has an ‘A’ Rating From the N.R.A. Can He Survive?;9;9
Is Immigration at Its Limit? Not for Employers;8;22
Democrats Condemn Trump After Shootings: This Week in the 2020 Race;8;10
Italy’s Biggest Economic Problem? It’s Still Italy;8;9
U.S. Shootings, Hong Kong, Iran: Your Monday Briefing;8;4
Nuclear Power Can Save the World;4;6
DealBook Briefing: Trump Delays Address Until After Shutdown;1;24
Federal Shutdown’s Uneven Toll: Some Americans Are Devastated, Others Oblivious;1;11
Steven Mnuchin on the Economy, and Trump;9;18
U.S. Shootings, Volodymyr Zelensky, Heat Wave: Your Monday Briefing;8;5
White Extremist Ideology Drives Many Deadly Shootings;8;5
Pelosi. Clinton. Obama. Now ‘the Squad’ Is the New Target for the Right.;7;27
Gavin Grimm: Fighting for the Rights of Transgender Students;6;19
Cross-Border Patrols, Mercenaries and the K.K.K.: The Long History of Border Militias;4;25
After Impeachment, an Angry Trump Looks to Voters for Vindication;12;20
He Tried E-Cigarettes to Quit Smoking. Doctors Say Vaping Led to His Death.;10;14
Trump Asserts He Can Force U.S. Companies to Leave China;8;24
The Boxing Champion Who Battles O.C.D.;7;31
Google and Amazon Are at the Center of a Storm Brewing Over Big Tech;6;2
Modi Cut India’s Red Tape. Now He Hopes to Win Votes for His Work.;5;14
Success of Los Angeles Teachers Strike Rocks Charter Schools, and a Rich Supporter;1;29
Despite Bitcoin’s Dive, a Former Soviet Republic Is Still Betting Big on It;1;22
‘I Am Desperate for Leadership’ on Reducing Gun Violence;11;11
At the Border, Lawmakers See a Broken System and Little Common Ground;9;28
6 Takeaways From the September Democratic Debate;9;12
After El Paso Shooting, Will Voters Revisit Beto O’Rourke?;8;11
Trump Condemns White Supremacy but Stops Short of Major Gun Controls;8;5
Elizabeth Warren Wants a Wealth Tax. How Would That Even Work?;2;18
Arrest in Jazmine Barnes’s Killing Allays Hate-Crime Fears;1;7
Inside a Texas Church, Guns, Bibles and a Spirited Firearms Debate;12;30
DealBook Briefing: Hoping to Bridge the Gap in Trade Talks;1;30
Beaumont, Calif.: Growing Fast, but Still a Bedroom Community;12;10
DaBaby Blew Up. But Can He Settle Into Stardom?;10;3
In Stores, Secret Bluetooth Surveillance Tracks Your Every Move;6;14
DealBook Briefing: Why Fiat Chrysler Nixed the Renault Merger;6;6
DealBook Briefing: Inside the Fall of the Trade Deal;5;17
DealBook Briefing: The Justice Dept. Needs a New Antitrust Target;2;27
DealBook Briefing: How to Really Tax the Rich;2;25
DealBook Briefing: ‘Forecasting a Slowdown’ for 2019;1;15
New Jersey Grapples With Far-Right Extremism After Arrests;11;29
The N.B.A.’s China Problem Is Getting Worse;10;8
DealBook Briefing: How the Impeachment Fight Could Affect the Markets;9;26
At Detention Camps and Shelters, Art Helps Migrant Youths Find Their Voices;7;19
Trump Tells Congresswomen to ‘Go Back’ to the Countries They Came From;7;14
DealBook Briefing: The Tit-for-Tat Trade War Gets Hotter;5;14
DealBook Briefing: Debating the Economics of the Shutdown;1;25
Peter Navarro, Trump’s Trade Warrior, Has Not Made His Peace With China;12;26
What the U.K. Election Result Means for Global Business;12;13
Minority Voters Chafe as Democratic Candidates Abandon Charter Schools;11;26
Warren and Biden Join U.A.W. Picket Lines as Democrats Use Strike to Court Labor;9;22
DealBook Briefing: Trump Admitted to Exploring Tax Cuts. Here’s Why.;8;21
DealBook Briefing: How a Recession Could Hit This Year;8;19
DealBook Briefing: Les Wexner Says Jeffrey Epstein Misappropriated His Money;8;8
Anger at Big Tech Unites Noodle Pullers and Code Writers;6;10
The Rematch: Bernie Sanders vs. a Clinton Loyalist;4;16
In Puerto Rico, Building a Disaster-Proof Business Is Part of Recovery;4;9
DealBook Briefing: The Fed Gave Trump What He Wants, Carefully;3;21
Super Bowl Commercials 2019: Brands Play It Safe and Look to the Future;2;3
Boeing Crisis Could Hit the Broader Economy;12;17
N.Y.C. Official Calls for Mandatory Diversity Effort in the Boardroom;10;11
DealBook Briefing: Is a $5 Billion Facebook Fine Enough?;4;25
Overwhelmed or Ill Informed, 70,000 Wildfire Victims May Get Nothing;10;6
Juul Replaces Its C.E.O. With a Tobacco Executive;9;25
How the El Paso Shooting Exposes the Rifts in Texas Politics;8;7
Katrina on Its Mind, New Orleans Keeps an Anxious Eye on Tropical Storm Barry;7;12
Outsider or Insider? How Bernie Sanders Learned to Walk the Line;7;6
Health Care and Insurance Industries Mobilize to Kill ‘Medicare for All’;2;23
DealBook Briefing: Is It Time to Worry About Oil Again?;6;14
DealBook Briefing: Want to Avoid Corruption? Don’t Invest Here;4;9
DealBook Briefing: Rajat Gupta Won’t Say Sorry;3;22
Business Leaders Set the A.I. Agenda;3;3
DealBook Briefing: China vs. U.S. Could Be a Long, Slow Grind;8;7
El Paso Shooting Suspect’s Manifesto Echoes Trump’s Language;8;5
DealBook Briefing: Chinese Investment in the U.S. Drops 90%;7;22
DealBook Briefing: A Rate Cut Isn’t a Done Deal;6;5
DealBook: Trump Says Business Leaders ‘Have No Choice’ but to Vote for Him;11;13
Fort Worth Police Have More Violence to Answer For, Residents Say;10;20
DealBook Briefing: Is Saudi Arabia Twisting Arms to Help Aramco’s I.P.O.?;9;20
DealBook Briefing: C.E.O.s Demand More Gun Control;9;12
DealBook Briefing: Corporate America Considers Its Role in Gun Violence;8;5
