Headline;Month;Day
Birth Control Without Seeing a Doctor: Oregon Now, More States Later;1;4
Morgan Stanley Management Shuffle Puts a C.E.O. on the Market;1;7
Review: The Devil Went Down to Chelsea to See ‘Prudencia Hart’;12;14
Phish’s Art Director Calls Four Shipping Containers Home;8;24
Election, Dodgers, Duterte: Your Thursday Evening Briefing;10;20
At a Refuge for New York City’s Hungry, Summer Brings Scarcity;7;15
A Humane Revolution;5;14
Five Ways to Shop for the Best Vacation Package;12;2
Looking for a Bargain Vacation? Don’t Rule Out Hawaii;11;23
It’s Not Easy Being Santa;12;22
It’s Not Easy Being Santa;12;22
Rego Park, Queens: A Rental Near the Relatives;1;14
Life Insurance Tries to Lighten Up;3;25
A Mason-Dixon Line of Progress;4;8
From a House to a One-Bedroom, for Family’s Sake;11;24
Organic Valley Traces Milk Back From Table to Farm;7;18
Failure to Lunch;2;25
Hampton Creek, Maker of Just Mayo, Is Said to Be Under Inquiry;8;20
‘UnREAL’ Season 2, Episode 5: Somebody Do Something;7;5
Whole Foods’ Scaled-Down 365 Store Has Robots, but No Tattoo Parlor;5;11
Thomas Perez, a Labor Watchdog Who’s Not All Bite;5;14
Fraud Arrests May Be Turning Point for Polygamist Sect;3;2
Addicts Who Can’t Find Painkillers Turn to Anti-Diarrhea Drugs;5;11
Whole Foods’ Scaled-Down 365 Store Has Robots, but No Tattoo Parlor;5;11
As Shelter Population Surges, Housing for Disabled Comes Up Short;9;17
Eggs That Clear the Cages, but Maybe Not the Conscience;7;16
‘Whole Foods Effect’: When Small Food Makers Get the Call to Go Big;4;20
San Francisco Wants Homeless to Leave Tent Camp, but Some Vow to Fight;2;26
F.D.A. Warns Whole Foods on Failure to Address Food Safety Problems;6;15
No Venture Capital Needed, or Wanted;6;1
A New Novel by Maria Semple, Author of ‘Where’d You Go, Bernadette’;10;3
Why Are Corporations Hoarding Trillions?;1;20
Final Frontier in Home Renovation: Giving Garages a Makeover;12;27
How Parents Harnessed the Power of Social Media to Challenge EpiPen Prices;8;25
Scalia Took Dozens of Trips Funded by Private Sponsors;2;26
How Love Inspired the Voice of the Dodgers to Rise in Song;10;1
How Should You Manage Your Money? And Keep It Short;1;8
Hearing Aid Prices Under Pressure From Consumer Electronics;4;20
Older Voters May Be Hillary Clinton’s Answer to Bernie Sanders’s Youth Appeal;3;21
Pet Food Pantries Offer Relief to Animal Owners Struggling With Bills;2;8
The $1,600 Marathon;7;15
Drake’s Very Own: On Dennis Graham’s Instagram;3;21
How Did Walmart Get Cleaner Stores and Higher Sales? It Paid Its People More;10;15
Sunset Park, Brooklyn: Not Quite Trendy;1;20
How to Keep the ‘Great Comet’ Party Going on Broadway: Dish Out the Pierogies (and Add Josh Groban);9;14
Why Sports Fans Risk Life and Limb for a Rolled-Up T-shirt;1;30
Turning Your Vacation Photos Into Works of Art;12;19
A $700 Juicer for the Kitchen That Caught Silicon Valley’s Eye;3;31
Morning Agenda: China Stops Trading After Less Than Half an Hour;1;7
Karch Kiraly Now Setting Up U.S. Women’s Volleyball Team to Succeed;6;18
The Superhero Franchise: Where Traditional Movie Stardom Goes to Die;5;19
The Faces of American Power, Nearly as White as the Oscar Nominees;2;26
Marie Kondo, Tidying Up and the Ruthless War on Stuff;7;6
Diary of a New York City Marathon, Now With a Finishing Kick;11;3
Corrections: November 30, 2016;11;30
