Headline;Month;Day
Shopping for Android Apps on the Web;12;28
Why the Computing Cloud Will Keep Growing and Growing;12;25
Use Labels to Sort Messages in Gmail;12;21
Silicon Valley Dominating Self-Driving Tech? Motor City Says Not So Fast;12;20
Rail Crossing Warnings Are Sought for Mapping Apps;12;20
How Google Knows When Your Bills Are Due;11;28
Choosing a Child’s First Smartphone;12;16
Daily Report: When Cars and Tech Repeatedly Collide;12;14
The Quest for Your Dream Streamer;12;14
Biggest Tech Failures and Successes of 2016;12;14
The Great A.I. Awakening;12;14
When Trump Meets Tech Leaders, Jobs Will Be on the Agenda;12;13
Europe Presses American Tech Companies to Tackle Hate Speech;12;6
Facebook and Other Tech Companies Seek to Curb Flow of Terrorist Content;12;6
Fashion’s Future, Printed to Order;12;5
Take Your Smartphone Photography to the Next Level;11;30
The Dawn of the ‘Tryborg’;11;30
With Shifts in National Mood Come Shifts in Words We Use, Study Suggests;11;28
Google and Facebook Take Aim at Fake News Sites;11;15
Taking Your Wallet on Vacation? Here’s How to Keep It Safe;11;23
Erasing the Past From Google Search;11;11
Anti-Clinton Fake News Casts Pizzeria as Front for Crime;11;22
Fake News Onslaught Targets Pizzeria as Nest of Child-Trafficking;11;22
Parallels Between Europe’s Antitrust Cases Against Google and Microsoft;11;10
Facebook and the Digital Virus Called Fake News;11;19
When Tech Is a Problem Child;11;19
When to Leave on Your Thanksgiving Drive;11;18
Silicon Valley Helped Create Trump, and That’s Bad for It;11;18
The New York Times Launches the Android App for Crosswords;11;17
Keep Your Email Online or Off;11;16
A Gmail Rival Sent to Siberia by a Mysterious Google Glitch;11;5
Social Media’s Globe-Shaking Power;11;16
Give Children a Safer Searching Experience;11;15
Daily Report: Twitter Addresses Troll Problem. Again.;11;15
How to Stream Video on an Older TV;11;14
Teslas in the Trailer Park: A California City Faces Its Housing Squeeze;11;14
Google Rebuts Antitrust Claims in Europe;11;3
Google Home vs. Amazon Echo: A Face-Off of Smart Speakers;11;3
How to Change the Way You Pay in Google Play;11;2
The Stakes Are Rising in Google’s Antitrust Fight With Europe;10;30
Finding a Non-Mac Alternative to Microsoft;11;9
Postelection Therapy: View Swing States From Space;11;8
Daily Report: Google’s Day in Europe’s Court Highlights Nature of New Tech;10;31
Larry Ellison’s Hardball Tactics Win NetSuite for Oracle;11;7
Daily Report: A New Helper in the Virtual Assistant Race;11;3
Google Curbs Expansion of Fiber Optic Network, Cutting Jobs;10;26
YouTube Agrees to Pay Royalties, Ending German Music Dispute;11;1
Hulu Adds ESPN, ABC and Fox News to Streaming Service;11;1
Daily Report: A $25 Billion Fiber Merger;11;1
Morning Agenda: Competition Heats Up, the Fight Over Global Trade;10;31
Apple and Tesla to Report Earnings;10;23
Farhad and Mike’s Week in Tech: Microsoft, Apple and Halloween!;10;29
A More Money-Conscious Alphabet Emerges;10;27
Twitter Has an Old Media Problem. Here’s a Solution.;10;27
Daily Report: Google Pixel and the New Long Game;10;18
Google Pixel Review: Assessing the New Smartphone;10;18
Want to make your own app? There are free classes for that;10;21
Google Unveils Hardware Projects;10;4
Google Introduces the Pixel, Its Own Smartphone;10;4
Move Android Photos to Your Mac;10;13
Five Places to Go in Milan;10;13
Daily Report: Google Would Like You to Meet Its Gadgets;10;5
The Problem With Google’s ‘Star Trek’ Computer;10;3
Google to Unveil New Devices, and Labor Dept. Will Report on Jobs;10;2
Google, Lagging Amazon, Races Across the Threshold Into the Home;10;2
Daily Report: Google’s Slow Response to Amazon’s Echo is a Warning;10;3
Freeing the Gmail New Message Window;10;10
Looking for a Choice of Voices in A.I. Technology;10;10
A High-Stakes Bet: Turning Google Assistant Into a ‘Star Trek’ Computer;9;28
Donald Trump Pushes Debunked Theory That Google Suppressed Rival’s Bad News;9;29
Julian Assange, WikiLeaks Founder, Promises Raft of Revelations;10;4
U.S. Tech Giants Are Investing Billions to Keep Data in Europe;10;3
Ushering in a Safe, Driverless Future;10;3
For Taiwan, Google Images of Disputed Island Are Too Clear;9;23
Farhad’s and Mike’s Week in Tech: Interest in Twitter From Disney? Unlikely.;10;1
A Peek at the Secret English Farm Where Amazon Tests Its Drones;10;1
How to Use Google to Plan Your Trip;9;21
Allo’s Tryout: 5 Days With Google’s Annoying Office Intern;9;21
Daily Report: Will Google’s Allo Make It in the Messaging App Field?;9;21
Protecting Humans and Jobs From Robots Is 5 Tech Giants’ Goal;9;28
What It’s Like to Fight Online Hate;9;26
What if ‘One Click’ Buying Were Internetwide?;9;25
Making Video Ads That Work on Facebook’s Silent Screen;9;25
Twitter Is Said to Be Discussing a Possible Takeover;9;23
Twitter Moving Closer to Sale;9;23
Move Your Address Book From Outlook to Google;9;13
Can Bots Fight Bullying?;9;21
Stop Your Children From Downloading Those Naughty Apps;9;21
Approve or Reject: Can You Moderate Five New York Times Comments?;9;20
Adblock Plus, Created to Protect Users From Ads, Instead Opens the Door;9;18
Artificial Intelligence Software Is Booming. But Why Now?;9;18
How Waze Tries to Keep Its Crowd Honest;9;16
How Digital Tracking of Rogue Fishing Can Safeguard Vast Ocean Reserves;9;15
Living in Two Time Zones With Google Calendar;9;6
Michiko Kakutani on Twitter: A World of ‘Splendid Dishevelment’;9;14
E.U. Rules Look to Unify Digital Market, but U.S. Sees Protectionism;9;13
This Fashion Week, Google Gets a New Look;9;1
Daily Report: Uber and Google, Ride-Sharing ‘Frenemies’;8;31
Goodbye, Ivory Tower. Hello, Silicon Valley Candy Store.;9;3
Alphabet Ends Effort to Create Modular Smartphone;9;2
Do Those Travel Search Results Look Fishy? Here’s Why;9;1
How Tech Giants Are Devising Real Ethics for Artificial Intelligence;9;1
Alphabet Expands Car-Pooling Project, Casting Shadow on Uber;8;30
Google Duo Challenges FaceTime;8;16
A Few Reasons Your Phone Isn’t Getting the Update;8;30
Daily Report: The Tax Man Comes for Apple in Ireland;8;30
Uber and Alphabet’s Rivalry Heats Up as Director Chooses Sides;8;30
Which Co-Pilot to Choose: Google Maps or Waze?;8;15
Endorsed on Instagram by a Kardashian, but Is It Love or Just an Ad?;8;30
Cloud Computing Brings Sprawling Centers, but Few Jobs, to Small Towns;8;26
Google Fined for Breaking Russian Antitrust Rules With Android;8;11
Personalized Traffic Alerts From Google;8;9
Google Duo Makes Video Calling Between Operating Systems Easier;8;16
No, Google Says, It Did Not Delete ‘Palestine’ From Its Maps;8;11
Daily Report: More Clean Energy, Brought to You by the Cloud;8;24
Apple Becomes a Green Energy Supplier, With Itself as Customer;8;23
Daily Report: A New Android for a New Tech World;8;23
Bill Maris Leaving as Chief of GV, Google’s Venture Finance Arm;8;11
Latest to Quit Google’s Self-Driving Car Unit: Top Roboticist;8;5
Paris (and Beyond) by App;8;18
Getting Chatty in Gmail;8;2
Google Silences Doubters With Blockbuster Quarter;7;29
Farhad’s and Mike’s Week in Tech: Betting on Jet and Diverse Work Forces;8;13
How to Make YouTube Stop Watching What You Watch;8;12
Google Races to Catch Up in Cloud Computing;7;25
Changing Your Google Account Settings;7;21
Google, Trying to Endear Itself to Europe, Spreads $450 Million Around;7;19
When Every Company Is a Tech Company, Does the Label Matter?;8;6
Google Called Harmful to Europe’s Market;7;14
Daily Report: The Message From Snapchat;8;4
Google Faces New Round of Antitrust Charges in Europe;7;14
Google’s Antitrust Charges in Europe Need Quick Action;7;14
Daily Report: Venture Capital’s Endangered Middle Class;8;3
Morning Agenda: Uber and Didi Chuxing Team Up in China;8;1
Research and the Corporation;7;30
Farhad’s and Mike’s Week in Tech: The Cautionary Tale of the Fall of Yahoo;7;30
Retrieving Your Google Photos;6;30
Tesla and Google Take Different Roads to Self-Driving Car;7;4
The Blog That Disappeared;7;29
Man Charged With Firebombing Street View Cars in Attacks on Google;7;6
Morning Agenda: Profits Tumble at European Banks;7;29
Spanish Tax Authorities Investigate Google;6;30
Tracing Your Google History;6;20
Checking the Delivery Date on That Android Update;7;27
Google Capital Ventures Into Public Companies With Care.com;6;29
What Goes Up Must Come Down: The End of Yahoo as We Know It;7;26
Tech Behemoths Report Their Results;7;25
Verizon and Yahoo: Internet Also-Rans With Big Hopes;7;25
Sara Thomas, Ajay Deshpande;7;24
Backing Up Into Google Photos;6;15
They Promised Us Jet Packs. They Promised the Bosses Profit.;7;23
Using Google Now for iOS;6;7
Reasons to Believe the A.I. Boom Is Real;7;18
Don’t Hand Our TVs Over to Google;5;30
Google Prevails as Jury Rebuffs Oracle in Code Copyright Case;5;26
Morning Agenda: Yahoo Is Said to Collect Final Bids;7;15
Google Appeals French Privacy Ruling;5;19
Google Home vs. Amazon Echo. Let the Battle Begin.;5;18
Morning Agenda: The First Woman to Lead Cravath, Swaine & Moore;7;14
Wanderlust by Design: Organizing Your Summer Travel;7;13
Keeping Current With Google Chrome;5;6
Oracle-Google Dispute Goes to Heart of Open-Source Software;5;20
Google Bests Oracle in Court, but the Fight Isn’t Over;5;27
Voice Searches With Cortana or Chrome;7;12
Google to Get Fiat Chrysler Minivans for Self-Driving Tests;5;3
Is Google a Harmful Monopoly?;4;28
Microsoft and Google Agree to Drop Mutual Complaints;4;22
Going Wide With Google Camera;5;23
Google Home: A Voice-Activated Device That Already Knows You;5;18
Google to Introduce Its Voice-Activated Home Device;5;17
Google’s Antitrust Woes in Europe Are Likely to Grow;4;19
Google Translate Updates Could Benefit Travelers;5;11
Google Fined by French Privacy Regulator;3;24
Ford and Google Team Up to Support Driverless Cars;4;27
Your Next Trip, Courtesy of Google Search;3;9
E.U. Official on Charges Against Google;4;20
Europe Tried to Rein In Google. It Backfired.;4;18
Alphabet Chairman Testifies in Oracle Suit Against Google;5;10
Google to Ban All Payday Loan Ads;5;11
Challenge to Google Books Is Declined by Supreme Court;4;18
Silicon Valley-Driven Hype for Self-Driving Cars;7;9
Amit Singhal, an Influential Engineer at Google, Will Retire;2;3
Europe’s Case Against Google Might Help Rivals More Than Consumers;4;28
Google Program Beats Go Champion;3;9
Google Goes Back to Court Over Android Code and May Face Fines in Russia;5;8
Speaking Your Mind to Google Docs;3;16
Want to Be Forgotten Online Without Google? Forget It.;4;19
If They Google You, Do You Win?;10;22
Comparing Mobile Wallets From Apple, Google and Samsung;5;4
Clinton: ‘Google “Donald Trump Iraq” ’;10;20
Oracle’s Suit Against Google Digs Up Old Bones;5;11
Google’s Calendar Now Finds Spare Time and Fills It Up;4;13
Android Security When You Need It;7;7
British Tax Deal With Google Puts Government on Defensive;1;27
Dear Google, Is There a Shrink for That?;2;6
Review: ‘Lion’ Brings Tears for a Lost Boy, Wiped Dry by Google;11;24
Makers of Self-Driving Cars Ask What to Do With Human Nature;7;7
Google Remains Stuck in Europe’s Regulatory Cross Hairs;4;20
Google Introduces Products That Will Sharpen Its Ad Focus;3;15
E.U. Charges Dispute Google’s Claims That Android Is Open to All;4;20
British Leaders Spar Over Google Deal;1;28
Is the Google Home the Voice-Controlled Speaker for You?;11;22
Google Will Further Block Some European Search Results;2;11
Try to Interview Google’s Co-Founder. It’s Emasculating.;1;27
Google Pays Britain $185 Million to Settle Back Taxes;1;23
Taxing Google and Other U.S. Giants Is Dividing Europe;1;28
Google Showcases Its Cloud Efforts, Determined to Catch Up to Rivals;3;23
Google to Shut Down Its Comparison-Shopping Website;2;23
Google Searches Point to a Strong Showing for Donald Trump;3;1
Europe’s Antitrust Enforcer on Google, Apple and the Year Ahead;3;6
Google Picks Former Obama Adviser to Lead Global Public Policy;1;12
Google and Apple’s New Headquarters Resemble Hippie Communes;3;28
Google Joins Race to Speed Up Mobile Delivery of News Articles;2;24
To Know Who’s Leading in the Voting, Just Ask Google;3;1
Tony Fadell Steps Down Amid Tumult at Nest, a Google Acquisition;6;3
Google Artificial Intelligence Beats Expert at Go Game;2;1
Alphabet, Google’s Parent Company, Grows Briskly to Close In on Apple;2;1
Shimon Peres, Hoboken, Google: Your Friday Briefing;9;30
‘Donald Drumpf’ Is Beating Rubio and Cruz for Second in Google Searches;3;1
Google Searches for Voter Registration Have Surged in Hispanic Areas;9;29
Your Tuesday Briefing: Ted Cruz, Google, Bill Cosby;2;2
Another Company With a Cause: Is Google Just Being a Good Citizen?;5;12
Google and Apple: the High-Tech Hippies of Silicon Valley;3;28
Autonomous Google Car Hits Public Bus During Test Drive;3;1
Google Shuts Out Competitors on Android? Hardly;4;27
How Larry Page’s Obsessions Became Google’s Business;1;22
Hillary Clinton Told People to Google ‘Donald Trump Iraq.’ They Did.;10;20
Morning Agenda: Half of Williams Board Resigns;7;1
Third-Party Keyboards Give Mobile Users More Options;6;29
While Limited, Wi-Fi-First Phones Are a Good, Frugal Bet;6;29
Morning Agenda: Puerto Rico Relief Measure Clears Senate;6;30
Europe’s Web Privacy Rules: Bad for Google, Bad for Everyone;4;25
No! There’s Something About Me You Haven’t Googled?;6;2
Amit Singh of Google for Work: A Respectful Clash of Ideas;1;22
Downloading Video Streams to Go;6;28
To Beat Go Champion, Google’s Program Needed a Human Army;4;4
Google Car Exposes Regulatory Divide on Computers as Drivers;2;10
Tech Makes Its Pitch to the Education Community;6;27
Amazon Unveils Online Education Service for Teachers;6;27
At Cannes, the Ad Industry Confronts the Rise of Facebook;6;27
Artificial Intelligence’s White Guy Problem;6;25
Master of Go Board Game Is Walloped by Google Computer Program;3;9
Alphabet Earnings Disappoint as Google Ad Clicks Cost Less;4;21
Watching Virtual Reality Videos on YouTube;6;23
Devices That Deserve to Go Along on Vacation;6;22
Conversations: Poking Fun at Tech Culture on ‘Silicon Valley’;6;20
Celeste Abou Negm and Dvir Kafri: Entanglements, Quantum and Otherwise;6;19
Cable Industry Mobilizes Lobbying Army to Block F.C.C. Moves;6;12
When Android Meets iCloud;6;8
Ingress Has the World as Its Game Board;6;8
Getting Over Stage Fright With the Help of Your Smartphone;6;8
Comment on That Shared Science Story – and Maybe Read it, Too!;6;7
For Driverless Cars, Citylike Test Sites Offer the Unpredictable;6;4
Zen and the Art of Managing Smartphone Photos;6;1
American Tech Giants vs. the Nation-State;6;1
Why the World Is Drawing Battle Lines Against American Tech Giants;6;1
Music World Bands Together Against YouTube, Seeking Change to Law;5;31
Rise of Ad-Blocking Software Threatens Online Revenue;5;30
Farhad and Mike’s Week in Tech: Techies vs. the Media;5;28
Morning Agenda: North Korea Linked to Attacks on Banks;5;27
Locating a Lost Windows Device;5;24
Corporate America Chases the Mythical Millennial;5;25
Morning Agenda: Hewlett-Packard Spinoff Prepares to Split Again;5;25
A Cheery Elevator Ride With Larry Page;5;20
Do You Love Music? Silicon Valley Doesn’t;5;20
Silicon Valley’s Artificial Intelligence Marathon Is On;5;19
How Facebook Warps Our Worlds;5;21
Morning Agenda: Push Continues on Insider Trading Cases Despite Limits on Prosecutors;5;20
Why Are You Laughing?;5;14
Emojis Would Show Women Doing More Than Painting Their Nails;5;12
Morning Agenda: Warren Buffett and Dan Gilbert in Bid to Buy Yahoo;5;16
Changing Android’s Default Apps;5;12
Morning Agenda: Swift Reports a New Attack;5;13
Head of Fiat Chrysler Sees Self-Driving Cars in Five Years, Not 20;5;6
Morning Agenda: Hard Hats for Hedge Funds as Mergers Collapse;5;12
Police and Tech Giants Wrangle Over Encryption on Capitol Hill;5;9
Morning Agenda: Staples and Office Depot End Merger Plan;5;11
Using Tweets and Posts to Speed Up Organ Donation;5;10
Questioning an Antitrust Case;4;29
Google, Europe and Privacy;5;2
The No-Good Week in Tech’s (Hopeful) Trip to a Bright Future;4;22
Keeping Your Android Files in Sync With a Computer;4;19
Bill Campbell, Coach of Silicon Valley Stars, Dies at 75;4;19
U.C. Davis Learns Downside of Trying to Scrub Search Results;4;15
Finding Online Support for Your Android Device;4;13
Stopping OS X Apps From Automatically Starting;4;14
Customizing Android Contacts With Photos;4;6
Billing by Millionths of Pennies, Cloud Computing’s Giants Take In Billions;4;10
How to Switch to iPhone From Android: Patience and Persistence;4;6
Moving CD-Ripped Music From the Computer to the iPad;4;1
Keeping Up With Android Security Patches;3;22
Silicon Valley Looks to Artificial Intelligence for the Next Big Thing;3;28
Finding Photo Programs That Recognize Faces;3;24
The Race Is On to Control Artificial Intelligence, and Tech’s Future;3;25
Samsung’s Smartphones Aren’t the Problem (Just Prune the Bad Apps);3;16
Managed by Q, an On-Demand Start-Up, Raises $25 Million;4;1
The End of the Road for Picasa;3;8
April Fools’ Undo: Gmail Removes Its ‘Mic Drop’ Feature;4;1
Why We Are Still Reaching for Wallets, Not Phones, at the Checkout;4;6
South Korean Gets ‘Priceless’ Victory Over Computer in Go Match ;3;14
Cities to Untangle Traffic Snarls, With Help From Alphabet Unit;3;17
Technology Transforms How Insurers Calculate Risk;4;6
Printing Gmail Backup Codes;2;25
Dude, Where’s My City?;4;1
New York Prosecutor on Privacy and Apple;2;19
Italian Towns Before and After the Earthquake;8;24
Fake Online Locksmiths May Be Out to Pick Your Pocket, Too;1;30
Using Chromecast to Stream Your Tablet on a TV Screen;2;12
What Americans Are Searching For on Debate Night;2;7
Tech Giants Battle for Top Cloud Talent;3;7
Marissa Mayer’s Media Problem at Yahoo Is Now Verizon’s to Solve;7;26
How You’re Making Facebook a Money Machine;4;29
Alphabet Shakes Up Its Robotics Division;1;15
Daily Report: Alphabet Eclipses Apple to Become the Most Valuable Company;2;2
Siri, Alexa and Other Virtual Assistants Put to the Test;1;27
Getting Your Gmail Just the Way You Like It;1;4
Making Corrections in the Gmail Address Book;2;10
Fiat Chief on New Innovation Ideas;5;6
The Best Plug-In Smart Outlet;4;11
Review: The New@Graham Series Is Helped by an App;2;26
Googling Is Believing: Trumping the Informed Citizen;3;9
Tech’s ‘Frightful 5’ Will Dominate Digital Life for Foreseeable Future;1;20
Editing a Gmail Inbox Trip Bundle;1;21
The Holidays With Jeremy Scott;12;12
Snowden: 'Being Patriotic Doesn't Mean Simply Agreeing';9;16
Melissa Schwartz, Gregory Nemeth;12;11
Making Music on an Android Tablet;1;26
Turn Your Smartphone Into a Pocket Scanner;8;23
What YouTube Red Gives You for $10 a Month;10;20
Protecting Personal Information From Virtual Assistants;1;27
Want to Buy a Self-Driving Car? Big-Rig Trucks May Come First;5;17
Tech Companies, New and Old, Clamor to Entice Cloud Computing Experts;3;7
Daily Report: More Earnings, Earnings, Earnings;2;1
Word + Quiz: hamper;12;8
Protecting the Privacy of Internet Users;3;12
Is Blind Hiring the Best Hiring?;2;25
For Alphabet, the Path to Becoming the Most Valuable Company in the World;2;3
Farhad and Mike’s Week in Tech: The Herd Mentality of Tech C.E.O.s;5;21
Fifty States of Anxiety;8;6
Blogging on the Road;4;8
Oracle, Having Bet Billions on Its Future, Sets Sights on Data Analysis;8;1
The Best Smart Smoke Alarm;10;31
11 Apps We Use for Remote Working;3;14
How Does My Browser Recognize Malware?;12;22
Finding Alternatives to Microsoft Excel;8;4
Europe’s Top Digital-Privacy Watchdog Zeros In on U.S. Tech Giants;1;24
What Microsoft’s Xamarin Purchase Says About the Cloud Computing Fight;2;24
Researchers Uncover a Flaw in Europe’s Tough Privacy Rules;6;3
Taking the Temperature Inside the (Feverish) Cloud;10;2
Why Yahoo Sold Its Internet Business;7;18
36 Hours in Philadelphia;5;25
European Antitrust Chief Takes Swipe at Privacy Issue;1;17
Alphabet Close to Overtaking Apple as Most Valuable Company;1;22
Facebook’s Conservative Charm Offensive;5;18
36 Hours in the Cinque Terre, Italy;9;1
Artificial Intelligence Makes the Phone a Personal Assistant;5;18
10-Second Videos From Your Sunglasses. Thank Snapchat.;11;11
Alphabet Program Beats the European Human Go Champion;1;27
Tali Jang, AJ Asver;10;16
Microsoft-LinkedIn Deal Ignites Twitter Speculation;6;16
Marketing in the Moments, to Reach Customers Online;1;18
Student Question | What New Emojis Does the World Need?;5;13
Hey Siri, Can I Rely on You in a Crisis? Not Always, a Study Finds;3;14
Twitter Brings Aboard Facebook Veteran Bret Taylor;7;5
Danielle Borovoy, Daniel Greenberg;1;24
The Modern Love Podcast: Gaby Hoffmann Reads ‘Three Mothers, One Bond’;7;27
What It’s Like to Work for Nicholas Kristof;3;24
Creating a Family Website;2;1
Defending Against Hackers Took a Back Seat at Yahoo, Insiders Say;9;28
Apple Sets Its Sights on Virtual Reality;1;29
Anna Valeo, Brian Haffner;4;17
Wellness App Aims to Improve Workplace Nutrition;2;22
Adam Plotkin, Adam Abrahams;3;20
Donald Trump Campaigns: Watch in Virtual Reality;1;29
Hillary Clinton Campaigns: Watch in Virtual Reality;1;29
Making the Screen Easier to Read;1;22
Kalila Minor, David Andresen;10;2
Mary Chapin Carpenter Reads ‘The Race Grows Sweeter Near Its Final Lap’;8;10
Taking Creepiness Out of Computer Voices;2;16
The Modern Love Podcast: Angela Bassett Reads ‘What the Psychic Knew’;8;31
Amazon Has Big Plans for Alexa: Running the ‘Star Trek’ Home;8;7
Challenging Uber, Lyft Bets on a Road Wide Enough for Two;1;9
Farhad’s and Mike’s Week in Tech: Samsung’s Exploding Products and Twitter’s Fizzling Deal;10;8
Research Exposes Flaw in ‘Right to Be Forgotten’;6;3
Chrysler Hopes New Pacifica Can Make Minivan Cool;6;2
Kimberlee Lisella, Joseph Rosenberg;12;25
Facebook, in Accounting Change, Could Pay Millions More in British Taxes;3;4
Tech Incubators on a Mission of Diversity;6;8
Yahoo’s Sale to Verizon Ends an Era for a Web Pioneer;7;24
The Modern Love Podcast: Gillian Jacobs Reads ‘To Fall in Love With Anyone, Do This’;8;3
Elena Viboch, Stephan Hoyer;6;19
Prince Tributes Include Purple Lighting and Broadway Performances;4;22
How Long Is an Actress Onscreen? A New Tool Finds the Answer Faster.;9;14
Nathalie Walton, Max Carter-Oberstone;9;11
Thanksgiving Travel Guide;11;23
Ted Cruz Campaigns: Watch in Virtual Reality;1;29
Bernie Sanders Campaigns: Watch in Virtual Reality;1;29
The 12.18.16 Issue;12;30
China’s Currency Didn’t Really Drop, Despite Jitters Over Trump;12;6
The 2.28.16 Issue;3;10
Tech Giants Gobble Start-Ups in an Antitrust Blind Spot;8;16
Modern Love: The Podcast | Jason Alexander Reads ‘Just One Last Swirl Around the Bowl’;6;13
Paying $15 Billion for Twitter Will Be Hard for Anyone to Justify;10;7
Daily Report: Latest Hack Shows Yahoo’s Weak Security History;9;28
The Modern Love Podcast: Sterling K. Brown Reads ‘My First Son, a Pure Memory’;8;24
Michael Prysby Email on Lead Levels at LeeAnne Walters's Home;4;24
The Modern Love Podcast: Haydn Gwynne Reads ‘Two Decembers: Loss and Redemption’;12;14
The Modern Love Podcast: Dan Savage Reads ‘DJ’s Homeless Mommy’;11;30
Looking Beyond the Internet of Things;1;1
The Modern Love Podcast: Mark Duplass Reads ‘Out of the Darkness’;11;16
Yahoo’s Suitors Uncover Few Financial Details;4;15
Stephanie Mayer, Brian Rudick;5;8
Rebecca Kaden, Scott Friedman;6;12
The Best Smart Doorbell Camera;6;23
Facebook Helps Develop Software That Puts Students in Charge of Their Lesson Plans;8;9
The Modern Love Podcast: Pamela Adlon Reads ‘In Marriage, Beware of Big Boxes’;12;21
The Modern Love Podcast: Tituss Burgess Reads ‘A Prince Charming for the Prom (Not Ever After, Though)’;8;17
Holdouts of the Social Media Age;3;26
Inside the Self-Driving Tesla Fatal Accident;7;1
Fund Managers Win With Tech Stalwarts and Burly Brand Names;1;15
Apple Developer Conference: A More Open Siri, and Other Upgrades;6;13
Uber Aims for an Edge in the Race for a Self-Driving Future;8;18
Daily Report: An Autonomous Car Future Needs Better Maps;12;20
Hibah Hussain, Timothy Grayson;9;25
The Modern Love Podcast: Catherine Keener Reads ‘Live Without Me. I’ll Understand.’;7;13
The Modern Love Podcast: Ruth Negga Reads ‘My Touchstone and a Heart of Gold’;11;9
Kerry Twombly, Brian Ballinger;4;17
The Modern Love Podcast: Molly Ringwald Reads ‘From Divorce, a Fractured Beauty’;11;23
Apple to Offer App Developers Access to Siri and iMessage;6;13
U.S. and Europe in ‘Safe Harbor’ Data Deal, but Legal Fight May Await;2;2
Apple Letter on iPhone Security Draws Muted Tech Industry Response;2;18
The Best Smart Water-Leak Detector;6;27
Online Booking Makes Hotel Loyalty Harder to Keep;1;18
The Modern Love Podcast: Constance Wu Reads ‘Marry a Man Who Loves His Mother’;10;12
The Modern Love Podcast: Dash Mihok Reads ‘A Path to Fatherhood, With (Shared) Morning Sickness’;10;5
The Modern Love Podcast: 2016 Emmys Edition;9;21
The Modern Love Podcast: Rebecca Hall Reads ‘Take Me as I Am, Whoever I Am’;10;19
The Modern Love Podcast: Tony Hale Reads ‘Just Friends? Let Me Read Between the Lines’;7;20
Microsoft Created a Twitter Bot to Learn From Users. It Quickly Became a Racist Jerk.;3;24
Why Microsoft Likes LinkedIn;6;14
The Modern Love Podcast: Issa Rae Reads ‘Even in Real Life, There Were Screens Between Us’;11;2
‘You Have to Jump First’ — New York Times C.E.O. Mark Thompson Talks Virtual Reality at SXSW;3;15
Worried About the Privacy of Your Messages? Download Signal;12;7
How to Protect Privacy While Using Pokémon Go and Other Apps;7;12
All Eyes on Facebook to Lift Tech’s Dismal Spirits;4;27
Send Us the Political Ads You See on Facebook;4;14
Silicon Valley’s Culture, Not Its Companies, Dominates in China;12;4
