Headline;Month;Day
How to Be Mindful With Facebook;9;28
The Modern Love Podcast: Kristin Chenoweth Reads ‘Revenge of the Friend’;9;14
The Modern Love Podcast: Cherry Jones Reads ‘Kept Together by the Bars Between Us’;9;7
The Modern Love Podcast: Lance Reddick of ‘The Wire’ Reads ‘In the Waiting Room of Estranged Spouses’;6;29
Apple Is Rolling Up Backers in iPhone Privacy Fight Against F.B.I.;3;3
The Definitive Guide to Cord-Cutting in 2016, Based on Your Habits;10;12
Using a Hardware Keyboard With an Android Device;3;28
2016 Holiday Gift Guide - Technology;11;21
Make Firefox Open Gmail to Send a Message;10;27
One Celebrated Brooklyn Artist’s Futuristic New Practice;4;29
No Clear Logic in Verizon’s Digital Media Venture;9;7
Farhad and Mike Parse Virtual Reality Tech and the Apple Standoff;3;19
A Potential Hitch in Zuckerberg’s Stock Plan for Facebook;12;13
Morning Agenda: TransCanada to Buy Columbia Pipeline Group;3;18
Obama Shifts Online Strategy on ISIS;1;8
Morning Agenda: Ackman’s Reputation at Risk;3;16
What We’re Reading;11;1
The Modern Love Podcast: Live From New York;10;26
Why Are Corporations Hoarding Trillions?;1;20
Finding Your Family by Phone;6;2
Expanded Worldview;4;16
Magic Leap, an Augmented Reality Firm, Raises $793 Million;2;2
Private Security Group Says Russia Was Behind John Podesta’s Email Hack;10;21
Magic Leap, an Augmented Reality Firm, Raises $793 Million;2;2
Museums Embrace Digital Offerings as Visitor Numbers Surge;3;11
Verizon Is Said to Be Near a Deal to Acquire Yahoo;7;22
Yahoo and the Online Universe According to Verizon;7;30
Morning Agenda: Timothy Cook’s Tax Arguments, Tronc’s ‘Just Say No’ Defense, Alphabet Drives Onto Uber’s Turf;8;31
Corrections: April 25, 2016;4;25
Apple’s $1 Billion Investment May Ease Ties With China;5;13
For Some Cord Cutters, Streaming Super Bowl Was a Nonstarter;2;8
BlackBerry Lays Off 200, Pointing to Shift Away from Phones;2;5
What Saudi Arabia’s $3.5 Billion in Uber Buys;6;2
Microsoft Acquires Minecraft App for Schools;1;19
Twitter Appoints Debra Lee, Adding Diversity to Its Board;5;16
Change Safari’s Search Engine Under the Hood;11;18
Make Your Phone Easier to Read;11;8
The Modern Love Podcast: Kathryn Hahn Reads ‘The Wedding Toast I’ll Never Give’;9;28
Obama Stresses Need to Monitor Data in Fighting Terrorism;4;25
Julie Mond, Aaron Himelman;8;21
Price-Fixing Truck Makers Get Record E.U. Fine: $3.2 Billion;7;19
What to Do If You Have a Samsung Galaxy Note 7;9;15
Verizon Announces $4.8 Billion Deal for Yahoo’s Internet Business;7;25
