Headline;Month;Day
Jazz Pianist Joey Alexander Turns 13 and Debuts New Song ‘City Lights’;7;7
Coke, Pepsi and Climate Change;10;17
Philadelphia Soda Tax: 2 Sides Weigh In;6;16
Bill Backer, Who Taught the World (and Don Draper) to Sing, Dies at 89;5;16
Roger Enrico, PepsiCo Chief During 1980s ‘Cola Wars,’ Dies at 71;6;2
Corporations Grow Nervous About Participating in Republican Convention;3;30
HP Inc. Joins Companies Declining to Contribute to G.O.P. Convention;5;31
A Tidal Wave of Corporate Migrants Seeking (Tax) Shelter;1;26
Dividends, Wall Street’s Battered Status Symbol;2;13
The Big Companies That Avoid Taxes;10;18
Jazz Listings for Sept. 2-8;9;1
The Big Companies That Avoid Taxes;10;18
Sarah Armstrong, Matthew Porwoll;10;9
Natalie Creamer, Keyvon Pahz;11;6
How Britain’s Soda Tax Plan Could Spur New Low-Sugar Drinks;3;29
Donald Trump, ISIS, Zika Virus: Your Thursday Briefing;8;4
Arnold Palmer and His Savvy Agent Set the Bar for Pitchmen;9;29
A Playful Sneaker Brand — With Plenty of History;10;20
After Conventions, a Debt to Donors;5;11
A Short Shutdown for Chipotle, Viacom’s Earnings and Yellen to Testify;2;7
After Conventions, a Debt to Donors;5;11
Company Behind ‘American Idol’ Files for Bankruptcy Protection;4;29
Does Sparkling Water Have a Downside?;9;16
Jazz Listings for Oct. 28-Nov. 3;10;27
Sack Time;9;10
Matthew Weiner to Create a Series for Amazon;10;26
New Movie Musical Planned for Will Ferrell and Kristen Wiig;12;16
Make Conventions Great Again;7;12
Jazz Listings for Feb. 12-18;2;11
Review: In ‘Under the Sun,’ Two Views of North Korea;7;5
Ardagh to Buy Assets From Ball and Rexam for $3.4 Billion;4;25
No Speaking Slots? Ted Cruz and John Kasich Brush Off Trump’s Threat;6;27
Review: Ralph Peterson Jr. Powers a Runaway Freight Train;4;20
One-Thing Shops: Soda, Los Angeles;5;31
G.M.O.s in Food? Vermonters Will Know;6;30
Review: Logan Richardson’s ‘Shift’ Serves as a Challenge;2;24
Warren Buffett Vows to Stick to Friendly Strategy, Rebuffing Activism;2;27
Tell Consumers How Many Calories There are in Alcohol;7;30
Robert Tuggle, Longtime Archivist of the Metropolitan Opera, Dies at 83;1;27
Lisa Borders of the W.N.B.A.: It’s Impossible to Refute Results;7;22
Lisa Borders of the W.N.B.A.: It’s Impossible to Refute Results;7;22
Jazz Listings for June 17-23;6;17
Jazz Listings for Oct. 7-13;10;7
Jazz Listings for July 29-Aug. 4;7;29
Microsoft Will Not Donate Money to Republicans’ Convention;4;29
With Billionaires Backing Her, Hillary Clinton Must Confront How to Deploy Them;8;4
Jazz Listings for Jan. 8-14;1;7
Jordan Spieth Pulls Out of the Olympics;7;11
Two Ranking Democrats to Offer Bill Aimed at Inversions;2;22
What’s on TV Sunday;5;29
Jazz Listings for July 29-Aug. 4;7;29
Theme Park Dining Beyond Burgers and Turkey Legs;6;15
Deal-Scouting Firm Scores Again With Danone-WhiteWave Deal;7;7
Jazz Listings for Dec. 2-8;12;2
Jazz Listings for Aug. 19-25;8;18
Two Ranking Democrats to Offer Bill Aimed at Inversions;2;22
Jazz Listings for Feb. 26-Mar. 3;2;25
Georgia’s Governor Sets a Wise Example for Tolerance;3;29
Jazz Listings for Aug. 26-Sept. 1;8;25
Rockefeller Foundation to Take Food-Waste Fight to Davos;1;21
The ‘Normalization’ of Trump, and What Comes After;11;1
Jazz Listings for Feb. 26-Mar. 3;2;25
Rockefeller Foundation to Take Food-Waste Fight to Davos;1;21
Milk and Other Surprising Ways to Stay Hydrated;6;30
50 Cent Tells Bankruptcy Court Piles of Cash in Photos Were Fake;3;10
Food and Drink Will Go to the Movies at Brooklyn Alamo Drafthouse;10;18
Jazz Listings for Feb. 19-25;2;18
Jazz Listings for June 24-30;6;24
Zoltan Kocsis, Pianist and Conductor, Dies at 64;11;10
Putting Sugary Soda Out of Reach;11;3
Food and Drink Will Go to the Movies at Brooklyn Alamo Drafthouse;10;18
Brooklyn Fish, Beware;7;20
Chobani Ads Shift a Battle Out of the Yogurt Aisle and Into the Courts;1;11
5 Ways to Sample Americana in Havana;3;15
Putting Sugary Soda Out of Reach;11;3
Jazz Listings for Sept. 9-15;9;8
Jazz Listings for July 22-28;7;21
Tekserve, Precursor to the Apple Store, to Close After 29 Years;6;30
A Founder of Odwalla Tries to Recapture His Mojo;12;17
At Opening Ceremony, a Contemporary Vision of the Future;2;15
Five Years In, Millrose Games Have Found Their Footing at the Armory ;2;20
Where to Go in Beirut;2;19
Jazz Listings for June 3-9;6;3
Behind Brooklyn Walls: A World of Sound;12;22
Tyson Foods, a Meat Leader, Invests in Protein Alternatives;10;10
Jazz Listings for Jan. 22-28;1;21
Is Sugar Really Bad for You? It Depends;6;8
Jazz Listings for Aug. 12-18;8;12
Looking for Legal Status;8;5
Calling the Shots;12;16
Donald Trump, Samsung, Yemen: Your Monday Evening Briefing;10;10
Republican Self-Destruction;3;28
Inside the Unmistakably Milanese Apartment of a Beirut Gallery Owner;3;15
Jordan Spieth’s and Rory McIlroy’s Two Approaches to an Olympic Snub;7;12
Jazz Listings for July 1-7;7;1
Jazz Listings for Jan. 15-21;1;14
Looking for Legal Status;8;5
Review: ‘Night Sky With Exit Wounds,’ Verses From Ocean Vuong;5;9
Paul Newman Who? Salad Dressing Company Adjusts to Reach Millennials;11;13
Advertising Industry Wrestles With Bias After a Lawsuit;3;24
Advertising Industry Wrestles With Bias After a Lawsuit;3;24
Why Good Governance Stock Index Lacks Expert Judgment;1;29
Northeastern’s Journey to N.C.A.A. Tournament Began With a Trip Abroad;3;24
Brandee Younger, a Harpist Finding Her Way to Jazz;2;29
After Election Surprise, Marketers Rethink How to Study Consumers;11;14
Jazz Listings for Sept. 23-29;9;23
A Fat Dad Election;11;8
The Public Face of Crazy Eddie Recalls the Real One;9;13
Berlin, Russia, Petra Kvitova: Your Wednesday Briefing;12;21
Samsung, U.S. Election, Cleveland Indians: Your Tuesday Briefing;10;11
Samsung, U.S. Election, Cleveland Indians: Your Tuesday Briefing;10;11
Wells Fargo Scandal May Be Sign of a Poisonous Culture;9;16
IndyCar Chief Looks to Build Interest Beyond the 100th Indianapolis 500;3;10
Warren Buffett, in Annual Letter, Rejects Candidates’ Message of U.S. Decline;2;27
Picture This: Marketers Let Emojis Do the Talking;3;7
Philip May, a Financier Who May Find It Harder to Be Low Key;7;14
Investors Get Stung Twice by Executives’ Lavish Pay Packages;7;8
Taking Shelter in Old-School Dividend Stocks;4;9
Bombing Suspect’s Hometown Is a Magnet for Immigrants;9;20
Super Bowl 50 Commercials Are Expected to Have a Lighter Tone;1;10
Philip May, a Financier Who May Find It Harder to Be Low Key;7;14
Samsung, U.S. Election, Cleveland Indians: Your Tuesday Briefing;10;11
Wells Fargo Scandal May Be Sign of a Poisonous Culture;9;16
How the Sugar Industry Shifted Blame to Fat;9;12
Jazz Listings for May 20-26;5;19
Berlin, Russia, Donald Trump: Your Tuesday Briefing;12;20
Jazz Listings for Nov. 11-17;11;11
He Had to Wait for LeBron, but Donald Trump Can Finally Set Up His Convention;6;17
The Siege Starts Without Warning;10;21
From the Mountains, to the Prairies, to the Ocean to Vanuatu;7;2
By Hiring Lisa M. Borders, W.N.B.A. Gets a Leader Who Follows the Game;2;10
Scientists, Give Up Your Emails;1;9
He’s 106. And Knows the Score.;11;7
Jazz Listings for April 29-May 5;4;28
Philip May, a Financier Who May Find It Harder to Be Low Key;7;14
Jazz Listings for Nov. 4-10;11;3
In Turkey’s Home of St. Nick, Far From North Pole, All Is Not Jolly;12;17
Review: ‘The Attention Merchants’ Dissects the Battle for Clicks and Eyeballs;11;2
Marisol, an Artist Known for Blithely Shattering Boundaries, Dies at 85;5;3
Business to Play Key Role as Georgia Weighs Bill on Religion and Gay Rights;3;22
How the Sugar Industry Shifted Blame to Fat;9;12
Jazz Listings for May 20-26;5;19
In Turkey’s Home of St. Nick, Far From North Pole, All Is Not Jolly;12;17
Review: ‘The Attention Merchants’ Dissects the Battle for Clicks and Eyeballs;11;2
Marisol, an Artist Known for Blithely Shattering Boundaries, Dies at 85;5;3
Pop, Rock and Jazz in NYC This Week;12;29
How the Chemical Industry Joined the Fight Against Climate Change;10;17
Stranded in the Snow, Travelers Camp in Cars and Make Do;1;23
Georgia Governor Rejects Bill Shielding Critics of Gay Marriage;3;28
Airbnb Vows to Fight Racism, but Its Users Can’t Sue to Prompt Fairness;6;19
Georgia Governor Rejects Bill Shielding Critics of Gay Marriage;3;28
Jazz Listings for Nov. 25-Dec. 1;11;25
Still Running at 119? Not So Fast;11;16
Tourists Gone Wild;12;9
Franco Took Decades to Leave the World Stage. His Statue? Only Days.;10;26
Venezuela Drifts Into New Territory: Hunger, Blackouts and Government Shutdown;5;28
Ad Agencies Need Young Talent. Cue the Beanbag Chairs.;4;18
Alex Da Corte’s ‘Free Roses’ Puts His Eccentricities on View;3;27
Marijuana Company Prepares to Cross State Lines, as Legally as Possible;11;9
Andrew Cyrille’s Late-Career Renaissance;10;17
Jazz Listings for Sept. 16-22;9;15
Jazz Listings for April 22-28;4;21
Marijuana Company Prepares to Cross State Lines, as Legally as Possible;11;9
Andrew Cyrille’s Late-Career Renaissance;10;17
As Soda Taxes Gain Wider Acceptance, Your Bottle May Be Next;11;26
Media’s Odd Couple: Proudly Freewheeling HBO and Buttoned-Up AT&T;10;30
Jazz Listings for Sept. 30-Oct. 6;9;29
Olympic Revelry Distracts Brazil (Momentarily) From Its Woes;8;13
Civil Rights History Finds Heightened Relevance in a Troubled Present;10;17
Jazz Listings for March 11-17;3;10
Jazz Listings for Sept. 30-Oct. 6;9;29
Chelsea Clinton’s Frustrations and Devotion Shown in Hacked Emails;10;28
Jazz Listings for July 15-21;7;14
Marijuana Company Prepares to Cross State Lines, as Legally as Possible;11;9
Andrew Cyrille’s Late-Career Renaissance;10;17
Jazz Listings for March 11-17;3;10
10 Things to Do Now in NYC;7;22
Women, Children and Razor Wire: Inside a Compound for Boko Haram Families;10;10
At Cannes, the Ad Industry Confronts the Rise of Facebook;6;27
10 Things to Do Now in NYC;10;28
Antarctic Life: No Dogs, Few Vegetables and ‘a Little Intense’ in the Winter;1;6
Women, Children and Razor Wire: Inside a Compound for Boko Haram Families;10;10
Morning Agenda: Sex, Fear and Video Surveillance at World’s Largest Hedge Fund;7;27
In Sicily, Making a Name for Vittoria;8;11
Rory McIlroy Says He Won’t Attend Olympics Over Zika Concerns;6;22
When TV Ads Go Subliminal With a Vengeance, We’ll Be to Blame;5;16
Sharing a Name With Barcelona, if Not Its Fortunes;1;19
Can Teenage Defiance Be Manipulated for Good?;9;12
Morning Agenda: Investor Nervousness Over Banking Giants;2;9
At Cannes, the Ad Industry Confronts the Rise of Facebook;6;27
When TV Ads Go Subliminal With a Vengeance, We’ll Be to Blame;5;16
The Magnificent 10: Restaurants That Changed How We Eat;9;20
Beyond Coal: Imagining Appalachia’s Future;8;17
Fidel Castro and the Moment of Departure;12;4
With Populist Anger Rising, Italy May Be Next Domino to Fall;12;2
Health Care Law’s Beneficiaries Reflect Its Strengths, and Its Faults;10;14
Don Buchla, Inventor, Composer and Electronic Music Maverick, Dies at 79;9;17
Hillary Clinton Struggles to Find Footing in Unusual Race;5;28
Can Teenage Defiance Be Manipulated for Good?;9;12
Morning Agenda: Investor Nervousness Over Banking Giants;2;9
Frustration in Queens as New Yorkers Dig Out From the Piles of Snow;1;25
Melania Trump’s Ljubljana, Then and Now;8;4
Hillary Clinton Struggles to Find Footing in Unusual Race;5;28
When Vanessa Beecroft Met Maya Rudolph;5;19
Power, Ambition and Betrayal in Hollywood: James B. Stewart on ‘Powerhouse’;8;9
Morning Agenda: Chairman Puts His Brand on Tribune;6;3
Alexi Pappas Shares Secrets From the Olympic Village;8;26
Morning Agenda: A Tidal Wave of Corporate Migrants Seeking Tax Shelters;1;26
Ratmansky and Lil Buck on the Spring Dance Calendar;2;17
36 Hours in Galway, Ireland;3;31
When Vanessa Beecroft Met Maya Rudolph;5;19
36 Hours in Galway, Ireland;3;31
Nick Offerman: By the Book;5;5
Jazz Listings for Oct. 14-20;10;13
Labeling the Danger in Soda;3;30
U.S. Fingerprints on Attacks Obliterating Yemen’s Economy;11;14
After Two Decades, W.N.B.A. Still Struggling for Relevance;5;28
A Constellation of Influencers: Behind the Curtain at Teneo;10;22
The Secrets in Guatemala’s Bones;6;30
Carrier Workers See Costs, Not Benefits, of Global Trade;3;19
Movie Listings for Nov. 4-10;11;3
Movie Listings for Oct. 28-Nov. 3;10;27
What Was the Greatest Era for Innovation? A Brief Guided Tour;5;13
Carrier Workers See Costs, Not Benefits, of Global Trade;3;19
Pop and Jazz Fall Preview: 105 Albums, Shows and Festivals;9;16
Why Did the Obamas Fail to Take On Corporate Agriculture?;10;5
The Faces of American Power, Nearly as White as the Oscar Nominees;2;26
Meet the Highest-Paid C.E.O.s in 2015;5;27
Edward Snowden’s Long, Strange Journey to Hollywood;8;30
25 Songs That Tell Us Where Music Is Going;3;10
Nigerians at the Mall;1;19
