Headline;Month;Day
The Supreme Court Is Being Hypocritical;10;11
‘Alibaba: The House That Jack Ma Built,’ by Duncan Clark;4;15
Tips for Landing a Career at Your Father’s Software Company;10;6
Your Monday Evening Briefing: Hillary Clinton, Donald Trump, Bitcoin;5;2
Banks Bet on the Next Big Thing: Financial Chatbots;10;26
Alphabet Earnings Disappoint as Google Ad Clicks Cost Less;4;21
The Power of ‘Why?’ and ‘What If?’;7;2
E.U. and U.S. Release Details on Trans-Atlantic Data Transfer Deal;2;29
Protecting Your Digital Life in 9 Easy Steps;11;16
Is Blind Hiring the Best Hiring?;2;25
Bull Market Blues;7;15
Is Blind Hiring the Best Hiring?;2;25
Here Come the iPhone 7 and iOS 10 Apps: What to Try First;9;21
Oracle’s $9.3 Billion Deal for NetSuite Will Bolster Its Cloud Offerings;7;28
Girl’s Name;7;26
How Europe Protects Your Online Data Differently Than the U.S.;1;31
Why Good Governance Stock Index Lacks Expert Judgment;1;29
Expa Labs Will Nurture Tech Start-Ups a Few at a Time;3;30
The Real Jobless Rate Is 42 Percent? Donald Trump Has a Point, Sort Of;2;10
Activision Buys Major League Gaming to Broaden Role in E-Sports;1;4
Bull Market Blues;7;15
Illumina Creating Company to Develop Early-Stage Cancer Detection Test;1;10
Amazon Has Big Plans for Alexa: Running the ‘Star Trek’ Home;8;7
360 Reviews Often Lead to Cruel, Not Constructive, Criticism;2;26
Friend Gave to de Blasio Just as Client Won Permit to Stage Festival;1;20
Aging in the Key of Humor;5;20
Apple’s Modest Product Upgrades Take Back Seat to Worries on iPhone Encryption;3;21
When Restless Billionaires Trip on Their Toys;1;12
Expa Labs Will Nurture Tech Start-Ups a Few at a Time;3;30
The Real Jobless Rate Is 42 Percent? Donald Trump Has a Point, Sort Of;2;10
Donald Trump Summons Tech Leaders to a Round-Table Meeting;12;7
Google Appeals French Privacy Ruling;5;19
Leaks Abound as Yahoo Auction Gets Underway;5;18
TiVo Said to Be in Merger Talks With Rovi;3;24
Apple Still Holds the Keys to Its Cloud Service, but Reluctantly;2;21
A Monopoly Donald Trump Can Pop;12;7
CrowdSignals Aims to Create a Marketplace for Smartphone Sensor Data;3;22
Donald Trump Summons Tech Leaders to a Round-Table Meeting;12;7
California Today: How Badly Do You Want That New Rail Line?;6;28
Make Algorithms Accountable;8;1
Review: ‘Chaos Monkeys’ Is a Guide to the Spirit of Silicon Valley;6;28
Artificial Intelligence’s White Guy Problem;6;25
Ads Evolve Into New Forms as Media Landscape Shifts;5;9
‘Silicon Valley’ Season 3, Episode 9: What Exactly Is Pied Piper?;6;20
The Week Ahead: Apple to Woo Developers, and Fed to Hold Monthly Meeting;6;12
Obama, at South by Southwest, Calls for Law Enforcement Access in Encryption Fight;3;11
Veterans, Patriots and Pawns;2;4
Intel’s Earnings Fall in Fourth Quarter, but Beat Expectations;1;14
Disney’s Hot Streak Stalls, Prompting Rumors That It’s Looking to Grow;10;3
A Robot May Be Training to Do Your Job. Don’t Panic.;9;10
Philip Knight of Nike to Give $400 Million to Stanford Scholars;2;24
