Headline;Month;Day
Adding Desktop Icons for Windows 10;12;6
Europe Presses American Tech Companies to Tackle Hate Speech;12;6
Facebook and Other Tech Companies Seek to Curb Flow of Terrorist Content;12;6
Microsoft Spends Big to Build a Computer Out of Science Fiction;11;20
The Built-In Accessibility Features of iOS;12;2
Making Movies With Windows 10;11;21
Parallels Between Europe’s Antitrust Cases Against Google and Microsoft;11;10
How LinkedIn Drove a Wedge Between Microsoft and Salesforce;11;5
Microsoft Puts Slack in Cross Hairs With New Office Chat App;11;2
Larry Ellison’s Hardball Tactics Win NetSuite for Oracle;11;7
Farhad and Mike’s Week in Tech: Microsoft, Apple and Halloween!;10;29
Business Leaders Support Steps to Rescue Climate;11;7
Farhad’s and Mike’s Week in Tech: Gaming as Prophylaxis to Elections;11;5
Microsoft Unveils Its First Desktop PC;10;26
A Formula for Easier-to-Read Excel Work Sheets;11;4
Daily Report: Microsoft, Ahead in the Cloud;10;21
Microsoft Shares Hit a High With Promise of the Cloud’s Profit Margins;10;20
Bill Belichick Throws In the Tablet;10;18
Earnings Reports for Goldman Sachs and Yahoo;10;16
How to Bid Adieu to Yahoo;10;12
Checking for the Windows 10 Anniversary Update;10;11
Looking for a Choice of Voices in A.I. Technology;10;10
Microsoft Reorganizes Its Research Efforts Around A.I.;9;29
Salesforce Is Said to Question Microsoft-LinkedIn Deal in Europe;9;29
U.S. Tech Giants Are Investing Billions to Keep Data in Europe;10;3
Daily Report: Trust Busters Destined to Dig into Data;9;30
Protecting Humans and Jobs From Robots Is 5 Tech Giants’ Goal;9;28
Daily Report: Twitter Attracts a Wide Range of Suitors;9;27
So Now You Want Windows 10 …;9;26
What It’s Like to Fight Online Hate;9;26
Get Sharper Text on Your Windows Screen;9;20
How to Manage Your Windows Drivers;9;15
Microsoft’s Challenge to Government Secrecy Wins Dozens of Supporters;9;3
Move Your Address Book From Outlook to Google;9;13
Will Trump Release His Tax Returns? Billionaire Pledges Up to $5 Million for Veterans if So;9;13
Goodbye, Ivory Tower. Hello, Silicon Valley Candy Store.;9;3
How Tech Giants Are Devising Real Ethics for Artificial Intelligence;9;1
Cloud Computing Brings Sprawling Centers, but Few Jobs, to Small Towns;8;26
In Buying LinkedIn, Microsoft Might Pay Heed to Monster;8;9
Finding Alternatives to Microsoft Excel;8;4
Picking a Digital Publishing Format;8;19
Converting Spreadsheets in Apple’s Numbers to Excel;8;17
Finding the Right Microsoft Office;7;20
Microsoft Earnings Are Up, Cushioned by Its Cloud Business;7;20
Taking the Windows 10 Express;8;8
Microsoft Wins Appeal on Overseas Data Searches;7;14
Microsoft Case Shows the Limits of a Data Privacy Law;7;18
When Every Company Is a Tech Company, Does the Label Matter?;8;6
Kevin Turner, Microsoft Executive, to Join Citadel Securities;7;7
Farhad’s and Mike’s Week in Tech: The Cautionary Tale of the Fall of Yahoo;7;30
Getting Extensions for Edge;7;25
Microsoft Makes a Marijuana Play;6;17
Google Races to Catch Up in Cloud Computing;7;25
Microsoft’s Biggest Deal;6;13
Why LinkedIn Will Make You Hate Microsoft Word;6;17
Why Microsoft Likes LinkedIn;6;14
Microsoft & LinkedIn C.E.O.s on Deal;6;13
Microsoft and Apple Making Headlines;6;13
Microsoft Buys LinkedIn for $26.2 Billion, Reasserting Its Muscle;6;13
The First Big Company to Say It’s Serving the Legal Marijuana Trade? Microsoft.;6;16
Microsoft’s Deal for LinkedIn Raises Red Flags;6;13
Handful of Advisers Behind Microsoft’s Deal for LinkedIn;6;13
Microsoft Finds Cancer Clues in Search Queries;6;7
Farhad’s and Mike’s Week in Tech: That Business of Microsoft Buying LinkedIn;6;18
Microsoft Takes Aim at Sony With Cheaper Xbox, Virtual Reality and Cross-Platform Games;6;13
Morning Agenda: Trump and Pence: Same Ticket, but Not the Same Page;7;19
For Microsoft, LinkedIn Deal Could Be a $26.2 Billion Time Machine;6;13
Microsoft Cutting 1,850 Jobs in Smartphone Unit;5;25
Farhad’s and Mike’s Week in Tech: One Game to Rule Them All;7;16
Morning Agenda: Yahoo Is Said to Collect Final Bids;7;15
Morning Agenda: Yahoo Is Said to Collect Final Bids;7;15
One Unspoken Reason Behind the Microsoft-LinkedIn Deal;6;14
Microsoft and Google Agree to Drop Mutual Complaints;4;22
Microsoft Awards First Grants to Help Expand Global Internet Access;5;24
Voice Searches With Cortana or Chrome;7;12
Microsoft Acquires Minecraft App for Schools;1;19
Microsoft Opens Its Corporate Data Software to Linux;3;7
Microsoft Will Not Donate Money to Republicans’ Convention;4;29
Microsoft Goes on Offensive Against Justice Department;4;15
Microsoft to Donate $1 Billion in Cloud Services to Nonprofits and Researchers;1;19
Microsoft Sues Justice Department to Protest Electronic Gag Order Statute;4;14
Finding a Non-Mac Alternative to Microsoft;11;9
Microsoft Faces New Scrutiny in China;1;5
Microsoft’s Cloud Business Falls Short of Investors’ Hopes;4;21
Microsoft to Close 2 Game Development Studios;3;7
Morning Agenda: Growing Unease as British Mutual Funds Block the Exit Doors;7;8
Microsoft Plumbs Ocean’s Depths to Test Underwater Data Center;1;31
Microsoft Trumpets Windows 10, and Pushes Into Sci-Fi Tech;3;30
Setting Up Tabs to Open Automatically in Microsoft Edge;1;6
Microsoft Profit and Revenue Fall, but Cloud Computing Grows;1;28
Setting Up Tabs to Open Automatically in Microsoft Edge;1;6
Nokia Phones May Find Life After Microsoft;5;18
Hiding From Windows 10;7;4
Park Geun-hye, Donald Trump, Microsoft: Your Friday Briefing;12;8
What to Try When the Start Menu Just Won’t Start;7;1
Microsoft Created a Twitter Bot to Learn From Users. It Quickly Became a Racist Jerk.;3;24
Third-Party Keyboards Give Mobile Users More Options;6;29
Downloading Video Streams to Go;6;28
Microsoft-LinkedIn Deal Ignites Twitter Speculation;6;16
What Microsoft’s Xamarin Purchase Says About the Cloud Computing Fight;2;24
Tech Makes Its Pitch to the Education Community;6;27
Amazon Unveils Online Education Service for Teachers;6;27
Sharing Screens Between PCs Running Different Versions of Windows;6;24
Buybacks by Companies Like Apple May Signal Danger, Not Growth;6;23
Weighing the System Upgrade Decision;6;17
Morning Agenda:  A Who’s Who of Financiers Expected at Trump Fund-Raiser;6;17
Unhitching the PC From OneDrive;6;16
Checking Your Windows 10 Lists;6;14
Morning Agenda: The Unspoken Reason Behind the LinkedIn Sale;6;14
A LinkedIn Timeline;6;13
Adding Features to Windows 10;6;9
How Gaming Helped Launch the Attack of the Internet Trolls;6;8
Getting Over Stage Fright With the Help of Your Smartphone;6;8
Expanding the Start Menu;6;6
Why the World Is Drawing Battle Lines Against American Tech Giants;6;1
Locating a Lost Windows Device;5;24
Morning Agenda: Hewlett-Packard Spinoff Prepares to Split Again;5;25
Silicon Valley’s Artificial Intelligence Marathon Is On;5;19
Locating Missing Windows Features;5;19
Why Windows 10 Upgrades Go Wrong, and How to Avoid It;5;18
What to Do if Windows 10 Eats Your Files;5;13
Brooklyn Judge Will Not Force Facebook’s Silence on Subpoenas;5;13
Saving a Web Page as a PDF;5;11
The Clash of Privacy, Legislation and Software;5;9
Restoring Windows Photo Viewer in Windows 10;5;4
Europe’s Case Against Google Might Help Rivals More Than Consumers;4;28
Removing QuickTime for Windows in a Hurry;4;25
Watching the Clock on That Windows 10 Deal;4;20
Recovering a Lost Windows Password;4;22
The No-Good Week in Tech’s (Hopeful) Trip to a Bright Future;4;22
What Chatbots Reveal About Our Own Shortcomings;4;21
Marking Up Web Pages in Windows 10;4;11
Billing by Millionths of Pennies, Cloud Computing’s Giants Take In Billions;4;10
Adding Links to the Windows 10 Start Menu;4;4
For Some Top Nonprofits, Changing the World Begins in Seattle;4;8
Silicon Valley Looks to Artificial Intelligence for the Next Big Thing;3;28
The Minecraft Generation;4;14
How to Live Without Windows 10;3;25
Keeping Track of Windows Updates;3;1
The Race Is On to Control Artificial Intelligence, and Tech’s Future;3;25
Finding Photo Programs That Recognize Faces;3;24
Taking Control of the Windows 10 Control Panel;3;30
Getting the Weather Report From Windows;3;11
Replacing Windows Media Center;1;29
Using Older Hardware With Windows 10;2;11
Windows 10 Upgrade Options for Vista Users;2;18
Watching DVD Movies on Windows 10;2;24
Protecting Personal Information From Virtual Assistants;1;27
Intuit, a True Survivor, Relocates to the Cloud;4;11
Tech Giants Battle for Top Cloud Talent;3;7
Reinstalling Windows 10;2;4
Daily Report: Divergent Fortunes in Cloud Computing;1;29
Small Cloud Computing Firm Turns to Helping Others Work With Giants;8;26
Bill Gates on Government and Privacy;2;23
Printing a Paper Backup of Your iCloud Contacts;1;11
Daily Report: The Tech News Cycle is About to Ramp Up;1;11
Apple Letter on iPhone Security Draws Muted Tech Industry Response;2;18
Moving Files to a Mac From a PC;2;5
Recording Live Television in Windows 10;3;14
F.B.I. Chief Presses Congress to Act on Data Privacy;2;25
F.B.I. Chief Presses Congress to Act on Data Privacy;2;25
Magic Leap, an Augmented Reality Firm, Raises $793 Million;2;2
Creating a Family Website;2;1
Bill Gates Weighs In on Apple’s Clash With the F.B.I.;2;23
Daily Report: Earnings, Earnings, Earnings;1;25
Making the Screen Easier to Read;1;22
HP Inc. Joins Companies Declining to Contribute to G.O.P. Convention;5;31
Next Big Tech Corridor? Between Seattle and Vancouver, Planners Hope;10;2
A Brief Explanation of Apple’s Showdown With the U.S. Government;2;26
Will Amazon Stand Apart From Weak Tech Earners?;4;28
Fund Managers Win With Tech Stalwarts and Burly Brand Names;1;15
Starting Windows 10 Without a Password;2;15
Checking the Graphics Card Specifications on Your Computer;3;2
Keeping Your Android Files in Sync With a Computer;4;19
Tech’s ‘Frightful 5’ Will Dominate Digital Life for Foreseeable Future;1;20
Taking the Temperature Inside the (Feverish) Cloud;10;2
Apple Is Rolling Up Backers in iPhone Privacy Fight Against F.B.I.;3;3
Aaron Bell of AdRoll: The Truth May Hurt, but It Also Heals;3;18
Picking a Windows 10 Security Package;1;12
Looking Beyond the Internet of Things;1;1
Sizing Up Apple’s New Downsized Devices;3;30
Siri, Alexa and Other Virtual Assistants Put to the Test;1;27
Bill Gates on Books and Blogging;1;4
Subpoenas and Gag Orders Show Government Overreach, Tech Companies Argue;10;4
Ex-N.F.L. Player’s New Team Takes On Challenges of A.L.S.;1;2
Farhad and Mike’s Week in Tech: Lessons From Earnings Season;1;30
Logging Into Windows 10 With a Favorite Photo;3;17
Dodging the Computer Kidnappers;5;9
How Does My Browser Recognize Malware?;12;22
Morning Agenda: Ethereum Challenges Bitcoin;3;28
Morning Agenda: Ethereum Challenges Bitcoin;3;28
Tech Giants’ Earnings, the Fed Meets and a Deadline on a Data-Sharing Deal;1;24
Nintendo Switch Console Is Met With Skepticism From Investors;10;21
Nintendo Switch Reaches for a New Market With Home-and-Mobile Console;10;20
Yahoo Is a Case Study in Poor Timing;7;26
For Apple, Potential Flaw May Be a Wake-Up Call;3;23
The Week in Tech: The Next Big Thing, According to Mark Zuckerberg;4;16
Karin Reiss, Lawrence Peters;5;15
Google Shuts Out Competitors on Android? Hardly;4;27
Salesforce to Use Amazon’s Cloud to Expand in Canada and Australia;5;26
Cloud Services Show Their Value in Earnings Reports;4;29
Twitter’s Troubles and Snap’s Appeal: It’s All About the Mojo;10;12
Facebook to Shut Down Parse, Its Platform for Mobile Developers;1;28
New Chinese Rules on Foreign Firms’ Online Content;2;20
The Eight-Second Attention Span;1;22
Why Yahoo Sold Its Internet Business;7;18
Iowa’s Republican Caucus Results, Precinct by Precinct;2;2
An Expanding Universe of Space Apps;2;3
Iowa’s Democratic Caucus Results, Precinct by Precinct;2;2
Corrections: February 2, 2016;2;2
Corrections: February 2, 2016;2;2
Yahoo Said to Have Aided U.S. Email Surveillance by Adapting Spam Filter;10;5
Apple’s Emoji Gun Control;8;16
Off to College? Maybe These Devices Should Go Along;8;10
Artificial Intelligence as a Bridge for Art and Reality;10;25
Twitter Is Said to Be Discussing a Possible Takeover;9;23
Brittany Bettman, Weston Baker;5;15
Apple’s New MacBook Pro Gets More Touchy;10;27
Facebook Helps Develop Software That Puts Students in Charge of Their Lesson Plans;8;9
Ethereum, a Virtual Currency, Enables Transactions That Rival Bitcoin’s;3;28
Apple’s New MacBook Pro Gets More Touchy;10;27
Facebook Helps Develop Software That Puts Students in Charge of Their Lesson Plans;8;9
Apple Sets Its Sights on Virtual Reality;1;29
Dropbox May Not Be LeBron James, but It Is Still in the Game;2;3
Twitter Is Said to Be in Continued Talks With Salesforce;10;11
Daily Report: WhatsApp Is Embraced by World’s Immigrants;12;22
To Compete With Mobile, Sony Tailors PlayStation to Next-Generation TVs;9;7
Farhad and Joe Examine Silicon Valley’s Pull in Washington;3;5
How Big Are Those Killer Asteroids? A Critic Says NASA Doesn’t Know.;5;23
New Research Center to Explore Ethics of Artificial Intelligence;11;2
To Compete With Mobile, Sony Tailors PlayStation to Next-Generation TVs;9;7
Artificial Intelligence Is Far From Matching Humans, Panel Says;5;25
Facebook Bets on Bots for Its Messenger App;4;12
China’s New Requirement for U.S. Tech Companies;5;17
Your Thursday Evening Briefing: Hillary Clinton, Bernie Sanders, Boko Haram;4;14
After Conventions, a Debt to Donors;5;11
Daily Report: New York Searches for Its Anchor Tech Company;5;2
Google Showcases Its Cloud Efforts, Determined to Catch Up to Rivals;3;23
Morning Agenda: Deutsche Gloom, Och Ziff Bribery, More Tech Reformation;9;30
Orlando, Hillary Clinton, Donald Trump: Your Monday Evening Briefing;6;13
Daily Report: New York Searches for Its Anchor Tech Company;5;2
Your Thursday Evening Briefing: Hillary Clinton, Bernie Sanders, Boko Haram;4;14
Storing Web Pages, and Much More, in Google Keep;12;9
Moving PDFs to a PC From an iPad;4;21
Explaining E.T.F.s and How They Gained Their Allure;2;22
Google’s Calendar Now Finds Spare Time and Fills It Up;4;13
Video Feature: Apps Give Journal Writers Inspiration, and Maybe a Nudge;1;6
Hey Siri, Can I Rely on You in a Crisis? Not Always, a Study Finds;3;14
The Promise of Artificial Intelligence Unfolds in Small Steps;2;28
Google’s Antitrust Woes in Europe Are Likely to Grow;4;19
Glenn Schiffman, Veteran Media Investment Banker, Joins IAC;4;7
Storing Web Pages, and Much More, in Google Keep;12;9
Moving PDFs to a PC From an iPad;4;21
Explaining E.T.F.s and How They Gained Their Allure;2;22
Google’s Antitrust Woes in Europe Are Likely to Grow;4;19
Windows Surface vs. Apple iPad: The Best Pro Tablets;12;8
Earnings Reports From Banking Leaders and Tech Giants;7;17
Google to Ban All Payday Loan Ads;5;11
How Society Pays When Women’s Work Is Unpaid;2;23
Make Firefox Open Gmail to Send a Message;10;27
With Imposed Transparency and Concerned Millennials, a Boom in Corporate Responsibility?;1;25
Google’s Calendar Now Finds Spare Time and Fills It Up;4;13
Video Feature: Apps Give Journal Writers Inspiration, and Maybe a Nudge;1;6
Daily Report: The Feds Can’t Resist Silicon Valley’s Data;10;6
Trump’s Meeting With Tech Leaders Turns Into a Charmfest;12;15
Now You Can Write the Great American Novel on the Subway;4;13
Vast Group of New Video Games and Hardware Jostle for Holiday Attention;10;26
Daily Report: More Earnings, Earnings, Earnings;2;1
Filters That Add a Dash of Dazzle to Smartphone Photos;2;10
Your Weekend Briefing: Donald Trump, Oregon, Novak Djokovic;1;31
The Fight Over Privacy and Secrecy in Government Investigations;5;16
Filters That Add a Dash of Dazzle to Smartphone Photos;2;10
Your Weekend Briefing: Donald Trump, Oregon, Novak Djokovic;1;31
Artificial Intelligence Software Is Booming. But Why Now?;9;18
Make the Mac’s Share Menu More Useful;9;27
Jo Cox, EgyptAir, Golden State Warriors: Your Thursday Evening Briefing;6;16
Taking Baby Steps Toward Software That Reasons Like Humans;3;7
The Twitter Post, Take 2;12;13
Opening Links in New Windows;7;19
Kymeta Raises $62 Million in Investment Led by Bill Gates;1;11
Trump’s Meeting With Tech Leaders Turns Into a Charmfest;12;15
Daily Report: Video Is Everywhere and Regulators Have Noticed;9;15
Vast Group of New Video Games and Hardware Jostle for Holiday Attention;10;26
Apple Policy on Bugs May Explain Why Hackers Would Help F.B.I.;3;23
Cloud Computing, an Idea With Old Roots;7;20
Intel to Cut 12,000 Jobs as PC Demand Plummets;4;19
Getting Your Gmail Just the Way You Like It;1;4
Russia Prepares to Block LinkedIn After Court Ruling;11;10
Exxon Mobil’s Sterling Credit Is Downgraded by Standard & Poor’s;4;26
E.U. Rules Look to Unify Digital Market, but U.S. Sees Protectionism;9;13
Orlando, Apple, Cleveland Cavaliers: Your Tuesday Briefing;6;14
Google Home: A Voice-Activated Device That Already Knows You;5;18
E.U. Rules Look to Unify Digital Market, but U.S. Sees Protectionism;9;13
Finding Your Path;9;8
G.E., the 124-Year-Old Software Start-Up;8;27
Paying $15 Billion for Twitter Will Be Hard for Anyone to Justify;10;7
Keeping Your Files Safe in the Sky;9;8
Telling Sign? Many Supporters of ‘Brexit’ Expect Defeat;6;21
Saving Your Data Allowance;5;17
Amazon Prime Video, Home and Away;1;14
E.U. Rules Look to Unify Digital Market, but U.S. Sees Protectionism;9;13
Stratolaunch’s Gargantuan Flying Launchpad Edges Toward the Skies;6;20
Software as Weaponry in a Computer-Connected World;6;7
Orlando, Apple, Cleveland Cavaliers: Your Tuesday Briefing;6;14
Google Home: A Voice-Activated Device That Already Knows You;5;18
Aleppo, John Glenn, Donald Trump: Your Friday Briefing;12;9
Daily Report: Google’s Day in Europe’s Court Highlights Nature of New Tech;10;31
Daily Report: A Light Local Hand on Tech;9;12
Google’s Antitrust Charges in Europe Need Quick Action;7;14
Instagram Introduces New Tools Meant to Curb Abuse and Expand Privacy;12;6
G.E., the 124-Year-Old Software Start-Up;8;27
Here Is Your Emmy Awards Cheat Sheet;9;18
MacArthur Foundation’s 23 ‘Genius’ Grant Winners for 2016;9;22
Pandora’s Worrisome Sign: Return of the Founder as C.E.O.;3;28
Zenefits to Lay Off 17% of Work Force;2;26
China’s Increasingly Muffled Press;2;24
E.U. Rules Look to Unify Digital Market, but U.S. Sees Protectionism;9;13
The Olympics, Where Winning Gold Can Mean Losing Billions;8;16
Student Question | What New Emojis Does the World Need?;5;13
Want to Be Forgotten Online Without Google? Forget It.;4;19
Chicago Cubs, Mosul, Jacob Zuma: Your Thursday Briefing;11;3
The Olympics, Where Winning Gold Can Mean Losing Billions;8;16
Student Question | What New Emojis Does the World Need?;5;13
Want to Be Forgotten Online Without Google? Forget It.;4;19
Bill Gates Leads New Fund as Fears of U.S. Retreat on Climate Grow;12;13
Election Day Choices;11;8
Orlando, Donald Trump, Golden State Warriors: Your Weekend Briefing;6;19
What We’re Reading;3;18
2016 in Review: The Year’s Best Apps;12;14
Morning Agenda: Bank Rule Distorting Performance Is Repealed;1;6
Daily Report: Salesforce Has Had Its Eye on Twitter. But Why?;10;7
What We’re Reading;3;18
2016 in Review: The Year’s Best Apps;12;14
Take Extra Steps to Keep Your Personal Information Secure;9;23
Putting Your Smartphone on a Data Diet;4;15
Entire Yahoo Board Would Be Ousted if Starboard Value Gets Its Way;3;24
Yahoo’s Sale to Verizon Ends an Era for a Web Pioneer;7;24
Mosul, Jacob Zuma, Federal Reserve: Your Thursday Briefing;11;2
European Tech Scene Begins to Feel Silicon Valley’s Woes;2;23
Daily Report: Google’s Renewable Cloud;12;6
Mosul, Jacob Zuma, Federal Reserve: Your Thursday Briefing;11;2
European Tech Scene Begins to Feel Silicon Valley’s Woes;2;23
Daily Report: Google Pixel and the New Long Game;10;18
Cheap, Great HDMI Cables;5;10
Moving CD-Ripped Music From the Computer to the iPad;4;1
Nintendo to Re-Release NES Games, No Blowing Necessary;7;15
Entire Yahoo Board Would Be Ousted if Starboard Value Gets Its Way;3;24
Apple Shareholders Show Their Support for Tim Cook;2;26
Build Your Own Computer;11;25
What’s on TV Sunday;6;26
Hillary Clinton Says She Is the Only Candidate With a Plan to Defeat the Islamic State;3;22
Obama’s Budget Urges a Deeper Commitment to Computer Education;1;30
Nintendo to Re-Release NES Games, No Blowing Necessary;7;15
Rwanda’s Entrenched President;1;11
Morning Agenda: Wells Fargo Hit Again, Bygone Times;11;2
Daily Report: Google’s Renewable Cloud;12;6
Paul, Weiss Hires 4 Partners to Bolster Antitrust Practice;8;4
Daily Report: Venture Capital’s Endangered Middle Class;8;3
Will Donald Trump’s Corporate ‘Tax Holiday’ Create Jobs? Not Necessarily;12;26
Europe Tried to Rein In Google. It Backfired.;4;18
Nintendo to Re-Release NES Games, No Blowing Necessary;7;15
The Gamble of Tronc’s ‘Just Say No’ Defense;8;30
Apple’s Privacy Fight Tests Relationship With White House;2;27
The Silicon Valley of Space Start-Ups? It Could Be Seattle;7;29
What’s on TV Wednesday: ‘Hairspray Live!’ and ‘Shut Eye’;12;7
‘I’m Here to Help,’ Trump Tells Tech Executives at Meeting;12;14
Xi Jinping’s News Alert: Chinese Media Must Serve the Party;2;22
Yahoo and the Online Universe According to Verizon;7;30
Cella Irvine, Digital Media Pioneer Who Led About.com, Dies at 59;11;12
Character, Fate and Yahoo;7;15
What’s on TV Sunday: The 68th Emmy Awards and Bruce Springsteen;9;18
Yahoo and the Online Universe According to Verizon;7;30
Private Sector Is Helping Puerto Rico Fight Zika;5;23
Tech Companies, New and Old, Clamor to Entice Cloud Computing Experts;3;7
Cella Irvine, Digital Media Pioneer Who Led About.com, Dies at 59;11;12
Character, Fate and Yahoo;7;15
Will Donald Trump’s Corporate ‘Tax Holiday’ Create Jobs? Not Necessarily;12;26
What’s on TV Wednesday: ‘Hairspray Live!’ and ‘Shut Eye’;12;7
Oracle, Having Bet Billions on Its Future, Sets Sights on Data Analysis;8;1
Zenefits, in a Shake-Up, Appoints New C.E.O., Replacing Parker Conrad;2;9
Apple to Testify Again, and VW Due Date Nears;4;18
Artificial Intelligence Swarms Silicon Valley on Wings and Wheels;7;17
African Elephant Population Dropped 30 Percent in 7 Years;9;1
Alphabet Program Beats the European Human Go Champion;1;27
Tech Companies, New and Old, Clamor to Entice Cloud Computing Experts;3;7
WhatsApp Is Briefly Shut Down in Brazil for a Third Time;7;19
Yahoo Again Considers Selling Itself as Investor Pressure Rises;2;3
Corrections: January 7, 2016;1;7
Apple Offers Free App to Teach Children Coding (iPads Sold Separately);9;12
Morning Agenda: Timothy Cook’s Tax Arguments, Tronc’s ‘Just Say No’ Defense, Alphabet Drives Onto Uber’s Turf;8;31
Alphabet Program Beats the European Human Go Champion;1;27
Amazon Inspire Removes Some Content Over Copyright Issues;6;29
Morgan Stanley to Rate Employees With Adjectives, Not Numbers;6;2
Apple Offers Free App to Teach Children Coding (iPads Sold Separately);9;12
Morning Agenda: Timothy Cook’s Tax Arguments, Tronc’s ‘Just Say No’ Defense, Alphabet Drives Onto Uber’s Turf;8;31
Google Fined for Breaking Russian Antitrust Rules With Android;8;11
The Great Instagram Logo Freakout of 2016;5;11
Goldman Sachs’s Eric Dobkin, Father of Modern I.P.O., to Retire;3;2
Chinese Group Bids $1.2 Billion for Company Behind Opera Web Browser;2;10
Researchers Uncover a Flaw in Europe’s Tough Privacy Rules;6;3
U.S. Asks Tech and Entertainment Industries Help in Fighting Terrorism;2;24
Apple Becomes a Green Energy Supplier, With Itself as Customer;8;23
Starboard Value’s Rise to Activist Prominence;4;27
Rail Crossing Warnings Are Sought for Mapping Apps;12;20
Yahoo’s Suitors Uncover Few Financial Details;4;15
Apple’s iOS 10 Is Available for Beta Testers Who Want a Head Start;7;7
Flowing Internet Video Streams Through the Television;7;29
We Gave Four Good Pollsters the Same Raw Data. They Had Four Different Results.;9;20
Bill Gates’s Clean-Energy Moon Shot;2;23
Amazon’s Profits Grow More Than 800 Percent, Lifted by Cloud Services;7;28
Amazon’s Profits Grow More Than 800 Percent, Lifted by Cloud Services;7;28
Edward Snowden to Help Develop a Safer Phone for Journalists;7;21
Apple Becomes a Green Energy Supplier, With Itself as Customer;8;23
Starboard Value’s Rise to Activist Prominence;4;27
Bill Gates’s Clean-Energy Moon Shot;2;23
Apple’s iOS 10 Is Available for Beta Testers Who Want a Head Start;7;7
Ford’s Planned New Headquarters Borrow Some Silicon Valley Sheen;4;13
We Gave Four Good Pollsters the Same Raw Data. They Had Four Different Results.;9;20
Bridgewater Names Ex-Apple ‘Podfather’ a Co-C.E.O.;3;10
Does the Messaging Service Telegram Take Privacy Too Far?;9;5
Twitter, Grappling with Anemic Growth, Tries to Bolster Its Advertising Business;7;26
Yahoo Edges Toward Its Sale With a Limp;7;19
Slowdown in Merger Deals Attributed to Political Uncertainty;7;1
Bridgewater Names Ex-Apple ‘Podfather’ a Co-C.E.O.;3;10
Does the Messaging Service Telegram Take Privacy Too Far?;9;5
Facebook Faces German Antitrust Investigation;3;2
Tips for Landing a Career at Your Father’s Software Company;10;6
Your Monday Evening Briefing: Hillary Clinton, Donald Trump, Bitcoin;5;2
Your Monday Evening Briefing: Donald Trump, Angela Merkel, Syria;3;14
U.N. Rights Chief Says Unlocking Gunman’s iPhone Could Open ‘Pandora’s Box’;3;4
Bridgewater Names Ex-Apple ‘Podfather’ a Co-C.E.O.;3;10
Google Home vs. Amazon Echo. Let the Battle Begin.;5;18
Amazon’s Cloud Business Lifts Its Profit to a Record;4;28
Tips for Landing a Career at Your Father’s Software Company;10;6
Your Monday Evening Briefing: Hillary Clinton, Donald Trump, Bitcoin;5;2
Banks Bet on the Next Big Thing: Financial Chatbots;10;26
Alphabet Earnings Disappoint as Google Ad Clicks Cost Less;4;21
Canada Today: Giving Thanks, Canadian Style;10;7
Apple May Soon Open Retail Stores in India;6;20
