Headline;Month;Day
Marilyn Monroe’s Musings, Letters and Lipstick to Be Auctioned;5;16
The Eight Best Films T Saw at Sundance This Year;1;29
Bill Backer, Who Taught the World (and Don Draper) to Sing, Dies at 89;5;16
Feeling Cornered, Coal Industry Borrows From Tobacco Playbook, Activists Say;8;16
California Today: $2 More for a Pack of Cigarettes?;9;30
How to Gauge a C.E.O.’s Value? Hint: It’s Not the Share Price;6;17
An Overwhelming War Memorial That Few Ever See;6;14
What’s on TV Monday: Madonna Accepts an Award and President Obama Joins Trevor Noah on ‘The Daily Show’;12;12
Tony Gwynn’s Family Sues Tobacco Industry, Seeking Recourse Over Fatal Habit;5;23
Art Museums Seek a Green Palette;3;15
Defending David Against the World’s Goliaths in International Court;7;15
Art Museums Seek a Green Palette;3;15
The 9.8.16 Issue;9;30
Ferrari’s Long Road Back to the Top;9;2
Review: ‘The Room,’ a Pinter Play That Won’t Be Onstage for Long;2;12
Jim Palmer, at 70, Is Still Talking Pitching;5;28
Inside Breaking News: On the Metro Desk;6;21
Fitzwilliam Museum Celebrates the Birth and Glory of Color Manuscripts;9;8
Things to Do in New Jersey, April 23 through May 1;4;22
Who Will Tell the Story of Slavery?;6;29
Walking the Walk in Hamilton’s Old Stomping Grounds;1;21
Making Museums Moral Again;3;17
New York Today: No Bed of Roses;2;22
Things to Do in New Jersey, April 23 through May 1;4;22
John Margolies, Photographer of Whimsical Architecture, Dies at 76;6;3
Things to Do in New Jersey, April 30 through May 8;4;28
Things to Do in New Jersey, April 9 Through April 17;4;9
Who Will Tell the Story of Slavery?;6;29
Ambassador Spurs an Irish-American Cultural Exchange;10;10
Things to Do in New Jersey, Mar. 5 Through Mar. 12;3;3
Review: ‘The Glory of the World,’ About Thomas Merton;1;22
Things to Do in New Jersey, May 14 Through May 22;5;12
Things to Do in New Jersey, May 7 through May 15;5;7
Megan Abbott: By the Book;7;21
Review: Eric Fair’s ‘Consequence,’ a Memoir by a Former Abu Ghraib Interrogator;4;4
Things to Do in New Jersey, June 11 Through June 19;6;10
Surprise: The Upper East Side Turns Experimental (for Art);4;21
Things to Do in New Jersey, June 4 Through June 12;6;2
Wounded Warrior Project Spends Lavishly on Itself, Insiders Say;1;27
N.F.L.’s Flawed Concussion Research and Ties to Tobacco Industry;3;24
New York Today: Final Call for Voters;10;14
Things to Do in New Jersey, May 21 Through May 29;5;20
Daniel Silva: By the Book;9;1
New Jersey Drivers Fume as Road and Bridge Work Stops;7;20
Things to Do in New Jersey, April 2 Through April 10;4;1
Things to Do in New Jersey, May 28 Through June 5;5;27
David Friedman, Choice for Envoy to Israel, Is Hostile to Two-State Efforts;12;16
Taking a Trip, Literally, on Colorado’s Pot Trail;4;14
Movie Listings for Aug. 26-Sept. 1;8;25
Classical Music to Come: A Finnish Star, Minimalism and Wagner;9;16
Movie Listings for Sept. 9-15;9;8
Things to Do in New Jersey, March 19 Through March 27;3;17
Movie Listings for Sept. 2-8;9;1
My Parents, My Landlords;2;19
Meet the Highest-Paid C.E.O.s in 2015;5;27
Things to Do in New Jersey, March 12 Through 27;3;10
Things to Do in New Jersey, March 26 Through April 3;3;24
The Faces of American Power, Nearly as White as the Oscar Nominees;2;26
Dance This Season: Tap, Ballet and the Inexplicable;9;16
The Art of Vulgarity;8;15
Art Fall Preview: From East Coast to West Coast. From Concrete to Ethereal.;9;16
Movie Listings for Jan. 29-Feb. 4;1;29
Things to Do on Long Island, June 18 Through June 26;6;16
Things to Do on Long Island, June 11 Through June 19;6;10
Coca Crystal’s Zany Downtown Circus;12;21
Things to Do on Long Island, July 9 Through July 17;7;8
The Year in Reading;12;19
