Headline;Month;Day
Randi Malkin Steinberger’s “No Circus” Photos;10;5
Fashion Week Photo Diary: Chanel and Kenzo;10;5
Lavish, Vintage-Inspired Emeralds;10;5
Inside Fabrizio Viti’s Doll Collection;10;5
How to Get Kenzo’s All-Red Disco Beauty Look;10;5
Soo Joo Park Transforms at Kenzo;10;5
A Bizarre, Colorful California Rite of Passage, in Photos;10;5
Fashion That Doesn’t Let You Use Your Hands;10;5
Sarah Jessica Parker and Ta-Nehisi Coates, on New Literary Paths;10;5
In Paris, the Shoe Designer Who Collects Dolls;10;5
Five Graphic, Arresting Mirrors;10;4
20 Years of the Hugo Boss Prize;10;4
Fashion Week Photo Diary: Alexander McQueen, Giambattista Valli, Hermès and Sonia Rykiel;10;4
Maria Grazia Chiuri and the History of Women at Dior;10;3
Louise Bourgeois, in Her 90s;10;3
In the English Countryside, Intimate Works by — and of — Louise Bourgeois;10;3
