Headline;Month;Day
Trump Revives Defense of Charitable Foundation Amid Inquiry;12;28
Cuomo’s Proposal for an Executive-Branch Prosecutor Is Called a ‘Scheme’;12;23
Officer Is Cleared in Fatal Shooting of Unarmed Man in Yonkers;12;22
How Social Isolation Is Killing Us;12;22
Financial Vetting Goes Slowly for Trump’s Wealthy Cabinet Picks;12;22
The Lives They Lived;12;21
Peter King’s Really Bad Idea;12;20
Trump’s Treasury Pick Moves in Secretive Hedge Fund Circles;12;20
Expect a Cozy Trump-Telecom Alliance;12;16
Are Americans Experiencing Collective Trauma?;12;16
To Combat Trump, Democrats Ready a G.O.P. Tactic: Lawsuits;12;15
For Trump’s Wealthy Cabinet, Prospect of a Sweet Tax Break;12;14
CBS-Viacom Reunion? Redstones May Seek a Better Deal;12;12
Donald Trump’s Wealthy Cabinet Picks to Undergo Financial Scrutiny He Didn’t Face;12;13
Goldman President Named Trump Adviser, Opening Door for Younger Executives;12;12
AT&T Appeals to Cord-Cutters With DirecTV Now, a New Streaming Service;11;29
Murdochs Take Another Shot at Sky;12;9
How to Play the Trump Stock Market Rally;12;9
Team Trump’s New Pledge on Tax Cuts;12;6
Terrorism Conviction of a Wiretapped American Is Upheld on Appeal;12;6
Hearings Will Unmask ‘Swamp Creatures’ in Trump’s Cabinet, Democrats Say;12;3
Trump Treasury May Mean Independence for Fannie and Freddie;12;2
Anthony Weiner Fined $65,000 for Campaign Finance Violations;12;1
Donald Trump’s Cabinet Choices Deepen an Age-Old Republican Rift;12;2
Donald Trump Is Betting That Policy Expertise Doesn’t Matter;12;1
Now, Netflix Users Can Watch Movies Offline on Their Mobile Devices;11;30
Succession Questions Rise at Goldman Sachs;12;1
Trump’s Economic Cabinet Picks Signal Embrace of Wall St. Elite;12;1
Why the Trump Team’s Economic Promises Will Be Hard to Execute;11;30
Steven Mnuchin Is More Pragmatist Than Ideologue;11;30
Steven Mnuchin, Expected Treasury Pick, Is an Outsider to Public Policy;11;30
Trump Taps Hollywood’s Mnuchin for Treasury and Dines With Romney;11;29
Confronting Racism in Berlin, One Offensive T-Shirt at a Time;11;16
Rezoning Plan for Schools on Upper West Side Is Approved After Bitter Fight;11;23
Trump Foundation Won’t Pay Any of $25 Million University Settlement;11;21
Exxon Mobil Accuses the Rockefellers of a Climate Conspiracy;11;21
Obama Is Considering Removing N.S.A. Leader;11;19
How T. Boone Pickens Sits Tight in the Riskiest of Businesses;11;12
Donald Trump Agrees to Pay $25 Million in Trump University Settlement;11;18
National Security Agency Said to Use Manhattan Tower as Listening Post;11;18
T. C. Boyle’s New Novel Taps the Biosphere’s Erotic Potential;11;11
Minneapolis Plan to End Big Banks;11;17
Morning Agenda: JPMorgan Said to Settle Bribery Case, Ending ‘Too Big to Fail,’ Goldman’s Pitch to the Masses;11;17
Minneapolis Fed Chief Proposes Eliminating ‘Too Big to Fail’ Banks;11;17
House Foe of Dodd-Frank Says Overhaul Will Face Test in Senate;11;16
A Heavy Heart May Have Rolled Pluto Over;11;16
N.F.L. Agrees to Stop Calling for Price Floor on Resold Tickets;11;15
C.E.O.s Ponder a New Game, With Trump’s Rules;11;15
Nasdaq Names a New Chief Executive: Adena Friedman;11;15
What About the Customers?;11;12
Donald Trump’s Cabinet Is Complete. Here’s the Full List.;11;12
Review: In Liz Gerring’s Latest, Words Dance, Too;11;11
Donald Trump Could Move From Deal Maker to Deal Slayer;11;11
New Charges for 2 Flophouse Operators Accused in Medicaid Fraud Scheme;11;11
Future of Big Mergers Under Trump? Like Much Else, It’s Unclear;11;10
Squirrel Nutkin Could Have Had Leprosy, Study Finds;11;10
An Anthropocene Journey;11;8
Larry Ellison’s Hardball Tactics Win NetSuite for Oracle;11;7
Morning Agenda: VW Scandal, Banker Bonuses, Media Mergers and Minions;11;7
How Comcast and NBCUniversal Used Minions to Fuse an Empire;11;7
New York Attorney General to Investigate Taser Death of Bronx Man;11;6
Media’s Odd Couple: Proudly Freewheeling HBO and Buttoned-Up AT&T;10;30
If a ‘Big Whack’ Made the Moon, Did it Also Knock the Earth on Its Side?;11;4
The AT&T-Time Warner Merger: A Match Built on Hope;10;28
Whales Can Really Rock With Their Mellow Songs;11;4
Collusion Caused Dodgers TV Blackout, Justice Department Says;11;3
For AT&T Chief, Time Warner Deal Is the Peak of an Ambitious Climb;10;29
AT&T’s Vision of Ultrafast Wireless Technology May Be a Mirage;10;27
AT&T’s Bid for Time Warner Could Bolster Boutique Advisers;10;27
Promises, Promises From AT&T;10;25
Will the AT&T Merger Hurt Consumers?;10;25
AT&T Could Find a Lesson in Comcast’s Media Merger;10;26
AT&T Cheerleading Squad for Merger: Nearly 100 Lobbyists;10;25
Jack T. Chick, Cartoonist Whose Tracts Preached Salvation, Dies at 92;10;27
Blockbuster Deals in a Race to Stay Ahead of the Competition;11;1
Opposition to an AT&T Giant;10;24
How Waning Competition Deepens Labor’s Plight;11;1
Morning Agenda: Markets and Trump, Time to Team Up, New Currency Frenzy;11;1
AT&T and Time Warner C.E.O.s;10;24
AT&T’s Bid for Time Warner Faces Fierce Political Opposition;10;25
Making Sense of AT&T’s Bid for Time Warner;10;24
Swift Opposition to Resurrection of AT&T Giant;10;24
Code Names and Covert Meetings in AT&T’s Courtship of Time Warner;10;25
Why AT&T Isn’t Sweating the Breakup Fee in Its Time Warner Deal;10;24
Individualized Ads on TV Could Be One Result of AT&T-Time Warner Merger;10;26
AT&T and Time Warner Seek to Mollify Deal’s Critics;10;24
Seeking Ownership of Both the Information and the Superhighway;10;31
To Secure a Mega-Merger, AT&T Plans to Shoulder Mega-Debt;10;23
A Chilly Reaction to AT&T-Time Warner Deal;10;25
Morning Agenda: AT&T and Time Warner, Behind the Curtain at Teneo;10;24
AT&T-Time Warner Deal Is a Shot in the Dark;10;24
15 of T’s Most Enjoyable Stories in 2016;12;30
35 Incredible Rooms Featured in T This Year;12;26
With AT&T-Time Warner Deal Brewing, a Focus on Preserving CNN’s Integrity;10;24
AT&T Agrees to Buy Time Warner for $85.4 Billion;10;22
Who’s Behind the Deal Between AT&T and Time Warner;10;23
N.S.A. Appears to Have Missed ‘Big Red Flags’ in Suspect’s Behavior;10;29
The Corporate Confidence of the AT&T-Time Warner Deal;10;23
AT&T in Talks With Time Warner;10;21
T’s Best Fashion Imagery of 2016;12;21
Telecoms’ Ambitions on Targeted Ads Seen Curbed by F.C.C.’s New Privacy Rules;10;29
AT&T Aims for an Empire in Merger Talks With Time Warner;10;21
Our Favorite Vintage, Rarely Seen Photos Published by T This Year;12;23
Exxon Concedes It May Need to Declare Lower Value for Oil in Ground;10;28
Regulatory Microscope Lies Ahead for AT&T and Time Warner;10;23
16 Beautiful — and Far-Flung — Travel Destinations Featured in T This Year;12;20
Daily Report: Every Big Deal Must Have a Great Tech Angle;10;27
Morning Agenda: Finance Gets Chatty, 2016’s Biggest American I.P.O., EpiPen Rival Returns, Commercials Just for You;10;27
Review: Dance That Tries to Capture One Body, Two Selves;10;26
Morning Agenda: New Antitrust Era, Relief for VW Owners, Apple’s Optimism;10;26
Why a Media Merger That Should Go Through Might Not;10;25
One Last Growl for F.C.C.’s Sharp-Toothed Watchdog;10;25
What We’re Reading;10;25
Daily Report: Bigger Is Better. Or So They Say.;10;25
DraftKings and FanDuel to Pay $6 Million Each to Settle New York Claims;10;26
Tracing the Path of AIDS Through the Dance World;10;25
Morning Agenda: A New Media Order, Crisis Echos, MetLife Disputes Its Status;10;25
At Colette, a Line of T-shirts and Toys for All Ages;12;5
Report Highlights How Guns Flow Into New York From States With Weaker Laws;10;25
Time Warner’s Non-Mogul Mogul Who Foretold Its Worth;10;24
Fantasy Sports Companies Near Settlement With New York State;10;23
T’s New Holiday Issue: Editor’s Letter;12;2
2016 Was the Year of Interesting Wellness;12;29
The Year in Beauty;12;27
The Breakdown: A Miu Miu Resort Look, Deconstructed;12;26
‘Nude’ Is Not One Color;12;28
How to Make Bubbly Punch (From a Chic New Champagne Bar);12;26
An App to Help Black Women With Hair Care;12;26
Ten Models We Loved a Lot This Year;12;22
Beautiful Gardens We Escaped to This Year;12;22
The Champion Logo, in the Hands of Fashion’s Provocateurs, Is Reborn;12;19
A Healing Unicorn Latte, From Brooklyn of Course;12;19
Man Who Took Trove of N.S.A. Data Has Court Date;10;22
My 10 Favorite Books: Dev Hynes;12;16
Character Building: Brit Marling;12;16
“Adventures in Moominland”;12;15
When It Became Cool to Be Cool;12;16
Beloved Children’s-Book Characters, in Their Own Immersive World;12;15
Like Drinking Cocktails at Home, in L.A.;12;15
Jewelry That Draws From a Japanese Technique — and Constructivist Sculpture;12;14
A New Japanese Restaurant With an Artist’s Sensibility;12;14
‘Empire’ Season 3, Episode 9: The Enemy Within;12;15
Santas, Wreaths and So Many Lights: Holiday Cheer Around New York;12;13
AGMES’s Simple, Sleek Jewelry;12;13
Kylie Jenner and the Year of the Drop;12;14
Case of Former N.S.A. Contractor Escalates as Espionage Act Charges Loom;10;21
Minimal, Super-Functional Bags for Creatives — Designed by an Architect;12;13
Shirley Hazzard, Novelist Who Charted Storm-Tossed Lives, Dies at 85;12;13
Brand to Know: an Understated Jewelry Line Made by Sisters;12;13
New York Attorney General Won’t Investigate Police Killing of Bronx Woman;10;20
The Holidays With Jean Pigozzi;12;12
The Holidays With Beverly Johnson;12;12
The Holidays With Dustin Yellin;12;12
The Holidays With will.i.am;12;12
The Holidays With Martha Stewart;12;12
The Holidays With Jeremy Scott;12;12
The Holidays With DJ Khaled;12;12
The Playlist: Pusha T Spurns the Doubters and Kendrick Lamar Tempts the Critics;10;14
My 10 Favorite Books: Laura Linney;12;9
Trove of Stolen Data Is Said to Include Top-Secret U.S. Hacking Tools;10;20
Education Company to Pay $4.3 Million in Settlement With New York State;10;19
Six Minimal — and Inexpensive — All-Black Watches;12;8
Harley Weir’s “Boundaries”;12;8
One Photographer’s Bright, Prismatic World;12;8
2016 Holiday Gift Guide - T Magazine;11;21
How To | Clean Silver;12;8
A Young Photographer’s Intimate, Dreamlike Images;12;8
This Workout Gear Is Fashionable Enough for the Runway;12;8
Ryan McGinness’s ‘50 Parties’;12;7
Inside Chanel’s Métiers d’Art Show;12;7
Drinking and Eating Like Old Writers and Artists;12;7
A New Vision of Lingerie: Men Not Required;12;7
One Artist Threw a Party a Week for an Entire Year;12;7
‘Empire’ Season 3, Episode 8: Fashion Show;12;8
Chanel’s Ritzy Ode to Parisian Society;12;7
The Phrase One Artist Lives (and Works) By;12;6
The Power of ‘Being Human’;12;6
4 Interesting New Takes on the White Shirt;12;6
Reviving an Old French Bistro, the American Way;12;6
Alia Shawkat Owns Her Curly-Haired Cool;12;6
Scenes From Art Basel Miami Beach;12;5
Four Women’s Things T Editors Are Really Into Right Now;11;21
What You Missed at Miami Art Week;12;5
In Books and Art, the New Life of Old Photography;12;5
At Home With Angela Missoni — and Her Hundreds of Hands;12;5
For the Missoni Matriarch, a Dizzying Collection of Hands;12;5
Trump Foundation Tells New York It Has Stopped Soliciting After State Order;10;17
The Sarabande Foundation’s “The Reindeer” Dinner Series;12;2
Minimal Home and Work Objects With Maximum Appeal;12;2
Bank of America Inches Toward Long-Term Goal;10;17
Barry Jenkins on ‘Moonlight’;12;2
Jeff Nichols on ‘Loving’;12;2
Mike Mills on ‘20th Century Women’;12;2
Tom Ford on ‘Nocturnal Animals’;12;2
An Under-the-Radar Art and Fashion Incubator, Courtesy of Alexander McQueen;12;2
My 10 Favorite Books: Janet Mock;12;2
The Auteurs Changing Cinema;12;2
A Photographer’s Adolescent Sister, Captured Over the Years;12;1
The Neiman Marcus Visionary;12;1
A One-Stop Artisanal Goods Shop, in Chinatown;12;1
An Art-Filled Ballet Comes to Los Angeles;12;1
In Marfa, Eating the Ancient Way;12;1
In the Air | Robots;12;1
The Man Who Brought Paris to Dallas;12;1
Art, at High Altitudes;12;1
The Modern Charm of Practical Magic;12;1
A Look Back at Snowboarding Culture — and Style;11;30
Is All Fur Bad Fur?;12;1
Neon Gear and Renegade Style: The Heyday of Snowboarding;11;30
Isabelle Huppert;11;30
‘Empire’ Season 3, Episode 7: Queen Cookie;12;1
More, More, More: That’s How They Like It;11;30
Eight Elegant Magazine Racks;11;30
Crafting, the Hermès Way;11;30
The Freshmen: Four Art Basel Miami First-Timers to Know;11;30
The Enduring Allure of Isabelle Huppert;11;30
Perfectly Designed and Extravagantly Nice Things;11;29
Home and Work: David Alhadeff;11;29
Elegant Bracelet Watches for Men;11;29
What to Expect From This Year’s Art Basel Miami Beach;11;29
Big City Food Migrates to Florida;11;29
Die Antwoord: The Real Zef Rappers of Beverly Hills;11;29
New York’s Foremost Champion of American Design;11;29
Sunad’s Shirts;11;28
An Artful Photographer Captures a Trip to Russia;11;28
The Season’s Most Delicate Pastels;11;28
Brand to Know: The Spanish Line Making Simple, Handmade Shirts;11;28
Baking Sweets From Childhood Tales;11;28
2 Face Hate Crime Charges in Attack on Sikh Man in California;10;15
Sticking With Stocks, Especially in Market Downturns;10;14
The Revival of the Corset;11;25
Can a Corset Be Feminist?;11;25
The Beauty of Big Books;10;14
Daily Report: The Aura of Snapchat;10;13
A Bracelet Reissued Over 40 Years After a Designer’s Death;11;23
Profile in Style: Michael Anastassiades;11;22
An Artist and a Poet Contemplate Forever;11;22
Reflections on True Friendship;11;23
The Great Big World of a Minimalist Lighting Designer;11;22
Martin Parr’s “Grenson Shoes, Rushden” Series;11;22
The Season’s Brightest Bags;11;22
The Spy We Forgot;10;13
A 150-Year-Old British Footwear Factory, Through the Lens of Martin Parr;11;22
T’s New Travel Issue: Editor’s Letter;11;10
Diamond Jewelry With Everyday Appeal;11;21
London’s New Design Destination;11;21
In One Avid Collector’s Home, a World of Wonder;11;21
Ivory Coast Style;11;19
Ivory Coast Style;11;19
My 10 Favorite Books: Ahilan Arulanantham;11;18
George Condo’s “Confrontation”;11;18
A New Show That Puts George Condo Next to Picasso;11;18
In Southern Tasmania, Great Food and Rugged Appeal;11;18
J.B. Blunk’s Handmade Home;11;17
Eight Great Jeweled Sandals;11;17
Painterly Scarves That Celebrate the Female Form;11;17
From Wallpaper to Printed Journals and Candles;11;17
The Creators: Rob Pruitt;11;17
A Little House in the Big Woods;11;17
‘Empire’ Season 3, Episode 6: Like Father, Like Son;11;17
Robert Longo, Refashioned;11;16
Inside the French Studio Where Fabienne Verdier Paints Music;11;16
Sweet Southern Hospitality in a New Charleston Hotel;11;16
White Hair, Don’t Care;11;16
One French Painter’s Unlikely Techniques, Developed at Juilliard;11;16
Bringing Together Eisenstein and Black Lives Matter, in Art;11;16
Baking Kabocha Focaccia;11;15
Two Men and a Show;11;15
Bonding Over Bread (and Breakups);11;15
At an Old Racetrack, a New Place to Get Away;11;15
The Danish Ceramists Beloved by Award-Winning Chefs;11;15
John Alexander Skelton’s Fall Collection;11;14
Ten Things to Know About California’s Iconic Chez Panisse;11;14
Person to Know: The Designer Making One-of-a-Kind Pieces From Sustainable Fabrics;11;14
From a Beauty Label to an Upstate Cafe and Bakery;11;14
Bartlett House’s Pear Rosewater Muffins;11;14
Four Cozy Things T Editors Are Really Into Right Now;11;4
A Radical Feminist Hair Salon With Serious Cool-Girl Cred;11;14
Sign of Thaw With Iran: American Cellphones Ringing in Tehran;10;8
The Pleasure (and Popularity) of Really Short Books;11;14
The Playlist: Bruno Mars Gives His Funk a Flashy Makeover;10;7
My 10 Favorite Books: Trevor Noah;11;11
N.S.A. Suspect Is a Hoarder. But a Leaker? Investigators Aren’t Sure.;10;7
At Home and in the Kitchen With Jori Jayne Emde;11;10
At Booz Allen, a Vast U.S. Spy Operation, Run for Private Profit;10;7
High Class Geometry;11;10
Glamorous Vintage Photos of Leonardo DiCaprio, Audrey Hepburn, Warhol and More;11;10
Rick Owens’s Monumental — if Not Entirely Cozy — Furniture;11;10
Photographs from Carla Sozzani’s Personal Collection;11;10
Highlights of Rick Owens’s and Michèle Lamy’s Furniture;11;10
One Designer’s Unexpected, Powerfully Lyrical Furniture;11;10
Stunning, Rare Images Collected by a Fashion-World Force;11;10
An Outerwear Brand Finds Its Place in Fashion — and in SoHo;11;10
Resort Fashion in the Spanish Badlands;11;10
Fermentation, a Love Story;11;10
A One-of-a-Kind Pendant, From a Fashion Favorite;11;10
Spain’s Most Inhospitable Landscape — as Dramatic Fashion Backdrop;11;10
‘Empire’ Season 3, Episode 5: Fight Club;11;10
A ‘Sad Case’ Suspect, Scared Pale as Police Swarmed His House in N.S.A. Case;10;6
The Classic Statement of a Plaid Scarf;11;8
N.S.A. Contractor Arrested in Possible New Theft of Secrets;10;5
A New Shop for Simple, Handmade Housewares;11;8
The Appeal of Sporty, Lightweight Anoraks;11;8
Jhumpa Lahiri Judges Books by Their Covers;11;8
A Love Letter to Drinking in Bars;11;8
Traveling While Muslim Complicates Air Travel;11;7
Contemporary Homes in Stunning Natural Surroundings;11;7
‘Girl Plays With Snake’;11;7
A Look at Gray Matters’s First Collections;11;7
Affecting Drawings by LGBTQ Prisoners;11;7
Brand to Know: Simple Architectural Heels, Made in Italy;11;7
Funny and Eerie Vintage Images of Women Handling Snakes;11;7
A Moving, Diverse Show of Drawings by Incarcerated LGBTQ Artists;11;7
Five Things T Editors Are Really Into Right Now;10;28
The End of Relaxation;11;7
Cold Comfort at the Edge of the World;11;7
State Attorney General Orders Trump Foundation to Cease Raising Money in New York;10;3
My 10 Favorite Books: Kim Gordon;11;4
Why Isn’t Blackface Taboo for Australians?;11;4
A Very Jonathan Adler Hotel;11;4
Iggy Pop’s Life Drawing Class;11;3
Lindsey Adelman on Sharing a Visual Language With Her Husband;11;3
A Photographer’s Homage to an Architect’s Modernist City;11;3
Iggy Pop: Musician, Icon — and Now, Live Nude Model;11;3
The ’90s Designer Making a Big Comeback — All Over the Runways;11;3
A Healthy Dressing Recipe From L.A.’s Newest Feel-Good Cafe;11;3
The History of Southern Africa, by Train;11;3
An Artist and a Poet Consider Failure;11;2
Behind the Scenes of Athi-Patra Ruga’s ‘Over the Rainbow’;11;2
Samara Scott’s Suspended Animation;11;2
A Performance Artist Tackles South African Identity, for a New York Audience;11;2
One Artist’s Curiously Beautiful Works, Created from Detritus;11;2
Trump Probably Avoided His Medicare Taxes, Too;11;2
The Season's Most Cheery, Beachy Carryalls;11;2
Malta’s Emerging Capital by the Sea;11;2
The Season’s Most Interesting Black Dresses;11;1
Three New Cookbooks, for Health’s Sake;11;1
A New Collection of High-Gloss Furniture and Accessories;11;1
Charcoal’s New Mission: Cleaning Your Face;11;1
Over a Long, Arduous Season, Joe Girardi Wore His Humanity Well;9;30
Tunisia, Through the Eyes of Its Artists and Intellectuals;11;1
T Celebrates The Greats at the Carlyle;10;20
Bright, Geometric Earrings to Fall for;10;31
My Life in Pictures: Kenneth Jay Lane;10;31
The Store Putting Tijuana on the Design Map;10;31
The Sparkling Life and (Fake) Jewelry of Kenneth Jay Lane;10;31
Pigeon: From the Wild to the French Table;10;31
An Uncharitable Foundation;9;30
Hunting Pigeon in the Pyrenees — for Supper;10;31
T’s New Greats Issue: Editor’s Letter;10;21
To the First Lady: T Readers Thank Michelle Obama in Their Own Words;10;21
Regional Japanese Fare Comes to America;10;28
My 10 Favorite Books: Richard Serra;10;28
Images of a Less Crowded New York;10;28
The Work, and Communities, of Mark di Suvero;10;27
What We’re Reading;9;27
One Photographer’s Vibrant, Color-Saturated Landscapes;10;27
Making It: Dana Barnes;10;27
When in India, Make Your Own Block-Printed Fabrics;10;27
Otherworldly Art, Created in a 19th-Century Synagogue;10;27
A Contemporary Art Titan’s (Almost) Secret Commune;10;27
Fall’s Most Interesting Trench Coats;10;26
My Town: Ellen Koenigsberg;10;26
On the Lower East Side With a Beloved Vintage Dealer;10;26
A Vibrant Upstate New York Town, Set Against a Quaint Backdrop;10;26
A New Crop of Exceptional Farm Stays;10;26
Brooklyn Officer Charged With Murder and Manslaughter in Off-Duty Shooting;9;26
Inside Azzedine Alaïa’s Intimate Spring Show;10;25
Six Modern Mexican Design Studios to Watch;10;25
Eight Sleek, Portable Speakers;10;25
The Enticing Power of Highly Plucked Brows;10;25
Home and Work: Kris Kim;10;24
Inside a Designer and Entrepreneur’s Pristine Apartment and Store;10;24
The Timeless Appeal of Abbreviated Swim Shorts;10;24
The Naked Truth About German Nudists;10;24
Phone Makers Could Cut Off Drivers. So Why Don’t They?;9;24
All You Need to Know About Fashion Week;9;8
The Other 13 Women Testifying Against Cosby ... if the Court Lets Them;9;23
My 10 Favorite Books: Christopher Guest;10;21
Caliber Said to Be Asked for Data on Handling Distressed Mortgages;9;23
Fashion’s Unlikely Pairing: Ladylike Skirts and Logo T-Shirts;10;12
One Fascinating Subculture, Four Photographic Perspectives;10;20
Karen Knorr’s “Gentlemen”;10;20
The Renaissance Artifact Collections That Are Back in Style;10;20
Inside London’s Exclusive Gentlemen’s Clubs;10;20
A Playful Sneaker Brand — With Plenty of History;10;20
Seven Whimsical Rings, Inspired by Animals;10;20
A Design Firm That Spins Modern Objects From Ancient Tales;10;20
The Centuries-Old Ceramics Techniques of Faenza;10;19
Peels NYC’s New Collection;10;19
Visiting Italy’s Ceramics Workshops With a Buzzy Multimedia Artist;10;19
MacArthur Foundation’s 23 ‘Genius’ Grant Winners for 2016;9;22
Falling in Love With Italy’s Blissful, Rustic Aeolian Islands;10;19
MacArthur Foundation Announces 2016 ‘Genius’ Grant Winners;9;22
Smaller Stars Will Get a Chance to Shine at Latin Grammys;9;21
The Season’s Coziest Fisherman's Sweaters;10;18
Everything Old Is New Again;10;18
Those Lips! Those Eyes! That Stubble! The Transformative Power of Men in Makeup;10;18
Sir Elton John Interviews One of His Favorite New Musicians;10;18
The Greats;10;17
S.E.C. Is Latest to Look Into Exxon Mobil’s Workings;9;21
Robert E. Allen, 81, Dies, Led an AT&T in Transition;9;13
Donald Trump Used Over $250,000 From Charity for Business Disputes, Report Says;9;20
The World According to William Eggleston;10;17
T’s 50 Best Photos of Fashion Month;10;7
The World of Massimo Bottura;10;17
Kerry James Marshall’s Paintings;10;17
Lady Gaga;10;17
William Eggleston;10;17
Kerry James Marshall;10;17
Cover Story: Lady Gaga;10;17
Massimo Bottura;10;17
Zadie Smith;10;17
Junya Watanabe’s Spring/Summer 2017 Show;10;17
Massimo Bottura, the Chef Behind the World’s Best Restaurant;10;17
Lady Gaga on Her New Album — and Everything That Came Before;10;17
William Eggleston, the Pioneer of Color Photography;10;17
Junya Watanabe, One of Fashion’s Foremost Thinkers;10;17
Kerry James Marshall Is Shifting the Color of Art History;10;17
The Pieces of Zadie Smith;10;17
To the First Lady, With Love;10;17
Four Things T Editors Are Really Into Right Now;10;7
Fall’s Muted (and Ruffled) Pastels;10;14
My 10 Favorite Books: Kehinde Wiley;10;14
Four Watches Inspired by Automobile Racing;10;14
An Artist and a Poet Meditate on Identity and Place;10;13
One Photographer’s (Calmer, Quieter) Imagined New York City;10;13
Review: In ‘The David Dance,’ a Gay Man Sheds His Crippling Self-Doubt;10;13
A Six-Day Walk Through the Alps, Inspired by Simone de Beauvoir;10;13
‘Empire’ Season 3, Episode 4: A Night at the Opera;10;13
A Louis Benech Masterpiece: Mas Sainte-Anne;10;12
Sofie Howard’s Venice Beach Cottage;10;12
Patchouli: The Scent of the Season;10;12
Gardens by France’s Most Revered Landscape Designer;10;12
A Venice Beach Craftsman Cottage Filled With Art;10;12
In the Studio With One of Fashion’s Most Prolific Milliners;10;11
Iconic Fashion for a Good Cause;10;11
My Life in Pictures: Paula Cooper;10;11
In Spain, Reviving Dishes That Disappeared in 1236;10;11
Conceptual Art’s Most Ardent Fan, 50 Years In;10;11
Home and Work: Nata Janberidze and Keti Toloraia;10;10
Musicians to Know: An R&B Duo With Indie-Film Cred;10;10
A Dizzying, Beautiful Stack of Pearls;10;10
Georgia’s Emerging, Avant-Garde Designers to Know;10;10
Nine Famous Women. No Makeup. Selfies.;10;10
To Wear Makeup or Not to Wear Makeup?;10;10
Andrzej Wajda, Towering Auteur of Polish Cinema, Dies at 90;10;10
Are Subpoenas on Exxon Mobil Inquiries Valid? Experts Say Yes, and No;9;14
New York Attorney General to Investigate Donald Trump’s Nonprofit;9;13
The Top 10 Moments From Paris Fashion Week;10;7
“The Toilet Attendant ... Now Wash Your Hands”;10;7
My 10 Favorite Books: Maggie Nelson;10;7
Why One Artist Is Spending Frieze London Hiding in the Bathroom;10;7
Eight Bold and Beautiful Bookends;10;7
Snap Sketch: The Faces of Paris Fashion Week;10;6
The Eight Best Jewels of Paris Fashion Week;10;6
The Seven Best Bags of Paris Fashion Week;10;6
The Eight Best Shoes of Paris Fashion Week;10;6
The Gallery of Everything;10;6
E-Trade Names New C.E.O. in Management Shake-Up;9;12
Where to Go Next: The Most Underrated City in Germany;10;6
Fashion Week Photo Diary: Louis Vuitton, Moncler Gamme Rouge and Miu Miu;10;6
A Potter’s Appealing Artistry, Broadcast on Social Media;10;6
The Next Generation of French Winemakers;10;6
A Britpop Star, a Curator and a Former Barbershop;10;6
Micki Pellerano Reads Jenny Hval’s Tarot;10;6
One Model, 36 Beauty Looks;10;6
Three’s a Trend: White Dresses, With Roomy Sleeves;10;6
Brutalism Is Back;10;6
A Brooklyn Artist Reads a Norwegian Singer’s Tarot;10;6
At Paris Fashion Week, a Season of Big Changes;10;6
After 11 Years, Case of A.I.G.’s Ex-Chief Is Going to Trial;9;11
‘Empire’ Season 3, Episode 3: Carry On, My Wayward Son;10;6
Three’s a Trend: The Return of the Power Suit;10;5
