Headline;Month;Day
How Facebook’s Ad System Works;10;12
Review: ‘Fifty Inventions’ Falls Short of Its Ambitions;8;29
Push for Gender Equality in Tech? Some Men Say It’s Gone Too Far;9;23
Australian Journalist’s Trump Teardown Goes Viral Amid Interest in G-20;7;9
Morning Agenda: Ethereum, Uber and Money Management Fees;2;28
Daily Report: For Uber, a New Week Brings Even More Bad News;2;28
X Marks the Spot to Close All Browser Tabs;1;24
‘The Daily’: The Alt-Right and the Internet;8;18
Daily Report: AlphaGo Shows How Far Artificial Intelligence Has Come;5;23
Listen to ‘The Daily’: A Special Episode for Kids;11;19
Apple Gets Permit to Test Self-Driving Cars in California;4;14
Executive Who Steered Uber Through Scandals Joins Exodus;4;12
La devastación en Puerto Rico vista desde arriba;9;27
Italy, Bracing for Electoral Season of Fake News, Demands Facebook’s Help;11;24
A Little-Known Accounting Change Could Have a Big Impact;5;12
Stroll Through Harlem With Marcus Samuelsson;5;15
Virtual Reality Has Arrived in the Art World. Now What?;2;3
Mark Zuckerberg Sees Augmented Reality Ecosystem in Facebook;4;18
Using Android to Zoom In for a Closer Look;6;14
Here Is How to Fend Off a Hijacking of Home Devices;2;1
Adding Facebook’s Birthday List to a Calendar Program;2;16
What Virtual Reality Can Teach a Driverless Car;10;29
Morning Agenda: Tech Giants Feel the Pressure Worldwide;9;18
Readers Ask Why a Surname Is Too Personal, but Snapshots Are Just Fine;7;19
Sharing Large Files With Mail Drop;7;10
Doing a 180 on Facebook 360 Photos;5;23
Tech Roundup: Improving Uber’s Diversity and Culture;3;28
With a Bazaar of Gizmos and Apps, Tackling Readers’ Tech Questions;5;24
YouTube Unveils Subscription Television Service;3;1
The Best Soundbar;7;19
What You Should Watch Wednesday Night;3;1
Amazon ‘Reviewing’ Its Website After It Suggested Bomb-Making Items;9;20
Traveling Together? Apps to Help Split (and Pay) the Bills;8;7
How to Be Mindful With Your Phone;1;18
How to Use a Hearing Aid with Your Smartphone;3;3
Listen to ‘The Daily’: Fake News, Real Consequences;9;27
1994 | A Road Map to the Information Superhighway;1;19
Tech Roundup: Canada Spends to Keep A.I. Experts Home;4;10
Listen to ‘The Daily’: Harvey Weinstein’s New Accusers;10;11
Listen to ‘The Daily’: The Pentagon’s U.F.O. Program;12;18
Using Your Phone to Scan Pictures of Prints;7;24
Mike and Nicole’s Week in Tech: United’s Troubles and Burger King’s ‘Hack’;4;15
‘Where Does Cloud Storage Really Reside? And Is It Secure?’;1;23
Judge Says Waymo Can Tell Jurors That Uber Withheld Evidence;8;18
An 8th Planet Is Found Orbiting a Distant Star, With A.I.’s Help;12;14
Facebook’s Virtual Reality Business Gets a New Leader;1;26
Coming From Automakers: Voice Control That Understands You Better;1;5
Facebook, Under Fire in Russia Inquiry, Posts 79% Rise in Profit;11;1
Morning Agenda: Stocks Decline on North Korea Tensions;8;9
