Headline;Month;Day
Facebook Job Ads Raise Concerns About Age Discrimination;12;20
What the Tax Bill Fails to Address: Technology’s Tsunami;12;20
The Tax Bill’s Winners and Losers;12;16
The Biggest Tech Failures and Successes of 2017;12;13
How 2017 Became a Turning Point for Tech Giants;12;13
Net Neutrality Protests Move Online, Yet Big Tech Is Quiet;12;12
Stop the Manipulation of Democracy Online;12;11
Choosing a Payment Option for Google Play;11;23
Farhad and Mike’s Week in Tech: The Big Bitcoin Boom;12;8
The Return of the Techno-Moral Panic;12;5
Farhad and Mike’s Week in Tech: Sex Scandals and Silicon Valley;12;1
The Case for Removing Extremist Videos From the Internet;11;30
Vietnam Wants to Control Social Media? Too Late.;11;30
Andy Rubin, Android Creator, Steps Away From Firm Amid Misconduct Report;11;29
Judge Tells Uber Lawyer: ‘It Looks Like You Covered This Up’;11;30
The Best Ways to Share Your Smartphone Photos This Holiday;11;29
Rebuking Uber Lawyers, Judge Delays Trade Secrets Trial;11;28
A New Way for Machines to See, Taking Shape in Toronto;11;28
Waymo Seeks Delay in Court Fight With Uber Over Trade Secrets;11;28
Meredith’s Persistence Pays Off for Time Inc. Shareholders;11;27
Missouri Opens Antitrust Investigation Into Google;11;13
Grab Copies of Google Emails, Photos and Files;11;9
When Dinosaurs Roam in Chrome;11;14
She Warned of ‘Peer-to-Peer Misinformation.’ Congress Listened.;11;12
Review: Two Contrasting Views of Silicon Valley’s Influence;11;10
How Corporations and the Wealthy Avoid Taxes (and How to Stop Them);11;10
Google Docs Glitch That Locked Out Users Underscores Privacy Concerns;10;31
Waymo’s Autonomous Cars Cut Out Human Drivers in Road Tests;11;7
Sam Hyde and Other Hoaxes: False Information Trails Texas Shooting;11;6
Building A.I. That Can Build A.I.;11;5
How Google’s Physical Keys Will Protect Your Password;10;25
In Reversal, Tech Companies Back Sex Trafficking Bill;11;3
Cisco and Google Find Mutual Interest in Cloud Computing;10;25
Facebook Says It’s Policing Fake Accounts. But They’re Still Easy to Spot.;11;3
Making YouTube Safer for Children;11;3
How Silicon Valley Plans to Conquer the Classroom;11;3
Russia Investigation Has Tech Giants Shying From ‘Social’ Label;11;2
Russia-Financed Ad Linked Clinton and Satan;11;1
House Intelligence Committee Releases Incendiary Russian Social Media Ads;11;1
The Upside of Being Ruled by the Five Tech Giants;11;1
Russia Inquiry Fails to Unite a Nation;11;1
Tech Executives Are Contrite About Election Meddling, but Make Few Promises on Capitol Hill;10;31
How to Report When the Science Is Sketchy;10;31
Russian Influence Reached 126 Million Through Facebook Alone;10;30
Tech Companies Face Congress, Fed News and Jobs Numbers;10;30
Mark Warner: Tech Millionaire Who Became Tech’s Critic in Congress;10;29
Meet the People Who Will Defend Google, Facebook and Twitter Before Lawmakers;10;20
What Worries? Big Tech Companies Post Glowing Quarterly Profits;10;26
Google’s Pixel 2 Smartphone Is a Powerful Extravagance;10;17
Scanning, Converting and Editing Text on the Go;10;26
Google Maps Pulls Calorie-Counting Feature After Criticism;10;17
Can Washington Stop Big Tech Companies? Don’t Bet on It;10;25
Google Serves Fake News Ads in an Unlikely Place: Fact-Checking Sites;10;17
Google’s Founders Wanted to Shape a City. Toronto Is Their Chance.;10;18
Tech Giants Are Paying Huge Salaries for Scarce A.I. Talent;10;22
Google Unveils Job Training Initiative With $1 Billion Pledge;10;12
Taking Your iTunes Library to Android;10;20
Farhad and Mike’s Week in Tech: Regulation Is Looming;10;20
Google Buying Apple? Sorry, That Was Just a Test;10;10
Hundreds of Mysterious Stone ‘Gates’ Found in Saudi Arabia’s Desert;10;19
Senators Demand Online Ad Disclosures as Tech Lobby Mobilizes;10;19
Google Finds Accounts Connected to Russia Bought Election Ads;10;9
How the Frightful Five Put Start-Ups in a Lose-Lose Situation;10;18
In Italian Schools, Reading, Writing and Recognizing Fake News;10;18
As the World Tweets, Social Media Chiefs Remain Tight-Lipped;10;15
Google’s New Gadgets Come With a Big Helping of A.I.;10;4
Silicon Valley Is Not Your Friend;10;13
Tech Giants, Once Seen as Saviors, Are Now Viewed as Threats;10;12
Have a Group Chat on an iPad;10;12
The Frightful Five Want to Rule Entertainment. They Are Hitting Limits.;10;11
Google Updates Policy on News Pay Walls. ‘First Click Free’ to End.;10;2
Google Prepares to Brief Congress on Its Role in Election;9;30
Who Invented ‘Zero’?;10;7
Co-Parenting With Alexa;10;7
Google Offers Concessions to Europe After Record Antitrust Fine;9;27
As Google Fights Fake News, Voices on the Margins Raise Alarm;9;26
Change the Key That Unlocks Your Accounts;10;6
Farhad and Mike’s Week in Tech: More Uber Drama, and Few Answers From Facebook;10;6
Google Acts to End One Fight in Europe as Bigger Antitrust Battle Looms;9;28
The End of Privacy;10;5
Keeping Your Reading List in Sync;10;4
What if Platforms Like Facebook Are Too Big to Regulate?;10;4
Industry Under Pressure Gathers for Ad Week and a Deadline for Google;9;25
After Las Vegas Shooting, Fake News Regains Its Megaphone;10;2
Move Your Mailbox to Another App;10;2
Labor Case Before Supreme Court and Jobs Numbers for September;10;2
Retiring the Google Drive Desktop App;9;21
Google Is Buying HTC’s Smartphone Expertise for $1.1 Billion;9;21
Morning Agenda: Google Gets Serious About Producing Better Phones;9;21
Can You Run Android on an iPad?;9;27
Tech Firms Add $300 Million to Trump Administration’s Computer Science Push;9;26
Google Sets Limits on Addiction Treatment Ads, Citing Safety;9;15
Farhad’s and Mike’s Week in Tech: A Very Bad Week for Digital Giants;9;22
World Leaders Urge Big Tech to Police Terrorist Content;9;22
Google and Facebook Face Criticism for Ads Targeting Racist Sentiments;9;15
Internet Giants Face New Political Resistance in Washington;9;20
Google Sued by 3 Female Ex-Employees Who Say It Pays Women Less Than Men;9;14
Google and Sex Traffickers Like Backpage.com;9;7
At Google, Employee-Led Effort Finds Men Are Paid More Than Women;9;8
Ellen Pao: Has Anything Really Changed for Women in Tech?;9;16
Chips Off the Old Block: Computers Are Taking Design Cues From Human Brains;9;16
New America, a Google-Funded Think Tank, Faces Backlash for Firing a Google Critic;9;1
Google’s Disturbing Influence Over Think Tanks;8;30
How Apps Can Make Your Vacation Better;9;12
Google Critic Ousted From Think Tank Funded by the Tech Giant;8;30
Google and Walmart Partner With Eye on Amazon;8;23
In Her Family’s Footsteps, a Reporter Takes to the Classroom;9;3
Silicon Valley Courts Brand-Name Teachers, Raising Ethics Issues;9;2
Go Bold (or Italics) With Gmail Formatting Options;8;29
Google Doesn’t Want What’s Best for Us;8;12
Sundar Pichai Should Resign as Google’s C.E.O.;8;11
Farhad and Mike’s Week in Review: Apple’s Self-Driving Shift;8;25
A Crisis Forces Google to Uphold Its Values While Fostering Debate;8;12
Google’s War Over the Sexes;8;9
Mike’s and Katie’s Week in Tech: Uber Infighting and the Google Memo;8;12
On Croatia’s Coast, Uber Takes Its Ride-Hailing App to the Seas;8;25
Google Cancels Employee Meeting Because of Harassment Fears;8;11
Contentious Memo Strikes Nerve Inside Google and Out;8;8
Answering Your Questions About the Controversial Google Memo;8;9
Google Fires Engineer Who Wrote Memo Questioning Women in Tech;8;8
Crowded TV Marketplace Gets Ready for Three Tech Giants;8;21
‘Thought Bullies’ or Right Move: A Divide Over James Damore Firing;8;11
Farhad’s and Mike’s Week in Tech: A Snap and Google Tie-Up?;8;5
Where Is the Line? Charlottesville Forces Media and Tech Companies to Decide;8;18
The Maddeningly Simple Way Tech Companies Can Employ More Women;8;15
How A.I. Is Creating Building Blocks to Reshape Music and Art;8;14
Packing Google Maps, but Not an Internet Connection;7;26
Google’s New Parental Control App Has a Flaw: Puberty;7;26
Teaching A.I. Systems to Behave Themselves;8;13
Tech’s Damaging Myth of the Loner Genius Nerd;8;12
Nsynth Sample;8;11
How to Watch a Solar Eclipse;8;11
The Alt-Right Finds a New Enemy in Silicon Valley;8;9
Converting Pictures Into Words You Can Process;8;9
The Culture Wars Have Come to Silicon Valley;8;8
How to Make Your House a Smart Home;8;8
Anita Hill: Class Actions Could Fight Discrimination in Tech;8;8
Google Wins Tax Case in France, Avoiding $1.3 Billion Bill;7;12
Switching Your Browser Loyalty;8;1
A Google Engineer Learns the Fashion Code;7;10
A New Way for Therapists to Get Inside Heads: Virtual Reality;7;30
Inside Yelp’s Six-Year Grudge Against Google;7;1
News Outlets to Seek Bargaining Rights Against Google and Facebook;7;9
How to Fix India’s Sex-Selection Problem;7;27
Google Will No Longer Scan Gmail for Ad Targeting;6;23
Daily Report: Alphabet Kicks Off Tech Earnings Season;7;25
Google Fined Record $2.7 Billion in E.U. Antitrust Ruling;6;27
Google Said to Face $1.2 Billion Antitrust Fine, but Battle With Europe Looms;6;26
Making Google the Censor;6;12
Farhad and Mike’s Week in Tech: Meal Kits, Lyft and ‘Despacito’;7;22
Pittsburgh Gets a Tech Makeover;7;22
My Doppelgänger on Google;12;26
Preparing for the Jump to a New Operating System;7;21
Google Said to Be Facing Record E.U. Fine by End of August;6;16
Finding the Date on a Map Image;7;20
Shopping for New Software;7;19
At School With Google;5;13
Planning a Trip With the Help of Google Home;5;31
How to Use Google Image Search on the Go;6;12
Getting Google Cards to Load Again;5;15
How Google Took Over the Classroom;5;13
Google Wants to Be Everywhere With Everyone;5;18
No, Google’s Not a Bird: Bringing the Internet to Rural India;5;21
Burger King ‘O.K. Google’ Ad Doesn’t Seem O.K. With Google;4;12
Google’s A.I. Program Rattles Chinese Go Master as It Wins Match;5;25
Stopping Video Autoplay on Google Chrome;3;20
The Best Google Assistant–Compatible Smart-Home Devices for Google Home;11;29
Is It Time to Break Up Google?;4;22
Questions for: ‘How Google Took Over the Classroom’;5;16
Google’s AlphaGo Defeats Chinese Go Master in Win for A.I.;5;23
Data on New Housing, and Google Hosts Its Developers’ Conference;5;15
Google Training Ad Placement Computers to Be Offended;4;3
Social Media and Democracy;11;11
Turkey to Investigate Antitrust Complaint Against Google;3;6
Google Agrees to Pay Italy $334 Million in Back Taxes;5;4
How to Tell Google That Meat Is Off the Menu;12;25
After Leaving Google, Bill Maris Is Set to Open New Fund;5;16
Daily Report: Remembering When Uber and Google Were Allies;5;18
How Google Cashes In on the Space Right Under the Search Bar;4;23
What One Student Things About Google Apps at School;5;13
Email Attack Hits Google: What to Do if You Clicked;5;4
Tweaking Alerts From Google Calendar;3;9
Waymo Scales Back Claims Against Uber in Driverless Car Dispute;7;7
Google, Not the Government, Is Building the Future;5;17
Uber Hires Google’s Former Head of Search, Stoking a Rivalry;1;20
Keeping Your Files Safe in Google’s Cloud;9;6
Google, in Post-Obama Era, Aggressively Woos Republicans;1;27
Switching Between Apple’s iOS and Google’s Android;9;1
Why Google Is My Friend;10;19
Tech Roundup: The Latest in the Google-Uber Fracas;3;30
Continuous Deployment to Google Cloud Platform with Drone;1;12
BMW and Volkswagen Try to Beat Apple and Google at Their Own Game;6;22
Tech Roundup: Google’s Ad Issues Expose a Vulnerability;4;3
Publishers Retreat From the Risks of Google-YouTube Advertising;3;26
Tech Stocks Boom, but Some Stock Pickers Are Wary;7;5
Google Tries to Stop Ads From Appearing Next to Hate Speech;3;21
What Google and Twitter Say About Trump’s First 100 Days;4;28
California Today: Google’s Idea for a New Silicon Valley;6;20
E.U. Antitrust Chief on Record Fine Against Google;6;27
Google Earth’s New Voyager Tool Aims to Feed Our Wanderlust;4;21
Google Earth’s New Voyager Tool Aims to Feed Our Wanderlust;4;21
Catalonia, Las Vegas, Google: Your Thursday Briefing;10;5
Alabama, Google, North Korea: Your Thursday Briefing;12;13
Climate Change, Kenya, Google: Your Tuesday Briefing;8;8
Google Helping Mobile Publishing? Some Publishers Are Not So Sure;1;1
Google, North Korea, Paul Manafort: Your Thursday Briefing;8;9
North Korea, Google, Jacob Zuma: Your Wednesday Briefing;8;8
In Quest of Privacy in the Digital Age;10;18
North Korea, Donald Trump, Google: Your Friday Briefing;8;11
Qualcomm Rebuffs Broadcom, and Missouri Subpoenas Google: DealBook Briefing;11;13
Donald Trump, Jacob Zuma, Google: Your Tuesday Briefing;8;8
Donald Trump, Emmanuel Macron, Google: Your Thursday Briefing;5;18
Daily Report: Google and Facebook Wield Buckets in Fake News Flood;1;26
Morning Agenda: After Google Case, E.U. Readies for More Action;7;3
Mike’s and Kevin’s Week in Tech: Streaming Music and Harassment in Venture Capital;7;1
Las Vegas, Google Home, Minnesota Lynx: Your Thursday Briefing;10;5
A Way to Own Your Social-Media Data;6;30
A Network Ad Wrangler Undaunted by Facebook and Google;5;14
The Times Sharply Increases Articles Open for Comments, Using Google’s Technology;6;13
Moving Your Number to Google Voice;12;28
Amazon Alexa vs. Google Assistant: Which Voice Assistant Is Best for You?;4;14
Delete Hate Speech or Pay Up, Germany Tells Social Media Companies;6;30
For Two San Francisco Transplants, an Easy Transition;6;30
DealBook Briefing: AT&T’s Defense — We’re Up Against Google and Netflix.;11;28
Senate, Syria, Google: Your Tuesday Evening Briefing;6;27
Questions About Mac Security and Google Password Prompts;3;6
The Making of Virtually Real Art With Google’s Tilt Brush;1;4
Tech, Fed, Trump: So Many Reasons to Worry About the Market;6;29
Daily Report: New Chapter in Europe vs. American Tech Behemoths;6;27
Donald Trump, Jimmy Fallon, Google: Your Wednesday Evening Briefing;5;17
An Alexa Holdout Wants to Know Who’s Listening;12;8
Unhappy With Photo, New Hampshire Town Wins Battle With Google;3;7
In Advertising Paradise, Reality Is Just a Conversation Away;6;26
At Cannes, the Great Gusher of Content Comes With Warning Signs;6;26
Google Cousin Develops Technology to Flag Toxic Online Comments;2;23
The Man Who Helped Turn Toronto Into a High-Tech Hotbed;6;23
Google Self-Driving Car Unit Accuses Uber of Using Stolen Technology;2;24
Russia Requires Apple and Google to Remove LinkedIn From Local App Stores;1;7
Uber Fires Former Google Engineer at Heart of Self-Driving Dispute;5;30
Yale Professors Race Google and IBM to the First Quantum Computer;11;13
Uncle Sam Wants Your Deep Neural Networks;6;22
Google’s Claim Against Former Executive Could Help Uber in Driverless-Car Lawsuit;3;30
Detroit Auto Show Reveals a Google-Designed Van That Could Steer the Industry;1;8
What to Do When Chrome Wants to Update — but Can’t;6;20
Lyft Is Said to Explore I.P.O. as It Raises $1 Billion Led by Alphabet;10;19
Xiaomi, Chinese Phone Maker, Losing Its Global Face as Hugo Barra Exits;1;23
YouTube Sets New Policies to Curb Extremist Videos;6;19
How Uber and Airbnb Became Poster Children for the Disruption Economy;6;19
Long Days, Google Docs and Anonymous Surveys: How the U.S. Soccer Team Forged a Deal;4;5
Daily Report: The Limits of A.I.;6;16
Online Sex Trafficking;9;15
A Slump in Tech Stocks That Leaves Some Investors Mystified;6;12
Taylor Swift Returns Her Music Catalog to Streaming Services;6;9
Daily Report: When Robots Can’t Trust Humans;6;7
Five Big Tech Stocks Build Market Euphoria, and Jitters;6;7
Robot Cars Can’t Count on Us in an Emergency;6;7
A Guide to Challenges Facing Self-Driving Car Technologists;6;7
Is Wisconsin Really That Hard to Spell?;5;31
Twitter Fails E.U. Standard on Removing Hate Speech Online;6;1
Erasing Your Android Tracks;5;25
How to Make It Known There’s a Problem With an App;5;22
The Gender Gap in the Tech World;8;11
Farhad’s and Mike’s Week in Tech: Caring About Tech News;5;20
Donald Trump, Our A.I. President;5;22
You Still Need Your Brain;5;19
Uber Threatens to Fire Star Engineer in Legal Battle Over Driverless Cars;5;19
Joshua Ferris on ‘The Dinner Party’;5;19
How Uber and Waymo Ended Up Rivals in the Race for Driverless Cars;5;17
Movers: Stocks Slide;5;17
Use Your Phone as a Digital Magnifying Glass;5;16
Uber Engineer Barred From Work on Key Self-Driving Technology, Judge Says;5;15
How to Do a Text Search on Mobile;5;11
Daily Report: Too Late to Run From Tech’s Frightful Five;5;10
Moving Bookmarks Between Browsers;5;9
When Apple Maps Marks Your Spot;5;8
Tech’s Frightful Five: They’ve Got Us;5;10
Ad Buyers Have a Say in Whether Real News Survives;5;8
Don’t Let Facebook Make You Miserable;5;6
The ‘Frightful Five’ Aren’t So Scary, as Long as They’re Competing;5;8
Giving the Behemoths a Leg Up on the Little Guy;5;3
Daily Report: Cloud Computing Asserts Itself;4;28
Uber Executive Steps Back From Self-Driving Cars During Waymo Legal Fight;4;27
Cloud Produces Sunny Earnings at Amazon, Microsoft and Alphabet;4;28
Checking a Website’s Security;4;25
This Week’s Movies: April 28, 2017;4;27
Why Your Next Wi-Fi Setup Should Be a Mesh Network;4;26
With Government in Retreat, Companies Step Up on Emissions;4;25
Waymo to Offer Phoenix Area Access to Self-Driving Cars;4;25
AT&T’s Words on Time Warner Deal Say ‘Underdog.’ Its Actions Speak Otherwise.;4;23
A McDonald’s Ad That Never Mentions the Name McDonald’s;4;18
Starting Up a Business, With Little Ones Close By;4;19
Tracking the Ticker on the Go;4;14
Uber Denies It Is Using Stolen Waymo Technology;4;7
Tech Roundup: A Defense of ‘Programmatic Ads’;4;6
That Fingerprint Sensor on Your Phone Is Not as Safe as You Think;4;11
Awaiting the Next Android Invasion;3;29
Uber Executive Invokes Fifth Amendment, Seeking to Avoid Potential Charges;3;30
United and Pepsi Affairs Force Brands to Respect Social Media;4;14
AT&T and Johnson & Johnson Pull Ads From YouTube;3;23
When Your Mail Moves Itself;4;4
Sorting Messages on Gmail;3;23
YouTube Advertiser Exodus Highlights Perils of Online Ads;3;24
Waymo Asks Court to Block Uber’s Self-Driving Car Project;3;11
Chase Had Ads on 400,000 Sites. Then on Just 5,000. Same Results.;3;30
Amit Singhal, Uber Executive Linked to Old Harassment Claim, Resigns;2;27
Alphabet’s Profits Stay Predictably Good in a Volatile Industry;1;27
Using Sling TV and Secure Texts to Keep on Top of Trump;3;15
Brands Try to Blacklist Breitbart, but Ads Slip Through Anyway;3;26
Apple’s Devices Lose Luster in American Classrooms;3;2
Before and After Hurricane Harvey;8;29
A Lawsuit Against Uber Highlights the Rush to Conquer Driverless Cars;2;25
Trying to Minimize the Misery of Mug Shots;2;11
Key Document Is Unsealed in Waymo’s Trade Secrets Case Against Uber;10;3
How Your Phone Knows Where You Have Been;1;20
SoftBank to Buy Boston Dynamics, Maker of Animal-Like Robots;6;9
Finding All Your Friends on the Map;7;4
Daily Report: Snap Is About to Bring Tech Wealth to Los Angeles;2;21
Morning Agenda: How Uber and Waymo Ended Up Clashing;5;17
Managing Your Passwords With a Web Browser;1;6
Sonos One Review: Is This the Best Smart Speaker?;11;27
Sonos One Review: Is This the Best Smart Speaker?;11;27
Dear Wirecutter: What’s the Best Radio for Retirees?;6;8
Using Android to Convert Pixels to Paper;12;21
Just What Was in That iOS System Update?;3;15
Daily Report: Another Day, Another Uber Scandal;2;24
Mexico City, Before and After the Earthquake;9;23
For Alphabet, a Record Fine Is Both a Footnote and a Warning;7;25
Big Tech’s Rivals Pounce at Chances to Win in Washington;10;25
Apple Provides Hedge Against Tech Backlash;12;20
Waymo’s Complaint Against Uber;2;24
Data Could Be the Next Tech Hot Button for Regulators;1;9
Tech Roundup: Julian Assange as Tech Companies’ Defender;3;10
Facebook and Twitter Could Face Fines in Germany Over Hate Speech Posts;3;14
Miscue Calls Attention to Amazon’s Dominance in Cloud Computing;3;12
Dumping a Bad App? Tips for a Painless Breakup;1;25
Laszlo Bock on Building Great Workplaces;4;10
Tech Companies Fight Trump Immigration Order in Court;1;31
A Flying Car Prototype From Silicon Valley;4;24
Dear Wirecutter: What’s a Good Burner Phone for International Travel?;5;4
The 2017 Oscars are Over. Here’s Where to Stream the Winners;2;27
Lisa Jiang, Tristan Smith;6;4
Morning Agenda: Bill Ackman and His ‘Huge Mistake’;3;30
Uber and Waymo Duel at Key Hearing Over Driverless Car Technology;5;4
When a Basic Laptop Will Do: Our Top Budget Picks;3;22
What Facebook Owes to Journalism;2;21
Is Your Digital Life Ready for Your Death?;1;18
WikiLeaks Will Help Tech Companies Fix Security Flaws, Assange Says;3;9
Farhad’s and Cecilia’s Week in Tech: Tech Policy, Too, Is Undergoing a Sea Change;3;11
Why Deleted Tweets Still Linger Online;9;19
Virtual Reality on the Cheap? Try These Apps on Your Phone;1;11
Snapping a Shot of the Android Screen;4;18
When You Should (and Shouldn’t) Share Your Location Using a Smartphone;7;12
The Best Outdoor Security Camera;1;31
The Best Smart Sprinkler Controller;6;16
Sally Jesmonth, Hattie Stroud;10;15
‘Cortana, Open Alexa,’ Amazon Says. And Microsoft Agrees.;8;30
Uber Sees an Executive Exodus as It Faces Questions of Workplace Culture;4;12
Sending Students to the Corner (of Their Screens);3;17
Trump Completes Repeal of Online Privacy Protections From Obama Era;4;4
Lauren Haffer, Jonathan Birnbaum;8;6
Morning Agenda: An Uber I.P.O.? It’ll Be Awhile.;8;31
New Ways to Find and Book the Perfect Vacation Rental;8;14
Microsoft Looks to Regain Lost Ground in the Classroom;5;2
Raising of Spirits;6;14
A Quick Guide to Backing Up Your Critical Data;3;31
Was It a 400-Pound, 14-Year-Old Hacker, or Russia? Here’s Some of the Evidence;1;6
What U.S. Tech Giants Face in Europe in 2017;1;1
Trump Picks Joseph Simons, Corporate Antitrust Lawyer, to Lead F.T.C.;10;19
Finding an Audio Assist on Your Smartphone;8;24
Morning Agenda: Puerto Rico Declares a Form of Bankruptcy;5;4
Making Your Phone Take Dictation;2;22
Kelly McHenry, Owen Jennings;5;21
Searching for a New Travel Companion;2;27
Instead of Leaving a Job, Why Not Take a Pause?;1;27
How to Automatically Label New Gmail Messages;1;3
Brette Allen, Patrick Mowrer;2;19
Shades of Gray in the Digital Darkroom;1;26
Morning Agenda: Uber’s Tough Week, Tech Acrimony and Manufacturing;2;24
Book Your Calendar;12;22
Busting the Myths About A.I. Invading Our Lives;12;13
Cracking Quick Response Codes With iOS 11;12;18
A Close-Up on Mysteries Made of Stone in Saudi Arabia’s Desert;11;17
The Best In-Wall Smart Light Switch and Dimmer;5;10
Pinterest Wants to Show Advertisers It Can Run With the Big Dogs;7;2
Lyft and Waymo Reach Deal to Collaborate on Self-Driving Cars;5;15
Tech Roundup: Amazon Error Is a Reminder That No Company Is Infallible;3;13
10 Great Jerry Lewis Movies to Stream;8;20
High Above, Drones Keep Watchful Eyes on Wildlife in Africa;3;13
A Stylus That Works for Tablet and Wallet;11;1
Choosing a Simple Smartphone Solution;9;13
Choosing a Simple Smartphone Solution;9;13
North Korea’s Nuclear Push Is Just One Piece of a Nationwide Building Boom;7;6
Sarah Fisher, Ricky Lu;5;14
Our Existential Climate Fears;1;27
The Wide World of Emoji;1;19
Stream These Great Steven Soderbergh Titles;8;16
Morning Agenda: Questionable Bonds;5;31
Listen to ‘The Daily’: Mueller’s Strategy, and an Attack in New York;11;1
Dear Wirecutter: Will a Budget Android Phone Provide Adequate Security Updates?;5;25
Two Executives to Leave Uber, Adding to Departures;3;20
Reasons Not to Dismiss GPS Devices for Your Car;4;5
The Devastation in Puerto Rico, as Seen From Above;9;27
Monica’s 3 Movies to Stream or Rent This Weekend;7;14
Tablets for Music Mixers on a Budget;8;2
Daily Report: The Next Voice You Hear Will Be Amazon’s;1;6
Fiat Chrysler Joins BMW in Race to Make Self-Driving Cars;8;16
Morning Agenda: Uber Executive Invokes Fifth Amendment;3;31
Snap’s Plan Is Most Unfriendly to Outsiders;2;3
Listen to Your Daily Audio Report;1;30
Daily Report: Facebook Takes Aim at YouTube’s Video Dominance;7;10
Stonewall Inn Project to Preserve Stories Behind a Gay Rights Monument;6;17
Apple Piles On the Features, and Users Say, ‘Enough!’;6;3
Before and After Photos: Fires Tear Through California’s Wine Country;10;10
Silicon Valley Takes a Right Turn;1;12
Surfing With a New Keyboard;6;8
Tech Roundup: Paying Up to $500 to Chat With a Live Streamer;4;13
Tech Roundup: Uber’s Many Bumps in the Road;3;21
Mike’s and Sapna’s Week in Tech: There are Zombie Social Networks. Then There’s Facebook.;1;21
The Electric Future, Waymo Documents, Uber: DealBook Briefing;10;3
Reading E-Books on a Bigger Screen;4;12
Russia’s Favored Outlet Is an Online News Giant. YouTube Helped.;10;23
When Snap Goes Public, Some Shareholders’ Voting Rights May Disappear;1;25
Listen to Your Daily Audio Report;2;1
Daily Report: Europe Gets Tough on Facebook;5;19
Daily Report: A New Week for Uber Dawns;2;27
Chief Executive of Audio Firm Sonos Steps Down;1;10
Daily Report: A New Form of Censorship in App Stores;1;18
Morning Agenda: Where’s the Next Big Deal for Fancy Coffee?;9;15
Morning Agenda: Britain Bolsters Its Bid for Aramco I.P.O.;7;13
Seven Films to Stream if You Loved ‘The Shape of Water’;12;12
Tech Opposition to Trump Propelled by Employees, Not Executives;2;6
Farhad’s and Mike’s Week in Tech: YouTube’s Problematic Advertising;3;25
Clearing Out the App Stores: Government Censorship Made Easier;1;18
Judge Denies Uber’s Motion for Private Arbitration;5;12
Apple Faces Inquiry in China Over App Store Content;4;19
Morning Agenda: Snap, Financial Regulation, Kraft Heinz and Unilever;2;21
The Best Alexa-Compatible Smart-Home Devices for Amazon Echo;11;3
Terrorism Is Faster Than Twitter;11;6
Five Technologies That Will Rock Your World;11;13
With C.I.A. Hacking Revelations, How to Protect Your Devices;3;8
Where Silicon Valley Is Going to Get in Touch With Its Soul;12;4
