What You Need to Wrap Gifts Like a Pro;12;18
World Series: Rays Bounce Back With a Narrow Win Over the Dodgers;10;22
N.B.A. 2020-21 Predictions: LeBron vs. Luka for M.V.P.;12;22
‘Tiger King’ Revisited: 5 Things We Learned in the New Episode;4;12
What’s the World’s Worst Smell?;2;17
As Coronavirus Looms, Mask Shortage Gives Rise to Promising Approach;3;20
The Sunday Read: ‘In the Line of Fire’;8;30
Judge Gives Carole Baskin the Tiger King’s Zoo;6;2
Arrested, Tortured, Imprisoned: The U.S. Contractors Abandoned in Kuwait;10;28
Rays Stun the Dodgers With a Chaotic Walk-Off Win in Game 4;10;25
Brexit Done? Not So Fast. Britain and E.U. Enter New Trade Deal Battle.;2;3
Little House on the Highway;2;25
What’s on TV Monday: ‘The Bachelor: the Greatest Seasons’ and ‘Amélie’;6;8
It’s Always the Summer of the Shark;8;14
Binge These One-Season Wonders;3;27
Hilary Rogers, Jeffrey Mauro;1;5
How Coronavirus Has Made Us All Very Handy;4;22
At Home, With a Long List of Needed Repairs;7;9
World Series: Dodgers Top the Rays in Game 3 With a Stellar Pitching Performance;10;24
‘These Are Real People Dying’: Why an Artist Filled His Yard With Flags;9;20
A Trump-Backed Senate Candidate’s Hedge Fund Disaster;7;5
‘Blow the Man Down’ Review: Women, They Get the Job Done;3;19
When Sharks Turned Up at Their Beach, They Called in Drones;11;20
It’s a Ballot Fight for Survival for Gig Companies Like Uber;10;23
Handcuffed by a New Rule, Rays Manage to Escape;10;12
What Happened After ‘Tiger King’;4;1
What to Make of the Rebound in the U.S. Jobs Report;6;5
Morgan Wootten, Acclaimed High School Basketball Coach, Dies at 88;1;22
As Brexit Deadlines Loom, the Posturing and Bickering Flare Again;9;7
What’s on TV Thursday: ‘Parks and Recreation’ and ‘Circus of Books’;4;30
What’s on TV Friday: ‘The Banker’ and ‘Blow the Man Down’;3;20
Freezers Sell Out as Consumers Stock Up;3;21
Yankees Cool Off in a Heated Series Against the Rays;8;9
What’s on TV Sunday: ‘Avenue 5’ and ‘9-1-1: Lone Star’;1;19
Markets Are Spooked. How Bad Could It Get?;3;10
With Brexit Official, Britons Start a ‘Brexodus’ From Brussels;2;1
‘Thunder Rock’ Review: A Beacon That Fails to Light the Way;1;26
About That Much Vaunted U.S.-U.K. Trade Deal? Maybe Not Now;3;2
Days From Election, Police Killing of Black Man Roils Philadelphia;10;28
Distressed Real Estate Market Beckons Opportunistic Buyers;5;26
The Alternate Aesthetic Realities of ‘Tiger King’;4;2
Rapper Pop Smoke Is Dead After Los Angeles Home Invasion, Label Says;2;19
From All-Star Flop to Astute Satire in Just 50 Years;9;25
The View From Waukesha;7;2
A Métis Woman’s Husband Disappeared — or Did He?;7;28
‘Who’s Your Baghdaddy’ Review: The Iraq War Set to Backpack Rap;11;10
Advertisers Flock to N.F.L. Broadcasts as a ‘Safe Haven’;9;10
McDonald’s Joins Walmart and Dozens of Other Chains With Mask Mandates;7;21
There’s No Spraying in Baseball This Year. Until the World Series.;10;23
Fix Everything Wrong at 23 Subway Stations? It Beats His Last Job;3;17
Yankees Beat Back the Rays, Giving Gerrit Cole a Shot at Game 5;10;9
In June, Slower Sales and Price Reductions in New York City;7;3
Pinterest Settles Gender Discrimination Suit for $22.5 Million;12;14
Pinterest Accused of Gender Bias in Suit by Former No. 2 Executive;8;11
You’re Choosing a Gift. Here’s What Not to Do.;12;17
What We Know About the Death of Walter Wallace Jr. in Philadelphia;10;29
In a Must-Win Game 6, Rays Plan to Turn Up the Aggressiveness;10;26
Executives to Step Down After Rio Tinto Destroys Sacred Australian Sites;9;11
Live: Oklahoma State Primary Election Results 2020;6;30
Here’s the Lady. Where’s the Gaga?;5;29
Economic Powers Vow to Fight Crisis;3;3
Live: Nebraska State Primary Election Results 2020;5;12
Theater to Stream: More Fringe and a Noël Coward ‘Party’;9;9
The TV Commercial, Once Advertising’s Main Event, Suffers in the Pandemic;5;28
When Moms Attack;2;12
A Bond Theme Suits Billie Eilish Quite Well;2;19
The 2020 Baseball Trivia Extravaganza;12;24
With Brexit Clock Ticking, Boris Johnson Vows, Again, to Walk Away;10;16
Iowa, Coronavirus, J.Lo: Your Monday Evening Briefing;2;3
Become an Indoor Plant Parent;5;4
Trump Rebuffs Demands to Lift Tariffs as Economy Falters;4;1
Rome Celebrates the Short, but Beautiful, Life of Raphael;3;6
Live: South Carolina State Primary Election Results 2020;6;24
Joel Schumacher, Director of ‘St. Elmo’s Fire,’ Is Dead at 80;6;22
Three New Memoirs Bring the Farm to the Page;6;5
Brinkmanship or Bluster? On Brexit and Pandemic, Boris Johnson Leaves It Late;12;20
William Barr, George Floyd Protests, Birdsongs: Your Tuesday Evening Briefing;6;2
Amazon Misses a Shopping Opportunity;5;26
The Culinary Couple Who Built a British Empire;2;18
‘Westworld’ Season 3 Is Here. Wait, What Happened in Season 2?;3;13
‘Wayne’s World’ & Me;7;1
The Fires Are Out, but Australia’s Climate Disasters Aren’t Over;2;23
Clayton Kershaw Steadies Dodgers and Puts a World Series Within Reach;10;26
Richard Teitelbaum, Electronic Composer and Improviser, Dies at 80;4;20
For Some Veteran Stars, NASCAR’s Appeal Is Fading;11;3
How Yurts and Heat Lamps Will Save New York’s Restaurants;9;25
How the Coronavirus Makes a No-Deal Brexit More Likely;6;5
At the Center of a Storm: The Search for a Proven Coronavirus Treatment;4;9
Ablaze With Art: Thriving Galleries in Lower Manhattan;10;15
A Potential Downside of Intermittent Fasting;9;28
U.S. Reports More Than 70,000 New Coronavirus Cases for the Second Time;7;17
Pictures of Themselves: The 2020 College Essays on Money;8;28
Even in a Pandemic, Everyone Still Hates the Astros;8;18
U.K. Officials’ New Trump Dilemma: What if He Loses?;7;31
Decade of Job Growth Comes to an End, Undone by a Pandemic;4;3
One N.B.A. Team Walked Out. A Generation of Athletes Followed.;8;27
As Winter Arrives, Heaters Become a Survival Tool for Businesses;11;27
‘Through Art, I Hope That We Can Make One Tulsa’;6;26
For Workers, No Sign of ‘What Normal Is Going to Look Like’;5;7
In a Town Where Meth Is Eclipsing Opioids, Everyone Feels the Pain;3;28
In a Town Where Meth Is Eclipsing Opioids, Everyone Feels the Pain;3;28
‘Parks and Recreation’ Is Back. Here’s Where We Left Off.;4;30
The Artists Keeping Up the Tradition of Mask-Making;2;17
In College and Homeless;2;20
Do It Yourself Home Repairs;12;6
Soccer’s Coming Storm;4;4
Lakers Fall to Blazers on Emotional Night Honoring Kobe Bryant;1;31
Big Tech Could Emerge From Coronavirus Crisis Stronger Than Ever;3;23
The Best Movies and TV Shows New to Netflix, Amazon and Stan in Australia in March;3;3
An Upstate N.Y. Backlash Over Virus Shutdown: ‘It’s Not Up Here’;5;1
Reinventing Workers for the Post-Covid Economy;12;1
What Happened at New York’s First Pandemic Fashion Show?;9;14
Virus Cases Rise, but Hazard Pay for Retail Workers Doesn’t;11;19
Democratic Victory in Wisconsin Looms as ‘Clarion Call’ for Trump;4;14
Get to Know These Black Bridal Designers;10;7
Jack Ma Quits SoftBank;5;18
Animals, Sex and Guns? Eric Goode Knew ‘Tiger King’ Had Potential;4;1
The Best Movies and TV Shows Coming to Netflix, Amazon and More in March;3;4
Trump’s S.E.C. Chairman Is Stepping Down;11;16
An Extra $600 a Week Kept Many Jobless Workers Afloat. Now What Will They Do?;7;29
Grim Economic Outlook Grips Markets as Stocks Plummet;3;16
Livestreams to Watch: John Legend Performance and Memorial Day Events;5;21
‘A Heartbreaking and Painful Week’;6;1
TikTok Makes a Deal (Not That One);8;17
What Did Google Do?;10;21
America’s Economy Begins to Shut Down as Pandemic Measures Take Hold;3;16
Six Months in the Life of a Locked-Down Theater;10;2
The Incredible Whiteness of the Museum Fashion Collection;9;29
Retail Sales Rise by 17.7 Percent;6;16
Virus Alters Where People Open Their Wallets, Hinting at a Halting Recovery;8;19
Fed Minutes Show Concern About Long-Term Economic Damage;5;20
Katherine Johnson Dies at 101; Mathematician Broke Barriers at NASA;2;24
The 50 TV Shows You Need to Watch This Winter;1;2
America at Hunger’s Edge;9;2
Emerald Fennell’s Dark, Jaded, Funny, Furious Fables of Female Revenge;12;17
Live: North Carolina State Primary Election Results 2020;10;28
U.S. Sets Record for Daily New Cases as Virus Surges in South and West;6;24
How Billie Eilish Rode Teenage Weirdness to Stardom;3;12
The Winners of Our Personal Narrative Essay Contest;1;7
Trump Administration Aims to Block New Funding for Coronavirus Testing and Tracing;7;18
As New Coronavirus Cases Hit Another Record in the U.S., Some States Delay Reopenings;6;25
‘We Are the Silent First Responders’: The Workers Who Make America Work;4;1
He Was a Science Star. Then He Promoted a Questionable Cure for Covid-19.;5;12
Eager to Visit a Different Time? These Novels Will Transport You;5;20
Summer Reading;5;20
Pulse-Pounding Summer Thrillers;5;20
The Summer Heats Up With Some True Crime;5;20
When Armchair Travel Is Your Only Option;5;20
Necessary Evils: New Horror Fiction;5;20
New Hollywood Books for Summer;5;20
Rakesses, Writers, Activists and Dukes, All of Them Hot;5;20
Puddings, Pimento Patty Melts, Sweet Potato Muffins: Drool-Worthy New Cookbooks;5;20
Victories, Defeats and the Science of Sports;5;20
Alicia Keys and Tori Amos Are the Headliners for This Season’s Music Books;5;20
