What Happens in Vegas if No One Stays in Vegas?;3;3
$825,000 Homes in New Jersey, New Mexico and Wyoming;5;6
$1.7 Million Homes in Wisconsin, Arizona and New Jersey;3;4
Finger Lakes Dreams Put on Hold;7;17
Santa Fe Board Crushes George R.R. Martin’s Plan for ‘Medieval Castle’;9;11
Companies Bet Big on Working From Home;11;30
1 America, 1 Pandemic, 2 Realities;11;21
‘Bleak Friday’ for Stores as Pandemic Pushes Holiday Shopping Online;11;30
Marfa’s Answer to the Collapse of Local News: Coffee and Cocktails;2;20
In New Orleans, a Home That’s Gotten Finer With Age;9;15
$630,000 Homes in California;8;10
Salesforce to Acquire Slack for $27.7 Billion;12;1
$700,000 Homes in California;4;27
Apple to Ditch Intel Chips in Macs as It Consolidates Its Power;6;22
Does the Shoe Fit? Try It On With Augmented Reality;12;22
A Vow of Silence, a Cabin in the Woods, a Terrible Wildfire;8;31
‘All-Electric’ Movement Picks Up Speed, Catching Some Off Guard;2;4
$2.4 Million Homes in California;3;2
$750,000 Homes in Ohio, New York and Arizona;10;28
All This Dystopia, and for What?;2;18
A Salvadoran-American Assembles the Fragments of a Violent Cultural History;9;1
No Live Sports on TV? Consumers Want a Refund;4;2
A String Quartet Is Crushed by the Coronavirus;4;19
Amazon and Apple Are Powering a Shift Away From Intel’s Chips;12;1
How May Google Fight an Antitrust Case? Look at This Little-Noticed Paper;7;13
‘Harry Potter’ and the Prisoners of Quarantine;11;17
When an Oil Price War Meets Coronavirus Fears, Markets Get Punched in the Face;3;9
$3 Million Homes in California;9;28
The T List: Five Things We Recommend This Week;11;5
‘It’s Just Crazy’ in Pennsylvania: Mail Voting and the Anxiety That Followed;11;2
$4 Million Homes in California;7;13
U.S. Will Drop Limits on Virus Testing, Pence Says;3;3
In ‘Penny Dreadful: City of Angels,’ California Dreaming, Darkly;4;24
Did John McCracken Make That Monolith in Utah?;11;27
Manhattan Emptied Out During the Pandemic. But Big Tech Is Moving In.;10;13
Food, Rent, Health Insurance? Tough Choices in Pandemic Economy;4;22
A Portuguese Hideaway That’s Part Refuge, Part Shrine;3;9
Golf Course Designers Bring the Details Home;3;6
About Those Job Numbers …;6;8
As Biden Prepares to Take Office, a New Rush at the Border;12;13
Is Goldman Sachs Going to Florida?;12;7
David Lee Roth Is Letting His Art (Mostly) Do the Talking;7;13
7 Activities to Build Community and Positive Classroom Culture During Online Learning;8;27
Even From the Desert, Danny Lyon Still Speaks to the Streets;11;27
Is This How the TikTok Saga Ends?;9;14
Dog the Bounty Hunter Is Hunting Alone;1;17
The Pandemic Work Diary of a Podcasting Tech Editor;11;25
How to Staycation in 6 American Cities;10;29
She Stalked Her Daughter’s Killers Across Mexico, One by One;12;13
Faces of Power: 80% Are White, Even as U.S. Becomes More Diverse;9;10
Joe Biden Says Age Is Just a Number;1;17
