Headline;Month;Day
How to Shop for a Used Computer;10;29
How to Shop for a Used Laptop or Desktop PC;8;7
Your Holiday Return Policy Guide;12;8
U.S. Stocks End the Week Lower After Tech Earnings;5;1
An Oscar Winner Made a Khashoggi Documentary. Streaming Services Didn’t Want It.;12;24
When Bosses Shared Their Profits;6;25
I Watched Months of Bolsonaro’s Broadcasts. It Was Wild.;9;10
Celebrating Pride on Film;6;1
They Clean the Buildings Workers Are Fleeing. But Who’s Protecting Them?;3;18
Congress Doesn’t Get Big Tech. By Design.;7;29
Big Tech’s Takeovers Finally Get Scrutiny;2;14
The Man With 17,700 Bottles of Hand Sanitizer Just Donated Them;3;15
5 Movies That Will Bring Spring Break to Your Home;3;19
Where to Go After ‘Mad Men’? A Canadian Dramedy;1;10
Where to Go After ‘Mad Men’? A Canadian Dramedy;1;10
The Week in Tech: We’re Testing How Much the Internet Can Handle;3;27
Watch TV, Free;6;30
MacKenzie Scott Announces $4.2 Billion More in Charitable Giving;12;16
Wirecutter Staff’s Favorite Smart Home Devices;9;18
The Week in Business: The Second Wave Is Coming;6;14
Dig Out Your Loose Change. It’s Time to Turn It Into Cash Money.;7;31
What’s on TV Monday: ‘CMA Best of the Fest’ and ‘Foodie Love’;7;13
‘Selah and the Spades’ Review: This Isn’t Your Average Teen Drama;4;16
10 Clever Accessories to Make Your Smart Speakers Better—and One to Skip;9;18
What’s in Our Queue? ‘The Great’;11;19
Warehouse Workers in a Bind as Virus Spikes in Southern California;7;9
‘Parasite’ Director Bong Joon Ho’s Must-See Movies: Where to Watch;1;24
What’s on TV Tuesday: ‘The Black Power Mixtape’ and ‘The Last O.G.’;6;9
What’s on TV Friday: ‘The Pale Horse’ and ‘Stargirl’;3;13
What’s on TV Monday: ‘Luce’ and ‘The Notebook’;1;27
14 Antiracist Books for Kids and Teens Recommended by BIPOC Teachers and Librarians;6;18
Stakeholder Capitalism Gets a Report Card. It’s Not Good.;9;22
I Was a Skeptic, but I Loved Cooking With the Google Nest Hub Max;2;20
New Rule in California Will Require Zero-Emissions Trucks;6;25
Now Playing: The South by Southwest Film Festival, Sort of;4;28
New Rule in California Will Require Zero-Emissions Trucks;6;25
Delta Plans to Go Carbon Neutral. Yes, You Read That Right.;2;14
Progressives Defeat Brooklyn Project That Promised 20,000 Jobs;9;23
Your Doorbell Camera Spied on You. Now What?;2;19
What Could Kill My New York Bookstores?;5;29
Does Cinéma Vérité Exist? Watch These 2 Movies to Find Out;6;25
Looking for an Introduction to Taiwan’s Greatest Filmmaker? Start Here;5;28
Tony Hsieh, Longtime Chief of Zappos, Is Dead at 46;11;28
Analysis Ties Hacking of Bezos’ Phone to Saudi Leader’s Account;1;22
Happy Results Turned Up Everywhere You Looked;1;17
When Is a Comedy Special Also a Corporate Synergy Message?;12;30
Does It Matter if a Documentary Is Staged? These Two Films Hold Answers;8;20
When the Police Treat Software Like Magic;6;25
What Makes Kiarostami a Modern Master? Start Here;8;6
What’s an Essential Service in a Pandemic? The Post Office;4;15
The Fast & Furious Art of the Car Chase;7;1
Films to Heal a Broken Moment;4;27
How to Thrive in Online Life;4;3
Sellers of Sex Toys Capitalized on All That Alone Time;6;7
3-D Sound and a Zoom Apocalypse: The Plays That Come to Life Online;5;20
Michelle Yampolsky, Matthew Gomez;1;5
Smart Speakers Can Go Beyond Music;3;16
What’s on TV Tuesday: ‘The Truth’ and Jim Jefferies;7;7
What’s on TV Tuesday: Super Tuesday Coverage and Taylor Tomlinson;3;3
What’s on TV Saturday: ‘S.N.L.’ and Young Dylan;2;29
What’s on TV Sunday: ‘Homeland’ and ‘High Maintenance’;2;9
What’s on TV Wednesday: An Adventure Series and ‘68 Whiskey’;1;15
What’s on TV Monday: ‘The New Pope’ and ‘On the Basis of Sex’;1;13
Ruth Bader Ginsburg: The Films About Her Life;9;19
