Headline;Month;Day
Many Rivers, Too Many Dams;10;2
No One Is Stopping the Child Sex Abusers;10;2
Can Our Culture Survive Climate Change?;10;2
It’s Not Just the West. These Places Are Also on Fire.;9;16
Protecting Brazil’s Uncontacted Tribes for 30 Years, Then Killed by an Arrow;9;11
Brazil Fires Burn World’s Largest Tropical Wetlands at ‘Unprecedented’ Scale;9;4
‘A Hail Mary’: Psychedelic Therapy Draws Veterans to Jungle Retreats;8;30
Aritana Yawalapiti, Revered Indigenous Leader in Brazil, Dies at 71;8;15
The Coronavirus Unleashed Along the Amazon River;7;25
Under Pressure, Brazil’s Bolsonaro Forced to Fight Deforestation;8;1
Amazon Deforestation Soars as Pandemic Hobbles Enforcement;6;6
The Amazon Will Soon Burn Again;5;27
Amazon Is Jeff Bezos;7;28
Amazon’s Biggest Leap Was Boring;9;2
Amazon’s Big Breakdown;5;28
Why Bernie Sanders Praised Amazon;2;10
Can Shopify Compete With Amazon Without Becoming Amazon?;11;24
Life Without Amazon (Well, Almost);12;29
Three Poets on the Amazon;10;2
When Even Amazon Is Sold Out of Exploding Kittens;4;17
As Amazon Rises, So Does the Opposition;4;18
Amazon Makes No Promises on Bezos Testimony;5;15
Can Amazon Conquer the World?;9;28
The Ghost Dogs of the Amazon Get a Bit Less Mysterious;5;4
Amazon Powers Ahead With Robust Profit;1;30
Reliable Amazon Isn’t Anymore;4;22
The Amazon Was Sick. Now It’s Sicker.;10;2
Google Takes Aim at Amazon. Again.;7;23
Amazon Misses a Shopping Opportunity;5;26
It’s Now Amazon’s Turn in the Spotlight;4;6
Amazon Wins Without Even Trying;7;31
Amazon Set to Face Antitrust Charges in European Union;6;11
Judge Halts Work on Microsoft’s JEDI Contract, a Victory for Amazon;2;13
In Amazon’s Bookstore, No Second Chances for the Third Reich;2;9
One of Amazon’s Most Powerful Critics Lives in Its Backyard;5;3
Unions Push F.T.C. to Study if Amazon Warps the Economy;2;27
‘Way Too Late’: Inside Amazon’s Biggest Outbreak;5;19
‘We Didn’t Sign Up for This’: Amazon Workers on the Front Lines;4;3
Amazon Sticks With Office Expansion Plans in New York and Elsewhere;8;18
The Best Amazon Prime Day Deals;10;14
Amazon Reaches Deal With French Unions in Coronavirus Safety Dispute;5;16
Amazon Looks to Question Trump in Pentagon Contracting Case;2;10
When Amazon Flexes Its Power;6;11
Amazon, Pushing Fashion, Opened Photo Studio as a ‘Warehouse’ Exemption;6;12
Amazon Is So Much Bricks and Mortar;8;12
Amazon Shopping Needs a Prime Army;11;30
The Amazon Has Seen Our Future;10;2
Amazon Angles to Grab Back Customers;5;22
Amazon Bans, Then Reinstates, Hitler’s ‘Mein Kampf’;3;17
How Amazon Keeps Defying Gravity;1;31
The Week in Business: Amazon Is Coming for Trump;2;16
Walmart Announces Membership Service in Attempt to Compete With Amazon;9;1
To Focus on Necessities, Amazon Stops Accepting Some Items in Warehouses;3;17
Amazon Workers Urge Bezos to Match His Words on Race With Actions;6;24
Amazon Says Jeff Bezos Is Willing to Testify Before Congress;6;15
Senators Want to Know if Amazon Retaliated Against Whistle-Blowers;5;7
Amazon to Suspend Operations in France Over Coronavirus Dispute;4;15
Amazon Sells More, but Warns of Much Higher Costs Ahead;4;30
Amazon Workers Near Vote on Joining Union at Alabama Warehouse;12;22
Pushed by Pandemic, Amazon Goes on a Hiring Spree Without Equal;11;27
Bezos Grilled About Amazon’s ‘Predatory Practices’;7;29
Amazon workers call for a day off to vote.;10;13
Pentagon Asks to Reconsider Awarding Huge Cloud Contract to Amazon;3;13
Amazon Loses Appeal of French Order to Stop Selling Nonessential Items;4;24
Don’t Let Amazon Get Any Bigger;10;8
Amazon Charged With Antitrust Violations by European Regulators;11;10
The Amazon Prime Day Deals Worth Buying;10;13
We Need Amazon During the Coronavirus. That’s a Problem.;3;31
Amazon Wants to Get Even Closer. Skintight.;11;27
Amazon’s Showdown in France Tests Its Ability to Sidestep Labor;5;14
Are Amazon Jobs Worth 1,400 Loads of Traffic? French Region Is Split;10;11
What Does Amazon Know About Your Thanksgiving Groceries?;11;25
Amazon Bans Sale of Foreign Seeds in the U.S.;9;7
How Fake Reviews Hurt Us and Amazon;11;19
My Mom, My Dad and Amazon’s Alexa;2;21
The Amazon Critic Who Saw Its Power From the Inside;7;22
Clicking Buy on Amazon? It’s Trying to Prevent a Coronavirus Caveat;2;20
Gaps in Amazon’s Response as Virus Spreads to More Than 50 Warehouses;4;5
Amazon and Apple Are Powering a Shift Away From Intel’s Chips;12;1
Drone Delivery? Amazon Moves Closer With F.A.A. Approval;8;31
Amazon Pushes Into Making Video Games, Not Just Streaming Their Play;4;2
Pasta, Wine and Inflatable Pools: How Amazon Conquered Italy in the Pandemic;9;26
Amazon Pauses Police Use of Its Facial Recognition Software;6;10
Jeff Bezos Doubles Down on Amazon’s Pandemic Response;5;1
Amazon Unveils Drone That Films Inside Your Home. What Could Go Wrong?;9;24
Introducing ‘Time,’ a Film From The Times and Amazon Studios;10;5
After a Flop, Amazon Makes Another Foray Into Video Games;8;10
New York Attorney General Scrutinizes Amazon for Firing Warehouse Worker;4;28
Quotation of the Day: Airing Worries for Amazon’s Workers;5;5
Amazon Said to Be Under Scrutiny in 2 States for Abuse of Power;6;12
An Amazon Vice President Quit Over Firings of Employees Who Protested;5;4
Amazon to Buy Zoox, in a Move Toward Self-Driving Cars;6;26
Amazon Confronts Criticism Over ‘Hunters’ and Sale of Nazi Propaganda;2;21
How French Workers Took on Amazon in the Middle of a Pandemic and Won;4;29
Coronavirus, U.S. Jobless Claims, Amazon: Your Friday Briefing;5;15
A Short Recommendation: Watch the Stage Version of ‘Fleabag’ on Amazon Video;4;10
My Partner Works in an Amazon Warehouse. I’m Worried — and Proud.;4;2
The Best Movies on Amazon Prime Video Right Now;9;10
Bezos Takes Back the Wheel at Amazon;4;22
12 Accusations in the Damning House Report on Amazon, Apple, Facebook and Google;10;6
The Trouble With Breaking Up Amazon? Its Online Store Is So Good;2;12
Jeff Wilke, Amazon’s Chief of Consumer Business, Will Retire Next Year;8;21
We Work in an Amazon Warehouse. We Didn’t Sign Up to Be Heroes.;5;29
We Work in an Amazon Warehouse. We Didn’t Sign Up to Be Heroes.;5;29
The Best Movies and TV Shows Coming to Netflix, Amazon and More in February;2;1
Amazon halts sales of shirts that used a derogatory term to refer to Kamala Harris.;8;19
The Best Movies and TV Shows Coming to Netflix, Amazon and More in March;3;4
The Best Movies and TV Shows Coming to Hulu, Amazon and More in October;9;30
The Best Movies and TV Shows Coming to Netflix, Amazon and More in April;4;1
The Best Movies and TV Shows Coming to Netflix, Amazon and More in August;7;31
Messias Kokama, Indigenous Leader in the Amazon, Dies at 53;6;18
The Best Movies and TV Shows New to Netflix, Amazon and Stan in Australia in April;4;2
The Best Movies and TV Shows New to Netflix, Amazon and Stan in Australia in March;3;3
The Best Movies and TV Shows New to Netflix, Amazon and Stan in Australia in December;12;7
The Best Movies and TV Shows New to Netflix, Amazon and Stan in Australia in May;4;30
The Best Movies and TV Shows New to Netflix, Amazon and Stan in Australia in July;7;2
The Best Movies and TV Shows New to Netflix, Amazon and Stan in Australia in November;11;2
The Best Movies and TV Shows New to Netflix, Amazon and Stan in Australia in October;9;30
We Have a Question for Jeff Bezos and Other Billionaires;7;29
Lesson of the Day: ‘Gaps in Amazon’s Response as Virus Spreads to More Than 50 Warehouses’;5;8
Jeff Bezos’ Company Is Carrying Scientific Cargo to Space. It’s Not Amazon.;10;13
The Best Movies and TV Shows New to Netflix, Amazon and Stan in Australia in September;9;1
Amazon to the Rescue of the Fashion World!;5;14
The Best Movies and TV Shows New to Netflix, Amazon and Stan in Australia in June;6;1
The Best Movies and TV Shows New to Netflix, Amazon and Stan in Australia in February;2;10
The Best Movies and TV Shows New to Netflix, Amazon and Stan in Australia in August;8;6
How Amazon, Geico and Walmart Fund Propaganda;1;21
The Best Movies and TV Shows Coming to Amazon, HBO Max, Hulu and More in January;12;31
To keep up with pandemic boom in online shopping, Amazon hired 427,300 employees in 10 months.;11;28
The Best Movies and TV Shows Coming to Amazon, HBO Max, Hulu and More in December;12;1
The Best Movies and TV Shows Coming to Amazon, HBO Max, Hulu and More in November;11;1
Amazon workers threaten to shut down warehouses if employees don’t get a day off to vote.;10;22
Help Wanted: Grocery Stores, Pizza Chains and Amazon Are Hiring;3;22
Amazon Satellites Add to Astronomers’ Worries About the Night Sky;8;10
Amazon and Google’s True Advantage;10;30
Strikes at Instacart and Amazon Over Coronavirus Health Concerns;3;31
India Targets Jeff Bezos Over Amazon and Washington Post;1;20
As Bolsonaro Keeps Amazon Vows, Brazil’s Indigenous Fear ‘Ethnocide’;4;19
Review: Al Pacino and Nazis, in Amazon’s ‘Hunters’;2;19
In South India, Amazon Builds Its Largest Office Yet;8;25
Congress Calls on Jeff Bezos of Amazon to Testify;5;1
What It Looks Like Inside an Amazon Warehouse Now;6;9
Amazon Buys Wondery as Podcasting Race Continues;12;30
FreshDirect, After Broken Eggs and Angry Customers, Stages a Comeback;2;21
Amazon Backtracks From Demand That Employees Delete TikTok;7;10
The Best Movies and TV Shows Coming to Netflix, Amazon and More in July;7;1
The Best Movies and TV Shows Coming to Netflix, Amazon and More in May;5;1
The Best Movies and TV Shows Coming to Netflix, Amazon and More in June;6;1
Amazon Halo Review: The Fitness Gadget We Don’t Deserve or Need;12;9
Paulinho Paiakan, Indigenous Defender of Rainforest, Dies at 67;6;23
Amazon, Apple, Facebook and Google Prepare for Their ‘Big Tobacco Moment’;7;28
Jeff Bezos Cast in a Role He Never Wanted: Amazon’s D.C. Defender;7;27
Progressives Killed Amazon’s Deal in New York. Is Industry City Next?;8;12
‘Going in the Wrong Direction’: More Tropical Forest Loss in 2019;6;2
Brazil’s First Indigenous Curator: ‘We’re Not Afraid Anymore’;5;22
Amazon Power Plant: A Company Responds;10;10
Animal Viruses Are Jumping to Humans. Forest Loss Makes It Easier.;4;9
Welcome to India, Mr. Bezos. Here’s an Antitrust Complaint.;1;13
All Your Favorite Brands, From BSTOEM to ZGGCD;2;11
Pentagon Sticks With Microsoft for Cloud Computing Contract;9;4
The Epic Battle Between Trump and Bezos Is On;2;18
Jeff Bezos Commits $10 Billion to Address Climate Change;2;17
Sonos, Squeezed by the Tech Giants, Sues Google;1;7
Apple Unveils a Smaller HomePod;10;13
100 Notable Books of 2020;11;20
Who Postpones Black Friday? This Year, the French;11;20
He Has 17,700 Bottles of Hand Sanitizer and Nowhere to Sell Them;3;14
Four Top Tech C.E.O.s Will Testify in Antitrust Inquiry, Panel Says;7;1
Four of the World’s Wealthiest Men Are Preparing for Battle;7;28
What to Do When Your Uncle Believes Coronavirus Conspiracies;4;23
Can Facebook Ever Stop the Drama?;7;9
A Handbook to Today’s Tech Hearing;7;29
‘We Want to Open!’ French Shopkeepers Revolt Against Orders to Close;11;3
The Luxury E-Commerce Wars Heat Up;11;29
I Tried to Live Without the Tech Giants. It Was Impossible.;7;31
Digital Habits Are Hard to Break;7;24
Online Retailers Spend Millions on Ads Backing Postal Service Bailout;5;6
Hooray (Mostly) for the Government!;9;23
Lawmakers Propose Making E-Commerce Companies Liable for Counterfeits;3;2
Watch Live: Tech C.E.O.s Testify Before Congress;7;29
Is It Immoral to Increase the Price of Goods During a Crisis?;3;16
Americans Keep Clicking to Buy, Minting New Online Shopping Winners;5;13
Big Tech Continues Its Surge Ahead of the Rest of the Economy;10;29
5 Things to Avoid on Prime Day;9;28
What’s on TV Tuesday: “Super 8” and “#TEAMPLUTO”;2;18
U.S. Cracks Down on Counterfeits in a Warning Shot to China;1;24
House Lawmakers Condemn Big Tech’s ‘Monopoly Power’ and Urge Their Breakups;10;6
How Much Are We Paying for Our Subscription Services? A Lot;1;29
Sports in a Pandemic Don’t All Stink;7;10
Golden Globes 2020: Where to Stream the Winners;1;6
Their businesses went virtual. Then Apple wanted a cut.;7;28
Where to Stream Alan Parker’s Best Movies;7;31
Stream and Shout: 10 Underseen Rock Documentaries;4;13
A Privacy Absolutist Isn’t So Sure Anymore;4;17
Where to Watch ‘Parasite,’ ‘Joker’ and More 2020 Oscar-Nominated Movies;1;13
The Boys Return to Their Comic Book Roots;1;23
How Do I Get HBO Max if I Already Have HBO?;5;27
Whole Foods Founder: ‘The Whole World Is Getting Fat’;9;24
Takeaways from the congressional report on Big Tech.;10;7
6 Must-Haves When Flying With a Cat or Dog;1;4
Pope Francis Sets Aside Proposal on Married Priests;2;12
Stream These Spooky Haunted House Movies;9;30
Big Tech Could Emerge From Coronavirus Crisis Stronger Than Ever;3;23
Catch up: Coinbase files for initial public offering.;12;18
Please Stop Big Tech, Small Rivals Tell Lawmakers;1;17
How to Fight Against Big Tech’s Power;7;29
With Baseball Benched, These Movies Make Good Relievers;4;1
Your Tuesday Briefing;9;28
The Super Bowl Ads You Won’t See This Year;2;1
‘What the Constitution Means to Me’ Review: Pursuits of Happiness;10;22
Democrats accused Big Tech of stifling competition. Republicans accused Big Tech of stifling speech.;7;30
Analysts worry about the top-heavy stock market.;7;23
AT&T Signed Up 4 Million HBO Max Customers;7;23
Does Your Pet Really Need Cat TV or a Dog Playlist?;2;2
Big Tech Has a Big Climate Problem. Now, It’s Being Forced to Clean Up.;7;21
Where to Stream ‘Spartacus’ and Other Great Kirk Douglas Movies;2;6
Big Tech’s Domination of Business Reaches New Heights;8;19
Covid-19: Lessons From the Yanomami;4;27
A Glimpse of Our Connected Tech Future, Courtesy of CES 2020;1;10
What’s on TV Wednesday: ‘The Farewell’ and ‘Big Cat Country’;2;12
11 of Our Best Weekend Reads;4;24
The Real Dangers of Surveillance;6;12
The Evolving Travel ‘Experience’: Virtual, Actual and In Between;11;12
What Years of Emails and Texts Reveal About Your Friendly Tech Companies;8;4
Who’s Watching Your Porch?;1;19
F.T.C. Broadens Review of Tech Giants, Homing In on Their Deals;2;11
15 Sean Connery Movies to Stream;10;31
How Facebook Entrenches Itself;9;30
Intense Arctic Wildfires Set a Pollution Record;7;7
9 Great John le Carré Adaptations to Stream;12;14
The Economy Is in Record Decline, but Not for the Tech Giants;7;30
As Customers Move Online, So Does the Holiday Shopping Season;11;23
When Our (Fictional) Presidents Are Tested by Their Moments;3;26
What’s on TV Thursday: ‘The Lighthouse’ and ‘Trolls World Tour’;4;16
What’s on TV Friday: ‘Making the Cut’ and ‘Uncorked’;3;27
‘This Is a New Phase’: Europe Shifts Tactics to Limit Tech’s Power;7;30
Manhattan Emptied Out During the Pandemic. But Big Tech Is Moving In.;10;13
Need a Laugh? Need a Lot? Stream These 15 Binge-Worthy Sitcoms;3;19
Gear to Bring the Outdoors Inside;4;25
Making the Most of Staying at Home;4;3
All the Smart Home Products You Need;9;18
The Roles Are L.G.B.T.Q., but the Movies Are Not About Self-Discovery;6;9
Santiago Manuin, Indigenous Leader in Peru, Dies at 63;7;8
What’s on TV Friday: An Ilana Glazer Stand-Up Special and ‘Little Women’;1;3
What to Stream on Valentine’s Day;2;14
Here’s how to watch the Democratic convention.;8;17
Victoria’s Secret and Sycamore Partners Play ‘Let’s Break a Deal’;4;23
Word + Quiz: grandstand;11;16
Settle In for the Season With These Films;11;22
Beyond TikTok, Walmart Looks to Transform;9;23
Big Tech’s Worries Should Worry You;5;1
Another Way the 2020s Might Be Like the 1930s;4;28
The Week in Business: TikTok’s Last-Minute Save;9;20
Gadgets Were on the Way Out. Then 2020 Happened.;10;14
Price Gouging Complaints Surge Amid Coronavirus Pandemic;3;28
The Essential Stephen King;5;4
From Stage to Screen: 5 Shows That Got It Right (And 5 That Didn’t);11;4
Max von Sydow: Where to Stream 13 of His Best Movies;3;9
Health Care Comes to Us;7;22
Ring Recalls Video Doorbells After Several Catch Fire;11;11
Here’s the business news to watch this week.;7;27
Carl Reiner: Where to Stream His Best Work;6;30
There Is a Racial Divide in Speech-Recognition Systems, Researchers Say;3;23
How Tech’s Lobbyists Are Using the Pandemic to Make Gains;4;3
5 Movies to Watch if You Have Trouble With Technology;4;8
Jeff Bezos, Tabloid Man;1;23
New Count Reveals 1,600 More Nursing Home Deaths in N.Y.;5;5
IBM, Seeing Its Future in the Cloud, Breaks Off I.T. Unit;10;8
Put Alexa and Siri to Work;1;22
What’s on TV Tuesday: ‘Miracle Workers: Dark Ages’ and ‘Afterward’;1;28
What’s on TV Monday: ‘Breeders’ and ‘Notes on a Scandal’;3;2
What’s on TV Monday: ‘The Bachelor: the Greatest Seasons’ and ‘Amélie’;6;8
Cartoons Aren’t Just for Kids. Stream These 11 Series for Adults.;4;10
What’s on TV Friday: ‘Homecoming’ and ‘AKA Jane Roe’;5;22
How Much Watching Time Do You Have This Weekend?;1;16
The Next Round of Bailouts Will Name Names;4;24
The Economy Is Reeling. The Tech Giants Spy Opportunity.;6;13
Congress Agrees: Big Tech Is Broken.;10;7
Autonomous Vehicles Take Another Big Leap;12;14
5 Ways to Stay in Touch With Less Tech-Savvy Family and Friends;5;6
With ‘Four More Shots Please!,’ India Gets Its Own ‘Sex and the City’;5;8
How ‘The Vast of Night’ Builds Tension With a Strange Sound;5;29
Tech Goliaths Act Like Davids;6;22
6 Movies That Take Place in a Single Location (Mostly);6;21
A Little E-Commerce Has Big Ripples;5;19
‘My Spy’ Review: A Secret Agent Gets Outsmarted;6;25
A Pandemic Bonus: Catch These TV Shows While They’re Still Free;4;21
The Week in Tech: Are Smartphones Interesting Again?;2;14
Bollywood, Reeling From the Pandemic, Shifts to Streaming;12;24
All Hail the Un-Tech Election;11;6
7 Films to Help Children Dealing With Grief;12;13
What’s on TV Monday: A Penn and Teller Special and ‘Good Deeds’;7;27
How Much Watching Time Do You Have This Weekend?;6;25
What’s on TV Thursday: Leonard Bernstein’s ‘Mass’ and ‘Trial by Fire’;5;21
You Are Being Influenced;4;28
Luis Sepúlveda, Chilean Writer Exiled by Pinochet, Dies at 70;4;20
What’s on TV Wednesday: Awkwafina and ‘The Revenant’;1;22
Trump Lost. Bolsonaro Can’t Get Over It.;12;8
What’s on TV Tuesday: ‘Elmo’s Playdate’ and ‘Fleabag’;4;14
What’s on TV Saturday: ‘Self Made’ and ‘I See You’;3;21
The Next Round of Bailouts Will Name Names;4;24
The Economy Is Reeling. The Tech Giants Spy Opportunity.;6;13
Congress Agrees: Big Tech Is Broken.;10;7
Autonomous Vehicles Take Another Big Leap;12;14
5 Ways to Stay in Touch With Less Tech-Savvy Family and Friends;5;6
With ‘Four More Shots Please!,’ India Gets Its Own ‘Sex and the City’;5;8
Tech Goliaths Act Like Davids;6;22
How ‘The Vast of Night’ Builds Tension With a Strange Sound;5;29
‘My Spy’ Review: A Secret Agent Gets Outsmarted;6;25
6 Movies That Take Place in a Single Location (Mostly);6;21
A Little E-Commerce Has Big Ripples;5;19
A Pandemic Bonus: Catch These TV Shows While They’re Still Free;4;21
The Week in Tech: Are Smartphones Interesting Again?;2;14
Bollywood, Reeling From the Pandemic, Shifts to Streaming;12;24
All Hail the Un-Tech Election;11;6
7 Films to Help Children Dealing With Grief;12;13
You Are Being Influenced;4;28
What’s on TV Monday: A Penn and Teller Special and ‘Good Deeds’;7;27
How Much Watching Time Do You Have This Weekend?;6;25
What’s on TV Thursday: Leonard Bernstein’s ‘Mass’ and ‘Trial by Fire’;5;21
Luis Sepúlveda, Chilean Writer Exiled by Pinochet, Dies at 70;4;20
What’s on TV Wednesday: Awkwafina and ‘The Revenant’;1;22
Trump Lost. Bolsonaro Can’t Get Over It.;12;8
What’s on TV Tuesday: ‘Elmo’s Playdate’ and ‘Fleabag’;4;14
What’s on TV Saturday: ‘Self Made’ and ‘I See You’;3;21
What’s on TV Thursday: ‘How to Get Away With Murder’ and ‘The Lodge’;5;14
What’s on TV Saturday: ‘Spaceship Earth’ and ‘Valley Girl’;5;9
What’s on TV Monday: ‘Some Like It Hot’ and College Basketball;2;10
What’s on TV Monday: ‘Capone’ and ‘The Titan Games’;8;10
What’s on TV Friday: ‘Bojack Horseman’ and ‘Spider-Man: Far From Home’;1;31
9 Great Olivia de Havilland Movies to Stream;7;26
What’s on TV Wednesday: ‘Parasite’ and ‘Modern Family’;4;8
Why Was ‘Amazing Stories’ Rebooted? These 7 Episodes Help Explain;3;6
11 Reality Shows to Watch With Your Older Kids;10;8
What’s on TV Wednesday: ‘Love Life’ and ‘American Soul’;5;27
What’s on TV Friday: ‘Barber Shop Chronicles’ and ‘Seberg’;5;15
Here’s how to watch Night 3 of the convention.;8;19
Looking for Escapism? Stream These Great British TV Shows;4;1
Where to Stream Chadwick Boseman’s Best Performances;8;29
Online Shopping Is Amazing. Or Is It?;12;15
The Gap Between the Haves and Have-Nots of Tech Widens;2;4
The Economy Needs Help;9;2
Silicon Valley’s Newest Rival: The Banks of the Hudson;1;5
Best in Show: Watch Fred Willard’s Most Memorable Roles;5;18
12 Family-Friendly Nature Documentaries;4;1
‘Black Box’ Review: Memory and Loss;10;6
Small tech stocks are posting eye-popping gains.;9;17
Lynn Shelton Movie Moments;5;16
What’s on TV Monday: ‘All or Nothing’ and ‘American Ninja Warrior’;8;31
‘Gulabo Sitabo’ Review: This Old House, Lucknow Style;6;12
Lawmakers, United in Their Ire, Lash Out at Big Tech’s Leaders;7;29
Now Streaming: French Movies for Every Niche;5;14
‘7500’ Review: Claustrophobia and Ethical Dilemmas on a Hijacked Plane;6;18
Is There Really a Toilet Paper Shortage?;3;13
Sorry, eBay and Uber. You’re Hated.;6;24
What’s on TV Monday: ‘Amy Schumer Learns to Cook’ and ‘Jawbreaker’;8;17
The Tech That Was Fixed in 2020 and the Tech That Still Needs Fixing;12;23
Investors Bet Giant Companies Will Dominate After Crisis;4;28
Algorithms Learn Our Workplace Biases. Can They Help Us Unlearn Them?;3;10
Stocks Rise, With Tech Index Now Up for 2020;5;7
Coronavirus Will Test Our New Way of Life;3;2
12 Great TV Series by Film Directors;5;20
Big Tech Funds a Think Tank Pushing for Fewer Rules. For Big Tech.;7;24
What to Carry on the Slopes;1;14
Modern Love Podcast: Judd Apatow Reads ‘At the Hospital, an Interlude of Clarity’;1;2
The Big Tech Hearing;7;30
Missing ‘Gomorrah’? Watch This;3;5
A Hassle-Free Guide to Gift Shopping for Your Friends & Family Abroad;10;29
Target Temporarily Closing or Shortening Hours at 200 Stores;5;31
Big Tech’s Backlash Is Just Starting;7;30
Will More Data Make Us Healthier?;8;28
Knockoff Dyson Vacuum Batteries Are Cheap, but They Aren’t Worth the Risk;2;19
Don’t Get What’s So Great About Westerns? Start Here;3;26
Best Cyber Monday Vacuum Deals from Dyson, Roomba, and Shark;11;30
The Justice Dept.’s Lawsuit Against Google: Too Little, Too Late;10;20
Big Tech Was Their Enemy, Until Partisanship Fractured the Battle Plans;10;6
Will Our Most Important Industry Survive the Coronavirus?;3;25
The Robots Are Coming. Prepare for Trouble.;1;30
Night 3 of the convention features high-stakes speeches. Here’s how to watch.;8;19
Capital One will pay $80 million over hack.;8;6
An Evangelical Conquista in Amazonia;10;2
8 Big-Studio Movies You Can Stream at Home Right Now;3;20
You Can’t Escape Uber’s Lobbying;10;12
Where to Stream ‘Parasite’ and Other Big Oscar Winners;2;10
6 Items to Stuff in Your Ski Jacket Pockets;1;25
A Revolt Over Safety and Pay;3;31
Reopening Prompts New Agitation Over Workers’ Virus Exposure;5;12
Welcome to the Second Quarter. Brace Yourself.;4;1
‘Scoob!’ Review: Once More Into the Mystery Machine;5;15
An Airline Bailout Is Taking Shape;4;14
Winners and Losers of the Trade Deal;1;16
Captain of the Day Traders;6;15
Bleak Data Shows Extent of Economic Damage;4;15
How to Use Smart Lights to Help Your Kids Get to Bed (and Stay Asleep);2;14
What Happens to Powell’s Books When You Can’t Browse the Aisles?;5;29
Free Video Streaming Services to Help Save Cash During Coronavirus Isolation;3;26
Monday’s Live-Streaming Events: Elizabeth Marvel Discussing Shakespeare and Jason Robert Brown in Concert;4;13
The New Tech Cold War;7;24
Modern Love Podcast: Susan Kelechi Watson Reads ‘When Cupid Is a Prying Journalist’;2;12
When Reality Is Scary Enough, These Movies Are Safe Nightmares;4;2
Modern Love Podcast: Rebecca Hall Reads ‘Take Me as I Am, Whoever I Am’;1;15
A Hopeful Forecast: More Accurate Long-Term Weather Predictions;9;25
How to Handle Packages During the Coronavirus Pandemic;3;17
5 Streaming Services for Watching Great Horror Movies;8;20
Never Mind the Internet. Here’s What’s Killing Malls.;2;13
Schools Struggle to Secure Computers;10;14
The Coronavirus Could Rewrite the Rules for Silicon Valley;4;30
Apple Watch Is a Private Road;9;15
Corporate America Says Black Lives Matter. It Needs to Hold Up a Mirror.;6;15
Binge These One-Season Wonders;3;27
In Bid for TikTok, Microsoft Flexes Its Power in Washington;8;28
Apple Watch Is a Private Road;9;15
Corporate America Says Black Lives Matter. It Needs to Hold Up a Mirror.;6;15
‘Making the Cut’ Is New, but the Pattern Is Familiar;3;27
Big Companies Harvest Our Data. This Is Who They Think I Am.;5;28
Bookstores Are Struggling. Is a New E-Commerce Site the Answer?;6;16
Workplace vs. Coronavirus: ‘No One Has a Playbook for This’;3;5
Big Tech Makes Inroads With the Biden Campaign;8;10
As Online Buying Surges, So Do Noisy Cargo Flights;4;15
Wall Street Recovers After a Day of Turbulent Trading;5;14
The Best Films and TV Shows to Stream Over the Holidays;11;18
Corrections: June 14, 2020;6;14
‘I Will Make You Mine’ Review: Three Times a Lady;5;28
Yasmin Monet Prince, a New Action Heroine;8;1
Can’t Find Toilet Paper? Try These Alternatives;5;7
Mark Zuckerberg Questioned Under Oath in F.T.C. Antitrust Inquiry;8;20
