Headline;Month;Day
You Are Not Working From Home;5;26
Mark Zuckerberg Rethinks the Office;5;22
How the ‘Plandemic’ Movie and Its Falsehoods Spread Widely Online;5;20
You Don’t Need Flying Cars to Save Lives;5;20
Inside Mark Zuckerberg’s Brain;5;18
Let’s Clean Up the Toxic Internet;5;11
Big Tech Has Crushed the News Business. That’s About to Change.;5;11
The Joy of Vegan Cooking, 60 Seconds at a Time;5;13
An E-Commerce Future, Ready or Not;5;6
5 Ways to Stay in Touch With Less Tech-Savvy Family and Friends;5;6
White-Collar Companies Race to Be Last to Return to the Office;5;8
Big Tech’s Worries Should Worry You;5;1
The F.B.I.’s Director, a Critic of Strong Encryption, Once Defended It;4;30
The Coronavirus Becomes a Battle Cry for U.S. Extremists;5;3
No Graduation Ceremony? You Get Oprah!;5;1
Trump’s Disinfectant Talk Trips Up Sites’ Vows Against Misinformation;4;30
How a Digital Ad Strategy That Helped Trump Is Being Used Against Him;4;28
Quibi, JetBlue and Others Gave Away Email Addresses, Report Says;4;29
This Should Be V.R.’s Moment. Why Is It Still So Niche?;4;30
Elon Musk and Mark Zuckerberg Aren’t on the Same Page;4;30
Europe’s Privacy Law Hasn’t Shown Its Teeth, Frustrating Advocates;4;27
Zoom’s Biggest Rivals Are Coming for It;4;24
No, the Best Doesn’t Win;4;27
Bored Russians Posted Silly Art Parodies. The World Has Joined In.;4;25
Can the Trump Campaign Rewrite the Story of the Trump Presidency?;4;28
The Social Media Challenges Helping Keep Boredom at Bay;4;22
Trump, the Master of Distraction;7;7
Will ‘Real’ Small Businesses Get the Money This Time?;4;22
Pandemic Propaganda Is Coming. Be Ready for It.;4;22
Biden Is Losing the Internet. Does That Matter?;4;16
Scrolling Through the Rise, and Takeover, of Instagram;4;14
Chinese Agents Helped Spread Messages That Sowed Virus Panic in U.S., Officials Say;4;22
Welcome to the ‘Rabbit Hole’;4;16
Burning Cell Towers, Out of Baseless Fear They Spread the Virus;4;10
Fitness Instructors Flock Online to Pump You Up;4;12
How Russia’s Troll Farm Is Changing Tactics Before the Fall Election;3;29
Tech Giants Prepared for 2016-Style Meddling. But the Threat Has Changed.;3;29
Privacy Cannot Be a Casualty of the Coronavirus;4;7
A Travel Story Where the Readers Take Us Away;4;10
D.I.Y. Coronavirus Solutions Are Gaining Steam;3;31
The Pandemic Feeds Tech Companies’ Power;4;8
How Tech’s Lobbyists Are Using the Pandemic to Make Gains;4;3
A Group Picture That Just Had to Be Weird;4;9
Black Women Learn to Braid While Social Distancing;3;27
Coronavirus Ended the Screen-Time Debate. Screens Won.;3;31
The Week in Tech: We’re Testing How Much the Internet Can Handle;3;27
The Right Way to Fight Fake News;3;24
Will Our Most Important Industry Survive the Coronavirus?;3;25
Manipulated Biden Video Escalates Online Speech War With Trump;3;9
Big Tech Could Emerge From Coronavirus Crisis Stronger Than Ever;3;23
Domestic Abusers Can Control Your Devices. Here’s How to Fight Back.;4;6
Jamie Dimon Expects a ‘Bad Recession’;4;6
Lockdown Can’t Last Forever. Here’s How to Lift It.;4;6
Coronavirus Spurs a Wave of Suspect Websites Looking to Cash In;3;24
Touting Virus Cure, ‘Simple Country Doctor’ Becomes a Right-Wing Star;4;2
Plan B: a Front Porch Wedding;4;3
National Cathedral, Nasdaq, Businesses and Unions Locate Troves of N95 Masks;3;26
If Mark Zuckerberg repeats himself, don’t be surprised.;11;17
Sheryl Sandberg Is Engaged to Tom Bernthal;2;3
We All Need a Gammy in Our Lives Right Now;3;27
Senators take aim at Mark Zuckerberg and Jack Dorsey.;11;18
This Is the Guy Who’s Taking Away the Likes;1;17
Workplace vs. Coronavirus: ‘No One Has a Playbook for This’;3;5
The Week in Tech: New Decade, Same Old Trouble in Washington;1;10
An attack ad targets a non-politician: Mark Zuckerberg.;10;7
When Politicians Get a License to Lie;1;8
Trump Won the Internet. Democrats Are Scrambling to Take It Back.;3;30
F.T.C. Broadens Review of Tech Giants, Homing In on Their Deals;2;11
Big Tech’s chief executives are becoming regulars on Capitol Hill.;10;28
Digital Edits, a Paid Army: Bloomberg Is ‘Destroying Norms’ on Social Media;2;22
Ruchika Budhraja, Drew Hodel;1;19
Microsoft’s Lessons for Google;12;17
Please Stop Big Tech, Small Rivals Tell Lawmakers;1;17
There’s a Simple Reason Workers Covered Windows at a Detroit Vote-Counting Site;11;5
Jimmy Fallon: Trump’s Hanukkah Party Was a ‘Festival of Lies’;12;11
