Headline;Month;Day
U.S. and States Say Facebook Illegally Crushed Competition;12;9
N.Y. Attorney General Asks Courts to Take Action Against Facebook;12;9
When it Comes to Facebook, the Need for Action Has Been Obvious for a Long Time;12;10
Facebook says it will remove coronavirus vaccine misinformation.;12;3
Justice Dept. Suit Says Facebook Discriminates Against U.S. Workers;12;3
‘The Other Half of My Soul’: Widows of Covid-19 Bond Over Sudden Loss;12;31
Humans Can Help Clean Up Facebook and Twitter;12;2
Heather Cox Richardson Offers a Break From the Media Maelstrom. It’s Working.;12;28
Brad Parscale Fell From Trump’s Favor. Now He’s Plotting a Comeback.;12;24
Misinformation Amplifiers Target Georgia Senate Races;12;22
Facebook to Acquire Start-Up Kustomer as It Faces Antitrust Glare;11;30
The Antitrust Case Against Big Tech, Shaped by Tech Industry Exiles;12;20
How Fake News Is Hatching in Immigrant Communities;12;20
Goliath vs. Goliath;12;19
Big Tech’s Circular Firing Squad;12;17
Google’s Legal Peril Grows in Face of Third Antitrust Suit;12;17
From Voter Fraud to Vaccine Lies: Misinformation Peddlers Shift Gears;12;16
Big Fines and Strict Rules Unveiled Against ‘Big Tech’ in Europe;12;15
Tech Companies Shift Their Posture on a Legal Shield, Wary of Being Left Behind;12;15
Big Tech Turns Its Lobbyists Loose on Europe, Alarming Regulators;12;14
The Week in Business: Getting Vaccines From Here to There;12;13
Facebook Struggles to Balance Civility and Growth;11;24
Your Friday Briefing;12;11
‘How Many Fact Checkers Do They Have?’;12;10
What Facebook Fed the Baby Boomers;11;24
How misinformation can affect Facebook employees’ morale.;11;25
‘On Social Media, There Are Thousands’: In Cuba, Internet Fuels Rare Protests;12;9
Why can’t the social networks stop fake accounts?;12;8
How Joe Biden’s Digital Team Tamed the MAGA Internet;12;6
E.U. Privacy Rule Would Rein In the Hunt for Online Child Sexual Abuse;12;4
Why WhatsApp Matters;12;1
Businesses With a Give-Back Mission Caught in Facebook Ad Ban;11;17
Facebook Executed ‘Largest Election Integrity Effort,’ Zuckerberg Says;11;17
Lawmakers drill down on how Facebook and Twitter moderate content.;11;17
How Twitter and Facebook plan to handle Trump’s accounts when he leaves office.;11;17
It’s Time for a Digital Detox. (You Know You Need It.);11;25
Imagine a World Without Apps;11;24
Can Shopify Compete With Amazon Without Becoming Amazon?;11;24
How Misinformation ‘Superspreaders’ Seed False Election Theories;11;23
Fact-Checked on Facebook and Twitter, Conservatives Switch Their Apps;11;11
Facebook plans to continue a ban on political ads for another month.;11;11
Tweets from Biden aide show campaign’s frustration with Facebook.;11;11
Uncool Can Beat Flashy Tech;11;20
Facebook Removes Pages Linked to Bannon for Pushing Misinformation;11;10
How Fake Reviews Hurt Us and Amazon;11;19
Key takeaways from the hearing, by the numbers.;11;17
Watch Full Video: Tech C.E.O.’s Testify Before the Senate;11;17
Here’s what you need to know about today’s hearing.;11;17
Facebook, Alarmed by Discord Over Vote Count, Is Said to Be Taking Action;11;5
The Rise and Fall of the ‘Stop the Steal’ Facebook Group;11;5
On Election Day, Facebook and Twitter Did Better by Making Their Products Worse;11;5
What to Expect From Facebook, Twitter and YouTube on Election Day;11;2
There is no proof that people stole maiden names to vote.;11;11
No Charges for Indianapolis Officer Who Fatally Shot Man After Chase;11;11
False claims that Biden ‘lost’ Pennsylvania surge, and tech companies struggle to keep up.;11;10
Biden Is Expected to Keep Scrutiny of Tech Front and Center;11;10
What Keeps Facebook’s Election Security Chief Up at Night?;10;31
Facebook, Google and Twitter C.E.O.s Testify at Senate Hearing;10;28
Dan Bongino Has No Idea Why Facebook Loves Him;10;29
Social Media Companies Survived Election Day. More Tests Loom.;11;4
Twitter Clamped Down on Trump, but Army of Accounts Spread His Message;11;4
How 2020 Changed the Internet;11;4
Why the Social Media Rage Machine Won’t Stop;11;4
After Twitter Labels Trump’s Tweet About Pennsylvania, Its Spread Slows;11;3
YouTube Cut Down Misinformation. Then It Boosted Fox News.;11;3
Watch Out for This Misinformation on Election Day;11;3
F.T.C. Decision on Pursuing Facebook Antitrust Case Is Said to Be Near;10;22
As Augmented Reality Evolves, the Reporting Is All Around You;10;31
How to Take On the Tech Barons;10;31
Instagram Tries Clamping Down on Misinformation;10;30
Amazon and Google’s True Advantage;10;30
How Three Election-Related Falsehoods Spread;10;30
Big Tech Continues Its Surge Ahead of the Rest of the Economy;10;29
‘Tsunamis of Misinformation’ Overwhelm Local Election Officials;10;29
She’s Bursting Big Tech’s Bubble;10;29
For Stock Markets, ‘an Unwelcome Déjà Vu Feeling’;10;29
Republicans Blast Social Media C.E.O.s While Democrats Deride Hearing;10;28
We Need Policy, Not WrestleMania;10;28
Watch Full Video: Tech C.E.O.s Testify Before the Senate;10;28
Tech chiefs plan a vigorous defense of speech on their sites.;10;28
Evidence of anti-conservative bias by platforms remains anecdotal.;10;28
Republicans and Democrats have similar goals. They will make different arguments.;10;28
Trump Allies Amp Up Fight Over Tech’s Legal Shield Before Election;10;27
Twitter to Highlight Accurate Voting Information;10;26
The Facebook-Twitter-Trump Wars Are Actually About Something Else;10;18
How Homegrown Disinformation Could Disrupt This U.S. Election;10;25
Russia Created an Election Disinformation Playbook. Here’s How Americans Evolved It.;10;25
The Week in Business: A Headache for Big Tech;10;25
Trump’s Claims About Hunter Biden Send Online Activity Soaring;10;24
Trump Still Miles Ahead of Biden in Social Media Engagement;10;22
Forget Antitrust Laws. To Limit Tech, Some Say a New Regulator Is Needed.;10;22
Facebook and Twitter Dodge a 2016 Repeat, and Ignite a 2020 Firestorm;10;15
Big Tech’s Professional Opponents Strike at Google;10;21
Facebook Bans Anti-Vaccination Ads, Clamping Down Again;10;13
A Misinformation Test for Social Media;10;21
As Election Nears, Government and Tech Firms Push Back on Russia (and Trump);10;20
On Facebook, Misinformation Is More Popular Now Than in 2016;10;12
It’s Time to Try Virtual Reality. Here’s Where to Start.;10;20
The Case(s) Against Big Tech;10;20
Facebook Bans Content About Holocaust Denial From Its Site;10;12
Facebook’s China Tactics Backfire;10;9
Where Liberal Power Lies;10;17
Facebook Widens Ban on Political Ads as Alarm Rises Over Election;10;7
In Reversal, Twitter Is No Longer Blocking New York Post Article;10;16
How The Babylon Bee, a Right-Wing Satire Site, Capitalizes on Confusion;10;16
Facebook Amps Up Its Crackdown on QAnon;10;6
Twitter Changes Course After Republicans Claim ‘Election Interference’;10;15
In Hubbub Over New York Post Report, YouTube Stands Apart;10;15
Can Big Tech Make Sure That 2020 Is Not 2016?;10;15
QAnon Believers Say Being Banned From Facebook Is Proof of the Conspiracy;10;7
Allegation on Biden Prompts Pushback From Social Media Companies;10;14
Mark Zuckerberg’s ‘Evolving’ Position on Holocaust Denial;10;14
How to Deal With a Crisis of Misinformation;10;14
Now Circulating on Social Media: 4 Election Falsehoods;10;14
12 Accusations in the Damning House Report on Amazon, Apple, Facebook and Google;10;6
Riled Up: Misinformation Stokes Calls for Violence on Election Day;10;13
Manhattan Emptied Out During the Pandemic. But Big Tech Is Moving In.;10;13
When to Buy a New Phone. Or Not.;10;13
How Facebook and Twitter Handled Trump’s ‘Don’t Be Afraid of Covid’ Post;10;5
July Is the New January: More Companies Delay Return to the Office;10;13
She Hunts Viral Rumors About Real Viruses;10;13
The Week in Business: A Conspiracy Crackdown;10;10
How Facebook Entrenches Itself;9;30
Membership of Anti-Mask Facebook Groups Jumps Sharply;10;1
Technology vs. Covid-19: Assessing the Threats;10;9
Now You Can Use Instagram to Chat With Friends on Facebook Messenger;9;30
The Facebook Pages With the Largest Share of Debate Conversation;9;29
False Rumors Often Start at the Top;10;8
Duterte Lashes Out at Facebook After It Takes Down Fake Accounts;9;29
Congress Agrees: Big Tech Is Broken.;10;7
Take a Social Media Break Until You’ve Voted;10;7
The House Antitrust Report on Big Tech;10;6
House Lawmakers Condemn Big Tech’s ‘Monopoly Power’ and Urge Their Breakups;10;6
WeChat Unites and Divides in America;10;6
Big Tech Was Their Enemy, Until Partisanship Fractured the Battle Plans;10;6
Facebook’s Power This Election;9;25
Facebook Takes Down Networks Linked to Russian Disinformation;9;25
Tech Isn’t the Answer for Test Taking;10;2
Facebook Takes Down Fake Pages Created in China Aimed at Influencing U.S. Election;9;22
How Facebook Can Slow QAnon for Real;9;21
Facebook Has Been a Disaster for the World;9;18
Facebook Tried to Limit QAnon. It Failed.;9;18
Don’t quit Facebook. Change laws.;9;18
What’s the Plan if Trump Tweets That He’s Won Re-election?;9;27
Facebook and Instagram Flag Tucker Carlson Virus Posts;9;16
Facebook Oculus Quest 2 Review: Solid V.R. Headset, but Few Games;9;16
Short of Money to Run Elections, Local Authorities Turn to Private Funds;9;25
Facebook Is Failing in Global Disinformation Fight, Says Former Worker;9;14
America’s Tech Billionaires Could Help Protect the Election. If They Wanted To.;9;22
A Capitalist Fix to the Digital Divide;9;22
No, Facebook Does Not Reflect Reality;9;9
Facebook May Be Ordered to Change Data Practices in Europe;9;9
No, a Black Lives Matter Co-Founder Didn’t Partner With a Pro-Communist Chinese Group;9;18
Celebrities Plan an ‘Instagram Freeze,’ but Reaction Is Icy;9;16
Apple Watch Is a Private Road;9;15
Facebook Moves to Limit Election Chaos in November;9;3
Why Facebook’s Blocking of New Political Ads May Fall Short;9;4
Trump Health Aide Pushes Bizarre Conspiracies and Warns of Armed Revolt;9;14
Russians Again Targeting Americans With Disinformation, Facebook and Twitter Say;9;1
How the Trump Campaign Pushes Voting by Mail on Facebook;9;1
Mark Zuckerberg Is the Most Powerful Unelected Man in America;9;3
Facebook Could Block Sharing of News Stories in Australia;9;1
Facebook Video of Assault, Found by Victim’s Mother, Breaks Open Case;9;3
Gig Work Is Risky for Apps, Too;9;11
Europe Feels Squeeze as Tech Competition Heats Up Between U.S. and China;9;11
What if Facebook Is the Real ‘Silent Majority’?;8;27
‘But I Saw It on Facebook’: Hoaxes Are Making Doctors’ Jobs Harder;8;28
Facebook Plans Legal Action After Thailand Tells It to Mute Critics;8;25
Parents Got More Time Off. Then the Backlash Started.;9;5
Threatened by Facebook Disinformation, a Monk Flees Cambodia;8;23
Lessons From a Virus Tracing Dud;9;3
Facebook Braces Itself for Trump to Cast Doubt on Election Results;8;21
A Freelance Writer Learns He Was Working for the Russians;9;2
Amazon’s Biggest Leap Was Boring;9;2
Facebook Removes 790 QAnon Groups to Fight Conspiracy Theory;8;19
Toxic Trade-Offs at Facebook;8;17
Facebook Will Promote Voting by Mail as Trump Attacks Method;8;13
With Hacks and Cameras, Beijing’s Electronic Dragnet Closes on Hong Kong;8;25
Facebook Removes Trump Campaign’s Misleading Coronavirus Video;8;5
Google, Facebook and Others Broaden Group to Secure U.S. Election;8;12
He Was Iran’s Homegrown Tech Star. The Guards Saw a Blackmail Opportunity.;8;21
With TikTok Mired in Uncertainty, Facebook Pounces With Instagram Reels;8;5
Facebook Gaming Finally Clears Apple Hurdle, Arriving in App Store;8;7
Mark Zuckerberg Questioned Under Oath in F.T.C. Antitrust Inquiry;8;20
How Kamala Harris Forged Close Ties With Big Tech;8;20
Can This Relationship Be Saved? Big Tech and Big Advertisers Talk It Over.;8;19
Big Tech’s Domination of Business Reaches New Heights;8;19
What Is QAnon, the Viral Pro-Trump Conspiracy Theory?;8;18
What Happened When Homeless Men Moved Into a Liberal Neighborhood;8;18
Facebook Bets Big on Future of N.Y.C., and Offices, With New Lease;8;3
Trump’s Attacks on TikTok and WeChat Could Further Fracture the Internet;8;17
More Than 1,000 Companies Boycotted Facebook. Did It Work?;8;1
Facebook Must Better Police Online Hate, State Attorneys General Say;8;5
QAnon Was a Theory on a Message Board. Now It’s Headed to Congress.;8;15
QAnon Followers Are Hijacking the #SaveTheChildren Movement;8;12
We Tested Instagram Reels, the TikTok Clone. What a Dud.;8;12
Uber’s Next Idea: A New Labor Law;8;11
Fighting False News in Ukraine, Facebook Fact Checkers Tread a Blurry Line;7;26
Big Tech Makes Inroads With the Biden Campaign;8;10
How Pro-Trump Forces Work the Refs in Silicon Valley;8;10
Amazon, Apple, Facebook and Google Prepare for Their ‘Big Tobacco Moment’;7;28
Hong Kong Officials Condemn and Mock Trump Administration Sanctions;8;8
F.T.C.’s Facebook Investigation May Stretch Past Election;7;17
The Cult of the Tech Genius;8;6
Hollywood Stays Away From Facebook Ad Boycott;7;15
Can Facebook Ever Stop the Drama?;7;9
Facebook Said to Consider Banning Political Ads;7;10
What Years of Emails and Texts Reveal About Your Friendly Tech Companies;8;4
Facebook Removes Roger Stone for Ties to Fake Accounts;7;8
This Tool Could Protect Your Photos From Facial Recognition;8;3
How TikTok’s Owner Tried, and Failed, to Cross the U.S.-China Divide;8;3
Facebook Fails to Appease Organizers of Ad Boycott;7;7
Facebook’s Decisions Were ‘Setbacks for Civil Rights,’ Audit Finds;7;8
I Have Cancer. Now My Facebook Feed Is Full of ‘Alternative Care’ Ads.;7;10
Facebook Can’t Be Reformed;7;1
I Tried to Live Without the Tech Giants. It Was Impossible.;7;31
They Made How Much?;7;31
Facebook’s Big Meeting Didn’t Go So Well;7;8
The Economy Is in Record Decline, but Not for the Tech Giants;7;30
When a Critic Met Facebook: ‘What They’re Doing Is Gaslighting’;7;9
Facebook Bans Network With ‘Boogaloo’ Ties;6;30
The Last Days of the Tech Emperors?;7;30
Big Tech’s Backlash Is Just Starting;7;30
Grilled by Lawmakers, Big Tech Turns Up the Gaslight;7;30
Advertiser Exodus Snowballs as Facebook Struggles to Ease Concerns;6;30
The Big Tech Hearing;7;30
‘This Is a New Phase’: Europe Shifts Tactics to Limit Tech’s Power;7;30
Congress Versus the ‘Emperors’;7;30
Zuckerberg Deflects Question on Copying Competitors;7;29
Lawmakers, United in Their Ire, Lash Out at Big Tech’s Leaders;7;29
Watch Live: Tech C.E.O.s Testify Before Congress;7;29
Commerce Department Asks F.C.C. to Narrow Protections for Web Platforms;7;29
Congress Doesn’t Get Big Tech. By Design.;7;29
Titans of Tech Testify in Their Trust-Me Suits;7;29
All the Companies Quitting Facebook;6;29
How to Fight Against Big Tech’s Power;7;29
A Handbook to Today’s Tech Hearing;7;29
Turkey Passes Law Extending Sweeping Powers Over Social Media;7;29
We Have Questions;7;29
Four of the World’s Wealthiest Men Are Preparing for Battle;7;28
Misleading Virus Video, Pushed by the Trumps, Spreads Online;7;28
Tech’s ‘Big Tobacco’ Moment;7;28
Ad Boycott of Facebook Keeps Growing;6;23
Clean Up Your Act, Facebook, or We’re Leaving;6;30
Facebook, Citing Looting Concerns, Bans Historical Artifact Sales;6;23
Facebook Adds Labels for Some Posts as Advertisers Pull Back;6;26
Facebook Loses Antitrust Decision in Germany Over Data Collection;6;23
Texas Prosecutor Resigns Over Facebook Post About Nazi Germany;6;29
Tech Is About Power. And These Four Moguls Have Too Much of It.;7;23
How Facebook Is Undermining ‘Black Lives Matter’;6;22
TikTok to Withdraw From Hong Kong as Tech Giants Halt Data Requests;7;6
Apple Rejects Facebook’s Gaming App, for at Least the Fifth Time;6;18
Conviction in the Philippines Reveals Facebook’s Dangers;6;16
Facebook Removes Trump Ads Displaying Symbol Used by Nazis;6;18
As Facebook Boycott Grows, Advertisers Grapple With Race;6;26
Now You Can Opt Out of Seeing Political Ads on Facebook;6;17
What’s Facebook’s Deal With Donald Trump?;6;22
Trump Campaign Has Spent $325,000 on Facebook Ads Featuring Brad Parscale’s Page;6;30
Biden Prepares Attack on Facebook’s Speech Policies;6;11
‘Morally Impossible’: Some Advertisers Take a Timeout From Facebook;6;9
CVS, Dunkin’, Lego: The Brands Pulling Ads From Facebook Over Hate Speech;6;26
Early Facebook Employees Disavow Zuckerberg’s Stance on Trump Posts;6;3
Facebook Brings Back a Former Top Lieutenant to Zuckerberg;6;11
Facebook and Its Secret Policies;5;28
Facebook Employees Stage Virtual Walkout to Protest Trump Posts;6;1
E.U. Court Strikes Down Trans-Atlantic Data Transfer Pact;7;16
Facebook Starts Planning for Permanent Remote Workers;5;21
You’re Doomscrolling Again. Here’s How to Snap Out of It.;7;15
How to Fight Health ‘Cures’ Online;7;14
Facebook Says It Will Ban ‘Deepfakes’;1;7
Facebook and Twitter Must Do More About Trump’s Tweets;6;1
Our Ingenuity Shapes Facebook;4;24
How Immigrant Twin Brothers Are Beating Trump’s Team on Facebook;5;18
Buckle Up for Another Facebook Election;1;10
The Coronavirus Revives Facebook as a News Powerhouse;3;23
Facebook Restructures Its Security Teams;4;28
Facebook to Introduce an App for Gaming;4;19
Who’s Up for the Job of Decontaminating Facebook?;5;6
Who Gets the Banhammer Now?;7;11
Zuckerberg Never Fails to Disappoint;7;10
Facebook Removes Misleading Trump Census Ads;3;5
Even Google and Facebook May Face an Ad Slump;4;14
Facebook Loves to Pass the Buck;1;13
Facebook-Backed Libra Cryptocurrency Project Is Scaled Back;4;16
Facebook Hampers Do-It-Yourself Mask Efforts;4;5
Surge of Virus Misinformation Stumps Facebook and Twitter;3;8
Don’t Tilt Scales Against Trump, Facebook Executive Warns;1;7
Facebook Is ‘Just Trying to Keep the Lights On’ as Traffic Soars in Pandemic;3;24
While Twitter Confronts Trump, Zuckerberg Keeps Facebook Out of It;5;29
The Tech Giants’ Invisible Helpers;7;8
Facebook Points to ‘Signs of Stability’ as Ad Declines Flatten;4;29
Does Zuckerberg Understand How the Right to Free Speech Works?;7;8
What if Facebook is the real ‘silent majority’?;8;28
Facebook and Twitter Are Still Tinkering With Democracy;10;20
Australia Moves to Force Google and Facebook to Compensate Media Outlets;4;20
How Facebook Handles Climate Disinformation;7;14
News Quiz: Facebook, Universal, Chuck Yeager;12;11
The Week in Business: Facebook Cracks Down;10;18
Facebook to Pay $550 Million to Settle Facial Recognition Suit;1;29
Facebook Invests $5.7 Billion in Indian Internet Giant Jio;4;22
Facebook Aims $100 Million at Media Hit by the Coronavirus;3;30
Child-Welfare Activists Attack Facebook Over Encryption Plans;2;6
In Hong Kong, a Proxy Battle Over Internet Freedom Begins;7;7
YouTube’s Power of the Purse;7;6
Daily Distortions: Trump’s Record Week on Facebook;10;9
Facebook and the Group That Planned to Kidnap Gretchen Whitmer;10;9
It’s Facebook vs. the Bloomberg Campaign vs. the Internet;2;26
Facebook bans ads that aim to undermine the election.;10;1
Google and Facebook Must Pay for Local Journalism;4;19
Merkel, Facebook, Ethiopia: Your Thursday Briefing;12;10
We Are a New Board Overseeing Facebook. Here’s What We’ll Decide.;5;6
Facebook Says It Won’t Back Down From Allowing Lies in Political Ads;1;9
George Soros: Mark Zuckerberg Should Not Be in Control of Facebook;1;31
Facebook Apologizes for Vulgar Translation of Chinese Leader’s Name;1;19
Facebook will forbid ads that undermine the legitimacy of the coming election.;10;1
Facebook, Don’t Exploit Us in Our Time of Need;3;24
What It’s Like to Use Facebook When You’re Blind;1;17
Facebook Political Ads: Which States Are 2020 Democrats Betting On?;1;17
What Are 2020 Democrats Saying to Iowans in Facebook Ads?;1;29
Facebook Won’t Take Down Misleading Political Ads;1;9
Facebook, Pfizer, Pantone: Your Wednesday Evening Briefing;12;9
4 San Jose Officers Put on Leave Amid Probe Into Racist Facebook Posts;6;28
Many Facebook Employees to Work From Home Permanently;5;21
Facebook, Israel’s outbreak, Uighurs: Your Tuesday Briefing;7;6
Now More Than Ever, Facebook Is a ‘Mark Zuckerberg Production’;5;16
Biden Pours Millions Into Facebook Ads, Blowing Past Trump’s Record;6;8
Reading Orwell for the Fourth of July;7;3
Facebook Says Political Candidates Can Use Sponsored Memes;2;15
Facebook lifts ban on political ads for Georgia runoff elections.;12;15
Facebook’s Revenue Rises Again, but More Slowly Than Ever;1;29
Russians are again targeting Americans with disinformation, Facebook and Twitter warn.;9;2
Pelosi Clashes With Facebook and Twitter Over Video Posted by Trump;2;9
Vaccines, Facebook, Warner Bros.: Your Thursday Evening Briefing;12;3
New ‘TV’ Is a Lot Like TV;7;2
Joe Biden, Facebook, ‘Mulan’: Your Thursday Evening Briefing;9;3
U.K. Sanctions, Facebook, Jair Bolsonaro: Your Tuesday Briefing;7;7
Goodbye to the Wild Wild Web;7;2
Kenosha, Facebook, State Fairs: Your Tuesday Evening Briefing;9;1
Four Top Tech C.E.O.s Will Testify in Antitrust Inquiry, Panel Says;7;1
Trump’s Covid-19 Scare Propels Him to Record Facebook Engagement;10;8
Here Come the 4 Horsemen of the Techopolypse;7;2
Bogus Ideas Have Superspreaders, Too;7;1
Lesson of the Day: ‘U.S. and States Say Facebook Illegally Crushed Competition’;12;20
Facebook Removes Trump and Biden Ads, Saying They Could Mislead Voters;10;28
Facebook, Google and Twitter C.E.O.s return to Washington to defend their content moderation.;10;28
Facebook Says It Should Have Taken Down Kenosha Guard Page;8;28
Republican Leaders Condemn a G.O.P. Congressional Candidate’s Racist Facebook Videos;6;17
Reopenings in Europe, Far-Right Protests, Facebook: Your Monday Briefing;6;15
Coronavirus Flare-Up, U.S. Police, Facebook: Your Monday Briefing;6;14
China’s Software Stalked Uighurs Earlier and More Widely, Researchers Learn;7;1
Facebook reverses postelection algorithm changes that boosted news from authoritative sources.;12;17
After being used to spread disinformation, Facebook seeks to limit election chaos.;9;3
When Facebook Politics Get Extra Personal;6;25
Republicans condemn Facebook and Twitter for limiting distribution of an unsubstantiated article about the Bidens.;10;15
Senate Republicans take aim at Facebook and Twitter executives for sharing of election content.;11;17
A Facebook Post Lands an Innocent Woman in Jail in This Riveting Debut Novel;6;8
‘Facebook: The Inside Story’ Offers a Front-Row Seat on Voracious Ambition;2;25
The Bumbling 1960s Data Scientists Who Anticipated Facebook and Google;9;15
Refinery29 Finds Next Top Editor at Facebook;9;9
India Debates Skin-Tone Bias as Beauty Companies Alter Ads;6;28
‘PizzaGate’ Conspiracy Theory Thrives Anew in the TikTok Era;6;27
Indianapolis Police Fatally Shoot Man Who May Have Streamed Encounter on Facebook Live;5;7
Where Coronavirus Help on Facebook Is ‘Inherently Political’;5;28
This Pilates Business Loves (and Hates) Tech;6;26
When Facebook Is More Trustworthy Than the President;3;15
Days After Suleimani Killing, Trump Campaign Promotes It on Facebook;1;7
Facebook will ban political ads indefinitely after polls close on Nov. 3, as alarm rises over the election.;10;7
Young Edward Hopper Copied Works. So What?;10;2
Twitter and Facebook worked to crack down on election disinformation, but challenges loom.;11;4
Sorry, eBay and Uber. You’re Hated.;6;24
That ‘Miracle Cure’ You Saw on Facebook? It Won’t Stop the Coronavirus;3;18
When Armed Vigilantes Are Summoned With a Few Keystrokes;10;16
Facebook, Google and Twitter Rebel Against Pakistan’s Censorship Rules;2;27
‘The Social Network’ 10 Years Later: A Grim Online Life Foretold;10;5
Tunisian Woman Sentenced to Prison Over Joke Alluding to the Quran;7;17
The Mystery of Teen Vogue’s Disappearing Facebook Article;1;8
Epoch Times, Punished by Facebook, Gets a New Megaphone on YouTube;2;5
41 Cities, Many Sources: How False Antifa Rumors Spread Locally;6;22
Grandmother’s Refusal to Remove Photos From Facebook Tests Privacy Law;5;22
Booker and McGrath Intensify Advertising Blitz in Kentucky;6;22
Tech Goliaths Act Like Davids;6;22
Trump Health Official Apologizes for Facebook Outburst;9;15
The Week in Business: Confronting Racist Marketing;6;21
Social Media Giants Support Racial Justice. Their Products Undermine It.;6;19
Here’s What Companies Are Promising to Do to Fight Racism;6;19
French Court Strikes Down Most of Online Hate Speech Law;6;18
Her Facebook Friends Asked if Anyone Was Actually Sick. She Had an Answer.;3;19
Justice Dept. Urges Rolling Back Legal Shield for Tech Companies;6;17
Is Trump Trying to Spread Covid-19?;6;16
The Economy Is Reeling. The Tech Giants Spy Opportunity.;6;13
The Complex Debate Over Silicon Valley’s Embrace of Content Moderation;6;5
Zuckerberg’s Free Speech Bubble;6;4
Zuckerberg Defends Hands-Off Approach to Trump’s Posts;6;2
Snap Says It Will No Longer Promote Trump’s Account;6;3
Corporate Hashtag Activism;6;3
Protests Captured Unfiltered;6;2
TikTok (Yes, TikTok) Is the Future;6;3
Mark Zuckerberg’s Biggest Challenge Yet;6;2
The Power of Bearing Witness;6;1
America, We Break It, It’s Gone;6;2
Misinformation About George Floyd Protests Surges on Social Media;6;1
Trump Administration Escalates Global Fight Over Taxing Tech;6;2
The Most Important Word in the Hospitality Industry? ‘Clean’;6;3
‘A Heartbreaking and Painful Week’;6;1
After Reality Star’s Death, Japan Vows to Rip the Mask Off Online Hate;6;1
Think Outside the Box, Jack;5;30
What It’s Like to Wear a Mask in the South;6;1
The President Versus the Mods;5;29
Defying Trump, Twitter Doubles Down on Labeling Tweets;5;28
It’s Trump vs. Twitter;5;29
Legal Shield for Social Media Is Targeted by Lawmakers;5;28
What Should You Say When Someone You Know Is Grieving?;5;28
Twitter Tsks, and Trump Fumes;5;27
Trump’s Order Targeting Social Media Sites, Explained;5;28
6 Things to Do at Home This Weekend;5;28
