Headline;Month;Day
Trump Stacks the Pentagon and Intel Agencies With Loyalists. To What End?;11;12
You’ve Got (Century-Old) Mail: Soldier’s Note Is Echo of World War I Era;11;9
Move to Drop Flynn Charge Reverberates in Ex-Business Partner’s Case;6;2
T.S.M.C. Is Set to Build a U.S. Chip Facility, a Win for Trump;5;14
The Service Economy Meltdown;9;4
Tech Goliaths Act Like Davids;6;22
Nvidia Buys Arm From SoftBank for $40 Billion;9;14
Stocks Fall as Second Virus Case in U.S. Spooks Investors;1;24
Tired of Plastic? These Businesses Have Ideas for You;5;27
Russians Are Believed to Have Used Microsoft Resellers in Cyberattacks;12;25
Pound for Pound, Taiwan Is the Most Important Place in the World;12;14
Here’s the business news to watch this week.;7;20
‘Who’s Your Baghdaddy’ Review: The Iraq War Set to Backpack Rap;11;10
Our New Historical Divide: B.C. and A.C. — the World Before Corona and the World After;3;17
How to Shop for a Used Computer;10;29
The Visas and the Fury;6;23
U.S.-China Feud, Hong Kong, Bullfighting: Your Monday Briefing;6;21
Apple Announces New Privacy Features;6;23
Lawmakers Push to Invest Billions in Semiconductor Industry to Counter China;6;11
What We’re Looking Forward To From CES 2020;1;8
9 Great Deals for All Your Laptop and Computing Needs;12;8
Microsoft Takes Down a Risk to the Election, and Finds the U.S. Doing the Same;10;12
Tougher Huawei Restrictions Stall After Defense Department Objects;1;24
Japanese Supercomputer Is Crowned World’s Speediest;6;22
Amazon to Buy Zoox, in a Move Toward Self-Driving Cars;6;26
People Aren’t Reading or Watching Movies. They’re Gaming.;8;15
The Week in Business: The Bitter End;12;27
How ‘Sesame Street’ Changed Childhood Forever;5;12
SoftBank Said to Be Near Deal to Sell British Chip Designer Arm;9;12
Jimmy Kimmel Has a Name for Trump’s Refusal to Concede: ‘Squattergate’;11;13
The Big Hack Breaches Treasury’s Top Levels;12;22
Can Supreme Stay Cool While Going Corporate?;11;10
Office Gossip Lives!;8;20
‘Westworld’ Season 3, Episode 3 Recap: Predators and Prey;3;30
Rounding Up the Spies of World War II in 4 New Books;2;11
John McAfee, Software Pioneer Who Fled the Law, Is Arrested in Spain;10;6
Tech Loses a Prophet. Just When It Needs One.;1;29
Trump’s China Deal Creates Collateral Damage for Tech Firms;1;20
Goldman Makes Its Bankers Pay;10;23
Why Does Trump Lie?;6;11
Twitter Could End the Office as We Know It;5;19
Michael Hawley, Programmer, Professor and Pianist, Dies at 58;6;25
Democrats Release More Material From Lev Parnas on Ukraine Campaign;1;18
Democracy Required Kind of a Lot of Patience, Actually;11;10
Lawmakers Clash Over Shape of Impeachment Trial as Rules Vote Looms;1;20
8 Tips for How to Use Zoom Like a Pro;3;18
What Happens in Vegas if No One Stays in Vegas?;3;3
Dueling Narratives Emerge From Muddied Account of Russia’s 2020 Interference;2;24
The World Builds a Wall to Keep America Out;7;1
Clayton Christensen, Guru of ‘Disruptive Innovation,’ Dies at 67;1;25
Stocks Waver as China Tensions Climb;5;4
Forget Antitrust Laws. To Limit Tech, Some Say a New Regulator Is Needed.;10;22
Breanna Stewart Pushes for Change on and Off the Court;6;14
Facebook Starts Planning for Permanent Remote Workers;5;21
The Gap Between the Haves and Have-Nots of Tech Widens;2;4
‘Corporate America Has Failed Black America’;6;6
Black Women Are the Superheroes the World Needs;8;16
‘Billions’ Season 5, Episode 5 Recap: Old Men;6;1
How to Fight That Sinking Feeling;3;2
‘What’s the Right Thing to Do Here?’;3;13
Autonomous Vehicles Take Another Big Leap;12;14
Your Tuesday Briefing;11;23
Coronavirus Empties European Cities of Chinese Tourists;2;17
The Week in Tech: A Tech Mogul’s Phone and the Saudi Crown Prince;1;24
How SoulCycle Got Stuck Spinning Its Wheels;5;19
Goldman’s Playbook for More Diverse Corporate Boards;1;24
Slotkin, Former Intelligence Briefer, Presses White House on Russia Reports;7;1
Trouble Ahead: More Deals Are Falling Apart;5;5
Trump Contradicts Advisers on China Technology Fears;2;18
With Money, and Waste, China Fights for Chip Independence;12;24
Davos Warms to Trump’s Results (if Not Him Personally);1;21
Why Pooled Testing for the Coronavirus Isn’t Working in America;8;18
Farewell to Gummy Bear Jars: Tech Offices Get a Virus Safety Makeover;6;10
Summer Internships Won’t Be the Same This Year;4;20
As Domestic Terrorists Outpace Jihadists, New U.S. Law Is Debated;2;25
Kobe Bryant’s Death Cuts Short a Budding Business Career;1;27
Jeff Bezos’ Company Is Carrying Scientific Cargo to Space. It’s Not Amazon.;10;13
The Biden Spin on ‘America First’;12;2
Where Is Wall Street in Biden’s Transition Team?;11;11
The West, Ablaze;9;10
It’s Finally Here. But Is It Enough?;12;21
Know Your Pandemic Schooling Options;8;8
Biden’s Top Diplomat Will Try to Rebuild Bridges;11;23
The Case(s) Against Big Tech;10;20
Running the Numbers on Biden’s Tax Policy;10;19
Tech’s ‘Big Tobacco’ Moment;7;28
C.E.O.s Say ‘It’s a Grind’;7;20
Spies and Commandos Warned Months Ago of Russian Bounties on U.S. Troops;6;28
Silicon Valley’s Newest Rival: The Banks of the Hudson;1;5
Getting Creative for the 2020 Office Holiday Party;12;3
Should C.E.O.s Keep Speaking Out?;11;9
Trump Rebuffs Biden Transition Team, Setting Off Virus and National Security Risks;11;13
Whistle-Blower’s Complaint Ignites a Smoldering Homeland Security Agency;9;11
SARS Stung the Global Economy. The Coronavirus Is a Greater Menace.;2;3
The Untold Story of the Birth of Social Distancing;4;22
For Flynn, Dropped Charges Are the Latest in a Life Full of Reversals;5;9
‘Tokenized’: Inside Black Workers’ Struggles at the King of Crypto Start-Ups;11;27
More Than 4 Million Filed Unemployment Claims Last Week;4;23
How L.O.L. Dolls Became the Dopamine Hit of a Generation;4;16
N.B.A. Players Miss Other Sports Too;4;1
The Grapelord of Napa Faces a Threat Worse Than Plague;5;9
U.S. Will Drop Limits on Virus Testing, Pence Says;3;3
Candice Bergen, Woman Who’s Had It All;12;5
Faces of Power: 80% Are White, Even as U.S. Becomes More Diverse;9;10
Colin Powell Still Wants Answers;7;16
Unwanted Truths: Inside Trump’s Battles With U.S. Intelligence Agencies;8;8
