Headline;Month;Day
New Brunswick, N.J.: Big-City Amenities With a Small-Town Feel;10;7
When Will You Be Able to Get a Coronavirus Vaccine?;9;17
Boris Johnson Delivered on Brexit. It May Not Soothe His Unruly Party.;12;25
Brinkmanship or Bluster? On Brexit and Pandemic, Boris Johnson Leaves It Late;12;20
Boris Johnson Orders New Lockdown in Sharp Reversal;12;19
Britain Won’t ‘Ban’ Christmas as Coronavirus Surges, Johnson Says;12;16
No Scrooge Here: Johnson Resists ‘Canceling’ Christmas to Stem Coronavirus;12;16
9 Drug Companies Pledge to ‘Stand With Science’ on Coronavirus Vaccines;9;8
For London, Tighter Virus Rules. For Boris Johnson, More Pressure.;12;14
Boris Johnson Tightens U.K. Lockdown, Citing Fast-Spreading Version of Virus;12;19
Brexit Trade Deal Really Is Coming Down to the Wire;12;18
U.K. Approves Oxford-AstraZeneca Vaccine, and Tightens Lockdown;12;30
Boris Johnson Once Mocked the Eurocrats of Brussels. They Haven’t Forgotten.;12;10
U.K. Virus Surge Surpasses Spring Peak as Lockdown Choices Loom;12;29
Britain and E.U. Reach Long-Awaited Brexit Trade Deal;12;24
Britain and E.U. Reach Landmark Deal on Brexit;12;24
Britain and E.U. Scramble to Reach Brexit Deal Before Christmas;12;24
The Brexit Fight, Through a Reporter’s Prism of a Changed Continent;12;26
Brexit Is Finally Done, but It Already Seems Out of Date;12;24
For U.K., an Early Taste of Brexit as Borders Are Sealed;12;21
Concerns About Coronavirus Variant Cut Off U.K. From Europe;12;21
Britain Gets a Boost With a Brexit Trade Deal, but Challenges Loom;12;24
Andrew Sullivan on the War Within Conservatism and Why It Matters to All of Us;12;24
The Artists We Lost in 2020, in Their Words;12;22
As Brexit Deadline Looms, Boris Johnson Takes Personal Control of Talks;12;7
As Brexit Talks Stall, Boris Johnson Offers the E.U. an Olive Branch;12;8
Elevating Fringe Theories, Ron Johnson Questions Virus Science;12;8
Boris Johnson Fails to Break Brexit Deadlock in Brussels Talks;12;9
Remembering Rafer Johnson in a Long Year of Lost Sports Legends;12;7
Your Thursday Briefing;12;17
Going ‘the Extra Mile,’ Britain and E.U. Give Brexit Talks More Time;12;13
Artists Ask MoMA to Remove Philip Johnson’s Name, Citing Racist Views;12;3
After Electoral College Votes, More Republicans Warily Accept Trump’s Loss;12;15
Your Tuesday Briefing;12;15
In Last-Ditch Bid for Brexit Deal, Leaders’ Theatrics Show the Stakes;12;6
All Fish and No Chips;12;12
Your Monday Briefing;12;14
U.K. to Halt Subsidies for Fossil Fuel Projects Abroad;12;12
Rafer Johnson, Winner of a Memorable Decathlon, Is Dead;12;2
The Best Poetry of 2020;12;12
For Boris Johnson, a Week to Exorcise the Demons of 2020;12;4
Coronavirus Vaccine Could Be Ready in a Few Weeks, Says Johnson;12;1
Your Friday Briefing;12;11
December Date for U.S. Women’s Open Brings New Challenges;12;10
‘A Tsunami of Change’: How Protests Fueled a New Crop of Prosecutors;12;8
5 Things to Do This Weekend;12;3
5 Art Accounts to Follow on Instagram Now;12;2
Best Movies of 2020;12;3
In England, Rumbles of Discontent as Parliament Votes to Exit Lockdown;12;1
Johnson Basks in a Rare Burst of Good U.K. News;11;23
England’s Lockdown Will Lift, but Many Pub Doors Will Stay Closed;11;26
How ‘The Crown’ Embraced ’80s Pop;11;27
Britain Set to Leap Ahead in Approving Vaccines;11;27
Assaults and Occupations in Wartime;11;25
Iconic or Sexist? Palm Springs Mulls a Marilyn Monroe Statue;11;25
Johnson, Seen as a Trump Ally, Signals Alignment With Biden;11;19
Boris Johnson, Coronavirus, Mike Pompeo: Your Friday Briefing;11;20
England Will Lift Coronavirus Restrictions;11;23
The Snake-Oil Salesmen of the Senate;11;24
Boris Johnson Lays Out U.K. Plan for a ‘Green Industrial Revolution’;11;18
Your Tuesday Briefing;11;24
English Gyms Offer a New Workout: Civil Disobedience;11;22
Instead of Regaining Momentum, Johnson Is Stalled at Home Again;11;16
Dustin Johnson Wins 2020 Masters in Record Fashion;11;15
The 2020 Masters: Dustin Johnson Sets Scoring Record;11;15
Dustin Johnson Widens Masters Lead and Eyes Scoring Record;11;15
Dominic Cummings, Powerful Aide to Boris Johnson, Resigns, Report Says;11;13
Brexit Hard-Liners Lose Battle as Aide to U.K’s Johnson Quits;11;12
Would He or Wouldn’t He? Johnson Is Relieved That Biden Called;11;11
Britain’s prime minister is quarantining, and other news around the world.;11;16
Tiger Woods Faced Disaster at the Masters. He Stuck Through It Anyway.;11;15
Trump’s Defeat Weakens Boris Johnson in Urgent Brexit Talks;11;9
What to Expect on Day 2 of the 2020 Masters;11;13
Pfizer Vaccine, Brexit, U.S. Presidential Transition: Your Friday Briefing;11;13
The 2020 Masters: DeChambeau’s Challengers Aren’t Exactly Long Shots;11;12
Eddie Johnson, N.B.A. Star Who Fell Into Crime, Dies at 65;11;6
New & Noteworthy, From Fake News to American Essays;11;10
Biden Speaks to European Allies as Strongmen Stay Silent on U.S. Vote;11;11
Does Trump’s Defeat Signal the Start of Populism’s Decline?;11;10
How Biden Can Govern in Spite of Everything;11;10
7 Podcasts From Familiar Faces;11;17
Europe Lauds Biden but Wonders: What Will He Want? How Long Will He Stay?;11;8
U.K.’s Johnson Faces a Growing Revolt Over His Coronavirus Policy;11;2
As Boris Johnson Plays Scrooge, Britons Feed the Hungry Themselves;11;2
For Some Veteran Stars, NASCAR’s Appeal Is Fading;11;3
Dr. Philip Lee Is Dead at 96, Engineered Introduction of Medicare;11;3
This Is an Election Story That Mentions Neither Biden Nor Trump;11;2
Britain Expands Coronavirus Restrictions;10;31
England to Shut Pubs, Restaurants and Most Shops as Virus Surges;10;31
‘Everyone Needs a Buddy’;10;31
The Capital of Sprawl Gets a Radically Car-Free Neighborhood;10;31
Taking a Page From White House, Boris Johnson Bets on Live Press Briefings;10;26
In Pandemic U.K., Brexit Is an Afterthought, as Is Trump;10;30
Harrison Johnson, Pastor at Funeral in Mass Shooting, Dies at 65;10;23
Britain’s Health Workers Face 2nd Virus Wave, but This Time With Less Support;10;27
James A. Johnson, Democratic Power Broker, Dies at 76;10;21
Arts Bailout in U.K. Buys Time, but No Peace of Mind;10;26
I Have Covid-19 Antibodies. Finally I Know How to Help.;10;26
Brett Phillips Becomes the Rays’ Latest Unlikely Hero;10;25
Johnson Announces Highest Coronavirus Restrictions for Manchester;10;20
Review: In a Cemetery, Music Lives;10;23
Bess Abell, Social Secretary in Johnson White House, Dies at 87;10;18
‘We Are Not Going to Lie Down’: A Coronavirus Revolt in England;10;22
7 Things to Do This Weekend;10;22
Could Dance Be a Weapon All Over Again?;10;22
Senate Bill Would Outlaw Bank Discrimination for the First Time;10;21
To Test Virus Vaccines, U.K. Study Will Intentionally Infect Volunteers;10;20
With Brexit Clock Ticking, Boris Johnson Vows, Again, to Walk Away;10;16
‘I Want to Avoid Another National Lockdown,’ Johnson Says;10;16
With Black Artists’ Input, One Gallery Is ‘Starting to Look Different’;10;20
As Britain Edges Toward Lockdowns, Long-Held Grievances Flare Up;10;19
What to Know About N.Y.’s Plastic Bag Ban;10;20
Alan S. Boyd, Nation’s First Transportation Chief, Dies at 98;10;19
As Virus Surges and Brexit Bears Down, Boris Johnson Stalls for Time;10;15
U.S. Election, Boris Johnson, Coronavirus: Your Friday Briefing;10;16
The Bubble Doctor Is In: She Keeps Dance Companies Moving;10;19
‘Vile, Racist Postings’ by N.Y. Court Officers Included Obama in a Noose;10;19
Man Sentenced to Life Over Theft of Hedge Clippers Is Granted Parole;10;17
While Boris Johnson Sinks, Rishi Sunak Is on the Rise;10;13
Boris Johnson Announces Three-Tier Coronavirus Alert System;10;12
Johnson & Johnson’s Coronavirus Vaccine Protects Monkeys, Study Finds;7;30
For Boris Johnson, and Maybe Trump, Covid as Metaphor Is Hard to Shake;10;10
Europe, Which Thought It Had the Virus Tamed, Faces a Resurgence;10;14
In England, Confusion Over Virus Rules That Change by the Day;10;14
Britain’s New Measures to Control Virus Inflame North-South Tensions;10;12
Planned Parenthood’s Plan for Amy Coney Barrett;10;12
How Could Voting by Mail Affect the Election? Look at Michigan;10;11
Inside Johnson & Johnson’s Nonstop Hunt for a Coronavirus Vaccine;7;17
‘Incredible What They’re Doing,’ Johnson Says of Vaccine Team;10;5
Jeff Tweedy’s Homesick Tune, and 11 More New Songs;10;9
11 New Books We Recommend This Week;10;8
‘It Really Was Abandonment’: Virus Crisis Grips British Universities;10;6
In U.K.’s Test and Trace: Now You See ’em, Now You Don’t;10;5
America, We Know What You’re Going Through;10;4
Leaders Who Caught Virus: Boris Johnson, Jair Bolsonaro and Now Trump;10;2
‘Dick Johnson Is Dead’ Review: A Father’s Painful, Funny Goodbye;10;1
‘Keep Calm and Carry On’ May Not Work in a Time of Pandemic;10;4
For Boris Johnson, a Grim Premiership That No One Foresaw;9;29
World Leaders Wish Trump a Speedy Recovery;10;2
Sexual Harassment Underreported at State Department, Report Says;10;2
Amid a Fashion Month Like No Other, Scenes of a Not-So-Distant Past;10;2
How Corey Johnson’s Decision to Drop Out Changed the N.Y.C. Mayor’s Race;9;28
The 50 Best Documentaries on Netflix Right Now;10;1
For U.K.’s Boris Johnson, Hardball Tactics Seem the Only Way to a Brexit Deal;9;26
Tanqueray, Humans of New York Star, Brings in Over $2.5 Million in Donations;9;28
Criticism of Skin Lighteners Brings Retreat by Unilever and Johnson & Johnson;6;26
Corey Johnson Drops Out of 2021 Race for N.Y.C. Mayor;9;24
‘By No Means a Return to the Full Lockdown,’ Johnson Says;9;22
U.K. Opposition Leader Denounces Boris Johnson Handling of Coronavirus Crisis;9;22
U.K.’s Boris Johnson Orders Pubs and Restaurants to Close Early;9;21
U.K. Opposition Leader Says Boris Johnson Is ‘Just Not Up to the Job’;9;22
Ginsburg’s Personal Trainer Honors Her With Push-Ups at Memorial;9;25
Johnson & Johnson Will Stop Selling Skin-Whitening Lotions;6;19
Videos Show Gunman Firing at Police During Louisville Protest;9;25
A Somber Boris Johnson Offers Britain a New Plan to Halt the Virus;9;22
A Painter Who Puts It All on the Line;9;25
Britain Introduces a Scaled-Back Wage Support Plan;9;24
Republican Inquiry Finds No Evidence of Wrongdoing by Biden;9;23
‘We Are Now Seeing a Second Wave,’ Johnson Says;9;18
Don’t Mess With Ireland, Biden Warns Boris Johnson;9;17
Boris Johnson Pushes to Backtrack on E.U. Deal, Despite Party Revolt;9;14
Young Adult Dystopian Fiction That Feels Pretty Real;9;19
Britain Scrambles to Avoid a Second Lockdown;9;18
Four Louisiana Officers Charged in Death of Black Man With Mental Illness;9;19
Why a Designer Held a Fashion Show on a Small New York City Island;9;16
New-Era Golfers Prepare to Be Humbled at Winged Foot;9;17
Europe’s Economic Revival Is Imperiled, Raising the Specter of a Grinding Downturn;9;16
Can Biden Fix What Trump Broke?;9;16
Brexit Talks Hit Crisis as Boris Johnson Rejects Ultimatum;9;10
As Second Wave of Virus Builds, U.K. Enters New Testing Crisis;9;15
Boris Johnson, Covid, Brexit and the Art of Policy Improvisation;9;9
Remember Brexit?;9;12
Boris Johnson Facing Revolt Over Northern Ireland Pact;9;8
From Miner’s Grandson to Lord Darroch of Kew, With a Touch of Irony;9;11
9 New Books We Recommend This Week;9;10
British Prime Minister Bans Gatherings of More Than 6;9;9
Bankrupt J.C. Penney Is Bought by Mall Operators in Need of Tenants;9;9
New York’s Reopened Museums: Where to Go and What to See;9;10
Dwayne Johnson Tests Positive for Coronavirus, Urging Fans to Wear Masks;9;3
News Quiz: Coronavirus Vaccine, W.H.O., Johnson & Johnson;5;22
As Brexit Deadlines Loom, the Posturing and Bickering Flare Again;9;7
Some Vaccine Makers Say They Plan to Profit From Coronavirus Vaccine;7;21
London’s Bridges Really Are Falling Down;9;7
Johnson & Johnson Is Told to Pay $344 Million in Pelvic Mesh Suit;1;30
Johnson & Johnson Sued Over Baby Powder by New Mexico;1;3
Jon Rahm Sinks a Big Putt to Win Playoff at the BMW Championship;8;31
‘Love, Guaranteed’ Review: Swiping Left on Online Dating;9;3
BBC Lost a Battle Over British Songs, and the War Is Far From Over;9;2
Trump Extends Pardon to Alice Johnson After She Praises Him at Convention;8;28
Economy, Johnson & Johnson, Suze Orman: Your Tuesday Evening Briefing;5;19
Johnson & Johnson to End Talc-Based Baby Powder Sales in North America;5;19
Dustin Johnson Rebounds With a Rout at the Northern Trust;8;24
Johnson & Johnson pauses its coronavirus vaccine trial because of a volunteer’s ‘unexplained illness.’;10;13
U.K. Braces for School Return Amid Fears of Virus Spike;8;29
Why Only the Republicans Are Talking About Abortion;8;26
Power and Passage: New Science Fiction and Fantasy;8;27
Read Our Reviews of 7 Important Books Released This Week;8;25
‘Sisters’ Builds a Gothic Plot to an Artful and Shocking Climax;8;25
Do New York City Voters Want Another White Mayor?;8;25
Detroit Firefighter Dies Trying to Save Girls From Drowning;8;23
Boris Johnson Retreats in a U.K. Exam Debacle;8;17
Drug Giants Create Fund to Bolster Struggling Antibiotic Start-Ups;7;9
Here’s What to Watch as the Postmaster General Testifies Before Congress;8;21
British Grading Debacle Shows Pitfalls of Automating Government;8;20
These Books Transport You to a Galaxy Far, Far Away;8;18
U.S. Will Pay $1.6 Billion to Novavax for Coronavirus Vaccine;7;7
Boris Johnson Says U.K. Has a ‘Moral Duty’ to Reopen Schools;8;10
Woody Johnson Asked State Dept. Auditors to Delete Claims of Offensive Remarks From Report;8;12
Pints or Primers? U.K.’s Push to Open Schools May Force a Choice;8;10
Dustin Johnson, Surrounded by Young Challengers, Leads the P.G.A. Championship;8;9
As Britain Climbs Out of an Economic Pit, Tough Questions Loom;8;13
Joe Biden and the Great Leaders of 2020 Are Part of a Club;8;13
Brexit Behind Him, Boris Johnson Tries to Quiet Scotland’s Calls to Leave U.K.;8;7
Dwayne Johnson Part of XFL Ownership Bid;8;3
Collin Morikawa’s Joyful Win Broke Through Golf’s Pandemic Fog;8;10
England’s Flawed Virus Contact Tracing Will Be Revamped;8;10
Collin Morikawa Delivers Magic at the P.G.A. Championship;8;10
‘I Won’t Stand By,’ Johnson Says, Halting Pace of Reopening;7;31
Overlooked No More: Roland Johnson, Who Fought to Shut Down Institutions for the Disabled;7;31
The Deafening Silence of a Coronavirus Championship;8;8
‘River City Drumbeat’ Review: A Community’s Pulse Proves Strong;8;6
New Nominations to U.K. House of Lords Raise Old Concerns of Cronyism;8;4
Women With Cancer Awarded Billions in Baby Powder Suit;6;23
As Trump Praises Plasma, Researchers Struggle to Finish Critical Studies;8;4
Conservative U.K. Lawmaker Is Arrested Over Rape Accusations;8;2
Boris Johnson’s New Tactic Against the Virus: Urge Britons to Lose Weight;7;27
Britain Tried to Bring Fans Back to Indoor Sports. That Lasted a Day.;8;2
U.K. Officials’ New Trump Dilemma: What if He Loses?;7;31
Woody Johnson Was a Loyal Trump Supporter in 2016. As an Ambassador, He May Be Too Loyal.;7;24
U.K. Has Europe’s Worst Surge in Deaths During Pandemic, Study Says;7;30
13 Books to Watch For in August;7;30
Heated Exchange During Barr’s Testimony Over Roger Stone Case;7;28
Coming of Age on Mars;7;27
A ‘Significant Return to Normality’ by Christmas, U.K. Prime Minister Says;7;17
Trump Denies Talking to Ambassador About Moving British Open to His Resort;7;22
As N.F.L. Fights Racism and Sexism, Team Owners Undercut the Message;7;25
Trump’s Request of an Ambassador: Get the British Open for Me;7;21
Pompeo Praises Britain for Getting Tough on China;7;21
Democrats Warn of Possible Foreign Disinformation Plot Targeting Congress;7;21
Five Takeaways From the Report on Russia’s Interference in Britain;7;21
They’re Used to Tapping. Now They’re Talking.;7;21
‘No One’ Protected British Democracy From Russia, U.K. Report Concludes;7;21
Europe Said It Was Pandemic-Ready. Pride Was Its Downfall.;7;20
‘Social Distancing Is Still Essential,’ Boris Johnson Says;7;3
It’s All About the Franklins … the Aretha Franklins;7;16
A Surprising Role Model Emerges for Boris Johnson: F.D.R.;6;29
Dustin Johnson Splashed and Rallied to a Travelers Championship Win;6;29
Coronavirus Vaccine Tracker;6;10
Boris Johnson’s ‘Global Britain’: Inspired Vision or Wishful Thinking?;7;3
Brexit Border Bureaucracy Looms for Truckers, Pet Owners and Travelers;7;13
After Months of Debate, England Requires Face Masks for Shoppers;7;14
U.K. Bars Huawei for 5G as Tech Battle Between China and the West Escalates;7;14
‘We No Longer Face the Virus Spreading Exponentially,’ Johnson Says;6;23
In Tackling Coronavirus, Scotland Asserts Its Separateness From England;7;10
Trump Administration Selects Five Coronavirus Vaccine Candidates as Finalists;6;3
Magic Leap Hires Top Microsoft Executive as C.E.O.;7;7
Boris Johnson Cares About ‘Liberty’ More Than People’s Lives;6;24
For Boris Johnson’s Science Advisers, Pressure, Anxieties and ‘Pastoral Support’;6;26
‘Whac-a-Mole’ Against Virus Sounds Reasonable, Unless You’re the Mole;7;9
Review: ‘P-Valley’ Has All the Right Moves;7;9
For Boris Johnson, a Rare Respite From Bad News;6;17
‘Let’s Get It Done,’ Johnson Says of Brexit Trade Deal;6;15
‘Absurd and Wrong’: Johnson Criticizes Protest Tactics;6;12
Britain, Charting Its Own Course on Human Rights, Imposes New Sanctions;7;6
With Brexit Trade Talks at an Impasse, Boris Johnson Finally Engages;6;15
As Prime Minister, Boris Johnson Struggles to Find His Voice;6;10
‘P-Valley’ Dances to a Different Tune;7;7
England Drops Its Quarantine for Most Visitors, but Not Those From the U.S.;7;3
Refugees’ Trauma, and Saving Migrant Children;11;3
Tulsa Police Sergeant, One of Two Officers Shot During Traffic Stop, Dies;7;1
Turner Prize Was Canceled, but Organizers Still Gave Out the Cash;7;2
10 New Books We Recommend This Week;7;2
Boris Johnson Can’t Fire His Brain;6;3
Nearly $1 Billion Is Shifted From Police in Budget That Pleases No One;6;30
N.Y.C.’s Budget and a Cut to N.Y.P.D. Funding, Explained;7;1
Sam Johnson, Congressman and Former P.O.W., Is Dead at 89;5;30
Boris Johnson Pledges to Admit 3 Million From Hong Kong to U.K.;6;3
Dominic Cummings or the National Interest? Lawmaker Grills Johnson;5;27
Rogue Trip by Boris Johnson Aide Makes U.K.’s Spectator Part of the Story;5;31
Why the $6 Billion N.Y.P.D. Is Now a Target of ‘Defund the Police’;6;28
A Teenager Hosted a Graduation Party. Then 2 Gunmen Showed Up.;6;24
Outcry Over Dominic Cummings Turns Public Against Boris Johnson for 1st Time;5;26
A Rebellious Victorian Woman Rescued From History’s Shadows;6;24
Boris Johnson Backs Top Aide Accused of Flouting Lockdown Rules;5;24
Boris Johnson Avoids Criminal Inquiry Into His Dealings as London’s Mayor;5;21
Boris Johnson’s Change of Heart;5;12
U.K. Leader Lifts Wide Variety of Coronavirus Restrictions;6;23
NASA Names Headquarters After Its First Black Female Engineer, Mary Jackson;6;25
Theater Streams Make Room for Molière (and Imelda Marcos);6;25
Why You Should Always Read Between the Emails;6;26
The 1968 Kerner Commission Report Still Echoes Across America;6;23
Johnson Describes ‘Careful Modification’ of Coronavirus Guidelines;5;11
‘This Is Not the Time Simply to End the Lockdown,’ Boris Johnson Says;5;10
Outrage Grows Over Boris Johnson Aide’s 260-Mile Trip During Lockdown;5;23
Black Gallerists Press Forward Despite a Market That Holds Them Back;6;21
J. Seward Johnson Jr., Sculptor of the Hyper-Real, Dies at 89;3;12
Lisa Johnson, Christopher Kelly;2;2
Rebecca Herrigel, Corey Johnson;2;23
Boris Johnson vs. the Coronavirus;4;7
As U.K. Deaths Mount, Political Terrain Gets Trickier for Boris Johnson;5;6
2 Sidelined Pittsburgh Journalists React: One Quits, the Other Sues;6;16
Trump Picks Ex-Drug Company Executive to Lead Accelerated Coronavirus Vaccine Effort;5;14
Boris Johnson Defends ‘Toxic’ Aide Again. Why Protect a Political Burden?;5;27
As Virus Deaths Jump, Boris Johnson’s Press Relations Turn Testy;5;4
Dominic Cummings Offers a Sorry-Not-Sorry for U.K. Lockdown Breach;5;25
‘We Have So Many Reasons to Be Hopeful,’ Johnson Says;4;30
For Boris Johnson, Parliament Is Becoming a House of Horrors;5;19
The U.K. Needs a Real Government, Not Boris Johnson’s Puppet Cabinet;5;4
Boris Johnson, Back on the Job, Urges Caution in Easing Covid-19 Rules;4;27
Nine Black Artists and Cultural Leaders on Seeing and Being Seen;6;23
‘You Must Stay At Home,’ Johnson Says;3;23
Boris Johnson Moves Boldly to Consolidate Power;2;14
With Boris Johnson in Intensive Care, U.K. Faces a Leadership Quandary;4;7
Boris Johnson Is a ‘Fighter and He’ll Be Back,’ Raab Says;4;7
Boris Johnson Is Not Cut Out for This Crisis;3;26
‘I Understand Your Impatience, I Share Your Anxiety,’ Johnson Says;4;27
England’s ‘World Beating’ System to Track the Virus Is Anything But;6;17
Boris Johnson’s Condition ‘Worsened,’ British Foreign Secretary Says;4;6
Louis Johnson, 90, Genre-Crossing Dancer and Choreographer, Dies;4;10
Rocky Johnson, Pro Wrestler Who Trained His Son the Rock, Dies at 75;1;16
Bafflement Greets Boris Johnson’s Plan for Reopening Britain;5;11
‘Was It a Lost Psych-Funk Classic?’ It’s Khruangbin, Right Now;6;15
Katherine Johnson Dies at 101, Mathematician Broke Barriers at NASA;2;24
Britain Placed Under a Virtual Lockdown by Boris Johnson;3;23
‘We Are Part of the Problem They Protest’;6;16
In the U.K., Johnson resists ‘canceling’ Christmas to stem the coronavirus.;12;17
Boris Johnson Needs to Learn From Andrew Cuomo;3;31
For Boris Johnson, Britain’s Baby Boom Starts at Downing Street;2;29
People Are Dying and All Britain Can Talk About Is Boris Johnson;4;16
Johnson Faces Scrutiny for Flooding Response After Storm Dennis;2;17
‘Be in No Doubt That I Can Continue,’ Boris Johnson Says;3;27
‘We Will Need to Go Further’: Johnson Unveils Coronavirus Guidelines;7;17
Boris Johnson ignored scientists’ advice for a brief national lockdown.;10;13
Self-Portraits From Black Photographers Reflecting on America;6;19
Brexit Has Arrived. But Boris Johnson’s Reign Is Just Beginning.;2;1
Pittsburgh Post-Gazette Staff Revolts Over Sidelining of 2 Black Colleagues;6;10
Boris Johnson Should Have Taken His Own Medicine;3;27
Sajid Javid, U.K. Finance Chief, Quits as Boris Johnson Shuffles Team;2;13
Johnson Urged to Adopt Stronger Measures to Fight Virus in Britain;3;15
Johnson Orders British Pubs to Close, Ending a Maverick Stance in Virus Fight;3;20
‘The escape route is in sight’: Boris Johnson outlines the end of Britain’s lockdown.;11;24
Boris Johnson, bracing for possible Biden presidency, defends Brexit plan.;9;17
Ron Johnson continues to oppose mask mandates after testing positive for the coronavirus.;10;4
In an English City, an Early Benefactor Is Now ‘a Toxic Brand’;6;14
Boris Johnson Aide Attended Secretive U.K. Coronavirus Panel;4;25
For Boris Johnson, a Baby Amid a Dizzying Year of Peaks and Valleys;4;29
Tighter virus restrictions in London add to pressure on Boris Johnson.;12;15
Coronavirus, Boris Johnson, Wuhan: Your Wednesday Briefing;4;8
Just as Air Travel Is Picking Up, U.K. Imposes a Quarantine;6;8
New & Noteworthy Audiobooks, From Betsey Johnson to Pot in San Francisco;4;21
Johnson Holds Back on Restrictive Measures in U.K.’s Fight to Curb Virus;3;12
Trump Seeks Push to Speed Vaccine, Despite Safety Concerns;4;29
‘Sisters,’ by Daisy Johnson: An Excerpt;8;25
Corey Johnson, a presumed front-runner in next year’s N.Y.C. mayoral race, drops out.;9;24
I Was the First Woman of Color in Space. Here’s What Katherine Johnson Means to Me.;2;29
How the Coronavirus Makes a No-Deal Brexit More Likely;6;5
Boris Johnson Leaves U.K. Hospital After Coronavirus Treatment;4;12
The election is over, but Ron Johnson keeps promoting false claims of fraud.;12;17
Shaky Reopenings, Boris Johnson, Coronavirus: Your Thursday Briefing;6;11
Boris Johnson, France, Remdesivir: Your Thursday Briefing;4;30
Profits and Pride at Stake, the Race for a Vaccine Intensifies;5;2
Boris Johnson Moved to Intensive Care, Foreign Minister Deputized;4;6
China’s Workers, Boris Johnson, SpaceX Launch: Your Wednesday Briefing;5;27
Coronavirus, Boris Johnson, Economy: Your Monday Briefing;4;6
Boris Johnson, Coronavirus, Wisconsin: Your Monday Evening Briefing;4;6
‘Get Rid of Them’: A Statue Falls as Britain Confronts Its Racist History;6;9
Coronavirus, Boris Johnson, Climate Change: Your Tuesday Briefing;4;7
Boris Johnson Contracts Coronavirus, Rattling Top Ranks of U.K. Government;3;27
U.S. Election, Boris Johnson, Nagorno-Karabakh: Your Monday Briefing;11;16
Boris Johnson, United Nations, Climate Change: Your Wednesday Briefing;9;23
Quotation of the Day: Amid a Rising Second Wave and a Brexit Deadline, Johnson Stalls for Time;10;16
Boris Johnson’s Balancing Act With Trump and Europe on Iran;1;6
Coronavirus, Vaccine Race, Boris Johnson: Your Tuesday Briefing;5;5
With Broad Subpoena Power, Republicans Seek to Undercut Russia Inquiry;6;4
Stimulus Plan, Coronavirus, Boris Johnson: Your Friday Briefing;4;10
Trump’s False Claim That ‘Nobody Has Ever Done’ More for the Black Community Than He Has;6;5
Wuhan, Boris Johnson, Japan’s Virus Emergency: Your Wednesday Briefing;4;7
Coronavirus, Boris Johnson, Wisconsin: Your Tuesday Briefing;4;7
Covid-19, Boris Johnson, U.S. Troops: Your Thursday Briefing;11;19
Boris Johnson Hospitalized as Queen Urges British Resolve in Face of Epidemic;4;5
Johnson and BBC Trade Jabs, as War on the Press Flares;2;5
No More Lynching!;6;4
As Europe Shuts Down, Britain Takes a Different, and Contentious, Approach;3;13
About That Much Vaunted U.S.-U.K. Trade Deal? Maybe Not Now;3;2
Johnson Risks a Rift with Trump by Granting New Access to Huawei;1;28
Boris Johnson Pressed to Move Brexit Deadline Amid Coronavirus Threat;3;14
