Headline;Month;Day
Senate Gives Final Approval to Revisions to Small-Business Program;6;4
How Ulla Johnson, Fashion Designer, Spends Her Sundays;1;31
Coronavirus, Boris Johnson, Easter Sunday: Your Monday Briefing;4;13
Boris Johnson Leaves Intensive Care, but Britain Faces Weeks More of Lockdown;4;9
10 Comic Books to Celebrate Pride;6;5
Boris Johnson Backs HS2, U.K.’s $130 Billion Railroad Plan;2;11
11 New Books We Recommend This Week;6;4
Where the Virus Is Growing Most: Countries With ‘Illiberal Populist’ Leaders;6;2
Boris Johnson Launches War on U.K.’s Own ‘Deep State’;3;7
Prime Minister Boris Johnson Stirs Culture War Over Churchill Statue;6;13
Boris Johnson Might Break Up the U.K. That’s a Good Thing.;1;10
Celebrating Pride on Film;6;1
Boris Johnson Aide Quits After Furor Over Racial Comments;2;17
New Spikes in Asia, Boris Johnson, Stimulus Efforts: Your Friday Briefing;4;9
They’re Calling It the ‘Conga Line Parliament’;6;2
Art That Confronts and Challenges Racism: Start Here;6;4
Boris Johnson Announces a Coronavirus Quarantine for Travelers to U.K.: Live Coverage;5;10
‘The High Note’ Review: A Little Pitchy;5;28
Britain’s Johnson Faces Virus Critics, but Israel’s Netanyahu Comes Out on Top;5;6
Anti-Muslim Attacks, Boris Johnson, China’s New Cases: Your Monday Briefing;4;12
6 Things to Do at Home This Weekend;6;4
$8 Billion Verdict in Drug Lawsuit Is Reduced to $6.8 Million;1;17
The Standing 7-Minute Workout;12;30
11 New Books We Recommend This Week;5;28
Rory McIlroy Won, but Golf Shined in Its Live Return;5;18
Britain Surpasses 10,000 Coronavirus Deaths as Boris Johnson Leaves Hospital, Pope Speaks of ‘Contagion of Hope’;4;12
N. Carolina Speedway Packs Its Stands, Drawing Governor’s Rebuke;5;27
On a Scottish Isle, Nursing Home Deaths Expose a Covid-19 Scandal;5;25
Man Arrested in Notorious 1980s Killing of Gay American in Australia;5;12
Covid-19 vaccines are a chance at salvation for drug makers.;10;13
After 274 Years, Princeton Will Have Its First Black Valedictorian;5;11
Britain to Impose Quarantine on Air Travelers to Fight Coronavirus;5;10
What Tracee Ellis Ross Worried About in ‘High Note’ (It Wasn’t Her Mom);5;29
The Pirates’ Booty That Changed the Course of History;5;12
More Coronavirus Vaccines and Treatments Move Toward Human Trials;4;8
Senate Panel, Urged On by Trump, Subpoenas Biden-Related Material;5;20
Researchers Are Racing to Make a Coronavirus Vaccine. Will It Help?;1;29
Rivers Merge in St. Louis. So Do Racism, Violence and Exclusion.;5;6
Britain’s Ethnic Minorities Are Being Left for Dead;5;22
Coronavirus Briefing: What Happened Today;9;23
Rattled by a Pandemic, People Turn to Leaders — Any Leaders;5;23
Justin Amash Abandons Third-Party Presidential Bid;5;16
‘The New Church of England’: Coronavirus Renews Pride in U.K.’s Health Service;5;12
J.C. Penney, 118-Year-Old Department Store, Files for Bankruptcy;5;15
Payout From a National Opioids Settlement Won’t Be as Big as Hoped;2;17
Unjust Convictions Must Become a Justice Department Priority;5;8
Obama Says G.O.P.’s Biden Inquiry Promotes ‘Russian Disinformation’;5;6
PG&E Chief Executive to Retire in June;4;22
Modi’s Popularity Soars as India Weathers the Pandemic;5;16
U.K. Coronavirus Briefings Offer a More Genteel Spin Than Trump’s;4;26
‘Chaos and confusion’ could follow vaccine approvals.;10;13
Coronavirus Puts to the Fore an Improbable U.K. Leader: Dominic Raab;4;7
Many Trial Volunteers Got Placebo Vaccines. Do They Now Deserve the Real Ones?;12;2
See How Vaccinations Are Going in Your County and State;12;17
Breonna Taylor, Coronavirus Vaccine, Belarus: Your Thursday Briefing;9;24
Undercutting Scientists, Trump Says Tightening Covid-19 Vaccine Guidelines ‘Sounds Like a Political Move’;9;23
News Quiz: Coronavirus, Super Tuesday, Israel;3;6
If U.K. Schools Reopen, Will the Students Return?;5;11
In 6 Minutes, You Can Be Done With Your Workout;2;19
Britain Is Sticking to Brexit Plans Despite Virus Upheaval;4;24
U.K. Virus Tests Surpass Target, but Britain’s Deaths May Overtake Italy’s;5;1
Who’s Afraid of Justin Amash?;5;7
Ready to Tame Your Sweet Tooth?;7;10
Different Approaches to a Coronavirus Vaccine;5;20
Coronavirus Killing Black Britons at Twice the Rate of Whites;5;7
South Dakota Election Results: At-Large Congressional District;11;3
Pfizer Says It Won’t Seek Vaccine Authorization Before Mid-November;10;16
Drug Companies Will Make a Killing From Coronavirus;3;18
For Covid-19 Vaccines, Some Are Too Rich — and Too Poor;12;28
Streets Should Be Car-Free During Lockdown. And After.;5;1
U.K. Labour Party Has a New Leader: Keir Starmer;4;4
Pfizer Seals Deal With U.S. for 100 Million More Vaccine Doses;12;23
The Case for Staying Single;3;10
Locked Down on V-E Day, Europe Celebrates World War II Liberation;5;8
2002: When the Rock Went Hollywood and Movie Stars Still Ruled;4;30
News Quiz: Vaccine Trials, BTS, Apple;10;16
Florida Doctor Bilked $26 Million From Health Insurers, Officials Say;2;15
A New Chapter in Salt Lake City;4;18
Your Thursday Briefing;9;23
Tesla is joining the S&P 500, and that could have investors scrambling to buy its shares.;11;17
From Missing Persons to Mistaken Identities, Books About Seeing and Being Seen;4;18
With First Dibs on Vaccines, Rich Countries Have ‘Cleared the Shelves’;12;15
What It’s Like to Be the Face of Trump’s Super Bowl Ad;2;6
Does Andrew Yang Want to Be New York’s Post-Coronavirus Mayor?;4;29
The Things Our Bosses Said a Lot This Year;12;29
News Quiz: Russia, Google, World Series;10;23
Covax, an international health group, announces vaccine deals to help less wealthy countries.;12;18
Health Care Costs Are Rising. Fund Returns Are Less Reliable.;1;17
Spring’s Most Enchanting Shell Jewelry;2;19
Ohio Election Results: Sixth Congressional District;11;3
U.S. corporations say they’ll hire one million Black workers in the next decade.;12;10
Britain Stiffens Its Response to the Coronavirus, Somewhat;3;16
Pools Are (Mostly) Closed—Here’s How I’m Staying Cool in My Backyard;6;9
The Risk in Suspending Vaccine Patent Rules;12;10
Sugarcoating and Brutal Honesty: How Leaders Are Handling Coronavirus Crisis;4;17
Top U.K. Civil Servant Quits and Vows to Sue, Accusing Minister of ‘Vicious’ Behavior;2;29
Britain’s leader faces a growing revolt over his virus policy.;11;3
A Wisconsin senator elevates fringe theories, questioning virus science.;12;8
News Quiz: Ruth Bader Ginsburg, Breonna Taylor Decision, C.D.C.;9;25
For the Foreseeable Future, U.K. Parliament May Meet in Cyberspace;4;15
Faced with twin crises, Britain’s leader is stalling for time.;10;16
‘All the Natalie Portmans’ Review: An Imaginary Friend With an Oscar;2;25
And You Thought Brexit Was Tough …;1;8
Louisiana Election Results: Fourth Congressional District;11;3
