Headline;Month;Day
What You Need to Know About 5G in 2020;1;8
HuffPost’s Top Editor Leaves for a Podcasting Company;3;6
Cellphone Carriers Face $200 Million Fine for Not Protecting Location Data;2;28
What the Sprint and T-Mobile Merger Means for You;2;11
Word + Quiz: appellation;2;12
T-Mobile and Sprint Are Cleared to Merge as the Big Get Bigger;2;11
T-Mobile Closes Merger With Sprint, and a Wireless Giant Is Born;4;1
Karen Fu, Victor Alves;1;19
What You Need to Know About 5G Smartphones;10;13
Future Pastime;11;4
All of the COVID-19 Data Upgrades That Cell Phone Carriers Are Offering;5;8
Cities Reimagined;11;17
Surging Traffic Is Slowing Down Our Internet;3;26
After six months, she hopes unemployment pay is behind her.;9;3
Here’s the business news to watch this week.;7;20
News Outlets Want More Advertisers to Act Like Burger King;5;7
Game Changing;10;20
The New Age of Care;10;27
Closing the Imagination Gap;11;11
Hello iPhone 12 and iPhone 12 Pro;10;13
News Quiz: Iran, Taal Volcano, Oscar Nominations;1;17
News Quiz: George Floyd, Twitter, Coronavirus;5;29
A Running List of Free and Discounted Services for Teachers;5;19
News Quiz: Coronavirus, World Health Organization, Joe Biden;4;17
Google, Facebook and Others Broaden Group to Secure U.S. Election;8;12
Coronavirus Brings a Surge to News Sites;3;20
News Quiz: New Hampshire Primary, Coronavirus, Oscars;2;14
Ready for Another Streaming Service? NBC’s Peacock Starts Rollout;4;14
Top Antitrust Official Is Said to Recuse Himself From Google Inquiry;2;4
OPEC Talks to Cut Oil Production Disappoint Traders;4;9
Why the Working Class Votes Against Its Economic Interests;7;31
2020 Super Bowl Commercials: Funeral for Mr. Peanut, Tears for Google;2;2
Judge Is Said to Rule for T-Mobile Merger With Sprint;2;10
China-Backed Hackers Broke Into 100 Firms and Agencies, U.S. Says;9;16
Why Your Kid Cuddles Her Toothbrush;4;20
F.C.C. to Fine Cellphone Carriers for Selling Customers’ Locations;2;28
Leaves Before Paying the Check;5;14
C.E.O.s Pledge to Hire 100,000 Low-Income and Minority New Yorkers;8;11
McDonald’s Joins Walmart and Dozens of Other Chains With Mask Mandates;7;21
The Week in Business: This Is Getting Awkward;11;22
Hollywood Stays Away From Facebook Ad Boycott;7;15
SoftBank Takes Another Multibillion-Dollar Hit From Bad Bets;2;12
Disney Plus Racks Up 28.6 Million Subscribers;2;4
The Week in Business: Failing to Save Jobs;4;12
Fed Announces More Loans as Investor Alarm Persists;3;18
The Learning Curve;10;13
Have a Search Warrant for Data? Google Wants You to Pay;1;24
Facebook Adds Labels for Some Posts as Advertisers Pull Back;6;26
Be Wary of Those Texts From a Friend of a Friend’s Aunt;3;16
Personal Data of All 6.5 Million Israeli Voters Is Exposed;2;10
N.W.S.L. Plans a One-Month Season: 25 Games in Utah;5;27
Zoom Is Easy. That’s Why It’s Dangerous.;4;9
An Important Year for Women’s Sports, Paused by Coronavirus;3;14
Who Is Postmaster General Louis DeJoy?;8;16
Where the Money Is for Small Businesses;6;11
Navigating Cybersecurity’s Ever-Changing Landscape;7;27
This Pilates Business Loves (and Hates) Tech;6;26
How to Work From Home Now That Your Boss Doesn’t Want You Coming In;3;12
How Amazon, Geico and Walmart Fund Propaganda;1;21
Ignore Phone Companies About 5G;10;15
5 Simple Ways to Improve Your Wi-Fi;8;24
Barr’s Interest in Google Antitrust Case Keeps It Moving Swiftly;6;25
The Tech That Will Invade Our Lives in 2020;1;1
Election Tech That’s Super Simple;10;19
Big Companies Are Starting to Swallow the World;9;30
The Week in Tech: Coronavirus Disrupts the Industry;2;28
Why the 5G Pushiness? Because $$$.;10;22
Are Companies More Productive in a Pandemic?;6;23
Coronavirus, Jobs, Weird Al Yankovic: Your Thursday Evening Briefing;4;9
Disney+ Passes 73 Million Subscribers as Streaming Takes Center Stage;11;12
Why Zoom Is Terrible;4;29
Barr Is Said to Be Weighing Whether to Leave Before Trump’s Term Ends;12;6
As Facebook Boycott Grows, Advertisers Grapple With Race;6;26
AT&T Names John Stankey C.E.O. as Randall Stephenson Plans to Retire;4;24
Michigan, Thanksgiving Guidance, Booker Prize: Your Thursday Evening Briefing;11;19
Google’s European Search Menu Draws Interest of U.S. Antitrust Investigators;6;4
Your Wednesday Briefing;2;11
How to Make Your Wi-Fi Suck Less While Working From Home;3;18
Ransomware Attacks Grow, Crippling Cities and Businesses;2;9
Sumner Redstone, Hollywood Brawler;8;12
Facebook Can’t Be Reformed;7;1
Stop Your Phone From Using So Much Data;3;5
For Small-Business Owners, a Shifting Landscape of Resources;11;16
TikTok Was a Wasted Opportunity;9;14
Unemployment Claims Show Layoffs Continue to Batter Economy;9;3
CVS, Dunkin’, Lego: The Brands Pulling Ads From Facebook Over Hate Speech;6;26
Who’s Behind the Fight Between Warner Bros. and Hollywood? It’s AT&T;12;8
Divvy Homes Says Rent-to-Own Deals Work. Next Year Will Be a Test.;11;25
Democrats Eye Trump’s Game Plan to Reverse Late Rule Changes;7;17
Reddit, Acting Against Hate Speech, Bans ‘The_Donald’ Subreddit;6;29
Coronavirus, Vaccine, U.S. Death Toll: Your Tuesday Briefing;4;28
A Prescription for Reviving the Economy;4;17
Coronavirus Briefing: What Happened Today;4;9
Doing Schoolwork in the Parking Lot Is Not a Solution;7;18
Advertiser Exodus Snowballs as Facebook Struggles to Ease Concerns;6;30
Bedminster, N.J.: Horses, Golf and Presidential Visits;1;1
The Tech That Was Fixed in 2020 and the Tech That Still Needs Fixing;12;23
With Hacks and Cameras, Beijing’s Electronic Dragnet Closes on Hong Kong;8;25
‘Very Harsh Indeed’;6;26
Summer Internships Won’t Be the Same This Year;4;20
Should Google Shrink to Save Itself?;2;6
U.S. Accuses Google of Illegally Protecting Monopoly;10;20
Manhattan Emptied Out During the Pandemic. But Big Tech Is Moving In.;10;13
‘Terrified’ Package Delivery Employees Are Going to Work Sick;3;21
Coronavirus, Anthony Fauci, Tornadoes: Your Monday Briefing;4;13
HBO Max Is Here to Take On Netflix. Is It Too Late?;5;26
An Evangelist for Remote Work Sees the Rest of the World Catch On;7;12
New Zealand, U.S. Coronavirus Deaths, Kim Jong-un: Your Tuesday Briefing;4;27
Could Limiting Corporate Candidates Hurt Biden’s Diversity Push?;11;20
C.E.O.s Say ‘It’s a Grind’;7;20
Say One Thing, Donate to Another;7;21
All the Companies Quitting Facebook;6;29
The Pandemic Isn’t Changing Everything;5;3
We Have Questions About SoftBank;9;8
Stocks Slide as Texas Rolls Back Reopening;6;26
This Isn’t Just JPMorgan’s Problem;9;16
Can Airlines Avoid Another Bailout?;9;15
Wall Street Starts the Week With a Gain;6;22
Mnuchin Paved Way for Postal Service Shake-Up;8;22
‘Extraordinarily Uncertain’ Outlook From Powell;6;29
Who Controls Trump’s Environmental Policy?;1;14
Demonstrators Linger After Curfew and Some Are Arrested in New York City;6;2
Faces of Power: 80% Are White, Even as U.S. Becomes More Diverse;9;10
Biden Addresses Racial Justice, Saying Trump Adds ‘Fuel to the Fire’;7;28
Arrested, Tortured, Imprisoned: The U.S. Contractors Abandoned in Kuwait;10;28
William Barr’s State of Emergency;6;1
Remembering the 100,000 Lives Lost to Coronavirus in America;5;24
